,Concerning,Text,URL
19,burma,"It is chilling to see how many times the word “genocide” is now being used to describe the humanitarian tragedy affecting Burma’s Rohingya Muslim minority. But like the endless Syrian civil war, this is a deepening crisis of historic proportions to which much of the world now seems largely indifferent — in spite of the warnings. There was the warning this week from the United Nations human rights chief, Zeid Ra’ad al-Hussein, that Burma’s military appears to have committed “acts of genocide” against the Rohingya people. There was the warning last weekend in The New York Times from journalist Nicholas Kristof, who has just visited the country. “I saw a genocide in slow motion,” was the headline, as the military “continues to kill its Rohingya” by denying them health care and food. And there was the warning last month from Shirin Ebadi, Nobel Peace Prize winner in 2003, that Aung San Suu Kyi, also a Nobel laureate and Burma’s discredited de facto leader, must be held personally responsible for “genocide” of Rohingyas under her watch.

Article Continued Below

In the past six months, more than 700,000 Rohingya Muslims have fled Buddhist-majority Burma (also known as Myanmar) for Bangladesh to avoid what the UN describes as a classic case of ethnic cleansing by the Burmese military — including the burning of villages and raping of women. There are plans to send Rohingya refugees in Bangladesh back to Burma but UN officials said this week that widespread violence against them is continuing in Burma. Similar warnings have come from former Liberal leader Bob Rae, who was appointed Canada’s special envoy for the crisis. In a powerfully written interim report in December, he outlined the scale of the “humanitarian crisis,” the need for “accountability for potential crimes against humanity” and the urgency for “action by all governments.”

Rae’s final report will be presented to Canada’s Parliament in a few weeks, and he will recommend “actions that Canada and others need to take.” And that, for Canadians and for our Prime Minister, will be when the ball will be back in our court — coming at a time when the rest of the world’s attention is focused on a multitude of other global crises. Given that, in the face of possible genocide, what should Canada do? Fortunately, we do have history to guide us. This is not the first time that Canada has been confronted with a profound global challenge that the rest of the world ignored. Let us not forget the brutal Ethiopian famine in 1984. Canadians saw on their television sets the immense horror of a hidden famine that was killing hundreds of thousands. And what happened next was unforgettable. Led by Canada’s new prime minister Brian Mulroney and Stephen Lewis, Canada’s ambassador to the UN, Canada spearheaded an international rescue effort in Ethiopia that became part of the greatest single humanitarian relief mission in history. I remember that experience very well because, with Brian Stewart, I was producer of the CBC news team that provided those first reports out of Ethiopia. These two dramas are obviously different in nature, but there are some lessons we can apply from Ethiopia in 1984 to the Rohingyas of 2018. Three come to mind: We need to understand the gravity. That happened in 1984, and it can happen now. This makes Rae’s final report essential reading. Doing nothing is not an option. Canadians, by the millions, decided not to turn their backs on Ethiopia in 1984 even though much of the world did, at least at the beginning. Today is no different. Who else but Canada? The global mood in the era of Trump is cynically inward and self-serving. Does that apply to us? What better time for the Trudeau government to remind the world that Canada is indeed different. Tony Burman is former head of Al Jazeera English and CBC News. Reach him @TonyBurman or at tony.burman@gmail.com.",https://www.thestar.com/opinion/star-columnists/2018/03/09/who-can-help-save-the-rohingya-canada.html
20,burma,"HIGHLIGHTS

• Access constraints continue to impede humanitarian assistance in Burma’s Kachin, Rakhine, and Shan states

• Preparations for Bangladesh and Burma cyclone, monsoon seasons continue

• USAID/OFDA provides $3.5 million to UNICEF to support health, protection, and WASH interventions for conflictaffected communities in Burma

KEY DEVELOPMENTS

• Government of Burma-imposed access constraints continue to impede humanitarian efforts in northern Rakhine, where an unknown number of internally displaced persons (IDPs) and other vulnerable populations—including remaining ethnic Rohingya Muslims— are sheltering. In addition, nearly 100,000 people remain displaced in Kachin and Shan, where ongoing conflict and access impediments continue to hinder the assessment of humanitarian needs and delivery of aid.

• Nearly 884,000 Burmese refugees were sheltering in Bangladesh’s Cox’s Bazar District as of February 25, the UN reports. The March–December 2018 Joint Response Plan (JRP) for the Rohingya Humanitarian Crisis estimates that nearly $951 million is required to address the needs of 1.3 million people in Bangladesh, including refugees and host communities.

• With nearly $77 million in FY 2018 funding, the U.S. Government (USG) continues to support lifesaving food, health, nutrition, protection, shelter, and water, sanitation, and hygiene (WASH) assistance to conflict-affected populations in Burma and Bangladesh.",https://reliefweb.int/report/myanmar/burma-complex-emergency-fact-sheet-2-fiscal-year-fy-2018
21,burma,"United Wa State Army (UWSA) soldiers march during a display for the media in Pansang, Wa territory in north east Burma Oct 4, 2016. Source: Reuters/Soe Zeya Tun

181 Social Buzz

A BURMESE court on Wednesday sentenced a former child soldier to two years’ imprisonment with hard labour under a colonial era law that critics say is being used to quash freedom of expression.

Aung Ko Htwe was arrested and charged under Section 505 (b) of the country’s Penal Code last August after telling the media how he was kidnapped by the Burmese military in 2005 when he was a teenager.

Speaking to reporters outside the court following his sentencing, the 26-year-old criticised his conviction.

“My rights have been violated. We have no rule of law in this country,” he said as he was taken away in shackles by police.

SEE ALSO: Burmese students expelled en masse for protests over education budget



Section 505(b) of the Penal Code is a vaguely-worded law that makes it an offence to “cause fear or alarm to the public” and is often used to prosecute activists.

Speaking to Anadolu Agency, Htwe’s sister Nay Zar Tun said: “I have no idea what is wrong in telling how he became child soldier.”

“The military already admitted that they had used child soldiers,” she said. “It seems they are still using child soldiers.”

According to the Myanmar Times, he and three other child soldiers deserted Tatmadaw – another name for Burma’s military – in 2008. Aung Ko Htwe’s sister said, her brother was soon arrested for accidentally murdering a motorcyclist during an effort to escape from the military camp in restive Shan state. After a seven-month trial, he was sentenced to death.

SEE ALSO: Mounting calls for Burma to release jailed Reuters journalists



Under former-President U Thein Sein, his punishment was reduced to life-time imprisonment. Once his case was raised with current military leader Senior General Min Aung Hlaing with evidence that he was an under-age soldier, the sentence was reduced to 10 years. After serving 9 years in jail, he was released in July last year, she said.

Yesterday’s sentencing of former child soldier Aung Ko Htwe is an open attack on freedom of expression and directly contradicts #Burma‘s commitment to end child military recruitment. AAPP condemns the decision and calls for his immediate release. #Myanmar https://t.co/hN8nO03wiG — AAPP (Burma) (@aapp_burma) March 29, 2018

Aung Ko Htwe also faces additional charges under the Union Seal Law for a protest in which he stepped on a copy of the Constitution during his hearing.

The law includes a provision against desecration of the Union seal. If found guilty, Aung Ko Htwe faces a maximum sentence of three years in prison.

Human rights organisation Assistance Association for Political Prisoners (AAPP) condemned Aung Ko Htwe’s sentence and called for his immediate release.

This is “an open attack on freedom of expression,” the group said on Twitter. “[His conviction] directly contradicts Burma’s commitment to end child military recruitment.”",https://asiancorrespondent.com/2018/03/burma-ex-child-soldier-sentenced-to-jail-hard-labour-for-talking-to-press/
22,burma,"Midwives working in refugee camps in Bangladesh have recounted the harrowing experiences of pregnant Rohingya women who fled from neighbouring Myanmar.

The mothers said they had seen family members raped and killed by Buddhist extremists and Myanmar’s security forces.

In posts on Facebook the midwives also described how mothers with newborn children arrived in Bangladesh without fresh clothing, and pregnant women were malnourished after having walked for days without food.

“We’ve had women come having lost their entire family,” Dr Sathya Doraiswamy, chief of health at the United Nations Population Fund (UNFPA) in Bangladesh, told The Independent.

“The stories we’ve actually heard are various degrees of violence, ranging from emotional to physical to sexual violence.

“The main impact of what we see among the women and girls is that they have been subject to violence themselves, but in several other instances they have been witness to violence that has been inflicted on their very close family members.”

Rohingya refugees – in pictures







15 show all Rohingya refugees – in pictures



























1/15 A young girl and a baby wade through mud after arriving in Whaikhyang, Bangladesh from Burma on 10 September Dan Kitwood/Getty Images

2/15 Rohingya refugees walk through a camp in Whaikhyang, Bangladesh after arriving from Burma Dan Kitwood/Getty Images

3/15 A young Rohingya refugee gathers firewood after arriving in Whaikhyang, Bangladesh from Burma Dan Kitwood/Getty Images

4/15 Rohingya refugees wait for sacks of rice to be distributed in Whaikhyang, Bangladesh Dan Kitwood/Getty Images

5/15 Rohingya Muslim refugees arrive on a boat in Whaikhyang, Bangladesh after crossing from Burma on 8 September Dan Kitwood/Getty Images

6/15 Rohingya Muslim refugees react after being re-united with each other after arriving in Whaikhyang, Bangladesh on a boat from Burma Getty

7/15 Rohingya Muslim refugees walk along the remains of a road after arriving in Whaikhyang, Bangladesh on a boat from Burma Dan Kitwood/Getty Images

8/15 Rohingya Muslim refugees wade through water after arriving in Whaikhyang, Bangladesh by boat from Burma Dan Kitwood/Getty Images

9/15 Rohingya Muslim refugees wade through water after arriving in Whaikhyang, Bangladesh by boat from Myanmar Dan Kitwood/Getty Images

10/15 Rohingya Muslim refugees stand in the rain after arriving in Whaikhyang, Bangladesh by boat from Burma Dan Kitwood/Getty Images

11/15 Indian children hold placards and shout slogans during a protest against the alleged persecution of the Rohingya Muslims in Burma EPA/Raminder Pal Singh

12/15 Supporters of the Difa-e-Pakistan Council (DPC), an Islamic organisation, listen to their leaders' speeches against Burma's persecution of Rohingya Muslims, during a demonstration in Karachi Reuters/Akhtar Soomro

13/15 Hundreds of Iranians take part in a protest against violence in Myanmar after weekly Friday prayers, in Tehran EPA/Abedin Taherkenareh

14/15 Indonesian Muslim activists hold placards and shout slogans during a protest against the alleged persecution of the Rohingya minority in Magelang, Central Java, Indonesia EPA/Ali Lutfi

15/15 Members of an Islamic organisation shout slogans against the Burma government during a protest in Dhaka, Bangladesh EPA

Over the last six months more than 700,000 Rohingya Muslims have fled to Bangladesh from Myanmar, where there have been widespread reports of killings, rape and the burning of homes, leading to accusations the state is guilty of “ethnic cleansing” or even genocide.

More than half of those affected by the crisis are women and girls, Dr Doraiswamy said. He said the UNFPA has helped deliver 1,827 babies and provided antenatal care for more than 51,000 Rohingya women.

Drone footage shows thousands of Rohingya fleeing Myanmar

In Facebook posts shared with The Independent, a UNFPA-trained midwife said one Rohingya refugee came to her with labour pains soon after she and her husband arrived in Bangladesh. The mother, identified as Hasina Khatu, said the pain had started a day earlier when she was in Myanmar, and had increased slowly as she fled by boat.

“When I asked her about her family members, she told me that her only son who was aged two had been killed by the Myanmar army. She also lost her mother, father and sister. She told me her younger sister was raped and killed by the Myanmar army. When she told me this history she was crying.”

When the midwife gave Ms Khatu food, she said she had not eaten for at least two days. Later that night she delivered two premature boys. One weighed 2kg while the other weighed 2.2kg.

Another midwife described how one mother whose husband had been killed in Myanmar had no clothes to change her baby after she gave birth. “She had nothing in Bangladesh, she had lost everything in Myanmar,” the midwife said.

Other mothers arrived in Bangladesh with their children after walking for days without food.

One midwife said a mother and husband told her they had walked for four days with their newborn and older daughter after all of their family members were killed in Myanmar. “In four days they only drank a small amount of water and some dry food. I made sure they had food. I prayed that things would be better for them.”

Myanmar has been accused of ‘ethnic cleansing’ or even genocide (AP)

Around 80 UNFPA-trained midwives have been providing sexual and reproductive health services through Bangladesh ministry of health facilities and in makeshift settlements formed near the refugee camps.

They also created around 19 women-friendly spaces where female refugees can share their experiences, and some choose to open up about the violence they have suffered.

Some were the victims of intimate partner violence, which Dr Doraiswamy said women in the camps were at a high risk of experiencing, and others had experienced sexual violence and rape at the hands of strangers.

“There is not adequate lighting in the camps, and the toilets are not always family toilets. Women have to walk long distances. Even to fetch water there is quite a bit of distance they have to walk. Along any of these points they face a very high risk,” Dr Doraiswamy explained.

Over the last six months more than 700,000 Rohingya Muslims have fled Myanmar to Bangladesh (Getty)

However, he said the women-friendly spaces have been “quite effective”. He added: “For women who have undergone so much trauma, it actually brings about a calming experience when they come into these spaces. The sheer number of people we have been able to reach in the last six months has been quite telling in terms of the impact the UNFPA has had.”

The UNFPA has also distributed around 88,000 dignity kits, which contain clothes, soap, a comb and sanitary wear for women and girls.

More than half of those affected by the Rohingya refugee crisis are women and girls ( UNFPA Bangladesh)

Dr Doraiswamy called on the international community to provide funding to maintain UNFPA services, which he said are in high demand among women and girls in the camps.

He said “software sectors” such as women-friendly spaces were often seen as less important than work on shelters, water and sanitation, which he termed “hardware materials”.

He added: “For us to be able to maintain this on a medium to longer term, these kind of services need to be sustained, and the international community needs to pay close cognisance of this.

“Often, the presence of pregnant women or survivors of gender-based violence is forgotten. And that should not be the case.”",https://www.independent.co.uk/news/world/asia/rohingya-refugee-crisis-muslim-pregnant-women-myanmar-midwives-burma-unfpa-a8242516.html
23,burma,"Members of Burma's military take part in a parade to mark the 73rd Armed Forces Day in the capital Naypyitaw, Burma March 27, 2018. Source: Reuters/Stringer

308 Social Buzz

BURMA’S military commander-in-chief urged the country’s ethnic rebel groups to agree to a comprehensive cease-fire agreement now and stop wasting time on demands he described as impossible.

“Instead of pointing to the past and finding faults, it is now high time to learn the lessons of the past and conduct for the country’s development,” Senior Gen. Min Aung Hlaing said during a speech at the annual Armed Forces Day parade on Tuesday.

According to the Associated Press, the general said the decades long conflicts with rebel groups were the reason Burma (Myanmar) had failed to develop as quickly as its Southeast Asian neighbours.

Clashes between the military and rebel groups continue in Kachin and Shan State where the army have been accused of potential war crimes. A recent United Nations fact-finding mission found military violence against minorities in the northern states has been silently escalating.

“The long-standing conflicts in Kachin and Shan states have recently intensified, leading to more reports of serious violations of international human rights and humanitarian law committed in these areas by the security forces,” head of the UN mission, Marzuki Darusman told the Human Rights Council.

SEE ALSO: ‘I don’t think they want peace’: Shan languish in Burma camps as peace process drags on



These include reports of “extrajudicial killings, arbitrary deprivation of liberty, enforced disappearances, destruction of property and pillage, torture and inhuman treatment, rape and other forms of sexual violence, forced labour, recruitment of children into armed forces.”

While the military has been pushing a formal National Ceasefire Agreement, only a handful of the ethnic armies have signed up. Others want to re-negotiate the deal to ensure greater political and economic autonomy.

Min Aung Hlaing blamed Burma’s British colonisers and their divide-and-rule policy for the differences among various ethnic and religious groups, and suggested that all parties put aside their grudges from the past.

Despite pledging her commitment to peace and national reconciliation, de facto leader Aung San Suu Kyi has failed to rein in the military who, on top of clashes in Kachin and Shan, are embroiled in brutal so-called “clearance operations” against the Muslim Rohingya minority in Rakhine State.

Tuesday’s parade, at a huge ground outside the capital Naypyitaw, featured more than 11,000 soldiers, and fly-pasts by fighter jets and helicopters.",https://asiancorrespondent.com/2018/03/burma-army-chief-tells-rebels-to-stop-wasting-time-with-impossible-demands/
