,Concerning,Text,URL
6,burma,"NAYPYITAW, Burma -- Burma's parliament on Wednesday elected as the country's new president a longtime loyalist of Aung San Suu Kyi who is expected to carry on his predecessor's practice of deferring to her as her nation's de facto leader.

The election of Win Myint comes as Suu Kyi's civilian government has struggled to implement peace and national reconciliation, with the powerful military still embroiled in combat with ethnic rebels and under heavy international criticism for its brutal counterinsurgency campaign against the Muslim Rohingya minority.

Burma's military ruled the country for a half-century during which it was accused of widespread abuses before partially handing power to a civilian government in 2016. It remains in charge of security matters and still faces accusations of rights abuses.

Win Myint, the vice president selected as presidential candidate by the lower house and backed by Suu Kyi's ruling party, received 403 votes from the combined houses. Myint Swe, the vice president with the military's backing, had 211 votes, and Henry Van Tio, the vice president selected by the upper house, had 18.

""I will try my best to the greatest degree I have and carry out my civic duties as best I can,"" the newly elected president told reporters as he left parliament after the vote.

Like his predecessor, Htin Kyaw, who retired last week for health reasons, Win Myint, 66, is a longtime Suu Kyi loyalist and a stalwart member of her National League for Democracy party, an affiliation that earned him a brief spell as a political prisoner more than two decades ago under the previous military government.

When Suu Kyi's government was installed in 2016, she explained that she would be ""above the president,"" a situation amenable to both the president and the public.

The job of state counsellor was created especially for Suu Kyi because she is constitutionally banned from the presidency. A clause in the 2008 military-drafted constitution bars anyone with a foreign spouse or child from holding the job. It clearly targeted Suu Kyi, whose two sons are British, as was her late husband.

Burma's president is elected by a joint sitting of the two houses of parliament from among the country's three vice presidents, representing the lower house, the upper house and the military. Under the constitution, the military holds special privileges in the country's administration, including a 25 percent share of parliamentary seats and the three security portfolios in the Cabinet.

The National League for Democracy's landslide election victory in late 2015 gave it large majorities in both houses.

Having been both a member of the party's Central Executive Committee and speaker of the lower house for two years shows Win Myint holds the skills to be president, said Win Zaw, a lower house lawmaker from the party.

""We hope that he will do great work as the president, and I am sure he will use his power to do the best he can for the country,"" he said.

Win Myint, who resigned as speaker of the lower house last week, was a successful parliamentary candidate in the 1990 general election, which was invalidated by the military, denying him his seat. He was elected in 2012 and again in 2015.

Born in the Irrawaddy Delta in 1951, Win Myint won his degree in geology in Rangoon and became a lawyer in the 1980s. His involvement with the National League for Democracy began when it was established during the failed anti-military uprising of 1988, which led to his brief term in prison. In 2010, he became a member of the Central Executive Committee of Suu Kyi's party.

Khin Zaw Win, director of the Tampadipa Institute, a policy advocacy group, questioned whether Win Myint's fealty to Suu Kyi was an asset.

""To those who are asking, he will be forever Aung San Suu Kyi's henchman,"" he said. ""I don't expect much change in the presidency, unless Win Myint puts the country's interests before Aung San Suu Kyi's and that of the military.""

Burma is often called Myanmar, a name that military authorities adopted in 1989. Some nations, such as the United States and Britain, have refused to adopt the name change.

A Section on 03/29/2018",http://www.arkansasonline.com/news/2018/mar/29/suu-kyi-loyalist-to-lead-in-burma-20180/
7,burma,"Double-decker bus bursts into flames near Thailand-Burma border

A double-decker bus carrying Burmese migrant workers to Thai factories crashed and caught fire on a highway in Thailand on March 30, killing at least 20 passengers.",http://www.washingtonpost.com/video/world/double-decker-bus-bursts-into-flames-near-thailand-burma-border/2018/03/30/716c9f9c-340e-11e8-b6bd-0084a1666987_video.html
8,burma,"Shikira Arifullah, a 22-year-old Rohingya woman is helped across the water after getting off a boat at a beach on the Bangladesh side of the Naf River at Shah Porir Dwip after fleeing from Guddumpara village, Bochidung in Burma's Rakhine state. Exhaustion and despair are almost palpable.

Since August 2017, more than half a million Rohingya people, a Muslim minority that Burma does not officially recognise as citizens, were forced to flee across the border to Bangladesh amid allegations of ethnic cleansing by Burmese forces. More than 688,000 of these refugees have reached Cox's Bazar, a district in southeast Bangladesh.

""The flow of people never seemed to stop,"" Getty Images photographer Kevin...",https://www.telegraph.co.uk/news/2018/03/25/behind-shutter-kevin-frayer-covering-rohingya-crisis-coxs-bazar/
9,burma,"Burma tops a list of countries where the ability of aid groups to reach people in need has worsened in the past six months, the Geneva-based research group ACAPS has said.

In examining 37 countries, ACAPS analysts considered nine indicators, including violence against humanitarian workers and restrictions preventing people from reaching aid.

“Myanmar is the country where humanitarian access has deteriorated the most, as access for the Rohingya population has become increasingly difficult,” the group said in a statement.

The ACAPS report preceded another released Tuesday by a British parliamentary committee, which warned floods and disease could kill thousands of Rohingya refugees in camps in neighbouring Bangladesh.

The chair of the International Development Committee, Stephen Twigg, said in a statement that time was running out, adding that donors “must work with the Bangladesh government.”

“Substantial numbers of refugees are about to face another crisis. With the weather about to turn, the fragile safety and sanctuary that the Rohingya have found in temporary camps provided by Bangladesh is in jeopardy,” Twigg said.

United Nations officials say nearly 700,000 Muslim Rohingya have fled Buddhist-majority Burma to Bangladesh.

That came after militant attacks in August sparked a crackdown, led by security forces, in Rakhine State that the UN and United States have said constitutes ethnic cleansing.

Burma has repeatedly denied reports implicating soldiers in widespread abuses of Rohingya civilians, particularly in Maungdaw, a border district in western Rakhine State.

Although the Burmese government had allowed some groups to access the district, it was “in a short-term and unpredictable manner,” said Pierre Peron, a spokesman for the UN Office for the Coordination of Humanitarian Affairs (OCHA) in Burma.

“Most humanitarian organizations that had been working in Maungdaw District for years have still not been able to resume life-saving programmes for some of the most vulnerable people in the world,” he told the Thomson Reuters Foundation via email.

A Burmese government spokesman was unavailable for comment.

The British parliamentary committee said the situation for Rohingya would likely worsen, with heavy rains expected to begin within days, followed by the cyclone season.

“Severe weather conditions and heavy rainfall could result in the deaths of thousands of Rohingya,” the IDC said.

The committee warned that the camps in Bangladesh are ill-equipped to withstand the 2.5 metres of heaviest rains predicted to fall from June through August. The camps were built quickly, with shelters in places prone to landslides and flooding.

Poor sanitation, as well as a low vaccination rate among Rohingya who had limited access to health care in Burma, meant flooding would likely bring disease, the IDC said.

ACAPS said humanitarian access had also deteriorated in Cameroon, Ethiopia, Libya, Mali, Pakistan and Turkey.",http://www.dvb.no/news/burma-worst-performing-country-aid-access-rohingya-refugees-face-monsoon-threats/80213
10,burma,"March 11, 2018; NPR

The US Holocaust Memorial Museum has revoked Aung San Suu Kyi’s Elie Wiesel award, given to those who confront hatred and prevent genocide, in light of her refusal to act on or even acknowledge the genocide being carried out against the Rohingya population in Myanmar (formerly known as Burma).

Suu Kyi was given the award in 2012 in recognition of her work against the Burmese military junta and for a peaceful, democratic Myanmar, a cause for which she spent 15 years under house arrest. Her father, Aung San, negotiated Burma’s independence from Britain. She has been the recipient of nearly a dozen prizes, including the Nobel Peace Prize, the Jawaharlal Nehru Award, and the Congressional Gold Medal. She currently serves as the State Counsellor of Myanmar, a position akin to Prime Minister; even though her party won a supermajority in the last election, she is prevented from holding the office of president because her late husband and her children were not born in Myanmar.

She faces global criticism now because she has refused to acknowledge or alleviate the plight of the Rohingya, a traditionally Muslim ethnic group based in Rakhine state. The country’s Buddhist majority and government refuse to acknowledge the Rohingya as citizens, referring to them as Bengali immigrants. As NPQ covered back in August, since neither Bangladesh nor any other country will allow them in, the Rohingya have nowhere to go. Either they live in refugee camps to which aid workers have little to no access, or they live in what the New York Times’ Nick Kristof has described as “modern-day concentration camps” in their native state, barred from citizenship, education, health care, and most other basic human rights. Hundreds of thousands have been killed, raped, burned, and displaced, but since aid workers and journalists are largely barred from Myanmar, exact statistics and the kind of large-scale interventions that might help have not been forthcoming. Reuters estimated in January that 655,000 Rohingya had been displaced. Al Jazeera reports that “in January, Myanmar and Bangladesh announced a repatriation deal, but rights groups and Rohingya have raised concerns about the agreement, saying it does not guarantee full citizenship, or safety, for those who return.”

The Holocaust Museum has been sounding the alarm for years. In 2013, they published a statement on the situation and staged an exhibition called “Our Walls Bear Witness: The Plight of Burma’s Rohingya.” In 2015, they released a report called “They Want Us All To Go Away: Early Warning Signs of Genocide in Burma” that called their treatment “a modern form of apartheid.” The report claimed that “there is still an opportunity to prevent this devastating outcome.” In 2017, Andrea Gittleman, Program Manager for the Simon-Skjodt Center for the Prevention of Genocide, said that the atrocities being perpetrated were preventable, but that “the international community has discarded much of its leverage to press the Burmese government to protect [the Rohingya].”

According to reports, Suu Kyi has lashed out at people who attempt to confront her about the genocide she has overlooked. Neither journalists nor international aid workers have been allowed into Myanmar; in fact, two journalists were arrested just months ago for investigating a mass grave in Rakhine State, where most Rohingya have traditionally lived. Bill Richardson, a former governor of New Mexico and United Nations ambassador, resigned from a Myanmar advisory board because, he said, “I discovered that this board was being used as a cheerleading squad for the government,” and he did not wish to serve on a board that was “devoid of any meaningful engagement with the local communities in Rakhine, whose people the advisory board is meant to serve.” (NPQ has frequently addressed the wisdom of resigning from boards that no longer fulfill their mission.)

On March 6th, the Museum sent a letter to Suu Kyi, stating,

Based on inspiration that you created for millions around the world, with your long resistance to military dictatorship, and your advocacy for freedom and human rights for all the people of Myanmar, we were honored to present you with the first Elie Wiesel Award in 2012. It is with great regret that we are now rescinding that award….We had hoped that you—as someone we and many others have celebrated for your commitment to human dignity and universal human rights—would have done something to condemn and stop the military’s brutal campaign and to express solidarity with the targeted Rohingya population…we urge you to use your unique standing and your official role as State Counsellor and Foreign Minister to cooperate with international efforts.

The museum’s bold step is not only directly aligned with its mission, it is an example others may follow. Pressure is mounting for the Nobel committee to revoke her peace prize; an online petition has nearly 500,000 signatures. Though it may not help the refugees directly, it is a loud call for the world’s attention and a principled act of disengagement based on mission and principle.—Erin Rubin",https://nonprofitquarterly.org/2018/03/14/holocaust-museum-revokes-humanitarian-award/
11,burma,"A new photographic exhibition documents the plight of Rohingya refugees fleeing ethnic cleansing in Burma and currently in refugee camps in Bangladesh.

A launch event was attended by members of the UK’s Rohingya diaspora community, some of whom met with Government officials in November last year to share their views on the crisis and discuss the UK’s response.

The exhibition by Adib Chowdhury lays bare the human cost of ethnic cleansing, recounting the violence and suffering through photographs and personal accounts. Each photo is accompanied by a handwritten testimony from the subject.

Adib Chowdhury is a British-Bangladeshi photojournalist who has travelled to conflict zones around the world, including Syria and Burma, to shine a light on the plight of refugees.

Chowdhury’s unique work is displayed alongside Government commissioned images recording the impact of UK aid.

Foreign Office Minister Mark Field opens an exhibition showing the plight of Rohingya refugees

Foreign & Commonwealth Office Minister for Asia and the Pacific Mark Field said, “I pay tribute to the commitment, energy and generosity shown by the British people, especially the British-Bangladeshi and wider Muslim community in supporting those affected by the Rohingya crisis.

""The UK Government will continue to work with its international partners to try to resolve this crisis, and to hold to account those that are responsible for it.”

Britain has so far pledged £59 million to support the 688,000 Rohingya who have fled to Bangladesh in the wake of humanitarian crisis created by the Burmese military.

Speaking at the exhibition, Adib Chowdhury said, “The exhibition is designed to tell the first-hand account of the Rohingya and give them a voice.

""The situation in Burma has been a horrific tragedy for many thousands of people, and I hope the photos will help to convey the unimaginable pain they have gone through.”



Nijam Uddin, General Secretary of the British Rohingya Community (BRC), said, “We’re pleased to have been invited to join this event and meet with Minister Field. The British Rohingya Community really appreciates that the UK Government is standing with us.”",http://www.asianimage.co.uk/news/16119003.New_exhibition_highlights_harrowing_cost_of_ethnic_cleansing_in_Burma/
12,burma,"Report

Background

As part of the programme, we visited the Rohingya refugee camps in Cox’s Bazar to follow-up on our interim report on that crisis (published in January 20183). The scale of the displacement, the provision made by the Bangladesh authorities and the efforts of the various international agencies, NGOs and other organisations, have to be experienced at first hand to be fully appreciated.4

We travelled to Bangladesh in early March 2018 as part of our inquiry into DFID’s work in Bangladesh and Burma1 commenced in October 2017.2

A new crisis

However, during discussions in the camps and afterwards, it became clear that a second challenge was fast approaching with the potential to derail, if not utterly negate, all the painful progress made in offering the displaced Rohingya refugees a measure of sanctuary, safety and hope. The matters raised were of such urgency that we felt a further interim report was required without delay.

While in Bangladesh, we heard grave and convincing concerns from many quarters that a substantial proportion of the Rohingya refugees’ accommodation was extremely vulnerable to the heavy rainfall that the imminent monsoon season would bring. Without decisions and action being taken very quickly to enable relocation to begin -- and to facilitate other mitigations -- people were going to die.

Extreme weather: heavy rain, storms, cyclones

The location, distribution and conditions of the Rohingya refugees’ camps and accommodation make them extremely vulnerable to the expected volumes of rainfall forecast for the 2018 wet weather, or ‘monsoon’, season and to the tropical storms and cyclones that are also a severe threat over the coming months. We were told that there were very serious risks of death, destruction and disease arising directly from flooding as well as consequent landslides and the escape of sewage and other forms of waste into a water-logged environment. These risks are estimated to affect some 230,000 Rohingya refugees.5 With around 500 Rohingya still arriving each week into the Cox’s Bazar district, the population under threat is constantly increasing.

This issue is extremely urgent for the simple reason that, at the time of writing, it is already mid-March and persistent rain is expected to begin in Cox’s Bazar in April until October with very heavy rainfall in June, July and August. Cox’s Bazar is expected to experience over two and a half metres of rainfall during these three months alone --average annual rainfall in the UK as a whole is 885 mm.

Conditions and factors in the Rohingya refugee camps which were described to us as creating, or aggravating, weather-related threats and risks included: • the location of the camps in an area which experiences strong winds and cyclones without the benefit of the evacuation systems and cyclone shelters that have worked effectively for the Bangladeshi population but do not have capacity for the refugees • restrictions on the use of durable materials, coupled with the sheer weight of demand, which have prevented the construction of new emergency shelters and led to the siting of structurally poor accommodation on hilltops and slopes offering limited protection from wind and wind-born debris • deforestation for fuel which has denuded the landscape and the consequent loss of binding root growth which has exacerbated the structural weakness of the sand and silt-based terrain, increasing the refugees’ vulnerability to mud and landslides • the sheer size, topography and population density of the Rohingya refugee camps -- plus the inhabitants’ previous lack of access to effective health care, in particular vaccinations -- which have already created conditions ripe for a public health disaster (diphtheria has already appeared7), and • the inevitable overwhelming of temporary sanitation arrangements by heavy rainfall, resulting in the environment being flooded by sewage, creating new vectors for the spread of contagious diseases.

We were told that the window of opportunity for establishing risk reduction and preparedness measures is closing. As the table above demonstrates, the time remaining until the rains start in earnest could be a matter of days. This in itself will hamper any efforts to take the steps necessary to prepare for the genuine deluges expected to start within two and half months.",https://reliefweb.int/report/bangladesh/house-commons-international-development-committee-bangladesh-and-burma-rohingya
