,Concerning,Text,URL
13,puerto+rico,"Daiza Aponte with her daughters Alannys and Enrielys at the Pointe Plaza Hotel in Brooklyn, where they are being housed by FEMA

Daiza Aponte with her daughters Alannys and Enrielys at the Pointe Plaza Hotel in Brooklyn, where they are being housed by FEMA

On March 5, nearly three months after landing at John F. Kennedy Airport on a flight from Puerto Rico, 29-year-old Daiza Aponte finally moved into a hotel room with a kitchenette.

Soon after Aponte and her two young daughters arrived in New York last December, the Federal Emergency Management Agency placed them, along with dozens of other Puerto Rican families fleeing the island in the wake of Hurricane Maria, in a Holiday Inn Express overlooking the Major Deegan Expressway in the Bronx. Hotel management refused to let the families bring food to their rooms, recalls Aponte, and her toddler daughter didn’t have a crib. She fell out of bed three times.

Now, FEMA has transferred Aponte to the quiet Pointe Plaza Hotel just north of Flushing Avenue in Hasidic Williamsburg. “It’s like a studio,” Aponte told the Voice in Spanish on a recent afternoon at a Brooklyn pizza shop. One-year-old Alannys slept in her stroller, tucked into a pink snowsuit, while three-year-old Enrielys climbed under the table. “If you need pots, spoons, they’ll give it to you. I can ask for a sheet and they’ll give me one.”

Daiza Aponte retrieves pizza and spaghetti from her hotel refrigerator to warm up for her daughters. Photography by David 'Dee' Delgado

Aponte is determined to stay in New York City, where her children, who both have asthma, receive better healthcare than they did in Puerto Rico. But she knows that her current living situation is temporary. FEMA was housing 225 Puerto Rican families in hotels in New York State as of March 13, according to the agency. Its Transitional Shelter Assistance Program has been extended until May 14 at the request of Puerto Rico Governor Ricardo Rosselló, but only for families who qualify based on FEMA’s inspections of their homes back on the island. FEMA also offers rental assistance on a case-by-case basis, but the amount is based on rents in the area where the disaster took place.

One-year-old Alannys finally has a crib at the Pointe Plaza, after repeatedly falling out of the bed she shared with her sister at a FEMA-provided Holiday Inn in the Bronx. Photography by David 'Dee' Delgado

Aponte says she’s been offered $550 per month for six months. So far, apartment hunting in New York at that price has been futile. “Everything I’ve found is $1,200 and up, for just one room,” she says. “We lost our homes there, and then came here to end up in the street.”

***

After Hurricane Maria hit Puerto Rico, New York Mayor Bill de Blasio was explicit that there isn’t enough affordable housing in New York City to accommodate families who couldn’t stay on the island. More than 63,000 New Yorkers already sleep in shelters each night as of January, and the rental vacancy rate is a sobering 3.6 percent. “I don’t want to encourage people to come here if they don’t have some family to turn to,” de Blasio told CBS’s Marcia Kramer in October. “I think we have to be really clear about that.”

To address other needs, the city launched an emergency service center at the Julia De Burgos Performance and Arts Center in East Harlem that welcomed more than 2,500 households from Puerto Rico, Texas, Florida, and the Virgin Islands seeking free, bilingual legal counsel and mental health services; winter clothing; and applications for food assistance and Medicaid.

But the emergency center quietly shut down on February 9. Now, nonprofit emergency response organizations and advocates for the Puerto Rican community say City Hall should form a task force to correct issues that have cropped up over and over in recent months, such as a lack of sympathetic translators at Human Resources Administration offices, and insufficient job training and legal assistance for families seeking to challenge FEMA denials. In fact, the city should have circled the wagons months ago, they say, so families would be more prepared to look for their own housing come spring.

Aponte shares her story with a panel of hurricane relief volunteers at Hostos Community College, as Jonathan Soto translates. Photography by David 'Dee' Delgado

Jonathan Soto worked at City Hall until late January as director of de Blasio’s Center for Faith and Community Partnerships. He was tasked with helping set up the city’s emergency center, but left for a job at Union Theological Seminary after realizing he could “do more on the outside.” Soto believes a task force could have helped the city coordinate with councilmembers in districts with large Puerto Rican populations, like the Lower East Side and Sunset Park. With multiple service centers, he says, families wouldn’t have had to make the daunting commute to East Harlem.

“The problem is going to get worse before it gets better,” says Soto. “When FEMA assistance runs out, where are those folks going to go? The existing shelter system.”

Many people who fled Puerto Rico after the storm are running through their savings, he notes, and the island is still a long way from a full recovery. “People are going to make the wager to stay here, putting a bigger strain on nonprofits and welfare,” he says. “I don’t think the city has a contingency plan.”

***

Health and Human Services Deputy Mayor Herminia Palacio said at a recent press conference that City Hall closed the emergency services center after “the influx of people evacuating … slowed.” She urges Puerto Ricans to instead seek help at any of the 24 Homebase offices across the city, which provide New Yorkers at risk of homelessness with emergency rental assistance and financial counseling.

“Folks should certainly know that they can walk into any Homebase and get a full array of services,” Palacio told reporters at a recent press conference. HRA also granted the nonprofit Catholic Charities $180,000 to assist Puerto Rican families already in the shelter system with Medicaid, SNAP, and FEMA applications at four Homebase offices in the Bronx.

But advocates worry the issue is a lack of advertising, not a lack of need. “At the beginning the Julia De Burgos Center was promoted very well. They allowed all of the newspapers and cameras to come in,” says Lilah Mejia, a coordinator with New York Disaster Interfaith Services. Her nonprofit had a table there, and distributed winter clothing and MetroCards. “As time went on it kind of died down and people forgot,” she says.

Aponte schedules an appointment as Alannys Martoral plays with an old cellphone. Photography by David 'Dee' Delgado

Aponte never made it to the service center. Instead, she says, she made two futile attempts to acquire cash assistance, complicated by the language barrier and her lack of sufficient documentation. HRA requires proof of the number of people living in an applicant’s household, and Aponte’s TSA paperwork doesn’t list her children. During one visit to HRA’s 300 Canal Place center in the South Bronx, she says, Alannys started coughing and a staff member accused her of spreading the flu. “She hung up on the translator, and I had to communicate there as best as I could,” Aponte recalls. “That was really hard. I left there crying. I felt nervous.”

HRA declined to comment on Aponte’s case, citing privacy rules. A spokesperson tells the Voice, “We are doing everything we can to help evacuees from areas impacted by major storms last year, working diligently and as fast as possible to help them get back on their feet.”

As of February 8, according to HRA, 49 percent of storm victims’ cash aid requests and 54 percent of SNAP requests were approved and active. HRA said that some cases were closed because applicants left New York or got jobs that made them ineligible, but did not break down the data further.

“You hear the HRA nightmares,” says Mejia. Since the emergency center closed, she has a skeleton crew operating on Tuesdays and Thursdays out of the Church of the Holy Agony on Third Avenue in East Harlem. “People treat you unjust,” she says. “So families return [to us] because they knew they could come to a warm friendly face. Where we would embrace and assist them.”

***

Advocates have also accused the city of failing to disseminate information about New York’s housing crisis to Puerto Rican families. Maisha Morales is a program coordinator at Good Old Lower East Side, a nonprofit that fights displacement in that neighborhood. For several weeks following Hurricane Maria, she says, Puerto Rican families would show up at her office seeking housing assistance, on the recommendation of volunteers at the Julia De Burgos Center. She had no choice but to send most of them back uptown.

“Of course it’s heartbreaking,” says Morales. “We tried our best as far as informing them what’s out there — understanding what a housing lottery is, and that you would need a certain income bracket to qualify. Most of them didn’t have jobs, so they didn’t qualify for it.”

Raul Grajales waits for the train at Columbus Circle. Photography by Mónica Félix

Without reliable housing, says 28-year-old Raul Grajales, everything else falls apart. His $200-per-month studio apartment in Canóvanas, with a rooftop view of El Yunque National Forest to the east and the beach at Isla Verde to the west, was completely destroyed in Hurricane Maria. He left Puerto Rico and moved in with a friend in Queens in October, but quickly realized that “there was basically no space between us.”

Grajales eventually responded to a Craigslist ad for a bedroom in Washington Heights and agreed to pay $550 for two weeks. The roommates disappeared after a week and the heat and electricity were cut off, a cruel reminder of the situation he’d left behind. “I was like, I should have stayed in PR. What the fuck am I doing?” he recalls.

Grajales ended moving in with some sympathetic neighbors for $650 per month. He established a routine, helping a roommate sell flowers out of a shopping cart. (He says his seven years of experience in food service meant nothing in New York, where restaurants asked for at least a year of local experience.) He was glad to be in a diverse city, he says: “I may not have enough money to travel the world, but New York brings the world to you. I met Jamaicans, I met a lot of Mexicans, I met Dominicans, Taiwanese, people from everywhere. That’s pretty nice.”

“I also chose New York because I wouldn’t need a car,” he says. “People complain a lot about the MTA, but hey, at least it’s something.”

Even so, on March 4 Grajales flew home to his parents’ house in Bayamón with the last of his two years’ savings. “I knew it was going to be difficult,” he says. “But I was unforgivably naive.”

***

On March 13, First Lady Chirlane McCray hosted a press conference at the headquarters of the Hispanic Federation in lower Manhattan to announce a $100,000 grant for mental health services in Puerto Rico. Later that afternoon, she flew to the island for a day of touring. During a Q&A session following the announcement, Deputy Mayor Palacio told the Voice that City Hall has “no plans for a task force explicitly” to address gaps in aid for Puerto Rican evacuees in New York City.

“On the island they’re doing great work,” Mejia of NYDIS said afterwards. “But what about our families here in the city?”

Now that the service center is closed, volunteers are stepping up to assist Puerto Ricans for free. Victor Martinez, a Puerto Rico native from the Bronx, created the website Diaspora X Puerto Rico in October with his wife, Surey Miranda. It links out to subway maps, details about emergency Medicaid and shelter, and job boards. “We use Facebook,” he explains. “We are only four volunteers, and we have been able to contact around 200 people since two weeks after the hurricane.”

Martinez adds, “Apart from talking to people about what they need, we try to have a conversation with them. To know a little bit more about their stories, what they went through.”

Axel Reyes and his wife, Michelle Torres, with their children Jonathan, Ashley, and Jailene Reyes, all of whom are sharing a room at the Pointe Plaza Hotel. Photography by David 'Dee' Delgado

Evacuees are also helping each other. Aponte’s friend Axel Reyes, a 42-year-old father of three, came to New York with his family after the hurricane destroyed his restaurant in Coamo. His children’s school shut down and his home lost potable water. He has lived in New York City before and speaks fluent English, so he’s helped other FEMA families, sharing his knowledge about the subway and public assistance.

“We try to help everyone,” he says. “One for all, and all for one.”

Reyes, who’s staying in the same hotel as Aponte, tells the Voice that he doesn’t qualify for a FEMA extension through mid-May because inspectors haven’t been able to assess damages. (He doesn’t have family or friends in Puerto Rico to let the inspectors inside.) He says he’s received notice to move out of the hotel on Tuesday, six months to the day after the hurricane hit Puerto Rico. A FEMA spokesperson says extensions are available for some families, but stressed that allowances are made on a case-by-case basis. Reyes has been working five days a week, commuting to a steelworking job in the Bronx nearly three hours each way, but doesn’t have enough saved to rent an apartment. “My kids aren’t taking it too good,” he says.

Yet he’s determined to stay in New York. Reyes proudly shows the Voice pictures of two certificates his fifteen-year-old daughter has received at her new school in the Bronx: perfect attendance and honor roll.

Back in Coamo, he says, there’s “no food, no water, no school, no light, no nothing. So I made the choice.”

“And my choice turned out to be right,” he adds. “I’m working. I’m feeding my kids. I don’t have a stable home for them, no, I do not, but they’re eating every day.”

Additional reporting by Felipe De La Hoz

To read the Voice’s complete coverage of Puerto Rico and Puerto Ricans six months after Hurricane Maria, click here.",https://www.villagevoice.com/2018/03/19/from-one-crisis-to-another/
14,puerto+rico,"I hesitate to even write the phrase “Activist Comedy.”

The second word is obviously subjective, because not all comedy is funny, but the first word can sound even more vague, loaded with subtext that threatens to defeat any actual context. So “Activist Comedy” sounds like something people can only loudly dislike for stupid reasons or proudly support for emptily symbolic reasons.

But I’m not sure how else to explain something like The Great American* Puerto Rico, an intriguing hourlong special made by Samantha Bee and the Full Frontal crew. It’s an impressive tour through the Caribbean Island, still recovering from Hurricane Maria half a year after the media cycle moved on. It is sometimes funny and sometimes unfunny, but it is a consistently profound attempt to focus the media cycle—and politicians, and voters—onto the problems facing Puerto Rico.

“How did we f— up so badly?” the host asks early in the special. It’s a complicated question, with several answers rooted in history, money, corruption, and the possibility that certain dominant personalities in the government have no idea what Puerto Rico is. One segment that explains the history of Puerto Rico and its confusing status within the United States. (The asterisk in the title is because Puerto Rico’s history, is, to put it mildly, complicated. The island is a Commonwealth, which means that Puerto Ricans are American citizens who don’t get to vote in American elections, which is obviously ridiculous.) Bee’s covering a lot of ground here, talking to local politicians, activists, barbers, people on the street. Trump and FEMA are mentioned, but they are as distant here as they actually are for many Puerto Rican citizens.

Although the special tries to explain the administration’s embarrassingly gradual reaction to the hurricane’s devastation, it also cleverly tracks the unexpected ways that Puerto Rico is changing. Bee flies to Florida, where has seen an influx of Puerto Ricans fleeing a busted power grid and the lack of running water. In one splitscreen, she captures the overlapping conversations about Puerto Rico’s future: Should it be a state, an independent nation, something else? The show also visits an extremely Mr. Robot-y investment summit, where she explores how Puerto Rico is becoming a tax shelter for millionaires. (God help the Puerto Ricans, first came the hurricanes, then came the Blockchainers.)

It’s an assault of information, much of it fascinating. One of the people interviewed is Tania Rosario Mendez, the executive director of Taller Salud, a “nonprofit NGO female-led feminist organization” which is attempting to provide supplies like food and shelter to areas not much helped by FEMA. When you least expect it, David Duchovny suddenly appears, vaguely in character as Fox Mulder and looking vastly less bored than he did this year on The X-Files, trying to come up with a conspiracy theory to explain why so many Puerto Ricans still don’t have power. The hour even ends on a note of capitalist advocacy, with Bee producing Full Frontal T-shirts in Puerto Rico (currently for sale!)

Full Frontal‘s been around for a little over two years. Bee clearly has ambitions for expansion, and I appreciate the intentions to produce something above and beyond the news cycle. The current administration often feels too perfect for late night comedy: If you’re low on jokes in the morning, you can count on the White House suffering a scandal by noon.

The Great American* Puerto Rico aims for something more expansive. It’s held back, I think, by a weirdly broad tone, and some undercooked sketches. The special opens with Bee and her correspondents “arriving” in Puerto Rico, as if they just swam there, okay. There’s a “Despacito” joke, which I guess was mandatory but still isn’t funny. There’s a long jokey montage of Bee working with a T-shirt designer on making a perfect T-shirt, and a long jokey montage where Bee tries to round up all her correspondents, and a scene where she sings “Nobody Does It Better,” oddly prefabricated beats that feel DOA compared to the roving curiosity of the interview segments. The episode ends on a Flashdance joke, and seriously, this and the Deadpool poster, what’s with the Flashdance jokes suddenly? Did everyone get the same subscription to Played Out Pop Culture References Weekly? Is there a Flashdance joke in Ready Player One?

There’s blunt honesty in how Bee presents the plight of the Puerto Ricans. She keeps on situating the island’s story within a larger national framework, referring to how it’s sustained “the longest blackout in US history” after suffering “the worst natural disaster in American history.”

Strong words, but some elements of The Great American* Puerto Rico feel too much like one of those BuzzFeed GIF explainers that simplifies a complex topic past the point of helpfulness. The production visits a local comedy troupe, a hipster bar, and two different barbers. You appreciate the intentions: We’ve gone beyond the politicians to speak to the people! But this never doesn’t feel like a specific sop to some notion of Full Frontal‘s demographic, who presumably have their own comedy troupes that perform at hipster bars in the back room behind a barbershop.

The special ends on an odd note of optimism. Bee says of Puerto Rico: “It’s got a long way to go, but it’ll get there.” This is a lovely thought, at odds with the general chaos the special maps out. I sure didn’t feel optimistic, so I donated to Taller Salud. Whether The Great American* Puerto Rico was good activism, so-so comedy, or unpaid advertising for nonprofit groups, it sure worked on me. I hope Puerto Rico gets “there,” and good luck with the Blockchainers.",http://ew.com/tv/2018/03/29/samantha-bee-puerto-rico-review/
15,puerto+rico,"Full Frontal tonight airs a one-hour special from Puerto Rico in which Samantha Bee and her correspondents visit the island that was very sexy top-of-show news when Hurricane Maria hit months ago, leaving 1,000 dead, about 10K homeless, and 3.4M without power.

The Great American Puerto Rico was taped about a month ago; 103K still were without power, Bee reported, calling it “shameful” given that Puerto Ricans are American citizens.

“If this happened in Connecticut, it would be front page news every day,” she said, adding, “How did we f*ck this up so badly?!”

Bee says in the special she grabbed her correspondents and rushed to Puerto Rico “to find out what the hell was going on,” telling her crew “Let’s make America give a damn about Puerto Rico.”

Bee’s program points the finger at the “shady” companies contracted to restore power to the island. And at FEMA which, locals told her, didn’t just not show up, but rejected hundreds of thousands of homeowner applications for assistance because they did not have deeds for their homes.

David Duchovny is brought in to serve as FEMA Conspiracy Explainer, making great use of his conspiracy-theory yarn. After the hurricanes, Duchovny said, ‘FEMA did its usual mediocre job in Florida and Texas” but in Puerto Rico “did way worse.” They told locals to apply for assistance by phone or online when they had no internet or electricity, for instance. And, even though Puerto Rico is famously broke, FEMA told them they had too much money to receive disaster loans, “because they didn’t do their f*cking homework,” Duchovny scowled.

The show went to the town of Loiza where Tania Rosario Mendez, executive director of Taller Salud, was doing incredible work with the NGO female-led organization. “We were waiting for FEMA to show up, but they didn’t, so we just started buying tarps and putting them up” to replace roofs that had been blown off, Mendez explained. They found out what else the people needed by going to the women and asking them.

“We just listened,” she said, becoming straight-woman for Full Frontal’s question: “You listened to women and no one tried to accuse you of ruining a mediocre comedian’s career?”

During the special Bee announces she had moved her TBS late-night show’s T-shirt production to Puerto Rico, and challenged others to do same, most especially former The Daily Show colleague/current CBS Late Show host Stephen Colbert.

Bee actually visited Late Show Tuesday night to tout her special, but kind of stepped on her own promotion when she mentioned to Colbert that, as an adolescent, she used to steal cars:

Bee had first announced herPuerto Rico special back in January, during another Full Frontal special in which she sent her staff to race around, apologizing on behalf of the United States for all the things Trump had done at that point.

That included a stop in Puerto Rico, where Trump paid a visit last October, 13 days after Hurricane Maria hit, to tell residents how much he loves the place he seemed to have only just learned was an island. He informed them their weather is “second to none, but every once in a while you get hit. And you got hit.”

POTUS also addressed the devastation the hurricane caused – to him. “I hate to tell you Puerto Rico, but you’ve thrown our budget a little out of whack,” he said. Trump met with victims, seen on-camera telling one local, “We’re going to help you out…have a good time.”

Trump also handed out supplies, in the Trumpiest way possible, lobbing paper towels and other goods at locals in a church. When he passed out flashlights, the president informed the residents, “Flashlights. You don’t need them anymore!”

About four months later, nearly half a million people on the island still lacked power.",http://deadline.com/2018/03/samantha-bee-puerto-rico-special-donald-trump-fema-david-duchovny-video-1202354417/
