,Concerning,Text,URL
19,puerto+rico,"Six months after Hurricane Maria, and whole towns in Puerto Rico still remain without power. To imagine living for half a year without energy, try this experiment.

Turn off your lights and television. Unplug your refrigerator, your washer and dryer and stereo. Leave off your faucets, because your town’s pumps need power, and your phone too because who knows when you’ll be able to charge it again.

Naguabo firefighter Ronald Vega was dealing with such circumstances when we visited his family home in January. He was one of the 70,000 people living along the coast whose home still remained without power. At night, Vega and his two daughters ran a gas-powered generator for light. But during the day, Vega’s house sits quiet without the buzz of electricity. The refrigerator doesn’t hum, the ceiling fan is still.

“It’s such a tough situation. I’m paying at least $15 a day for the fuel of my generator during the week,” said Vega, who makes less than $20,000 a year.

During our visit, major highways were free of debris, but signs of the devastation lingered in most towns. Trees and power poles leaned haphazardly across roadways in Naguabo and Humacao, two southeastern municipalities where Maria first hit. Lines of cars and trucks crawled along a beachside road, careful to avoid the dangling powerlines. Even the homes that do have power are often struck with power outages.

But a few miles away from Vega’s home, Naguabo’s firehouse sat energized, thanks in part to a 6,600-kilowatt solar system and a humanitarian effort led by a San Francisco-based nonprofit called Empowered by Light.

After Maria knocked out emergency communications and water resources across the island, the organization teamed with the Las Vegas Fire Department to install solar hubs at firehouses across the island. Sunrun, a Bay Area solar company, provided solar panels and solar batteries, while a local construction company called Aireko installed solar-powered water filtration units.

“These communities need to rebuild using smarter, more resilient, diversified power sources,” said Moira Hanes, Empowered by Light’s executive director and co-founder. “Solar and storage is the foundation for the future of any energy infrastructure for places like this that are really prone to extreme weather events.”

These organizations were among dozens to provide renewable energy after the storm. But making renewables a mainstay will require more than solar panels and wind turbines. There’s also a monopoly and Congress with which to contend.

Why Puerto Rico stayed dark

When Hurricane Maria slammed into central Puerto Rico, the entire town of Adjuntas went dark — save for one pink building known as Casa Pueblo.

Founded in 1980, Casa Pueblo is half community center, half environmental organization and fully powered by solar.

“Casa Pueblo has been running on solar power since 1999, so we’re not new in this. After the hurricane, our facilities were intact, as well as our energy system,” said Arturo Massol, Casa Pueblo’s director.

After the hurricane, the building became a refuge. The center’s solar microgrid — a self-contained island of power that doesn’t need any outside energy to operate — allowed the people in Adjuntas to charge their medical devices and phones. Its community radio station broadcast news updates in the days after the storm, Massol said.

Solar panels can survive hurricanes, even Maria’s 150 mile-per-hour winds. Not so for the power plants residing not far from Adjuntas.

“If you were going to pick the worst possible direction for a hurricane to come through, Maria took that route, and did a lot of damage,” said Colonel John Lloyd, commander of Army Corps of Engineers Task Force Power Restoration in Puerto Rico. Eighty percent of the commonwealth’s grid was damaged or destroyed, along with 65 percent of its transmission and distribution system, he said

“If you were going to pick the worst possible direction for a hurricane to come through, Maria took that route, and did a lot of damage.” – Colonel John Lloyd, commander of Army Corps of Engineers

A number of factors made this grid uniquely vulnerable. Puerto Rico Electric Power Authority (PREPA), the island’s sole energy supplier for 1.5 million subscribers, had built its grid over 76 years. Most of the island’s power plants reside in the south, where the storm made landfall.

These facilities run almost exclusively on imported fossil fuels, with 98 percent of the island’s energy supplied by coal, natural gas and oil. The first wave of Maria flooded those power plants and destroyed ports, which should have stalled but not stopped the energy supply. The death blow came in the form of overgrown trees.

“A big part of the problem was the backlog of maintenance,” said José Román Morales, head of the oversight commission that regulates PREPA. If they wouldn’t have had a trimming backlog, there would have been less damage on the lines.”

Prior to Maria, PREPA had racked up $9 billion in debt and its Fuel Procurement Office faced a corruption scandal. As a result, much of Puerto Rico’s grid was 20 years out of date when the storm arrived. In a matter of hours, trees toppled hundreds of miles of old school transmission power lines.

Rebuilding a grid for 3.5 million Americans in mountainous terrain takes time. The U.S. Army Corps of Engineers helicoptered supplies and employees to secluded valleys, but it has also been forced to hand-dig holes in places where heavy equipment can’t go.

Also slowing recovery is The Robert T. Stafford Disaster Relief and Emergency Assistance Act. This legislation, which sets the terms for how emergency funds are allocated, requires buildings and other infrastructure to be restored to their original state after a disaster.

One stark example involves “Puerto Rico special” — a type of wiring specific to Puerto Rico that is used for electricity lines. Early in the recovery, U.S. stockpiles of Puerto Rico special ran out, and the government was forced to contract with factories overseas in Canada, Mexico and South America.

Other materials, like poles, were running short when we visited– due to demand from areas hit by other Hurricanes, Harvey and Irma. The Army Corps and PREPA had received only half of the 9,800 miles of wiring and less than half of the 54,000 poles they had requested by January.

An Army Corps map of functioning transmission lines from late January showed these challenges. The island’s rugged center and southeast were de-energized.

In the last two months, more supplies and workers have arrived, quickening the recovery. In January, four months after the storm, 450,000 power subscribers lacked power. Today, the number is down to 105,000.

New poles and wiring replaces aging infrastructure, but The Stafford Act prevents the recovery from hardening the grid against the next storm, Lloyd said.

Justo Gonzalez, PREPA’s interim director, echoed this point. In the wake of the storm, he said PREPA wanted to install its power cables underground. But this upgrade would require a seperate overhaul of the grid.

“We hope to change some things to make the system stronger. We now know which [electric] posts are needed to withstand winds of such categories,” Gonzalez told NewsHour through an interpreter. “But this won’t take months to replace. It will take years.”

But there’s an alternative, some say, to replacing the aging infrastructure: a renaissance of renewables.

A solar plant in a virtual cloud

In a white chest in an upstairs apartment in Old San Juan is a box inlaid with a green, pulsating circle that looks like Iron Man’s chest plate. It’s a solar battery — one of the key ingredients in a solar microgrid.

“Batteries have made an enormous leap forward in recent years with the addition of lithium ion batteries, which is why we were able to have this self-contained system,” said Adam Gentner, head of business development for sonnen’s Latin America Expansion.

Sonnen, a world leader in solar batteries, donated microgrids at 15 key sites. They picked mostly food shelters, schools and other locations that had served as makeshift shelters after the storm.

But in Old San Juan, the battery’s cables were attached on one end to rooftop solar panels and on the other to La Perla Lavandería — a laundromat. After Maria, wastewater in Puerto Rico wasn’t being treated, and the skin disease leptospirosis emerged. These solar-powered washing machines can now prevent the risks associated with handwashing clothes in hazardous water.

“We use lithium iron phosphate, which is, as you can see, not a small system for a home, but it’s much more resilient to environmental factors,” Gentner said, relative to other types of batteries. This lithium-ion battery can discharge and charge up to 10,000 times. Meaning at a typical rate of one charge-discharge cycle per day, the battery would last 26 years without replacing, even in this hot humid climate which can affect battery life.

One sustainability expert estimates Puerto Rico would need 350,000 solar systems to support its 3.5 million residents. But that’s not totally accurate, as residential solar systems often collect more energy than they need. This excess energy could be pooled into what’s called a virtual power plant.

Unlike a standard power plant, which ships energy from a single place, virtual power plants consist of hundreds if not thousands of sources — all feeding power to the community. In Europe, a sonnen community of 10,000 residential solar microgrids produces as much energy as all the coal plants in Texas and West Virginia — America’s top-two leaders in coal power production.

A smart grid is a type of virtual power plant that relies on a self-thinking network of microgrids. It can autonomously communicate where excess energy is being produce, and then decide how to transmit this juice along power lines.

At the University of Puerto Rico, Mayaguez, a team of computer scientists, electrical engineers and social scientists have been designing a smart grid tailored for Puerto Rico. The project, called OASIS, has completed lab testing and is in the early stages of field testing.

To support the smart grid, the team engineered a series of machine-learning algorithms. One algorithm predicts how solar microgrids perform in real-time by monitoring weather reports. Another tracks how much energy passes through transmission lines to prevent power surges, electrocution of line operators and blackouts.",https://www.pbs.org/newshour/science/puerto-rico-went-dark-6-months-ago-heres-how-solar-energy-may-speed-the-recovery
20,puerto+rico,"Health experts had registered a total 253 suicide cases; the majority of victims, roughly 86 percent, were men aged between 55 and 69.

Six months since Puerto Rico was torn apart by Hurricane Maria, suicide rates continue to soar as the island struggles to regain its footing.

According to reports, following 2017’s natural disasters on September 20, the number of suicides spiked were seen to spike by nearly 30 percent, the Puerto Rican Department of Health announced.

In 2016, there were 196 victims of suicide registered, the lowest rate recorded in twenty years. However, one year later, health experts had registered a total 253 suicide cases, the highest rate since 2013. The majority of victims, roughly 86 percent, were men aged between 55 and 69.

As of January, the Puerto Rican crisis hotline has received a total of 3,050 calls from suicide attempts, a 246 percent spike from last year.

An additional 9,645 people admitted to calling the hotline in the past three months after considering suicide which is an 83 percent increase from 2016’s records.

Homelessness, unemployment, lack of basic necessities are believed to be large contributing factors to the cloud of stress and anxiety hovering over the island, said Psychology Professor Julio Santana Marino from Puerto Rico’s Universidad Carlos Albizu.

""It's normal for there to be family conflicts, but when you add the stress of more than five months without power, without food, living patterns change ... it makes it harder for people to manage daily life,"" Santana told El Nuevo Dia in February.

The territory continues to experience the longest recorded power outage in U.S. history and health professionals say this also contributes to the prolonged feelings of depression.

“Such prolonged darkness is insidious to community mental health,” said First Deputy Commissioner Oxiris Barbot, New York City Department of Health and Mental Hygiene.

Sandro Galea, dean at the Boston University School of Public Health explained that a study should be conducted which links the physical and mental strain victims experience in post-disaster situations, “The stigma that you can just “get over” mental illness remains. In truth, one can get over mental illness roughly the same way one can get over a broken bone by oneself—with difficulty, and likely in a way that will not result in proper healing.”

Last week, distraught family members, Puerto Ricans, and members of civil rights groups paraded outside the Federal Emergency Management Agency, FEMA building in Washington D.C. to protest the stagnant state of affairs on the island and to demand government aid.

FEMA has come under severe criticism for its failure to provide help to Puerto Ricans in dire situations. The U.S. agency has failed to respond to people looking for respite amid situations demanding urgency. With the island in crisis, FEMA has rejected the pleas of Puerto Ricans who don't have a deed to their home.",https://www.telesurtv.net/english/news/Puerto-Rico-Suicide-Spikes-by-30-Percent-After-Hurricane-Maria-20180328-0032.html
21,puerto+rico,"CLOSE Puerto Rico is facing a galloping mental health crisis. Besides working to restore electricity and basic needs to residents after Hurricane Maria’s destructive run here, state officials are also scrambling to meet the mental health of its residents. Carrie Cochran/USA TODAY Network, Rick Jervis/USA TODAY

Magdaliz Medina has been without electricity and running water since Hurricane Irma -- two weeks before Maria. She collects water in plastic barrels in her carport, some of which contain floating, dead mosquitos. She uses that water for bathing and washing dishes and buys bottled water to drink. (Photo: CARRIE COCHRAN/USA TODAY NETWORK)

MOROVIS, Puerto Rico — Magdaliz Medina struggles each day to meet life's basic needs: electricity, water, food.

But there's a darker challenge she faces six months after Hurricane Maria ravaged her island: her mental stability and the crushing depression that visits her each day in her darkened home.

“I sit and cry all day,” said Medina, 42, who has lived without power or water for more than six months. “I was depressed before the storm. Maria made it worse.”

Puerto Rico is facing a galloping mental health crisis across the island. Besides working to restore electricity and other basic needs to residents after Maria’s destructive run Sept. 20, state officials also are scrambling to meet the mental health needs of their residents.

Crisis managers at a suicide prevention hotline in Bayamón, near San Juan, receive 500 to 600 calls a day from people around the island in varying stages of desperation. Some callers just want to talk about their loss of home or income or family members who have fled to the mainland USA. Others call with very specific suicide plans.

The number of suicide-related calls to the hotline more than doubled from 2,046 in August to 4,548 in January, according to department statistics. Suicide attempts also have climbed from 782 in August to 1,075 in January, data show.

More: Hurricane Maria storm victims still need your help

Crisis managers work the phones of a 24-hour state-run suicide prevention hotline in Bayamón, Puerto Rico. Suicide rates have gone up since Hurricane Maria on the island, which was experiencing a financial crisis before the storm struck. The hotline takes crisis calls, and the staff also follows up with clients and connects them with services. (Photo: CARRIE COCHRAN/USA TODAY NETWORK)

The island already had been wrestling with a rise in mental illness during its 10-year recession that sparked widespread unemployment and family separation caused by migration. Maria made matters much worse, public health officials say.

The mental health center at Ponce Health Sciences University in the southern part of the island receives about 4,000 to 4,500 patients a month. Many come from the nearby mountains, complaining of anxiety, depression and suicidal thoughts tied to Hurricane Maria's destruction, said Kenira Thompson, a university vice president in charge of mental health services.

Initially, counselors saw patients with acute stress and anxiety, she said. But as the six-month mark approached, doctors recorded surges in post-traumatic stress disorder, depression and suicidal thoughts and attempts, Thompson said.

“We’re very concerned with the suicide rates,” she said. “It’s nerve-racking.”

Besides manning the suicide hotline, public health officials have dispatched more than 400 counselors and mental health professionals across the island to meet the growing need, said Suzanne Roig, administrator of the mental health division of the Puerto Rican health department.

A rapidly approaching hurricane season, which begins June 1, adds to their concerns. “We know that could have a very big impact on the mental health and emotional reaction of people,” Roig said.

Magdaliz Medina has been without electricity and running water since Hurricane Irma. “I sit and cry all day,” Medina, 42, said as tears welled in her eyes. “I was depressed before the storm. Maria made it worse.” (Photo: CARRIE COCHRAN/USA TODAY NETWORK)

On a recent morning at the hotline call center, Claudee Garnett, one of the crisis managers, took a call from a woman who confessed she had taken an excessive amount of Xanax. Her voice was slow and slurred. Calmly, he asked for the names and phone numbers of family members.

While Garnett kept her on the line, another crisis manager called a relative who raced to the woman’s home. Garnett talked to the woman for more than an hour, until the family member was able to arrive and take her to a nearby hospital emergency room.

Many callers display acute mental disorientation brought on by Maria, Garnett said. “They don’t have basic needs: roof, home, water, electricity,” he said. “Their lives have changed.”

Crisis manager Claudee Garnett talks to a suicidal client who called Línea PAS, a state-run suicide prevention hotline in Bayamón, Puerto Rico. The client called after taking too many Xanax. (Photo: CARRIE COCHRAN/USA TODAY NETWORK)

Another crisis manager, Alberto Morales, answered a call from a man in Corozal, about 25 miles southwest of San Juan, who said he was suffering panic attacks brought on by living with family members for months. Maria destroyed his home.

In a calm, steady voice, Morales advised him to keep his mind busy with other activities: Read, listen to music, exercise. If the attacks persists, seek professional help, he told him.

“They feel helpless,” Morales said later. “You try to give them the basic tools to survive.”

The crisis managers work eight-hour shifts, five or six days a week, absorbing some of the worst thoughts and behavior wrought by the hurricane.

Silvette Acosta, 27, said all the crisis managers, including herself, have been trained to handle the pressure of other people’s problems. She deals with the stress by going to the beach, reading or watching movies.

Helping the island's most vulnerable makes it all worth it, she said.

“Some of the cases we work with are difficult,” Acosta said. “But the satisfaction we receive — like saving a life — is all that matters.”

Follow Jervis on Twitter: @MrRJervis.

Read or Share this story: https://usat.ly/2pCjrBJ",https://www.usatoday.com/story/news/2018/03/23/mental-health-crisis-puerto-rico-hurricane-maria/447144002/
22,puerto+rico,"SAN JUAN, Puerto Rico — A blackout hit Puerto Rico's capital and surrounding areas on Thursday after two of the U.S. territory's main power plants shut down as officials warn the power company is struggling to remain operational.

The capital of San Juan was left without power, along with the neighboring municipalities of Caguas, Bayamon and Carolina, company spokeswoman Yohari Molina told The Associated Press. She said crews were working to repair the problem but that wasn't clear how many customers were affected by the outage. More than 970,000 people live in the areas hit by the blackout.

Puerto Rico's Electric Power Authority tweeted that the Palo Seco and San Juan plants shut down to protect the electrical system, but it is unclear what caused the shutdown. Officials said they aimed to restore power by Thursday afternoon.

RELATED: Why does restoring full power in Puerto Rico seem like a never-ending task?

The power outage comes nearly three weeks after a fire erupted at one of the company's substations, knocking two power plants offline, leaving some people without power for two days. The investigation into that incident is still ongoing.

Overall, more than 15 percent of power customers still remain in the dark nearly six months after Hurricane Maria, which destroyed two-thirds of the island's power distribution system. Officials have said they expect power to be fully restored by May.

Meanwhile, a federal control board overseeing the island's finances recently obtained a $300 million loan for the power company, warning it will only serve to keep it operational through late March. Board members said they expect to request more loans in upcoming weeks.

Gov. Ricardo Rossello announced in January that he plans to privatize the power company in 18 months. The company is $9 billion in debt and operating with infrastructure that is nearly three times older than the industry average.

FOLLOW NBC NEWS LATINO ON FACEBOOK, TWITTER AND INSTAGRAM.",https://www.nbcnews.com/storyline/puerto-rico-crisis/another-major-blackout-hits-puerto-rico-after-2-power-plants-n852316
23,puerto+rico,"After a group of SCVi students decided to fundraise for those Puerto Ricans who are still recovering from the disastrous effects of Hurricane Irma, a few decided to offer up their spring break in order to visit and assist those on the ground in the devastated U.S. territory.

According to the official SCVi Backpacks For Hope Blog being run by those on the ground in Puerto Rico, 13 backpackers began their journey at 2 a.m. on Thursday morning, with a minimal amount of their own personal belongings in tow.

“While each traveler carried a small bag of their own belongings, the team also carried 11 large duffle bags filled with the supplies that iLEAD families and supporters had generously donated, and were on their way,” said a blog post from Friday morning. “As the team settled in to the eight-hour flight, excitement was high, but energy was waning.”

And while the flight was long and arduous — from Los Angeles to Houston to Puerto Rico — the SCVi students once again grew excited after they got their first taste of Puerto Rican culture and gratitude — before even landing in San Juan.

“Completely unexpectedly, one of the members of the crew announced our presence to the rest of the passengers: ‘We would like to thank the group of students from iLEAD Schools in California who have come to help rebuild Puerto Rico…’ and proceeded to call each student by name,” said this mornings blog post.

By the time the sun had set on their first day, the SCVi crew had traveled in their van caravan to the far west coast “home-base” located in Aguada.

“A long and winding road led us into the coastal jungle, to the house where we will be staying. It’s amazingly serene, but remote,” explained the blog. “The calls of the night birds and the famous Puerto Rican coqui frog surround us.”

“It was a beautifully painful journey,” reflected one of the students.

Bunkering down to sleep after the long bumpy trip on Thursday, SCVi students planned to wake up early on Friday and utilize their first day full day on the island to replenish and rehabilitate some of the surrounding ecosystem of Cialis.

As they drifted off to sleep, one student said he was excited being helping and lifting up “our friends in Puerto Rico and let them know that they are not alone.”

Did you spot a correction? Let us know by emailing Corrections@hometownstation.com

KHTS FM 98.1 and AM 1220 is Santa Clarita’s only local radio station. KHTS mixes in a combination of news, traffic, sports, and features along with your favorite adult contemporary hits. Santa Clarita news and features are delivered throughout the day over our airwaves, on our website and through a variety of social media platforms. Our KHTS national award-winning daily news briefs are now read daily by 34,000+ residents. A vibrant member of the Santa Clarita community, the KHTS broadcast signal reaches all of the Santa Clarita Valley and parts of the high desert communities located in the Antelope Valley. The station streams its talk shows over the web, reaching a potentially worldwide audience. Follow @KHTSRadio on Facebook, Twitter, and Instagram, and sign up for KHTS email and text alerts today!",http://www.hometownstation.com/santa-clarita-news/community-news/scvi-students-provide-humanitarian-aid-to-puerto-rico-226603
