,Concerning,Text,URL
3,puerto+rico,"Close Get email notifications on Annie Charnley Eveland daily!

Your notification has been saved.

There was a problem saving your notification.

Whenever Annie Charnley Eveland posts new content, you'll get an email delivered to your inbox with a link.

Email notifications are only sent once a day, and only if there are new matching items.",http://www.union-bulletin.com/local_columnists/etcetera/corps-of-engineers-deploys-aid-to-puerto-rico/article_06687ece-32aa-11e8-8d0a-2b6c36c33ecc.html
4,puerto+rico,"Chicago Mayor Rahm Emanuel and Congressman Luis Gutierrez are in Puerto Rico to deliver aid and to inspect the damage left behind by Hurricane Maria last year.

Emanuel delivered medical supplies from Chicago hospitals and also presented checks to help in the relief efforts in multiple cities, including Loiza and the capital of San Juan.

The mayor and his social media team have been posting photos on social media as they tour the island:

The city has helped efforts in Puerto Rico through a variety of methods, including sending Chicago firefighters to help provide assessments for future relief efforts. Puerto Ricans in Chicago have also been given access to various services, including food and health assistance.

Chicago Public School students will also be heading to the island beginning on Sunday, with another weeklong trip scheduled for late June and early July.

Finally, the city has also set up a website for Chicago residents to donate funds to help in relief efforts on the island.",https://www.nbcchicago.com/blogs/ward-room/rahm-emanuel-luis-gutierrez-visit-puerto-rico-477829703.html
5,puerto+rico,"Puerto Rican veterans will be reuniting for the first time in 30 years Saturday, and they’ll be raising awareness about the current situation on the island.

For most of the veterans, this will be the first time seeing each other since they were stationed at Naval Station Roosevelt Roads in Ceiba, Puerto Rico, in the 1980s and 1990s.

According to a press release, it will be an opportunity to not only reunite old friends but also to show unity and support for fellow Puerto Ricans.

""Puerto Rico has been suffering through an economic crisis prior to Hurricane Maria and we are continuing our effort no matter how small to bring positive change to the island,"" said Roberto Antonio Germain, veteran and co-organizer of the event.

Last year, Hurricanes Irma and Maria devastated Puerto Rico, destroying homes, roads and bridges, triggering heavy flooding, and causing a power outage on the entire Island.

Six months later, approximately 150,000 homes and businesses - 11 percent of the territory - is still without power.

The reunion will be held at 10 a.m. Saturday at George Steinbrenner Field in Tampa before the spring training game between the New York Yankees and the New York Mets.",http://wusfnews.wusf.usf.edu/post/veterans-reuniting-raise-awareness-about-puerto-rico-crisis
6,puerto+rico,"Roughly six months after Hurricane Maria slammed into Puerto Rico, the island's governor signed into law ""education reform"" legislation that he says ""puts our students first"" but that critics say stinks of a privatization plan that will do nothing to help students.

The plan will consolidate schools and allow for charter schools and vouchers—ideas that are not endorsed by the Puerto Rico Teachers Association (Asociación de Maestros de Puerto Rico).

Another teacher's union, the Federación de Maestros de Puerto Rico, vowed that it, alongside teachers, parents, and students, would ""defeat the false reform with the struggle on the street and in schools.""

Offering background, education historian Lauren Lefty wrote at Jacobin:

In the wake of twin disasters—one man-made in the form of a vulture fund-fueled debt crisis, and one natural in the form of last September's Hurricane María — Puerto Rican leaders are attempting to implement a vast austerity program, claiming it will solve the island's economic woes. In the eyes of many Puerto Ricans, however, this is textbook ""disaster capitalism"": capitalizing on a moment of crisis, when the population is weak and unable to mobilize, to ram through pro-market austerity measures.

Although the government has slowly been rolling out austerity measures since the debt crisis began, post-hurricane, it's doubled down. And the island's public school system is one of the leading targets.

Among critics' targets is Julia Keleher, Puerto Rico's non-Puerto Rican Education Secretary, who, in the wake of the hurricane said the storm was a ""real opportunity to press the reset button."" Her role, Lefty argued, ""highlights the island's precarious colonial status and harkens to even less sovereign days.""

As NPR reported earlier this month,

teachers' unions in Puerto Rico have responded to the government's proposed overhaul with protest, anger, and derision. Since Gov. Ricardo Rossello presented it to the legislature last month, critics have said he and Keleher are using the damage that Hurricane Maria inflicted on the island and its schools as justification to push privatization, much like the governor recently announced his intention to sell off Puerto Rico's publicly owned electric grid.

""We are disappointed the powers that be in Puerto Rico have bought the wrongheaded DeVos and Trump spin that charters and vouchers are a panacea,"" American Federation of Teachers president Randi Weingarten said recently.

Responding to the new law, education historian Diane Ravitch writes that it marks ""a sad day for Puerto Rico."" She continues:",https://www.commondreams.org/news/2018/03/30/seizing-upon-post-hurricane-damage-puerto-ricos-new-education-reform-law-paves-way
7,puerto+rico,"Major League Baseball started the season with its most players born in Puerto Rico since 2011.

Nineteen players on opening-day rosters were born on the island, an increase of three from last year, the commissioner's office said Friday.

The overall percentage of players born outside the 50 states was 29 percent, down from last year's record 29.8 percent figure. This year's percentage tied 2007 for third behind last year and 2005 (29.2 percent).

Toronto infielder Gift Ngoepe is the first player from South Africa on an opening-day roster and Pittsburgh pitcher Dovydas Neverauskas is the first from Lithuania.

The Dominican Republic led with 84, down from 93 last year. Venezuela was next with 74, followed by Puerto Rico, Cuba (17), Mexico (11), Japan (eight), Canada and South Korea (six each), and Colombia and Curacao (five apiece).

Australia, Brazil, Nicaragua and Panama had three apiece. Aruba, Germany, Lithuania, Netherlands, South Africa, Taiwan and the U.S. Virgin Islands each had one.

The Texas Rangers (14) had the most for the second straight year, followed by the Chicago White Sox and Miami (13 each).

Figures include 750 active players on opening day rosters, 118 on disabled lists, eight on the restricted list and one on the paternity list.

———

More AP baseball: https://apnews.com/tag/MLBbaseball",http://abcnews.go.com/Sports/wireStory/mlb-starts-players-puerto-rico-2011-54128784
8,puerto+rico,"When Hurricane Maria battered their home island in September, Puerto Ricans on the U.S. mainland activated immediately. At a Johns Hopkins panel discussion Tuesday that assessed Puerto Rico's recovery six months after the devastating storm, scholars described how Puerto Ricans in the diaspora ignited an wave of grassroots support through social media and personal favors, leading to mass deliveries of supplies to the island.

It's a ""complete shift in the paradigm of emergency response,"" said Yale infectious disease specialist Marietta Vazquez, one of the panelists.

""What you have is just people, regular citizens, who were able to organize and establish an effective grassroots response that was timely and replicable,"" she said. ""They were able to deliver life-saving supplies and medication … in a way that government officials and federal agencies could not do.""

In the days following the hurricane, Vasquez launched Puerto Rico Rising Connecticut, which tapped into word-of-mouth connections to deliver 18,000 pounds of medicine and supplies, she said.

In Baltimore, Yonaira Rivera—a Bloomberg School of Public Health PhD candidate—helped found her own relief group, Puerto Rico Stands. Rivera served as moderator of Tuesday's panel, part of the JHU Forums on Race in America. The event also featured Juan Giusti-Cordero, a history professor at the University of Puerto Rico; and Antonio Trujillo, a professor of health economics at the Bloomberg School.

Their wide-ranging discussion touched on a number of topics.

How information spreads

In the telecommunications blackout during and immediately after the Sept. 20 storm, only one radio station was still transmitting on the island, becoming the lone media lifeline for Puerto Ricans.

The AM station, WAPA, took ""desperate calls from persons who still had phone connections"" and at one point delivered a life-saving warning of rising floodwaters, Codero said.

For Puerto Ricans who were not on the island, social media provided critical connections.

""Social media [was] unequivocally … instrumental in the way we were able to communicate,"" said Rivera, who used Facebook Live to track Maria's impacts. ""We were watching.""

Giusti-Cordero, speaking of the relief efforts that sprouted up on the mainland in the storm's wake, said the hurricane could be a groundbreaking case study for ""the role of social media in disaster recovery and making available supplies.""

Maria in context

Major hurricanes are a part of Puerto Rico's history, Giusti-Cordero said, noting that Maria was the 10th such storm of the past 200 years. He spoke of a string of especially damaging storms in the late 1920s to early 1930s, leading Puerto Rico to establish new government mechanisms for relief and reconstruction.

But the Category 4 storm caught everyone by surprise, panelists said. Giusti-Cordero said the local government was ""as well-prepared for Maria as it was for a snowstorm"" and called federal relief funds insufficient.

Puerto Rico's estimated $91 billion in losses add to a fragile economic mix of crippling debt and high unemployment rates on the island, Trujillo said.

Giusti-Cordero pointed to further complications in the territory's ""colonial relationship"" to the mainland U.S., which he said ""creates its own problems with the colonial government,"" including corruption.

Public health impacts

In Maria's wake, pressing concerns include water safety, mitigating infectious disease, providing access to services, and addressing mental health issues, panelists said.

""Suicide ideation and attempts have skyrocketed in Puerto Rico since the storm,"" Rivera said. ""There's a sense of despair among pretty much everyone, especially those who are lacking essential services.""

Even before Maria, Puerto Rico was suffering from an ""exodus of physicians,"" Vazquez said. Trujillo noted that some populations were already vulnerable, particularly the island's large number of elderly residents.

Displacement

For the thousands of Puerto Ricans who have sought refuge on the mainland U.S., there's a lack of coordination and resources, Vazquez said.

""Who runs the show?"" she said of housing efforts. ""It's local officials with nonprofits and human rights organizations, and it's not very organized, and we're all quite anxious about what's going to happen.""

Giusti-Cordero noted that government housing vouchers are only temporary.

""They're offering return tickets"" as the solution, he said.",https://hub.jhu.edu/2018/03/28/puerto-rico-maria-panel/
9,puerto+rico,"More than three years ago, I led a team preparing a report on Puerto Rico's economy at the request of the Commonwealth. Puerto Rico was in dire straits: real GDP had been falling since 2006; migration out was accelerating; and the Commonwealth's debt had risen to the point where further borrowing could take place, if at all, only at a very high interest rate. The situation has gotten worse. But Puerto Rico now has a once in a generation opportunity to change course.

Recent governments controlling the island believed that Puerto Rico was in recession, and sought to remedy the situation with increased government spending. But Puerto Rico was not in recession: it was in decline. Years of fiscal stimulus failed abysmally. We found that a panoply of growth-inhibiting policies adopted by Puerto Rico and others imposed by the US government had contributed to the dismal performance.

It remains clear to this day that changes in economic policies need to be made, and there will be difficult years of transition. When countries find themselves in such severe difficulty, they can approach international organizations for support.

Puerto Rico, however, has no such lifeline. There is virtually no prospect of a resumption of sustainable growth without policy reforms, funding for pensions has run out, the government is no longer creditworthy, and the tax burden is already relatively high. PROMESA, which mandated the establishment of an Oversight Board to, among other things, oversee the budget and debt-servicing relief, did not authorize any new money.

The situation is further complicated by Irma and Maria. The electric utility, PREPA, inefficient and costly, which had failed to invest in maintenance and resiliency and is saddled with unsustainable debt, has failed completely. Add to this the damage to other infrastructure and productive capacity, and it is no surprise that an additional 200,000 persons have left the island.

Yet there is an opportunity in the midst of this tragedy. The significant hurricane assistance authorized by Congress and continued suspension of debt service could cushion the impact of much-needed reforms through the short-term rebound from the undertaking of construction and other activities.

The most important prescription for change is in Puerto Rico's labor market. Labor force participation is estimated to be under 40 percent (versus 63 percent on the mainland). Reasons for this include costly regulations governing conditions of work and disincentives for participating in the formal labor market (no earned income tax credit and full access to federal welfare programs).

Puerto Rico is also subject to the federal minimum wage, which is harshly binding, deterring employment (Puerto Rico's per capita income of about two-thirds that of the poorest state, hence the requirement bites hard); a required Christmas bonus of one-month's pay compounds the problem. Other areas of structural reform that are needed include improving the business climate, relaxing regulations governing youth employment, and infrastructure modernization (especially the provision of reliable and competitively priced electricity).

Puerto Rico will also have to overcome disadvantages relative to U.S. states and territories. If it were a state, per capita federal support for Medicare and Medicaid (which covers 60 percent of the population) would be 2.5 times larger than present levels. Puerto Rico receives less than half the lowest supported state (Nevada) and the total shortfall (excluding exceptional financing) is about $2 billion a year. The Jones Act requires that Puerto Rico (but not the U.S. Virgin Islands) use more costly U.S. vessels to ship to and from the mainland.

Puerto Rico must seize the opportunity at hand. Federal disaster relief money gives the Island breathing room to offset deflationary pressures from needed targeted fiscal downsizing. Deep structural policy reforms can reverse the negative economic spiral and spur growth. At the same time, debt restructuring should give room for deep economic reforms to put Puerto Rico on a new growth trajectory. The return to creditors will be higher and reforms can turn the Island into the jewel of the Caribbean.

If, however, federal funds are expended without reforms, the prospects will be dismal. The one-time stimulus from the infusion of cash for reconstruction and other relief efforts will have dissipated. The island's economy and population will return to a world of economic contraction.

Commentary by Anne O. Krueger, senior research professor of International Economics, School of Advanced International Studies at Johns Hopkins University.

For more insight from CNBC contributors, follow @CNBCopinion on Twitter.",https://www.cnbc.com/2018/03/26/puerto-ricos-best-shot-at-economic-recovery.html
10,puerto+rico,"The battle between the governor of Puerto Rico and the federally appointed oversight board over the beleaguered island's fiscal plan hit a new level on Wednesday evening, as Governor Ricardo Rossello gave an impassioned televised address to publicly deny many of the board's requirements.

""As part of the evaluation process of the fiscal plan submitted by our government, the board has sent us a communication proposing measures that would have the effect of increasing the conditions of poverty in Puerto Rico,"" Rossello said in his prepared remarks.

""Although the board endorsed our initiatives to transform the education and health systems, I cannot allow the board to award itself powers that it does not have, much less when they intend to use this power to impose measures that negatively affect the quality of life of our people,"" the governor added.

Earlier on Wednesday, the oversight board sent several letters to Rossello, saying that changes to the proposed fiscal plan, including a cut to the commonwealth's troubled pension system and additional austerity measures, are required.

""The conditions that the board pretends to impose would make it practically impossible to increase the federal minimum wage; would eliminate the Christmas bonus for public employees, would further affect vacation and sick leave; and do not include programs for the training of our workforce. Our proposal was based in the salary increase for our workers and the creation of training opportunities. With these elements made impossible, the proposal is not viable,"" he said.

A spokesman for the oversight board declined to comment on the governor's remarks.

The board is requiring a 10 percent cut to the island's pension system, which currently has around $50 billion of unfunded obligations. Pensioners with a combined retirement plan and Social Security benefits below the poverty level of $1,000 per month would not be subject to the 10 percent cut, according the letter the board sent to Rossello.

The governor has repeatedly rejected any reductions to the island's pension system and excluded it from the most recent draft of the fiscal plan he submitted for review on Friday

Rossello reiterated his stance on the subject in his address Wednesday evening.

""I inform you that although the board certifies in the fiscal plan a reduction of 10 percent to pensions, that unfair and abusive measure will have my tenacious opposition,"" he said.

However, the board says this is a non-negotiable requirement for the bankrupt island's fiscal plan.",https://www.cnbc.com/2018/03/28/they-intend-to-dictate-public-policy-puerto-ricos-governor-spars-with-federal-oversight-board.html
11,puerto+rico,"MLB Hall of Fame catcher Ivan ""Pudge"" Rodriguez, center, stands with the Rangers during the playing of the national anthem before a spring training game against the Chicago Cubs at the Rangers' training facility on Sunday, March 5, 2017 in Surprise, Arizona. (Ashley Landis/The Dallas Morning News)

The after effects of the hurricane that ravaged Puerto Rico six months ago are still being felt, and one Texas Ranger continues his quest to help.

Over the offseason, Ivan 'Pudge' Rodriguez helped lead an effort to send assistance and comfort to those affected by the destructive Hurricane Maria in his homeland of Puerto Rico. Hundreds of thousands of pounds of supplies were gathered and sent from in an Irving warehouse to help aid the rebuild.

""Everything is getting better. There's still a lot of work to do, obviously,"" said Rodriguez at an opening day tailgate event outside Globe Life Park. ""We've been doing a lot of work. A lot of organizations are doing a lot of work in Puerto Rico.""



Hurricane Maria came ashore on Puerto Rico's eastern edge in September 2017. It tore through the island's interior with winds of 155 mph, dumping nearly 40 inches of rain. Sixty-four people died as a direct result of the hurricane, according to the U.S. government. About 1,000 more perished in the aftermath, according to The New York Times.",https://sportsday.dallasnews.com/texas-rangers/rangers/2018/03/30/rangers-pudge-rodriguez-gives-latest-update-recovery-efforts-puerto-rico-following-hurricane-maria
12,puerto+rico,"- Rahm Emanuel's office says the Chicago mayor and U.S. Rep. Luis Gutierrez are leading a delegation of local officials on a humanitarian visit to Puerto Rico.

Officials say the delegation will travel to San Juan on Friday along with 5,200 pounds of non-perishable goods, medical equipment and supplies to help after last year's hurricane damage.

Emanuel is taking the trip as part of a mayoral exchange program that connects local leaders on the mainland with their counterparts in Puerto Rico to help rebuilding efforts. Emanuel is scheduled to visit with two mayors while he is in Puerto Rico.

Separately, Chicago Public Schools students will participate in hurricane relief trips to Puerto Rico later this month and during the summer.",http://www.fox32chicago.com/news/local/chicago-mayor-congressman-part-of-puerto-rico-delegation-1
