,Concerning,Text,URL
11,yemen,"Ahead of the upcoming international fundraising conference for Yemen, the United Nations has received nearly $1-billion contributions from Saudi Araba and the United Arab Emirates (UAE) and urged other donors to follow suit and help tackle the world's worst humanitarian crisis there. UN Secretary-General Antnio Guterres expressed his deep gratitude for the $930-million provided on Tuesday evening by the two donor countries to the Yemen Humanitarian Fund. ""I would like to take this occasion to appeal to all the other donors who will be meeting in Geneva next week to follow the same generosity"" shown by the two countries, the UN chief told reporters at the world body's New York Headquarters, after meeting with Prince Mohamad Bin Salman Al Saud, Saudi Arabia's Crown Prince. ""These funds cover almost one-third of the $2.96-billion required to implement the 2018 Yemen Humanitarian Response Plan, which will enable the United Nations and its partners to help alleviate the suffering of millions of vulnerable people across Yemen,"" read a statement issued by Mr Guterres' office, following the signing of the memorandum on the voluntary contributions. More than 22-million people in Yemen require humanitarian aid or protection assistance, including 2-million who are internally displaced due to the ongoing conflict between the Government and rebel forces. On 3 April, donors will meet in the humanitarian pledging conference in Geneva, Switzerland. In his meeting with the Crown Prince, who is also First Deputy Prime Minister and Defence Minister, Mr Guterres said ""to give to those in need is a central pillar of Islam,"" noting that two-thirds of the refugees are Muslims and are received by Muslim countries. The Secretary-General and the Crown Prince discussed the obligations of all parties to the conflict under international humanitarian law to protect civilians and civilian infrastructure, and the critical need for humanitarian access across the country and for all of Yemen's ports to remain open to both humanitarian and commercial movement. They also discussed the need for the parties to the conflict to work towards a negotiated political settlement through inclusive intra-Yemeni dialogue. Mr Guterres expressed the UN's readiness to work together with Saudi Arabia for these objectives. The UN, through its envoy, has been engaged in helping Yemenis to find a peaceful solution. UN agencies and partners are also on the ground to deliver life-saving aid. UNi XC-SNU 1336 -- (UNI) -- C-1-1-DL0442-1307348.Xml",https://news.webindia123.com/news/articles/World/20180329/3309189.html
12,yemen,"ADEN (Reuters) - Suspected al Qaeda militants attacked a military checkpoint in southeastern Yemen, killing at least nine soldiers from a local force backed by a member of the Saudi-led coalition fighting in the country, an official said on Thursday.

The official said that five suspected militants also died during the gun attack late on Wednesday outside al-Mukala, the Hadramout provincial capital, against a unit of the Hadrami Elite Forces.

The unit was set up and trained by the United Arab Emirates, as part of a strategy to combat al Qaeda, which had exploited a three-year civil war and tried to expand its control in the area before they were driven out.

Hisham al-Jaberi, a local military commander, said at least four other soldiers from the Hadrami Elite Forces were also wounded in the attack in an area called Wadi Hajar.

Al Qaeda’s Yemen affiliate, Al Qaeda in the Arabian Peninsula (AQAP), had briefly seized control of Mukalla and several other towns and cities in the neighboring Shabwa, Abyan and al-Bayda provinces. Local forces, backed by the UAE member of the Saudi-led coalition drove them out in a series of military operations over the past two years.

But militants still operate in remote areas in southeastern Yemen, including in Abyan, Shabwa and al-Bayda.

The Saudi-led coalition, which includes the UAE, is fighting in Yemen against Iran-aligned Houthis, who seized large parts of the country in a series of operations that began in late 2014, culminating in forcing the internationally recognized President Abd-Rabbu Mansour Hadi to flee into exile in Saudi Arabia.",https://www.reuters.com/article/us-yemen-security/nine-soldiers-five-militants-killed-in-attack-on-elite-yemeni-force-idUSKBN1H51E4
13,yemen,"Filed on March 29, 2018 | Last updated on March 29, 2018 at 06.41 am

Saudi Arabia's Crown Prince Mohammed bin Salman presents a cheque for $930 million to UN Secretary-General Antonio Guterres at UN headquarters in New York. (AP)

The Arab world's poorest country is in the grips of a stalemated war and what the UN calls the worst humanitarian crisis.

Saudi Arabia and the United Arab Emirates gave $930 million to UN humanitarian efforts in Yemen on Tuesday as a war between a Saudi-led military coalition and Yemen's rebels enters its fourth year.

Saudi Crown Prince Mohammed bin Salman presented the previously pledged donation to UN Secretary-General Antonio Guterres as the two discussed Yemen.

The Arab world's poorest country is in the grips of a stalemated war and what the UN calls the worst humanitarian crisis, with 22 million people needing aid.

Guterres thanked Prince Mohammed for the contribution, which covers nearly a third of the total the UN is seeking for Yemen humanitarian aid this year.

""On the other hand, we know that there is no humanitarian solution for humanitarian problems,"" Guterres added. ""The solution is political, and we are entirely at your disposal to work together to find a political solution when that becomes possible.""

The UN said Guterres and the Prince also discussed protecting civilians and needs for humanitarian access and open ports.

Saudi Foreign Minister Adel Al Jubeir called the meeting ""very productive and comprehensive.""

He said the two talked about avoiding foreign intervention in Yemen, particularly from Iran.

Western countries and UN researchers have accused Iran of supplying arms to the Yemeni rebels Houthis. Iran denies it, though a growing body of evidence contradicts the claim.

The US provides logistical support and weaponry to the Saudi-led coalition.

The Houthis and their allies seized Yemen's capital, Sanaa, in September 2014. The war began six months later, with the coalition backing Yemen's internationally recognised government. Over 10,000 people have been killed. On Sunday, the rebels fired a barrage of ballistic missiles targeting Saudi Arabia. Fragments of one missile that went over Riyadh, the Saudi capital, killed one person and wounded two.",https://www.khaleejtimes.com/region/mena/saudi-uae-offer-930m-for-un-humanitarian-work-in-yemen-
14,yemen,"Bill Gates, the co-Founder of the Microsoft company and co-Founder of the Bill and Melinda Gates Foundation pictured at the Elysee Presidential Palace on June 27, 2016 in Paris, France. (Photo by Chesnot/Getty Images)

The billionaire philanthropist is rolling out the red carpet for Mohammed bin Salman, crown prince of Saudi Arabia, who is overseeing the mass starvation and death of children in Yemen.

Despots who happen to be in Washington’s good standing get a pass, no matter how horrific and well-documented their crimes may be.

On the front page of the Bill and Melinda Gates Foundation website, the philanthropic organization identifies a key priority for disbursing its unparalleled $40.3 billion endowment: “Ensure more children and young people survive and thrive.”

Yet today Bill Gates welcomes Mohammed bin Salman, Crown Prince of Saudi Arabia, who is overseeing the mass starvation and death of children in Yemen. As part of his U.S. tour, the crown prince—who also serves as Minister of Defense, among other titles—is slated to travel to Seattle, where Gates is reportedly hosting him on March 30 at a meeting focused on technology.

The visit comes just days after the three-year anniversary of the Saudi-led war on Yemen, which has left nearly all of the country’s children “in desperate need of humanitarian assistance,” according to UNICEF. Abetted by U.S. vessels, a Saudi naval blockade has choked off food and medical supplies, driving a famine and the largest-ever recorded cholera outbreak.

Meanwhile, the Saudi-led coalition—which includes the United States, United Kingdom and Gulf allies—has unleashed a vicious bombing campaign on Yemen’s civilian infrastructure, hitting hospitals, weddings and funerals. No one knows exactly how many Yemeni civilians have died since the bombing started, but UN estimates usually settle on 10,000. Though this has been the most popular total for over a year now, the actual number is likely much higher, given the difficulty in calculating the number of people killed by bombs, famine and disease.

With U.S. assistance, the Saudi-led coalition has repeatedly bombed schools, in some cases striking the same facility multiple times, suggesting that the schools were intentionally targeted. These attacks are notable in light of the Bill and Melinda Gates Foundation’s stated focus on improving education and ensuring that students graduate.

The prince’s visit will not mark the first collaboration between bin Salman and Gates. After meeting with the prince in the Saudi Arabian capital Riyadh last fall, Gates announced a joint venture with the Prince Mohammed bin Salman bin Abdulaziz (MiSK) Foundation to launch a $10 million “Grand Challenges” initiative aimed at fostering “innovation to solve key health and development problems.” (A pitiful sum in its own right, at 0.000006 percent the estimated worth of the Saudi state oil company.)

Gates is not the only prominent figure actively validating and normalizing bin Salman, whose brutal crackdown on his political opponents has garnered him gushing coverage as a “reformer” in the U.S. press. Oprah Winfrey and former secretary of state Henry Kissinger are just some of the people bin Salman was slated to meet, according to a leaked itinerary.

But by laying out the red carpet for bin Salman, Gates is displaying a new level of moral odiousness, as the tech icon has reinvented himself as a philanthropist and dedicated champion of humanity—namely children.

The billionaire has built his foundation’s name on its humanitarian mission and, through that branding, developed a philanthropic empire. As the largest private funder of the World Health Organization, the Bill and Melinda Gates Foundation has the power to sidestep governments and shape the political agenda of international entities like the United Nations.

It goes without saying that accused war criminals hailing from nations that are geopolitical foes of the United States would not be met with the same warm reception. But despots who happen to be in Washington’s good standing get a pass, no matter how horrific and well-documented their crimes may be. Even the U.S. State Department found in 2016 that the United States, in its support for the Saudi bombing of Yemen, is exposing itself to war crimes prosecution.

Thanks to the dogged work of activists, the Saudi onslaught is increasingly falling out of favor in U.S. Congress, with a recent political push to end U.S. support for the Saudi war narrowly failing in the Senate on March 20. While lawmakers fail to bring an end to the U.S. war, private foundations are even less accountable, beholden only to their internal leadership—safe from any meaningful public control.

The Bill and Melinda Gates Foundation claims it is a responsible steward of the largest endowment in the United States, stating in its code of conduct: “We are honest, fair and trustworthy in our foundation activities and relationships.” Gates’ ongoing relationship with one of the worst perpetrators of child suffering in the world does not inspire confidence that this principle is being followed—at least not in the most baseline moral sense.",http://inthesetimes.com/article/21025/Bill-Gates-Melinda-Founation-Saudi-Prince-Mohammad-bin-Salman-Yemen
15,yemen,"Purpose

The deconfliction mechanism informs the Saudi-Led Coalition (SLC) of humanitarian movements and static locations in Yemen. It aims at ensuring the safety and security of humanitarian premises, personnel, equipment and activities in areas of active military operations (airstrikes, shelling, conflict, etc.). The deconfliction mechanism was established in April 2015 upon the request of the Humanitarian Country Team (HCT) in Sana’a to ensure a safe delivery of humanitarian assistance in Yemen.

UNOCHA serves as the conduit between humanitarian organisations that wish to share their data (locations and/or movements information), and the focal point(s) assigned by the Saudi-led Coalition (SLC); Evacuation and Humanitarian Operations Committee (EHOC).

Using the deconfliction mechanism does not constitute a legally binding agreement between any of the involved parties, and does not guarantee the safety of personnel, facilities, or sites. OCHA will not verify the data / information provided. Organisations are required to verify the accuracy of their data / information prior to submission to OCHA.

To be noted, the notification of humanitarian locations, activities, movements and personnel to the military through UNOCHA is voluntary. The process of notification is intended to help promote the safety and security of humanitarian locations, activities and personnel but is without prejudice to the responsibility for upholding IHL that lies solely with the warring parties.",https://reliefweb.int/report/yemen/deconfliction-mechanism-humanitarian-organisations-operating-yemen-mission-movements
16,yemen,"Common sense would suggest Iran toning down its language and measures as domestic and international pressures increase.

One cannot claim Tehran’s rulers lack common sense, as many accused Libya’s Muammar Qaddafi. The Iranian regime has been in power for four decades and their mentality hinges on pragmatism with the sole objective of maintaining their existence to the utmost extent.

Sunday night, local time, Saudi civilians became the target of seven ballistic missiles fired by the Iran-backed Houthi militants in Yemen.

“The Iran-aligned Houthi rebels fired three missiles at Riyadh and four others at the southern cities of Khamis Mushait, Jizan and Najran,” according to reports.

Saudi Patriot missile air defense batteries were able to destroy at least one projectile heading for an urban area, reports indicate. These batteries are programmable to allow missiles headed for remote areas lacking civilian population to hit the ground, preventing the unnecessary deployment of costly Patriot missiles.

This turn of events is resulting in a long slate of negative international reactions.

The United Nations, a long slate of Middle East countries, the United States and European Union have condemned the missile attacks, recommitting their support for the Kingdom.

London, despite its history of seeking to maintain ties with Tehran and expanding economic relations, grilled the latest developments in strong terms.

“We question why Iran is spending significant revenue in a country with which it has no real historical ties or interests,” reads a joint statement from Foreign Minister Boris Johnson and International Development Secretary Penny Mordaunt.

The text also calls for Iran to stop transferring weapons into Yemen. This is a litmus test for Tehran to prove it favors ending the violence and establishing peace in the Arab World’s poorest country. A test the Iranian regime has and will continue to fail, considering its nature of trekking from one crisis to another.

In line with this argument, Iran’s regular army chief commander again voiced threats of total annihilation against Israel.

“We will finish off Israel’s life within less than 25 years,” said Major General Abdolrahim Mousavi referring to a comment by Iranian Supreme Leader Ali Khamenei.

This goes alongside the necessity for senior Iranian regime officials to save face in times of increasing domestic unrest parallel to elevating international isolation.

“We must choose between hard & harder. If we don’t accept the hard methods, we will have to succumb to more difficult circumstances,” said Iran’s Deputy Trade Minister Ali Sarzaeem.

Such comments from Iran come as the Trump administration undergoes major reshuffling, with analysts believing increasing pressure on Iran is a major focus.

After more than a year’s work with U.S. Secretary of State Rex Tillerson, President Donald Trump’s move to appoint CIA Director Mike Pompeo as his top diplomat is raising eyebrows across the globe, including most importantly in Tehran. Tillerson is well-known for convincing Trump, along with former National Security H.R. McMaster, to stick to the controversial Iran nuclear deal for a year.

With a new Secretary of State, and former U.S. ambassador to the United Nations John Bolton set to take over as National Security Advisor, many believe the coffin is completing for the Joint Comprehensive Plan of Action (JCPOA), as the Iran nuclear agreement is formally known.",https://www.forbes.com/sites/heshmatalavi/2018/03/29/why-did-yemens-iran-backed-houthis-fire-missiles-into-saudi-arabia/
17,yemen,"Cooking gas and fuel shortages

The shortage of cooking gas in several northern governorates has entered the second month. Available gas is retailing at about 8,000 YER per 20-litre cylinder, compared to about 5,000 YER three weeks ago.

The official price is 3,000 YER per 20-litre cylinder.

In Al Hudaydah, Sana’a and Sa’ada, the authorities are distributing gas through local leaders to lessen congestion at gas stations and distribution points. In Sa’ada, black market gas costs 8,000-10.000 YER per cylinder. Many families and bakeries are now cooking with firewood. Fuel shortages are reported in southern governorates following the break-up of an earlier import monopoly. In February, average prices of diesel and petrol increased by two per cent across Yemen. In Shabwah governorate, the increase was significant – 17 per cent for diesel and 13 per cent for petrol. UNVIM data shows that before the November 2017 blockade of Yemen’s ports, nearly one-third of the monthly fuel import requirements of about 544,000 MT were being met. Since then, monthly imports have dropped by nearly a half. In the first two weeks of March, just 92,560MT of fuel was imported.

UPDATES FROM THE HUMANITARIAN HUBS

Sa’ada Hub: Conflict has escalated in Sa’ada governorate, with a high level of civilian impact incidents and casualties, including women and children. According to the Protection Cluster, airstrikes, shelling and ground fighting have impacted homes, farms and civilian infrastructure; and increased the risk of unexploded ordnances. In neighbouring Al Jawf governorate, escalated fighting is reported in several districts, with casualties. The violence has affected humanitarian movements, access and response within Al Jawf and Sa’ada governorates.

The ongoing violence in Sa’ada and Al Jawf has triggered new displacement, according to local authorities. Humanitarian partners report an urgent need to provide shelter, non-food items and food to at least 20 newly displaced households that are living in an open area in Rajwaza district in Al Jawf. There is also need to assist about 200 newly displaced families in Sa’ada and an estimated 500 households that have returned to their areas of origin in Sha’da and Al Dhaher districts in Sa’ada governorate.

Ibb Hub: Humanitarian partners are concerned about access challenges in Taizz governorate, including disruptions of movement along the Aden-Taizz city road. This road is a key transport route for humanitarian supplies, civilians and commercial goods. On 19 March, heavy clashes in Al Beirain area of Al Maafer district temporarily closed the road for six hours. Discussions are on-going with local parties about the option of using another road from Ibb to Taizz to enhance civilian movement and the delivery of humanitarian supplies.

Violence in Taizz governorate has displaced increasing numbers of civilians. In the last three weeks, clashes in Al Mukha district displaced about 126 families from AlZahra sub-district to Wadi Kabeer area in Al Mashaleha sub-district. This week, clashes were reported in Naqueel As Silw and in the southern areas near Khaled military camp.

Aden Hub: Recent assessments in Abyan governorate show that there is space for partners to respond to growing needs of displaced people in Khanfir and Zingibar districts. The needs vary from food, water, shelter and education. About 74 per cent of the assessed population were food-insecure and 57 per cent severely food-insecure. As of 13 March, UNHCR assistance had reached 5,710 IDPs in Khanfir district and 2,540 IDPs in Zingibar district. In Shoqra district, a rapid WASH assessment of 430 recently displaced households from Al Hudaydah found drinking water to be a major problem.

Since December, humanitarian partners operating in the southern governorates have recorded at least 8,670 displaced households; of whom 54 per cent originated from Hudaydah. An assessment by an international partner found that 42 per cent of the total population of Hays and Al Khawkah districts in Hudaydah have moved out, mostly to Al Mukha, Aden and Abyan.

Al Hudaydah Hub: Fighting in Hays, Al Tuhayat and Al Garrahi districts of Al Hudaydah continues to displace hundreds of families. This week, local authorities reported that 223 families were displaced to Jabal Ras district, 59 to Al Hudaydah city and 13 to As Salif district.

In Al Hudaydah city, local authorities are accommodating newly displaced families in a residential compound.

Humanitarian partners have raised concerns over the legality of accommodating IDPs in private property, but will provide basic assistance to the affected families.

Local authorities are establishing a camp in Zabid city and have put up tents to accommodate new IDPs.

The authorities have requested support from the humanitarian community in Al Hudaydah. In Abs district in nearby Hajjah governorate, OXFAM is supporting 7,111 vulnerable families from both displaced and the host community with cash assistance amounting to 29,500 YER per household.

Sana’a Hub: A recent mission to Bani Hushaysh district in Sana’a governorate found that the district has a large number of IDPs coming from Nihm district. Most of the IDPs are renting accommodation at an average monthly rate of 20,000-25,000 YER which is beyond what they can afford, given that most of them lack stable income.

Protection partners report an increase in civilian impact incidents in the Sana’a hub, from five last week to eight this week. These were primarily in Marib, specifically in Sirwah district. Although the number of incidents increased, civilian casualties fell, dropping from eight to four. Twenty houses and 25 farms were damaged as the result of airstrikes or shelling.",https://reliefweb.int/report/yemen/yemen-humanitarian-update-covering-19-march-25-march-2018-issue-8
18,yemen,"UN Secretary-General António Guterres expressed his deep gratitude for the $930 million provided on Tuesday evening by the two donor countries to the Yemen Humanitarian Fund.

“I would like to take this occasion to appeal to all the other donors who will be meeting in Geneva next week… to follow the same generosity” shown by the two countries, the UN chief told reporters at the world body’s New York Headquarters, after meeting with Prince Mohamad Bin Salman Al Saud, Saudi Arabia’s Crown Prince.

“These funds cover almost one-third of the $2.96 billion required to implement the 2018 Yemen Humanitarian Response Plan, which will enable the United Nations and its partners to help alleviate the suffering of millions of vulnerable people across Yemen,” read a statement issued by Mr. Guterres’ office, following the signing of the memorandum on the voluntary contributions.

More than 22 million people in Yemen require humanitarian aid or protection assistance, including 2 million who are internally displaced due to the ongoing conflict between the Government and rebel forces.

On 3 April, donors will meet in the humanitarian pledging conference in Geneva, Switzerland.

In his meeting with the Crown Prince, who is also First Deputy Prime Minister and Defence Minister, Mr. Guterres said “to give to those in need is a central pillar of Islam,” noting that two-thirds of the refugees are Muslims and are received by Muslim countries.

The Secretary-General and the Crown Prince discussed the obligations of all parties to the conflict under international humanitarian law to protect civilians and civilian infrastructure, and the critical need for humanitarian access across the country and for all of Yemen’s ports to remain open to both humanitarian and commercial movement.

They also discussed the need for the parties to the conflict to work towards a negotiated political settlement through inclusive intra-Yemeni dialogue.

Mr. Guterres expressed the UN’s readiness to work together with Saudi Arabia for these objectives.

The UN, through its envoy, has been engaged in helping Yemenis to find a peaceful solution. UN agencies and partners are also on the ground to deliver life-saving aid.",https://news.un.org/en/story/2018/03/1006131
