,Concerning,Text,URL
19,yemen,"The denouncement against such launches, including the use of ballistic missiles, came in a Press Statement issued late Wednesday by the Council, which said that the 25 March attacks ‘threatened civilian areas and resulted in at least one fatality.”

The Statement said the 15-member body “underlined that such attacks pose a serious national security threat to the Kingdom of Saudi Arabia as well as a wider threat to regional security.”

Since the uprisings in Yemen broke out in early 2011, the UN has been engaged in helping Yemenis to find a peaceful solution. However, on 26 March 2015, a coalition of countries led by Saudi Arabia intervened militarily at the request of President Abd Rabbuh Mansour Hadi to secure the return of the Government to Sana’a, which had been seized by Houthi militias and allied units of the armed forces.

Three years on, the fighting is raging and the ensuing humanitarian crisis has only deepened in a country that was already one of the region’s poorest.

In the Statement, the Council “reiterated the need for all parties to return to dialogue as the only means of delivering a negotiated political settlement and engage constructively with the Special Envoy of the Secretary-General for Yemen, Martin Griffiths, with a view towards swiftly reaching a final and comprehensive agreement to end the conflict and address the ongoing humanitarian crisis.”",https://news.un.org/en/story/2018/03/1006211
20,yemen,"New York-based activist Summer Nasser has coaxed bodega owners into sending aid to Yemen. She’s helped organize rallies against US immigration policies, even flown to Geneva to testify before the UN Human Rights Council about Yemen’s humanitarian crisis.

It’s hard to believe she’s just 23 and still a student.

Yemen, the country where her parents were born and where she spent most of her school vacations, is in turmoil. But when Summer returned there in February 2015 for her wedding, she never could have imagined the nation’s political crisis escalating into a deadly regional war, practically overnight.

Three years later, with the war still raging, I ask her about the spring of 2015 when the fighting overtook Yemen, just as she was to be married.

'I had flowers shipped in from Ethiopia, and I had to cancel that'

I’ve spoken with Summer about Yemen many times, but this is the first time we have met in person. She and her husband, Muntaser Yaghnam, sit in the living room of their apartment in Mount Vernon, New York, just north of the Bronx, where Summer was born.

Muntaser remembers meeting Summer online in 2011.

“She was in New York City, and we were chatting on Facebook. And I was posting pictures of projects,” he says.

It was the Arab Spring, and Muntaser was an activist in Yemen helping to feed, clothe and house Yemenis escaping from the southern province of Abyan, which was being overrun by al-Qaeda.

“I was explaining how dire the need is of people in Yemen, and she was really interested,” Muntaser recalls

Summer smiles. “He was actively following my publications. He enjoyed it,” she says of her frequent blog posts on Yemen, then pauses, and turns to her husband. “Did you enjoy it?”

They laugh.

I am struck by how eager they are to talk. Knowing they had to escape a war, I am impressed by how at ease they are.

In 2013, Summer was visiting her family in southern Yemen when she and Muntaser first met face-to-face. “After that, I mean, we clicked,” he says. “We liked each other.”

The next year they became engaged.

Muntaser studied English literature at Sana’a University, in Yemen's capital. He peppers his speech with casual English phrases such as “like,” “I mean” and “really.” For our interview, he's wearing jeans, a sweater and a leather jacket, short hair and a neatly trimmed beard. He drives for Uber in New York City.

In February 2015, Summer and Muntaser were set to rendezvous in southern Yemen — to be married. They’d booked a venue in Aden, made all the arrangements. This would be Summer’s dream wedding, with family and friends coming from America and all around Yemen.

But as the wedding day grew near, the rebel group Ansar Allah, better known as the Houthis, swept south from their ancestral base in northern Yemen. The green area of the map marks the territory controlled by the Houths in early March 2015.

#BREAKING #Houthis rebels are getting ready to the war in Aden with The #Yemen President #Hadi and The legitimate Gov pic.twitter.com/vZRsM1VXiD — Harry M. #Yemen (@harrymakaleh) March 23, 2015

Following a coup, Yemen's president and his cabinet fled to Aden with the Houthi army at their heels. The war had come to Summer's doorstep.

She remembers the night when the Saudi-led coalition began to bomb Houthi fighters in Aden. “The street wars broke out, and the first bomb fell from a Saudi jet that night, and there was just me and my mom and my siblings.”

Muntaser was still 200 miles north in Sana’a, the capital, texting and calling.

“I mean, people ... shooting and bombardment and everything. I was so worried about her and her family,” he says.

The wedding was off.

“Nobody would attend the wedding, anyway,” Summer says, a little ruefully. “I had flowers shipped in from Ethiopia, and I had to cancel that. I was really bummed out.”

“I really felt devastated because we had been waiting for this for too long,” Muntaser says.

As they recall that time three years ago, it's clear that this remains a difficult subject for them. Seeing them together this day, hanging on each other's words, it's easy to imagine the pain and anxiety they must have felt, stuck hundreds of miles apart in a shooting war that showed no signs of ending.

“I used to wake up at night,” Summer says, “and my sister — we would take shifts of when to sleep. She would do morning; I would do night. And each of us would hold a weapon.""

Daar Saad air strike aftermath. Near my house. They also striked a hotel full of Houthis based there. #Yemen pic.twitter.com/fIWOiAw2xS — Summer Nasser سمر ناصر اليافعي (@ToEducate) April 1, 2015

'My mom sees the planes and she freaks out'

Life became untenable in Aden. People who could leave, did. Summer’s mom brought the family north, through Houthi territory, to try to find safe passage out of Yemen.

But Summer and Muntaser were determined to marry. The families hastily arranged a wedding on April 30 in Sana’a at Muntaser’s family home. Even though it is controlled by the Houthi rebels, Sana’a is not troubled by ground fighting. In Sana’a, the threat comes from fighter jets flown by Saudi Arabia and the United Arab Emirates. The militaries of both countries receive considerable support from the United States and Britain.

Summer knew it wouldn't be her dream wedding.

Her dad, who lives in the US, wouldn’t be there. Nobody from the US could fly in, because the runway at Sana’a International Airport was cratered, and all of Yemeni airspace was closed. For similar reasons, Summer's relatives from the South wouldn't be there.

“I know she was really devastated about the wedding,” Muntaser says. “It's the first and the only wedding for a man or a woman, so she was really sad. But we were going through very tough circumstances. We had to do it that way.” There were dozens of wedding guests, but they were mostly Muntaser's family and friends.

Summer still thinks about her wedding day.

“I was with the ladies on the second floor, the men were on the first. And all I hear is the women, you know, shouting and doing all these happy sounds. And then I hear gunshots. It's a very traditional thing here, if there's a marriage ceremony. Once the sheik or the imam says OK [and] blesses your marriage, [the men] start shooting in the air.” Then the groom is brought to the bride.

Summer and Muntaser have few photos from Yemen in 2015. This one, taken the day they were married, shows Muntaser in a traditional Yemeni wedding outfit.

Muntaser Yaghnam dressed for the wedding. Credit: Courtesy of Summer Nasser

“At first he comes in, and everybody starts clapping,” she recalls.

“And dancing — like, playing some music, you know,” Muntaser adds.

Summer and Muntaser now seem to be remembering the wedding minute-by-minute.

“Yeah,” Summer continues, “and he kissed my forehead, and we went into the the Arabian room — a setting that they have in every traditional home — and the family was there. A woman came up congratulating, and his brothers and his father, all of them. And then, they all they all stepped out. We got to have our time.”

But not a lot of time.

The building where they married is right next to a military base, held by the Houthis and frequently targeted by coalition jets. Muntaser seems almost blasé talking about the air strikes, which occurred nightly, as if they were just an inconvenience, something to put up with. Summer also takes the war in stride.

“We left early, because everybody leaves early due to the [airstrikes],” she recalls. “We were leaving the house, and all we hear is the planes. And you see them flashing, right? And I said, 'oh my God,' like, holy crap.”

Summer and Muntaser were about to drive off together, their first moments truly alone as a married couple. But even that would be denied them.

“My mom sees the planes and she freaks out,” Summer says. “She jumped in the car and all the siblings, we all got squished in one car. Because the first airstrike hit. And it was very close.”

In Yemen, the war touches everything.

Summer and Muntaser spent their wedding night at a downtown hotel, accompanied by the sound of soaring jets and explosions. “I could not sleep because of the airstrikes. Yeah, it was really bad,” she recalls.

“I remember the doors really shaking because of how strong the earth was shaking, because of the rockets hitting,” Muntaser says.

“My mom would call every 10 minutes,” Summer adds. “'Are you OK.' 'No, mom — are you OK?' You know?”

They started early today. Airstrike just hit Faj Attan with a big one. Sana'a #Yemen — Hisham Al-Omeisy (@omeisy) April 29, 2015

Boooom #sanaa — Summer Nasser سمر ناصر اليافعي (@ToEducate) April 29, 2015

“We have to sleep, every night, checking our phones.""

Throughout the spring of 2015, Summer became a go-to American in Yemen for foreign news outlets including the New York Times, Voice of America, Al-Jazeera, the BBC, Britain’s Daily Mail, Fox News and us here at PRI’s The World. This, Summer says, was part of why she stayed: to be able to help tell Yemen's story to the world.

But when weeks had become months, and the war still showed no signs of ending, she and Muntaser chose to leave Yemen to start their life together in America.

They first tried, and failed, to cross by land into Saudi Arabia. At the end of June they boarded a flight from Sana’a to Amman, Jordan. It was the first time Muntaser had been outside Yemen. But without a US visa, he could go no further.

The couple tells me they were frustrated by how little help they could get from the US embassy in Amman.

In November 2015, Summer went back to New York, alone. Muntaser would remain in the Jordanian capital while Summer resumed her classes at Concordia College and worked through her local congressional representative to expedite a visa for him.

It took nine months for the paperwork to clear. Then Muntaser boarded a plane to New York City.

Summer Nasser and Muntaser Yaghnam on their first holiday together in America. Credit: Courtesy of Summer Nasser

“It was August 28, and I was tracking him on his plane, where he was,"" Summer remembers with a broad smile. ""And when I picked him up at the airport he was so excited. And I gave him a hug and I said, ‘Welcome to your new home. And this is it.’ I took him to the car, and we drove around. We drove everywhere. We drove over the bridges. And he couldn't believe it, he was so excited. I said ‘You're going to have to let me focus on driving, because I can't drive when you're so excited.’”

Summer pauses.

“To be together, it was truly a blessing after all of that. To be honest now, thinking about it, I'm like, ‘Wow, this is really what we went through?”

Summer and Muntaser escaped the war. But they haven't left it behind.

Summer Nasser driving in New York. Credit: Stephen Snyder/PRI

“We have to wake up every morning and we have to sleep, every night, checking our phones. That last 10 minutes before 10:00, we have to check our social networks. We have to check our family,” Summer says.

The couple keep busy schedules, Muntaser driving for Uber, and Summer completing her undergraduate degree and working as a paralegal. But they make time to help the people of Yemen.

“Being Yemeni in America,” Muntaser says, “we are, like, we are blessed here, we are safe, we have a good income. So we end up joining [the] Yemen Aid [charity] organization, where we are talking about the Yemen situation and how we can send help and implement projects.""

Yemen Aid is a non-profit charity founded in 2016 by Summer and a group of Yemeni American professionals determined to inform the public about the humanitarian crisis in Yemen, and to do something about it. Summer is its executive director. Muntaser is its chief operating officer. They run a speaker’s bureau. They do fundraising and find ways to relieve some of the widespread suffering in Yemen.

When we spoke at the end of February, their group had just sent a 40-foot shipping container filled with medical equipment and supplies to hospitals in Yemen. A second container is in transit. Summer and Muntaser expect it to arrive in Aden on April 10, near the anniverary of their wedding.",https://www.pri.org/stories/2018-03-27/getting-married-amid-airstrikes-yemen
21,yemen,"This week the war in Yemen enters its fourth year. Since the start of the conflict, basic services in Yemen have become nonexistent. More than half of all health facilities in the country are nonfunctional, and three-quarters of the population, 22 million people, are in need of immediate humanitarian assistance.

What makes this conflict so heartbreaking is its cruelty, the warring factions deliberately targeting civilians and civilian infrastructure. International humanitarian law stipulates that hospitals, schools and similar facilities remain off limits to combatants. Both government forces and militants have violated these laws. According to the Yemen Data Project, least 4,500 airstrikes have hit gas, electric, transportation and other essential infrastructures, including 68 strikes on health clinics and hospitals and 342 on educational buildings. The destruction has pushed eight million people to the brink of starvation, 1.8 million of them children suffering acute malnourishment.

Yemen is on the verge of becoming a failed state. Mothers helplessly watch their children grow ill.

Since the outbreak of fighting, the International Rescue Committee has been on the ground in Yemen doing incredible work under extremely difficult and dangerous conditions. Each working day our mobile health clinics travel up to five hours in remote mountainous regions to reach isolated people entirely dependent upon our health care services. The IRC screens children for moderate and severe malnutrition and puts those in acute distress on nutrition regimes. We provide immunization to stop the spread of disease and livesaving medicine to those already ill. Sadly, this work amounts to a drop in the bucket compared to the suffering afflicting Yemen.

Abdul Ghafar lives in a remote village in the mountains. The nearest medical facility is an IRC-supported health center two hours away. There are no cars available, and even if there were, the cost of gasoline has skyrocketed since the start of the war. The IRC mobile health clinic comes to Abdul’s village every Wednesday.

But early one Monday morning, his three-year-old son, Abdullah, became ill, “One night, he was vomiting and having diarrhea,” Abdul recalls. “I knew the IRC mobile clinic was coming here in two days.”

Cholera is a fatal bacterial disease, typically contracted from infected water and causing severe vomiting and diarrhea. It can kill within hours if left untreated. Yemen is experiencing the largest outbreak of cholera in recorded history, having surpassing one million suspected cases last December.

Abdul brought his son to the IRC clinic that Wednesday, where Abdullah was given an IV drip and medicine. The boy was also suffering from severe acute malnutrition. But he was lucky … he survived the ordeal, although his life, like everyone’s in the village, is fragile.

Abdullah was born the same year civil war erupted in Yemen. “Ever since this child was born, he has been sick,” laments Abdul. “Sometimes we have one meal a day. Sometimes we don’t eat at all. I am not thinking about me eating, I think about my children. I buy juice or biscuits and feed them that. This is all we have. Without the IRC, my son was going to die in my arms.”

As the war wages on, more civilians are put at risk. “The wars and the fighting is the reason my son is always sick, and why I cannot find a job,” says Abdul. “I just want safety and security. Everyone needs to be able to feel safe when they leave their home.”",https://www.rescue.org/article/worlds-worst-humanitarian-crisis-yemen
22,yemen,"How Global Politics Made Yemen's Humanitarian Disaster

Enlarge this image toggle caption Arezou Rezvani/NPR Arezou Rezvani/NPR

The war in Yemen is one of the worst humanitarian crises in the world. Largely started as an internal fight between rebels and their government, it's now a much more bloody battleground in the regional rivalry between Iran — which backs the rebels — and Saudi Arabia, which backs the government.

An NPR team spent weeks working to get a picture of the war, which has often taken place out of public view. NPR traveled with the Saudi military into Yemen, interviewed people in rebel-controlled zones, and then traveled to Djibouti, in East Africa, a destination for Yemeni refugees.

What emerged were the stories of people like Ola Ali Salim.

Salim is a citizen of Yemen, now a refugee. She had one daughter with her husband, who supported the family by driving a motorcycle, carrying one or two passengers at a time on the back of the seat.

Enlarge this image toggle caption Arezou Rezvani/NPR Arezou Rezvani/NPR

Last year, her husband was driving around the capital city, Sanaa, when it erupted in violence. A former president was trying to switch sides in the civil war and was killed. Sanaa was also being bombed by a Saudi-led coalition fighting Yemen's Houthi rebels. Amid explosions and gunfire, Salim simply stopped hearing from her spouse.

""He never called. We don't know any news of him, so the only explanation is that he's dead,"" she told NPR. ""They didn't find the body.""

It was only her latest loss. In a separate incident, three of her cousins were killed in what she believed to be an airstrike by the Saudi-led coalition — the only side in the battle with an air force.

Middle East Why Yemen's Nearly 3-Year-Old Civil War Remains Mostly Out Of Headlines Why Yemen's Nearly 3-Year-Old Civil War Remains Mostly Out Of Headlines Listen · 10:19 10:19

In December, she packed a few belongings and traveled to the coast, hiding her grief beneath the black head covering, or niqab, which Yemeni women are expected to wear. She brought along her 12-year-old daughter. They boarded a small boat that bobbed across the Gulf of Aden in the middle of the night. They arrived in the African country of Djibouti, where NPR interviewed her.

Djibouti can have something of the feel of the movie Casablanca — a former French African colony, which serves as a way station or last refuge for the desperate. But there was nothing romantic about Salim's flight. She lives in a United Nations refugee camp in a tent with a floor of desert sand. She is within sight of the water and nearly within sight of the country where she lost her husband.

Enlarge this image toggle caption Arezou Rezvani/NPR Arezou Rezvani/NPR

The war that displaced Salim has a U.S. connection, which was on exhibit in Washington this week. Saudi Crown Prince and Defense Minister Mohammed bin Salman visited the White House and got a warm welcome from President Trump, who showed pictures of U.S. military hardware sold to Saudi Arabia.

Africa To Escape Civil War, Many Yemenis Flee To Djibouti To Escape Civil War, Many Yemenis Flee To Djibouti Listen · 3:49 3:49

A globalized conflict

The U.S. has provided targeting information, equipment and aircraft refueling to the Saudi air campaign, which has been widely criticized for being indiscriminate and killing civilians in places like hospitals, funerals and homes. Several thousand civilians have been killed since 2015, when the Saudis got into the war. On Tuesday, the day the prince met Trump, the U.S. Senate defeated a resolution 55-44 that would have limited what the U.S. can do to support the Saudi war effort.

Enlarge this image toggle caption Top and bottom left: Steve Inskeep/NPR; Bottom right: Emily Ochsenschlager/NPR Top and bottom left: Steve Inskeep/NPR; Bottom right: Emily Ochsenschlager/NPR

The issue will likely come up again. While both sides – the Houthi rebels and the Saudi-led coalition — have killed, detained or displaced civilians, much of the international focus has been on how the Saudi-led campaign escalated the violence.

The Saudis, along with a coalition that includes the United Arab Emirates, argue that they are countering a dangerous rebel faction backed by Iran. They note that Houthis have fired missiles – allegedly Iranian-made – into Saudi territory.

Enlarge this image toggle caption Steve Inskeep/NPR Steve Inskeep/NPR

In the face of international criticism, the Saudis have cracked open a window on their side of the war. They have begun inviting reporters to view small portions of their battle lines. So in early March, the NPR team boarded a U.S.-built, Saudi-owned C-130 transport plane for a flight into Yemen to assess.

After arriving, the team drove into the mountains and to an observation post more than 8,000 feet above sea level, soldiers from Yemen's army took turns with binoculars peering into the valley. Somewhere over the horizon, the Houthis control Sanaa.

At the observation post, a Yemeni soldier, Lt. Ahkram Messen, told reporters that his parents live on the rebel side of this divided nation. ""They are waiting on me to come,"" he said.

A senior officer, Gen. Nasser al-Thebani, said the Yemeni army strategy was ""to liberate all Yemeni territory.""

But soldiers at this forward position indicated they had been guarding the same line for two years without much movement. Yemen's army, which collapsed almost without firing a shot when the Houthis took the capital in 2014, remains a lightly trained force of uncertain strength.

Saudis prop up the Yemeni government to an extraordinary degree. Saudis pay the army. Saudi planes provide air cover, fire the artillery and use special forces to work with the lightly armed Yemeni government troops. This month, Saudi Arabia had to drop $2 billion in the Yemeni central bank to stave off a currency collapse. Yemen's president does not even live in Yemen; he lives in Saudi Arabia for safety.

Globalized criticism

Saudi officials recently emphasized their efforts to deliver humanitarian aid. One U.S. diplomat acknowledged these efforts but said they have not been enough. Even in Marib, which has ties to Saudi Arabia, there are long lines for gasoline — and Marib is more prosperous than most cities.

Rebel-held areas have had no electricity for years. Food is available, but inflation makes it nearly impossible to afford.

Enlarge this image toggle caption Arezou Rezvani/NPR Arezou Rezvani/NPR

Enlarge this image toggle caption Steve Inskeep/NPR Steve Inskeep/NPR

Dr. Najla al-Sonboli, a doctor at a maternal hospital in the capital, described an economic collapse. ""Our staff have no salary for 1 1/2 years,"" she said. ""We have a shortage of medicines for our patients."" Cholera, which has swept parts of the country, is expected to intensify in the hot summer months.

Much of the chaos can be blamed on Houthi rebels. Refugees who fled the area told us that there is scant governance, merely a multitude of young men with Kalashnikov rifles at checkpoints.

But there are also the airstrikes of the Saudi-led coalition. A military base across the street from Sonboli's hospital has been bombed again and again. ""This happens during the day, any part of the day, anytime,"" she said.

Human rights groups and reporters document other civilian sites that were struck: a different hospital, houses, a market, a funeral. The Saudis have begun to acknowledge some mistaken bombings — 11 so far. Outside groups count far more.

Under pressure, the Saudis have been in contact with the Houthi rebels and are believed to have made quiet efforts to arrange a peace.

But Saudi officials remain profoundly concerned about the spreading influence of Iran — and so does the Trump administration.

On a recent visit to the region, CIA Director Mike Pompeo showed a sharp interest in Yemen. He had a long meeting with U.S. diplomats about the country. Since then, Pompeo has been nominated to a post of even greater influence, secretary of state, where one of the many questions facing him will be what to do about Yemen's war.

Arezou Rezvani and Emily Ochsenschlager with Morning Edition contributed to this report.",https://www.npr.org/sections/parallels/2018/03/22/595002666/how-global-politics-made-yemens-humanitarian-disaster
