,Concerning,Text,URL
0,yemen,"Highlights

UN Secretary-General Antonio Guterres announced on the 16 February that former British diplomat Martin Griffiths would be the new UN Envoy for Yemen. Griffiths previously served as an adviser to three special envoys to Syria.

The killing and maiming of 53 and 92 children respectively, was documented and verified this month, in 12 governorates. Child casualties have also increased by three-fold in Al Hudaydah since previous month.

The number of diphtheria cases continued to rise this month with a total of 1,216 probable cases reported and 73 associated deaths, a case fatality rate of 5.9%.

UNICEF and partners continued supporting the scale up of Community Management of Acute Malnutrition (CMAM) programme and the cure rate has now increased from 77% to 85%, with nearly 10,000 children receiving treatment in February.

UNICEF developed an Integrated Cholera Response, Preparedness and Prevention plan for 2018-2019 that will guide health, WASH and C4D cholera interventions and aims at being prepared for a potential 500,000 cases of AWD/cholera.

February 2018

11.3 million # of children in need of humanitarian assistance (estimated)

22.2 million # of people in need (OCHA, 2018 Yemen Humanitarian Response Plan)

1 million # of children internally displaced (IDPs)

4.1 million # of children in need of educational assistance

400,000 # of children under 5 suffering Severe Acute Malnutrition (SAM)

16 million # of people in need of WASH assistance

16.37 million # of people in need of basic health care

UNICEF Appeal 2018*

US$378 million

Funding Status**

US $ 208 million

Situation Overview & Humanitarian Needs

The UN Secretary-General Antonio Guterres announced on the 16th February that former British diplomat Martin Griffiths would be the new UN Envoy for Yemen. Griffiths previously served as an adviser to three special envoys to Syria.

Whilst there were no significant changes in the conflict lines in February, the situation has remained volatile, particularly in Al Hudaydah, Sa'ada, and Aden governorates. Violence is raging along the western coast, with the frontline moving north, and resulting in 100,000 new displacements this month. Internally displaced people (IDPs) move north from Mokha towards Al Hudaydah and Haiz and some displacements are also taking place further south. The continuation of the conflict has led to a challenging operating environment, and poses ongoing threats to movement, making the delivery of supplies difficult and hindering monitoring visits.

The killing and maiming of 53 and 92 children, respectively, was documented and verified this month in 12 governorates. Child casualties have increased by three-fold in Al Hudaydah. Cases of recruitment and use of children in armed conflict are still under verification yet thus far, the Country Task Force of Monitoring and Reporting documented and verified 19 cases of recruitment and use of boys in 11 governorates in February. Additionally, five attacks on schools and hospitals were verified in Taiz compared to two attacks in January. Meanwhile, nearly three quarters of public school teachers, mainly in the north of the country, have not received their salaries in over a year. This has disrupted schooling and contributed to a 20 per cent increase in the number of out-of-school children, from 1.6 million before the war to 2 million today.

With 18,470 new cases of acute watery diarrhea (AWD)/suspected cholera in February, the number of new cases continues to gradually decline (the weekly number of cases has decreased again for the 25th consecutive week). Despite this, the risk of another outbreak looms large with the rainy season expected to begin in parts of the country by April. UNICEF's new focus in the AWD/suspected cholera response will is now on response to IDPs on the frontlines of conflict. In addition to this, there has been a sharp rise in the cases of diphtheria in the country. By the end of the month, a total of 1,216 probable cases were reported with 73 associated deaths, a case fatality rate of 5.9%.",https://reliefweb.int/report/yemen/unicef-yemen-humanitarian-situation-report-february-2018
1,yemen,"Ahead of the upcoming international fundraising conference for Yemen, the United Nations has received nearly $1 billion contributions from Saudi Araba and the United Arab Emirates (UAE), urging other donors to follow suit and help tackle the world’s worst humanitarian crisis there.

UN Secretary-General António Guterres expressed his deep gratitude for the $930 million provided on Tuesday evening by the two donor countries to the Yemen Humanitarian Fund.

“I would like to take this occasion to appeal to all the other donors who will be meeting in Geneva next week… to follow the same generosity” shown by the two countries, the UN chief told reporters at the world body’s New York Headquarters, after meeting with Prince Mohamad Bin Salman Al Saud, Saudi Arabia’s Crown Prince.

“These funds cover almost one-third of the $2.96 billion required to implement the 2018 Yemen Humanitarian Response Plan, which will enable the United Nations and its partners to help alleviate the suffering of millions of vulnerable people across Yemen,” read a statement issued by Mr. Guterres’ office, following the signing of the memorandum on the voluntary contributions.

More than 22 million people in Yemen require humanitarian aid or protection assistance, including 2 million who are internally displaced due to the ongoing conflict between the Government and rebel forces.

On 3 April, donors will meet in the humanitarian pledging conference in Geneva, Switzerland.

In his meeting with the Crown Prince, who is also First Deputy Prime Minister and Defence Minister, Mr. Guterres said “to give to those in need is a central pillar of Islam,” noting that two-thirds of the refugees are Muslims and are received by Muslim countries.

The Secretary-General and the Crown Prince discussed the obligations of all parties to the conflict under international humanitarian law to protect civilians and civilian infrastructure, and the critical need for humanitarian access across the country and for all of Yemen’s ports to remain open to both humanitarian and commercial movement.

They also discussed the need for the parties to the conflict to work towards a negotiated political settlement through inclusive intra-Yemeni dialogue.

Mr. Guterres expressed the UN’s readiness to work together with Saudi Arabia for these objectives.

The UN, through its envoy, has been engaged in helping Yemenis to find a peaceful solution. UN agencies and partners are also on the ground to deliver life-saving aid.",https://reliefweb.int/report/yemen/un-receives-nearly-1-billion-saudi-arabia-uae-humanitarian-response-yemen-crisis
2,yemen,"By Maliheh Bitaraf

The Case Against the Yemen Intervention

The case for US Support of the Saudi intervention in Yemen rests on two assumptions, that the US is a moderating force in the campaign, preventing further death and destruction, and that the war is a regional proxy struggle against a revisionist Iran. Both assumptions are erroneous, the war is anything but ‘moderated’ and before the intervention, the link between the Houthi rebels and Iran was tenuous at best. Moreover, I argue that to give Iran the sole title of destabilizing power obscures more than it reveals.

In 2012, the president of Yemen, Ali Abdullah Saleh, resigned, handing over the power to his Deputy Abdrabbuh Mansur Hadi. This was not a smooth transition, and this failure led to the current unrest in Yemen. Moreover, the involvement of Saudi Arabia has created further instability in the country.

While Saudi Arabia accused Iran of providing arms to Houthi rebels and called on the UN Security Council for the imposition of an arms embargo on Iran, it has spent billions in weaponry mostly made by the U.S. and the U.K. to use against Yemen. No one can deny the Saudi government’s atrocities against innocent Yemeni people. According to the UN, out of over 29 million population, approximately one-third are on the verge of famine which has been described as “the biggest famine in the world.” Some 17 million people (60% of the population) are suffering from severe food and water shortages. The Saudis purposefully installed a blockade aimed at stopping the Houthi rebels, preventing the delivery of humanitarian aid to millions of Yemeni people, based on a UN report.

The Saudi- led coalition is comprised seven countries: Egypt, United Arab Emirate, Bahrain, Jordan, Pakistan, Sudan and Kuwait, is supported by the United States, Britain, and Australia. In March of 2015, the coalition launched a bombing campaign against Houthi militias with the objective of restoring Hadi’s presidency. Overall, tens of thousands of people have been killed, suffered from starvation or cholera, including hundreds of children’s deaths, according to the UN.

While Saudi Arabia accused Iran of controlling Houthis militias in Yemen to justify its war, there is very little evidence to support its claim. Iranian authorities deny supporting the rebels and have even discouraged them from capturing Sanaa, the capital of Yemen. In response to the Saudi’s claim, Bernadette Meehan, a spokeswomen for the National Security Council said that “It remains our assessment that Iran does not exert command and control over the Houthis in Yemen.” Moreover, a U.S. intelligence official said, “It is wrong to think of the Houthis as a proxy force for Iran… Yemen’s chaos is a civil war, not a battleground for regional conflict between Iran and the Sunni-ruled Gulf states,” The Huffington Post has reported. Conversely, Saudi Arabia, with its radical Islam ideology supports Sunni extremists has emerged as “the Middle East’s Biggest Danger.”

A Destabilizing Power?

In the 72nd session of the Third Committee of the UN General Assembly, the Saudi delegate expressed his appreciation to Canada for the sponsorship of a draft resolution tabled against five member states, including Iran and Syria, for violation of human rights, underscoring his support of the draft. In response, the Syrian delegate referred to Saudi Wahhabism as “a weapon of mass destruction.” Despite some reforms, such as ending the ban on women driving and allowing them to join the army or anti-corruption measures, Saudi Arabia still remains an autocratic and repressive regime. Yet, Saudi Arabia’s horrific record on human rights abuses, including beheading, is barely covered. Within the kingdom, there is no gender equality and women do not enjoy the same rights as men do. There is no freedom of the press and numerous human rights activists and bloggers that have run afoul of the regime are in prison.

How could Canada sponsor draft resolutions against some Member States, yet overlook Saudi violation of human rights nationwide and worldwide, their destabilizing role in the Middle East, and their involvement in supporting and funding global terrorism including extremist Wahhabism, the origin of several Jihadist groups? How can the United States turn a blind eye to the Saudi government’s inhumane and illegal practices? According to Senator Bob Graham, the former Chair of the Senate Intelligence Committee, 28 classified pages of the 2002 Congressional Joint Inquiry suggest, “a strong linkage between [the Sep 11] terrorists and the Kingdom of Saudi Arabia, Saudi charities, and other Saudi stakeholders.” Yet, notwithstanding the crimes committed by Saudi Arabia, the Saudis maintain good relations with the two major powers, the U.S. and the U.K. Surprisingly, neither has censured the Saudi government, but rather have signed arms deal with Saudi Arabia. The UK’s BAE Systems has sold 48 typhoon fighters to Saudi Arabia worth € 43 billion, adding to 72 jet fighters.

There was “nothing new” in CBS’ 60 minutes regarding Mohammad Bin Salman, the Saudi Crown Prince, viewed as the de facto leader. Bin Salman’s remarks were too insignificant to resolve any current crisis; rather, his belligerent language and incendiary rhetoric against Iran and Lebanon signify his antagonistic attitude, contributing to “playing an increasingly destabilizing role” in the region. Houthis’ connection with Iran is exaggerated “without providing solid evidence,” giving Saudi Arabia more justification to intervene in Yemen. The U.S, the U.K, France, and other major powers should halt its support of Saudi Arabian campaign in Yemen. By providing arms support to the Saudis, the powerful states, in fact, are contributing to the deaths of thousands of civilians including children in Yemen. What is Saudi Arabia’s motivation? It is not humanitarian aid, but a political machination to exert its influence and dominance in the region.

Maliheh Bitaraf is a graduate student at the Seton Hall School of Diplomacy and International Relations. Her specializations are International Organizations and Foreign Policy Analysis. Maliheh is an associate editor at the Journal of Diplomacy. Maliheh received her first Master’s degree in Mass Communication from the Middle Tennessee State University.",http://blogs.shu.edu/diplomacy/2018/03/to-end-yemeni-starvation-stop-saudi-arabia/
3,yemen,"As the brutal conflict in Yemen enters its fourth year, more than 3 million people (10 per cent of the total population) have experienced the shock of displacement. Two million people remain internally displaced across the country.

As with any conflict situation, people flee violence and leave everything behind. They end up in desperate need of shelter, food, water, sanitation and access to health services. They are also more likely to be exposed to protection risks, including human rights abuses and gender-based violence.

Read more on OCHA",https://reliefweb.int/report/yemen/yemen-humanitarian-fund-helps-displaced-families-survive-harsh-winter
4,yemen,An in-depth report by our senior reporters and team of correspondents from around the world. Every Saturday at 9.10 pm Paris time. Or you can catch it online from Friday.,http://www.france24.com/en/20180330-reporters-yemen-abd-rabbu-mansour-hadi-houthi-saudi-arabia-houthis
5,yemen,"

A soldier at the Marib dam in Yemen. During the civil war, cities in Yemen have been heavily damaged or destroyed by Saudi airstrikes or in Houthi shelling, but a building boom is underway in Marib city, a provincial capital. (Kareem Fahim/The Washington Post)

The camp did not feel like a refuge, in a parched patch of nowhere by a bare, black hill. There was nothing in the way of distractions for the displaced people sheltering in tents here, like a playground, a store, a cafe; nothing to prevent thoughts drifting to the war and the dead.

Three years had passed since his father was killed by Yemeni rebels known as the Houthis, but Azzam Shalif seethed at a memory still fresh. They had snatched his father, a teacher, from in front of his house. There had been long and tortured negotiations to reclaim the body. Then there was disbelief when his father, disfigured beyond recognition, was finally brought home.

Now Shalif, who fled and ended up in the camp in a government-controlled area, referred to the parts of Yemen dominated by the Houthis as “enemy” — a classification that included his home town and even his own relatives who had joined the rebels. “The enemy doesn’t understand the word dialogue,” he said when asked how the war might end.

“We have an enemy that doesn’t want any solution,” he said.

Such resentments have pooled in Marib, a pocket of relative, if uneasy, stability that has received tens of thousands of people fleeing battlefields across Yemen during more than three years of civil conflict.

The Post’s Kareem Fahim reflects on his fourth visit to Yemen since the civil war began in 2015 and how embittered civilians had become by the violence. (Kareem Fahim,Joyce Lee/The Washington Post)

The war has been defined by the terrible violence that the combatants have inflicted on civilians and by a humanitarian crisis called the most severe in the world. It has dark shades of a proxy struggle between Saudi Arabia and Iran, and has caused rising consternation in foreign capitals, including Washington, where a group of lawmakers last week condemned the Trump administration’s involvement in a ruinous conflict by providing military and intelligence assistance to the Saudi-led coalition fighting the Houthis.

[U.S. is resisting calls to end its support for Saudi-led coalition in Yemen’s war]

The strains on Yemeni society have been less apparent — the divisions and antipathies that will make it difficult for people to live together again even if the armies stop.





A trip to Marib for journalists this month was organized by the Saudi military, which hoped to showcase what the Saudi government says are its effort to provide aid and financial assistance to Yemen. The trip was also intended to blunt a resilient criticism: that the Saudi-led military coalition backing Yemen’s government bears much of the responsibility for the humanitarian disaster because of its imposition of an air, sea and land blockade.

Yemen’s cities have been scarred or destroyed by Saudi airstrikes or Houthi shelling. But a building boom is underway in Marib city, the capital of Marib province, and there is regular electricity and plenty of fuel. Restaurants have opened and classes are full at the local university. A well-stocked hospital is one of the few able to operate normally in the entire country.

Abd-Rabbo Moftah, the deputy governor, said Marib had “benefited” as Yemenis, including business executives, had flocked to the city and invested there. Others who were displaced found jobs in construction. Together, “they feel they are part of the city,” he said.

But the calm could be deceptive.

Rockets still fall on the city, fired from static front lines a few dozen miles away. A rebel ambush recently destroyed a truck traveling on the highway on the city’s outskirts. The pressures weighing on Marib’s new arrivals were unmistakable: the wrenching separation from families and homes and the hardening animus toward fellow Yemenis who happened to be on the other side of the conflict.



Soldiers stand guard near the Marib dam. The central province of Marib, rich in oil, is largely under the control of government forces and defended by their main military backers, a Saudi-led coalition that has several bases here. (Kareem Fahim/The Washington Post)



Omran Ammar, a soldier at a front-line position overlooking rebel-held territory, said he had been at the same post for about two years, since he was 18 years old. (Kareem Fahim/The Washington Post)

A view of the Marib dam. Marib province has taken in tens of thousands of displaced Yemenis, who have brought it new prosperity but also a wealth of resentments. (Kareem Fahim/The Washington Post)

Omran Ammar, a baby-faced soldier guarding a front-line position on a mountaintop overlooking rebel-held territory, said he had been at the same post for about two years, since he was 18 years old. A few times since the war began, he had managed to travel home, across the front lines into rebel territory. But he was happiest at the front, he said, while offering to show reporters decaying corpses of rebel fighters.

He had come from a family of farmers, but now all fought on the government’s side. His duty, as Ammar saw it, was “defending my religion, my honor,” from the rebels. To that end, “I would kill anyone,” he said. “Even my own brother.”

Badr Sharif, 30, stood nearby as the soldier spoke. “We feel sorry. We don’t want to be in this situation. But what can you do?” he said. Sharif, who was studying oil and gas management overseas before the war, now accompanied his brother, a Yemeni official, on his regular visits to the front line.

In the distance was Sanaa, the capital, controlled by the Houthis — a military objective for these soldiers that raised the specter of another sacked Yemeni city. “We don’t want to crush Sanaa,” Sharif said. “Many people are suffering.”

[Yemen’s war is so out of control, allies are turning on one another]

In Marib, there were frequent expressions of gratitude to the Saudi government, which has long been a financial benefactor to the province and its tribes. “They are the only people that helped us,” said Ahmed al-

Dhibaa, a member of an Islamist party that was fiercely opposed to the Houthis, who sat in a bare tent in a Saudi-financed camp.

There were appeals for unity, too, but they were more fleeting. “We are all Yemenis,” people were fond of saying, before insisting that the rebels were “animals” who regarded their enemies as terrorists.



Lt. Gen. Mohammed al-Miqdashi, right, the acting defense minister for Yemen’s exiled government, speaks to reporters with Saudi military officers present. Yemen’s military, which is backed by air power from a Saudi-led coalition, has not been able to dislodge the Houthis from areas they control, including Sanaa, the capital. (Kareem Fahim/The Washington Post)

Many have concluded that a division of Yemen, perhaps into federal states, is inevitable, even preferable, to resolve its competing grievances. In southern Yemen, there are renewed calls for secession from northern rulers accused of decades of repression and neglect. North and South Yemen were separate states until 1990, and four years later, they fought a brief civil war.

But even formal division requires some sort of national agreement. And over the past three years, a lengthening tally of perceived wrongs had made such agreement more elusive than

ever before.

The greatest fear is that religious sectarianism between Sunni and Shiite Muslims — the kind of acrimony that has ravaged Iraq — could take hold in Yemen, where such divisions are largely unfamiliar, and that the sectarian nature of the conflict between Saudi Arabia and Iran could rub off. The Sunni leaders of Saudi Arabia have backed Yemen’s Sunni government forces, while the Shiite government of Iran has backed the Houthis, a Zaydi Shiite group.

The worries accumulate with each assassination, airstrike, car-bomb explosion or kidnapping. Near the front line on the road to Sanaa, someone had painted “No to sectarianism” on the side of a mountain, in what seemed like a warning to soldiers consumed by the most vicious of fights.

“When this fighting takes on religious aspects, it cannot be solved,” said Mohamed el-Sabry, a professor of English at the local university who is originally from Taiz in western Yemen.

[A climate of fear and silence emerges in Yemen after killing of former dictator]

Lately, he had encouraged his students to talk about the conflict. “They are worried about their relatives. . . . They are worried about home,” he said. He also taught George Orwell’s “Animal Farm,” which seemed to resonate among pupils fed up with the failures of Yemen’s politicians, many of whom reside comfortably in villas overseas. “This party says they are fighting for us, then that party says they are fighting for us,” he said.

Some of his despairing students have given up hope. “They replaced our dreams, and everything is destroyed,” said Mohammed Mohsin, 24.

“Nothing is as it was,” he said. “There was no advantage to this war.”

Read more:

Today’s coverage from Post correspondents around the world

Like Washington Post World on Facebook and stay updated on foreign news",https://www.washingtonpost.com/world/middle_east/i-would-kill-anyone-even-my-own-brother/2018/03/24/861b5922-2c68-11e8-8dc9-3b51e028b845_story.html
