,Concerning,Text,URL
6,yemen,"Congress Sours on Saudi Arabia Over Yemen

As Saudi Arabia’s military intervention in Yemen enters its fourth year, U.S. lawmakers from both parties are running out of patience with a campaign that has left thousands of civilians dead and helped trigger one of the world’s worst humanitarian crises.

A concerted White House lobbying effort last week helped defeat a resolution in Congress that would have halted U.S. military support for the Saudi-led campaign in Yemen, but Riyadh’s troubles on Capitol Hill are far from over.

A top secret briefing from the U.S. Defense Department, direct appeals from Defense Secretary James Mattis, and phone calls from the White House were enough to avert an embarrassing political outcome in the congressional vote. Still, 44 senators voted for the resolution, sponsored by Bernie Sanders, an independent from Vermont; Chris Murphy, a Democrat from Connecticut; and Mike Lee, a Republican from Utah.

Even lawmakers who opposed the bill blasted Saudi Arabia for failing to do more to end the war and open access to humanitarian aid.

While Saudi Arabia may have dodged a bullet, the political climate in Congress is moving in a hostile direction for the kingdom — and another, more moderate bill aimed at curbing carte blanche U.S. support for the war in Yemen remains on the table.

Four separate congressional votes over the past three years, including last week’s measure, point to deep and growing dissatisfaction with Saudi Arabia. Two U.S. arms sales narrowly won approval, and a proposal allowing families of 9/11 victims to sue Saudi Arabia for damages passed with enough votes to overcome a veto from former President Barack Obama in 2016.

“The temperature is rising,” says Scott Paul, a senior humanitarian policy advisor for Oxfam America. “This is now on a trajectory that’s been in place for three years.”

Despite the congressional mood, President Donald Trump rolled out the red carpet for Saudi Arabia’s crown prince, Mohammed bin Salman, during his visit to Washington last week.

“The relationship is probably the strongest it’s ever been,” Trump told reporters as he sat down with the Saudi heir apparent for lunch.

The Saudis seem to agree. Riyadh has a particularly sympathetic ear in the president’s son-in-law, Jared Kushner. The Intercept reported that the crown prince privately boasted Kushner was “in his pocket.”

Shortly after the crown prince paid a visit to the White House, the administration unveiled a major arms sale to Riyadh worth more than $1 billion.

Meanwhile, Houthi rebels — who control much of western Yemen, including its capital, Sanaa, and are alleged to have Iranian-supplied missiles — have stepped up attacks on Saudi Arabia. On Sunday night, Houthi rebels launched seven missiles into the kingdom. Saudi Arabia says it intercepted all the missiles, but one person was killed by shrapnel, and video appears to show that the Patriot defense systems didn’t work as well as claimed.

Both the Trump administration and aid organizations working in Yemen sharply condemned the attacks. Yet there’s also concern such attacks could serve as a pretext for Saudi Arabia to ramp up the war.

“These unlawful attacks must not be used as an excuse by the Saudi Arabia-led coalition to indiscriminately attack civilians or further exacerbate Yemen’s humanitarian crisis,” says Samah Hadid of Amnesty International.

Another bipartisan bill in the Senate aims to tackle just that. Republican Todd Young of Indiana and Democrat Jeanne Shaheen of New Hampshire are spearheading the effort for the proposed legislation, which is expected to be taken up by the Senate Foreign Relations Committee next month.

The bill would require the State Department to certify whether the Saudi-led coalition is taking steps to expand access for food, fuel, and medicine shipments to Yemen; undertaking “an urgent and good faith effort” to pursue a diplomatic settlement of the civil war; and demonstrating it is reducing the risk of civilian casualties in its bombing campaign.

“This will create leverage for the administration and pressure on the Saudis that does not exist today,” a Senate aide says.

Unlike the resolution backed by Sanders and Lee last week, Young and Shaheen’s bill does not propose an immediate halt to U.S. military assistance for the Saudi air war in Yemen. Critics say this latest proposal of undercutting the legislation that failed last week with much less ambitious requirements.

But proponents say this new bill has a better chance of securing support from both sides of the aisle, including from the Republican chairman of the Senate Foreign Relations Committee, Bob Corker of Tennessee.

Corker opposed the Sanders-Lee resolution last week but promised to hold a hearing on Yemen next month. Corker says he and other lawmakers conveyed a stern message to the crown prince in talks last week and “strongly pushed back on what is happening right now in Yemen and asked them to take strong corrective actions.”

The White House has not stated its position on the new bill, but like with previous administrations, officials oppose any attempt to curtail the executive branch’s freedom of action.

“The United States is taking a number of actions to help the Saudi-led coalition support the Yemeni government and defend Saudi territory while minimizing civilian casualties,” says a State Department spokesperson, including providing equipment and training and advising the Saudi military.

“Without U.S. support and training, it is likely the rate of civilian casualties would increase,” the spokesperson says.

The Saudis and their Persian Gulf allies launched bombing raids in March 2015 hoping to reinstall President Abed Rabbo Mansour Hadi, and the U.S. military has provided intelligence and aerial refueling for coalition aircraft. As civilian casualties have mounted and relief officials have warned of an imminent famine, both the Barack Obama and Trump administrations have pleaded for patience from Congress.

After three years, the arguments are beginning to ring hollow with frustrated lawmakers.

Despite U.S. advice and support, the air war continues to exact a brutal toll on civilians, and lawmakers say repeated Saudi pledges to ease the humanitarian crisis have produced little concrete results. Aid agencies say a de facto Saudi naval blockade has helped fuel a spike in deadly diseases, including 1 million suspected cases of cholera.

Congressional staffers say the Trump administration’s arguments against the resolution last week were almost identical to the case made by officials during Obama’s tenure.

The White House, State Department, and Pentagon argue that halting U.S. military support would damage relations with Riyadh and undercut Washington’s influence, call into question U.S. credibility by abandoning an Arab ally, and place civilians at even more risk without any U.S. advisory role in the air campaign.

“The talking points don’t change,” a Democratic congressional aide says.",http://foreignpolicy.com/2018/03/26/saudi-arabia-faces-strong-headwinds-in-congress-over-yemen/
7,yemen,"Doctors Without Borders/Médecins Sans Frontières (MSF) head of mission Djoen Besselink recently returned from Yemen, where he witnessed how the country’s pervasive conflict has affected nearly every aspect of Yemeni life. Here he describes the situation.

Even before the war, Yemen was one of the poorest countries in the Middle East. Now the war is everywhere, affecting every aspect of people’s lives. Cities and villages have been destroyed. Many people haven’t been paid for the last year and a half. We see a lot of malnutrition and food insecurity because it’s not just about the availability of food, it’s about the money. There are goods to buy in the markets, but people can’t afford them. It’s a disastrous situation.

You can’t speak of a normal life in Yemen. People don’t have time to recover from one crisis before the next ones hit them. It’s crisis on top of crisis. You have the armed conflict; the economic situation, where health workers haven’t been paid; you have outbreaks of cholera and diphtheria; and you have the blockade preventing vital supplies from entering the country. Everything is related and comes on top of the previous problems, but nothing is ever solved. And this has horrible consequences for the people. Yemenis are trapped in this many-layered crisis.

A Crippled Health System

It’s all related. Health workers are not paid, so they flee the country or stop working, and the health system, already crippled by a lack of supplies and stock, collapses. Because their salaries have been stopped, people have no money. So they can’t pay for private care and have to go to the free services, like those provided by MSF.

But then the free clinics are overwhelmed and can’t respond to the massive needs. For example, when I arrived in the country, an MSF maternity hospital would have 200 deliveries per month. But one month we had 1,000 [deliveries], with some people walking nine hours to reach us. But the clinic was only built to deliver 500 babies a month. So some days we were forced to close the doors because we had run out of space.

Deadly Outbreaks

The diphtheria and cholera outbreaks are also a consequence of this. If you have a strong health system, then when cases of cholera or diphtheria appear you can isolate them and prevent the diseases from spreading. Cholera is endemic in Yemen, which means it comes back every few years. But in its current state the health system couldn’t absorb the cases, so MSF had to set up seven cholera treatment centers. We treated over 100,000 cases last year.

In Europe, when you are a child you get vaccinated against diphtheria, so the disease has been eradicated. But in Yemen, with the health system falling apart, people are not getting vaccinated and they get infected.

Addressing Massive Needs

Yemen is one of the largest MSF projects in the world. But that, of course, is not a good sign. It means the needs are very big. We have a huge impact in Yemen simply because we are the only organization providing medical care in most of areas where we work. But sometimes the magnitude of the need is too great and we have to make difficult choices. For me, that’s the biggest challenge: the vastness of the needs.

The situation was very difficult when I arrived in Yemen and it still is. It’s a combination of a lack of access to the people in need and increasing medical needs, as well as a lack of other organizations responding. As MSF, we are not there to find a political solution or end the conflict. We provide medical care.

In the last two years we’ve treated a lot of patients, and the numbers are not decreasing. Based on our experience, the conflict is not declining either. We saw massive spikes in violence in different parts of the country. We are working less than a kilometer from the front line in some areas. Four of our facilities have been hit by airstrikes—one hit close to our medical facility last December and destroyed part of the emergency room. We had to stay in the basement for two weeks in November 2017 when fighting escalated in Sanaa.

Untold Stories

The impact on the population is the side of the story that is missing from most media coverage. They talk about organizations leaving the country and the conflict, but everything has an impact on Yemenis, and they don’t explain that. They don’t explain that when people are not paid, they can’t get medicines or vaccines. The blockade of Yemen’s ports has increased prices and that has caused a lack of both food and water, which affects hygiene conditions. Everything seems to be about politics. But what does it all mean for normal people?

People survive because they have no other choice. They can’t leave. They are forced to live in these conditions. People just try to get to work or to the market to get food, and not get hurt along the way.

People are selling their cars, their jewelry to get the money they need to survive . . . But you can only sell it once, right? There is an informal social safety net, where people help each other. But living a good quality life is very difficult.

The same is true for MSF’s Yemeni staff. They are constantly afraid of what could happen to them or to their families at home while they are working. People are constantly scared because the fighting can start any moment. I once asked a colleague how they deal with the conflict. They just answered: “We duck our heads and continue. There is no other option.” They are the people we support and our staff at the same time. Leaving the incredible Yemenis I worked with was not easy.",https://www.doctorswithoutborders.org/article/yemen-trapped-many-layered-crisis
8,yemen,"Oxfam says Yemen 'worst humanitarian crisis' after 3 years Cholera, famine, 80% of population needs urgent aid

(ANSAmed) - ROME, MARCH 26 - The people of Yemen are fighting for survival without access to food and clean water, three years since the start of one of the most atrocious conflicts in recent history, said Oxfam in a statement on the crisis in the country.



It said 22 million people there depend on humanitarian aid, and the price of many food items has become unsustainable.



The price of rice, for example, has risen 131%, and nearly 18 million people are going hungry.



Behind all of this is a brutal war that has caused more than 5,500 civilian deaths and forced three million people to flee their homes. With half of the health facilities destroyed or out of service, the country is facing the largest outbreak of cholera in recent decades, with more than one million cases and another 2,000 deaths, Oxfam said.



It said 80% of the population is in urgent need of aid, making Yemen ""the world's worst humanitarian crisis"".



Oxfam said it is working to provide clean water and food in nine of the country's governorates. (ANSAmed).



",http://www.ansamed.info/ansamed/en/news/sections/generalnews/2018/03/26/oxfam-says-yemen-worst-humanitarian-crisis-after-3-years_e8b9cc91-bdfc-4a09-9968-25cbe035f1f1.html
9,yemen,"Jan Egeland is the secretary general of the Norwegian Refugee council and David Miliband is President of the International Rescue Committee. The opinions in this article belong entirely to the authors.

(CNN) The Middle East today is poised between multiple wars fueling extremism and a burgeoning younger generation looking for a new start.

Prince Mohammed has presented himself as a voice of moderation at home. But abroad, the story is different.

When the White House rolls out the red carpet for the newly empowered crown prince this week, President Trump must prioritize holding him accountable for his country's conduct on the world stage, starting with Yemen.

Yemen presents a catastrophic case study of what can happen when the center cannot hold. The country is consumed by at least five ""mini-states"" at varying degrees of conflict with one another. Their conduct is ruthless and feeds radicalism, but the main players are deaf to pleas from the outside world to end the killing.

Saudi Arabia is not the only culprit in Yemen's descent into hell, but it is the most powerful player. While the Houthis are also guilty, nothing justifies the Saudi-led three-year bombing campaign that has destroyed hospitals and schools and killed countless civilians.

Since December's White House call to end the suffering, the Saudi-led coalition has, according to the Yemen Data Project, carried out over 860 airstrikes in Yemen - one strike roughly every 100 minutes. More than one-third of these have struck civilians, including markets, farms and schools.

Riyadh has generously pledged almost $1 billion to the UN aid appeal for Yemen. But Saudi Arabia cannot play both arsonist and firefighter. Its behavior is damaging Saudi and American reputations, without making the region more secure. Instead, al Qaeda exploits the chaos to expand its foothold in Yemen, and Iran gains clout.

JUST WATCHED Yemen's ex-child soldiers tell their stories Replay More Videos ... MUST WATCH Yemen's ex-child soldiers tell their stories 03:39

Saudi Arabia's de facto and longstanding blockade of Yemen's main Hodeidah port is, in spite of recent modifications, still preventing large quantities of food, fuel and medicine from reaching millions of people. Commercial flights to the country's main Sana'a airport have been similarly blocked for over 18 months.

A UN panel of experts recently accused Saudi Arabia of using the threat of starvation as a weapon of war.

Our staff from the International Rescue Committee and the Norwegian Refugee Council work every day to navigate a byzantine set of inspections and impediments to assist communities in desperate need. Just to travel between the country's two main cities, Aden to Sana'a, humanitarian agencies have to pass through more than 70 checkpoints. And spiking fuel prices due to low supply make the drive more expensive than ever. Several major medical suppliers have already stopped direct deliveries to Yemen, forcing organizations like ours to find alternative and complicated arrangements.

President Trump needs to make Saudi conduct in Yemen a priority in his talks. Three concrete steps are essential.

First, Trump must bring Saudi Arabia to its senses: Piling human suffering on the people of Yemen is not strategic or defensible. Instead, commercial, civilian and humanitarian supplies need to flow freely to all parts of Yemen. This includes granting visas to aid workers and letting UN inspectors do their jobs. It also means demanding a permanent opening all Red Sea ports to commercial imports. The White House's past efforts that resulted in the blockade's temporary lifting proved half measures at best.

Second, President Trump must publicly commit US support to international efforts to restart peace talks. This includes empowering the new UN Special Envoy, and a new UN Security Council resolution that reflects current conflict dynamics, offers a more realistic framework for negotiations without preconditions and demands an immediate ceasefire. Without a political settlement, the human suffering will plummet to new depths and continue to overwhelm responders like IRC and NRC.

Finally, Yemen needs more than a war economy. Aid organizations cannot be a substitute. This means replenishing hard currency reserves in Yemen's Central Bank as promised, and paying essential civil servants.

The US has a unique ability to influence Riyadh's actions. There have been some good words, but so far no effect. This is the moment for Saudi Arabia's closest ally to save it from further destruction, and the chaos that follows in its wake.",https://www.cnn.com/2018/03/19/opinions/president-trump-bin-salman-yemen-opinion-miliband-intl/index.html
10,yemen,"Watch the MSF Field Report

Doctors Without Borders/Médecins Sans Frontières (MSF) head of mission Djoen Besselink recently returned from Yemen, where he witnessed how the country’s pervasive conflict has affected nearly every aspect of Yemeni life. Here he describes the situation.

Even before the war, Yemen was one of the poorest countries in the Middle East. Now the war is everywhere, affecting every aspect of people’s lives. Cities and villages have been destroyed. Many people haven’t been paid for the last year and a half. We see a lot of malnutrition and food insecurity because it’s not just about the availability of food, it’s about the money. There are goods to buy in the markets, but people can’t afford them. It’s a disastrous situation.

You can’t speak of a normal life in Yemen. People don’t have time to recover from one crisis before the next ones hit them. It’s crisis on top of crisis. You have the armed conflict; the economic situation, where health workers haven’t been paid; you have outbreaks of cholera and diphtheria; and you have the blockade preventing vital supplies from entering the country. Everything is related and comes on top of the previous problems, but nothing is ever solved. And this has horrible consequences for the people. Yemenis are trapped in this many-layered crisis.

A Crippled Health System

It’s all related. Health workers are not paid, so they flee the country or stop working, and the health system, already crippled by a lack of supplies and stock, collapses. Because their salaries have been stopped, people have no money. So they can’t pay for private care and have to go to the free services, like those provided by MSF.

But then the free clinics are overwhelmed and can’t respond to the massive needs. For example, when I arrived in the country, an MSF maternity hospital would have 200 deliveries per month. But one month we had 1,000 [deliveries], with some people walking nine hours to reach us. But the clinic was only built to deliver 500 babies a month. So some days we were forced to close the doors because we had run out of space.

Deadly Outbreaks

The diphtheria and cholera outbreaks are also a consequence of this. If you have a strong health system, then when cases of cholera or diphtheria appear you can isolate them and prevent the diseases from spreading. Cholera is endemic in Yemen, which means it comes back every few years. But in its current state the health system couldn’t absorb the cases, so MSF had to set up seven cholera treatment centers. We treated over 100,000 cases last year.

In Europe, when you are a child you get vaccinated against diphtheria, so the disease has been eradicated. But in Yemen, with the health system falling apart, people are not getting vaccinated and they get infected.

Addressing Massive Needs

Yemen is one of the largest MSF projects in the world. But that, of course, is not a good sign. It means the needs are very big. We have a huge impact in Yemen simply because we are the only organization providing medical care in most of areas where we work. But sometimes the magnitude of the need is too great and we have to make difficult choices. For me, that’s the biggest challenge: the vastness of the needs.

The situation was very difficult when I arrived in Yemen and it still is. It’s a combination of a lack of access to the people in need and increasing medical needs, as well as a lack of other organizations responding. As MSF, we are not there to find a political solution or end the conflict. We provide medical care.

In the last two years we’ve treated a lot of patients, and the numbers are not decreasing. Based on our experience, the conflict is not declining either. We saw massive spikes in violence in different parts of the country. We are working less than a kilometer from the front line in some areas. Four of our facilities have been hit by airstrikes—one hit close to our medical facility last December and destroyed part of the emergency room. We had to stay in the basement for two weeks in November 2017 when fighting escalated in Sanaa.

Untold Stories

The impact on the population is the side of the story that is missing from most media coverage. They talk about organizations leaving the country and the conflict, but everything has an impact on Yemenis, and they don’t explain that. They don’t explain that when people are not paid, they can’t get medicines or vaccines. The blockade of Yemen’s ports has increased prices and that has caused a lack of both food and water, which affects hygiene conditions. Everything seems to be about politics. But what does it all mean for normal people?

People survive because they have no other choice. They can’t leave. They are forced to live in these conditions. People just try to get to work or to the market to get food, and not get hurt along the way.

People are selling their cars, their jewelry to get the money they need to survive . . . But you can only sell it once, right? There is an informal social safety net, where people help each other. But living a good quality life is very difficult.

The same is true for MSF’s Yemeni staff. They are constantly afraid of what could happen to them or to their families at home while they are working. People are constantly scared because the fighting can start any moment. I once asked a colleague how they deal with the conflict. They just answered: “We duck our heads and continue. There is no other option.” They are the people we support and our staff at the same time. Leaving the incredible Yemenis I worked with was not easy.

Read More About MSF's Work in Yemen",https://reliefweb.int/report/yemen/yemen-trapped-many-layered-crisis
