,Concerning,Text,Title,URL
6,central+african+republic,"A ranger returns from patrol and hands over his weapon into Chinko’s armory. All photos by Jack Losh

This story appears in VICE magazine's Dystopia and Utopia Issue. Click HERE to subscribe.

As wind whips through an open cockpit, the bush plane banks eastward above the red earth of central Africa. Columns of black smoke tower on the horizon—the calling card of armed cattle herders. The dry season is their time to escape the arid Sahel in search of pasture for their enormous droves—burning forest and poaching wildlife along the way. But they are not the only intruders. A bullet hole in the plane’s wing from a guerrilla’s potshot is a reminder that the Lord’s Resistance Army (LRA) still operates in these badlands, where war is again intensifying. The pilot, Cédric Ganière, peers into the hot, darkening haze. “There is nothing romantic about this,” he says. “They are destroying a country that isn’t theirs. The fox is in the middle of the chickens. It is just kill, kill, kill.”

This is the front line in the battle to save Chinko—one of the largest intact wildernesses in the heart of Africa. The reserve, deep in a remote corner of the war-torn Central African Republic (CAR), lies near borders with Congo and South Sudan. Sitting on an ancient volcanic plateau, the area supports an extraordinary mix of species thanks to a fusion of Congolian rainforest and wooded savannah, nourished by underground wells that feed an expansive network of waterways. This patchwork has created a vital paradise, home to hundreds of bird species and imperiled populations of megafauna—lion and leopard, chimpanzee and antelope, hippo and buffalo, wild dog and golden cat. Devoid of human habitation, it is one of the last holdouts for the country’s endangered elephant population.

But this enchanted Eden is under siege. A protracted civil war is escalating in the region—a brutal and forgotten conflict that has prompted warnings of genocide from the UN. Militarized poacher units have plundered the park to feed the lucrative, insatiable demand for bushmeat, ivory, animal skin, and traditional medicine. Miners illegally dredge riverbeds for diamonds and gold. And the slash-and-burn tactics of nomadic herders, who kill game to supplement their meager rations and salary, threaten a fragile ecosystem.

Within this maelstrom, a group of conservationists is fighting to protect Chinko. Leading this resistance is David Simpson, a charismatic 30-year-old and the park’s manager. His hunger for adventure led him to quit his factory job in the United Kingdom and move to the wilds of central Africa to work for a big-game hunting firm before transforming the area into a unique sanctuary.

Covering an area almost twice the size of Yellowstone, Chinko has since become a mini-state within a failed nation-state. The biggest employer outside the capital of Bangui, Chinko hires hundreds of locals (including reformed poachers) as rangers, builders, farmers, mechanics, and medics. But the park’s survival hangs on the fate of a chronically unstable region. Renewed conflict could wipe out everything Simpson and his cadre are dedicated to protecting.

***

High above the smoldering bush, Ganière calls the control room where NASA-made software plots each blaze on a Google Earth map. This nerve center and two small aircraft are Chinko’s eyes. Units of armed, camouflaged rangers below: its fist.

The tiny plane drops into a gut-wrenching turn toward base. On landing, Ganière spots Simpson, near the dirt airstrip chatting with a group of workers in Sango, the local language. This is a rarity for munju, or white foreigners, who, at best, typically learn a couple of phrases, then opt for French, the tongue of the country’s despised former colonial master.

Cédric Ganière flies over a bush fire on the Chinko savannah in his tiny, two-seater plane during a mission to spot cattle herders and blazes.

Wearing desert boots, tan chinos, and a checked shirt, Simpson has a coppery glow at odds with his origins in England’s leaden, drizzly north. His accent is an unusual blend: no-nonsense Yorkshire with a southern African twang. He is direct yet understated, with a light, good-humored touch, at ease holding court during Chinko’s nightly group dinners.

“People make conservation complicated,” says Simpson. “It’s not complicated. You just stop the people killing the animals, and then you’re done. How much do I deal with animals on a daily basis? Zero. I deal with people. Sort that out, and the animals are fine.” He pauses. “I wish it was just about animals, though. It’d be much fucking easier.”

The area around the Chinko River was not always a wildlife reserve. From 2005, it was administered by an isolated hunting ranch called Central African Wildlife Adventures, which ran high-end shoots on strict quotas for wealthy tourists. Simpson became general manager in 2011. Soon after, things began to fall apart in the region. Sudanese poachers and LRA rebels had already decimated the once-abundant elephant population; well-armed poaching groups were now butchering the remaining wildlife. “A client would be getting ready to shoot a giant eland, then a whole load of AK-47s would go off nearby and slaughter the entire herd,” recounts Simpson. “We once found an eland with eight AK bullets in it and was still going.” Buffalo were being annihilated; lion prides, poisoned.

In March 2012, Simpson and his team came across 13 victims of an LRA massacre near an illegal gold mine. Their skulls were crushed, and bodies hacked with machetes. He and Erik Mararv, the concession’s founder, went to the capital to answer questions as witnesses but were instead arrested for murder and jailed in a filthy, overcrowded prison. They later learned that an official involved in the ivory trade had pinned the murders on them.

Languishing in prison, the pair realized that the area around the Chinko River needed to be transformed into a wildlife sanctuary. “We had to protect it,” says Simpson. “It was under attack.”

***

Six months later, the trumped-up charges were dropped, and Simpson reunited with his parents in the UK. After three weeks, he and Mararv headed back to eastern CAR to begin the transformation. At first, Simpson says, his team, armed only with hunting rifles, faced poachers carrying AK-47s. But Chinko’s capabilities began to expand after securing funding and, in 2014, coming under the aegis of African Parks—a conservation nonprofit that has national parks covering 10.5 million hectares. A key objective was to clear the reserve of foreign pastoralists. Each dry season, hundreds of thousands of cows are herded south from Chad and Sudan in search of fresh vegetation, a yearly practice known as transhumance, now intensified by drought, desertification, and war.

A Chinko employee monitors screens in the park’s control room, where software plots ranger movement, bush fires, and other crucial information on a Google Earth map.

This tradition has existed for centuries but has altered radically with the proliferation of weapons and involvement of cattle barons who use cows as roving bank accounts. Desertification and conflict across the Sahel have pushed foreign pastoralists deeper into CAR and the Congo as they seek out verdant terrain, especially grasslands away from armed groups who levy taxes on migrating cattle. The animals overgraze land, spread disease, and devastate dry-season soil amid uncontrollable fires that are lit by herders to clear dense brush and encourage new grass growth.

Such mega-herds—each up to 800 strong—pass through the Chinko region. Park rangers have clashed with herders in shootouts, seizing weaponry and veterinary medicines. But diplomacy is preferred. Local negotiators meet with gun-wielding nomads over tea to encourage them to bypass the reserve through a specially designated “corridor,” marked by yellow plastic bags tied to trees. The herders are given food supplies if they don’t stray off the path. “Confidence does not come quickly, but we have started the process of communication,” says Chinko’s lead negotiator, himself the grandson of a cattle trader.

Surprisingly Chinko’s personnel also includes Hervé Ngambo, a short, unassuming man in his late 30s who, from the age of 15, worked as an elephant poacher. “In the bush, I would slowly approach the elephant until I was as close as possible,” he tells me one morning. “Then I would shoot it in its head, ears, or heart.”

At the start, Ngambo says he could leave his village and find an elephant the same day. A decade later, it took him weeks. Mass poaching was taking its toll. “I always had to come home with something. If I didn’t find an elephant, I’d kill a buffalo or other animals. We’d sell some parts and go back out as soon as possible.”

Elephants were the most valuable quarry. Each time he killed one, Ngambo called his contact, a man from CAR, who bought the ivory to sell to foreign dealers. Ngambo says a pair of tusks plus the meat could bag his five-strong hunting team more than $700—a decent sum in this desperately poor region. He claims he killed well over a hundred but has lost count.

As wildlife numbers plummeted, Ngambo struggled to make ends meet. Living near the Chinko boundary, this lifelong hunter was familiar with the park and embarked on a dramatic career change, joining the reserve in 2014 to track wildlife and poaching activity. “I stopped hunting because there were no animals left. I thought Chinko was good because I want my grandchildren to see elephants. Before, I needed to make money and there was no other work. Hunting was just a job. Now I am committed to protecting these animals.”

But only so long as Chinko exists. Ngambo said, “In my community, there is nothing. There is no work. If Chinko stopped tomorrow and I didn’t get a salary, I would have to go back to hunting.”

***

In the heat of a cloudless February afternoon, the helicopter races over Chinko’s savannah, a parched expanse interspersed with snaking trails of gallery forest, seemingly empty of all human life. That is, until the tents come into view.

Several dozen shelters cluster among charred trees. The thump of rotors draws out dozens of figures who disappear amid clouds of billowing dust. Simpson and his deputy, Evelyne Malfliet, step out to face a host of women and children wearing headscarves and vibrant dresses. They are Fulani—Islamic pastoralists by tradition and, in the case of this exiled community, survivors of savage sectarian violence.

Simpson and Malfliet walk through the desolate, makeshift village toward a small thatched hut where they meet with elders. The plight of this community can be traced back to the outbreak of civil war in late 2012, when a majority-Muslim coalition of rebels known as the Séléka advanced on the capital and overthrew the government, committing atrocities on their path to power. Militias composed largely of Christians—the anti-balaka—fought back. Clashes across the country killed thousands.

At the end of a meeting, the park manager, David Simpson, speaks with elders of a community that was displaced by vicious fighting and is now sheltering in Chinko.

The Séléka were eventually ousted, splintering into rival factions that now control some 80 percent of this mineral-rich country. Violence surged again in late 2016, compounding the humanitarian crisis and uprooting hundreds of thousands of people. One of them was Amadou Boukar, who, in March 2017, awoke before dawn to militants attacking his town, Nzako. “They killed lots of people—women and children,” says Boukar, a 41-year-old former shopkeeper and a father of five. “The attack lasted all day.”

Around 380 civilians fled into Chinko, where park staff gave them food and shelter, later relocating them deep in the savannah where the sheer remoteness offers protection, though hyenas and lions stalk their camp at night. “We would have nothing without Chinko,” Boukar continues. “We could not survive alone. But look at these children. There is no school. This is no future for them. We want to go home more than anything. All we need is peace.”

Chinko is a beacon in one of the world’s darkest corners, bringing order and employment in a time of chaos. It fills the void left by a wholly absent state, sending the park’s medical staff into the community and paying for 50 teachers who reach more than a thousand children. At stake is not just the ecology of the region—it’s the people, too.

Two suspected poachers who were arrested deep in the Chinko bush board a helicopter to be taken to a holding cell at the park’s main base.

“The conditions needed for people to thrive are the same conditions for wildlife and ecosystems to thrive,” says Peter Fearnhead, the CEO of African Parks. “If you have an ungoverned area where natural resources are being exploited in an illegal manner, this contributes to the cycle of poverty.” Well-managed reserves, he says, “can radiate a system of good governance over a very, very large area.”

Despite the existential threats and tortuous logistics of keeping Chinko afloat, Fearnhead believes it presents “one of Africa’s greatest conservation opportunities.” Already, against the odds, wildlife is bouncing back. “In CAR, you have this big black hole filled only with tragedy. Chinko portrays hope in a situation where everything is stacked up to be doom and gloom. We are not allowing Eden to be lost. We are in the process of bringing Eden back.”

***

Swaddled in khaki fatigues and a desert scarf, Stefan Maritz, Chinko’s acting assistant law enforcement manager, waits on the airstrip for takeoff in the 95-degree heat. This burly South African, a former lance-corporal, goes on leave tomorrow. Before his departure, there is one last task.

The day before, rangers found a poaching camp, uncovering a haul of carcasses—buffalo, crocodile, giant forest hog, monkey, water buck, and hippo (its teeth, a valuable substitute for elephant ivory). The rangers lay in wait for the poachers’ return, later catching five of them, confiscating shotguns, rifles, machetes, and a large cache of ammunition. These men are suspected to be part of a larger operation, backed by a wealthy businessman.

The chopper takes off and pushes to the south. “Our mission is to fight the wrong,” says Maritz. “In Chinko, there is authority. There are consequences for what you do. Once accountability falls away, nothing works anymore.”

Fifty miles on, the helicopter descends in a forest clearing. Carrying his Kalashnikov, Maritz greets two rangers who emerge from the scratchy, sun-scorched grass escorting two poachers, one of whom wears flip-flops; the other, barefoot and hobbling. For a fortnight these men have slept rough in the forest amid clouds of mosquitos and tsetse flies.

In a patch of shade, I ask them why they’re here. “This is the only way I can make money for my family,” responds Constant, a father of one in his late 30s whose wife is pregnant with their second child. He says he has been working here independently without support for two weeks and insists he wasn’t aware of Chinko’s boundaries. The rangers shake their heads. “There is no work in my village. There are no opportunities. I do this to survive.”

The two men stare into the trees. Constant seems resigned, strangely calm. The other, Kinimapé, looks forlorn—his eyes, bloodshot. After days of pursuing faceless villains in the bush, this is a strange meeting that only blurs the line between good and bad, between greed and desperation.

The rangers lead the men to the helicopter. It thuds back to base where the men are frogmarched to a holding cell for questioning. Three days later, they will be transferred to Bangui to enter the country’s decrepit justice system. Poachers can be jailed for up to ten years, but this is no real indication of the fate of these men. Whoever funded this poaching trip may let them languish behind bars, or pay off the cops and deploy them once more.

The sun slides behind a canopy of dark forest. The sky is a deep, bruised purple, slashed with red. The air is cooler now. After the day’s drama, Simpson is wrapping up before lights-out. He’ll be up by 5:30 AM tomorrow to do it all again.

“Give it five to ten years, Chinko will be the jewel of African Parks,” he says. “This could be a thousand-lion park. We could have 100,000 buffalo. We’ve now created some stability. If we keep on, we’ll see more development. Then, in time, hopefully, peace.”

Reporting for this story was supported by a grant from the Pulitzer Center on Crisis Reporting.",Saving a Pristine Wilderness from Militarized Poachers and a Humanitarian Crisis,https://www.vice.com/en_us/article/mbxbvv/saving-a-pristine-wilderness-from-militarized-poachers-and-a-humanitarian-crisis-v25n1
7,central+african+republic,"'Times' Column Is Slammed For Its Portrayal Of Central African Republic

Enlarge this image toggle caption Florent Vergnes /AFP/Getty Images Florent Vergnes /AFP/Getty Images

The column was supposed to draw attention to a crisis in a country that Americans don't often hear about in the media: the Central African Republic.

Instead, it drew fury on social media this week for its portrayal of CAR and the sources interviewed. Sarah Knuckey, a professor at Columbia University's law school and the co-director of the university's Human Rights Institute, called it ""shallow"" and ""reckless"" in its reporting.

The piece, ""Conflict Is More Profitable Than Peace,"" written by New York Times columnist Nicholas Kristof, was published in the Times on March 25. A two-time Pulitzer winner, Kristof explains why years of violence and conflict in the CAR have created major barriers to alleviating poverty, hunger and preventable disease.

Kristof argues that international donors, including the U.S. government, should amp up investments in peace-building efforts like the U.N. peacekeeper budget — not just humanitarian aid.

The story was part of Kristof's annual ""Win A Trip"" contest, where he takes a promising student journalist on a reporting trip to highlight under-covered global development issues. Kristof chose the CAR because it is indeed a country in crisis. It ranks 188 out of 188 in the Human Development Index, which measures such data as life expectancy, education and per capita income.

As for the story's intent, in an interview with NPR on Thursday, Kristof said, ""I was writing a piece about global conflict as an impediment to development and health care. I was using CAR as an example of that. South Sudan would have been as good an example.""

Within hours of publication, Kristof's column was slammed in a tweetstorm on Twitter by Knuckey, who has visited the CAR in her research on human rights crimes. Her tweets ignited a conversation across the global humanitarian community.

There is little recognition of the agency and work of the countless Central Africans who run NGOs, provide healthcare, work for peace, prosecute crimes, risk their lives to protect others 11/n — Sarah Knuckey (@SarahKnuckey) March 25, 2018

He tells his readers that death results from “chaos and dysfunction,” and fails to grapple with the complexities of the conflict, the harms of colonization, the systems & structures leading to poverty 17/n — Sarah Knuckey (@SarahKnuckey) March 25, 2018

""Kristof represented CAR as if it were miserable across the board, and that the people who live there are victims,"" Knuckey told NPR. ""It represents a brand of journalism that has been heavily criticized for decades, and that is harmful.""

Kristof himself says he was a ""little bit"" surprised by the reaction on social media but ""understands the frustration that people have with the lack of coverage about things they care deeply about,"" referring to researchers, academics and aid workers who work to improve conditions in the CAR.

For Moussa Abdoulaye, a Central African activist, founder of a community school and consultant for media companies like Al Jazeera, VICE and HBO, perhaps the worst offense was Kristof's depiction of his country as a hopeless place.

Kristof described the CAR as ""the world's most wretched country,"" ""the capital of human misery"" and home to ""the world's most neglected crisis.""

Abdoulaye, who lives in CAR's capital of Bangui, acknowledges the challenges that a journalist like Kristof might face when reporting about his country. CAR is huge, the size of Spain and Portugal combined, he says. Telecommunications are difficult. There are few roads. ""It's not possible for any journalist to spend five days here and judge the whole country.""

Igor Acko, a Central African program specialist for the U.S. Institute of Peace based in Bangui, agrees somewhat with Kristof's characterizations. War and violence has indeed made life in the CAR ""miserable,"" he says. ""But it's not the most miserable.""

""I have seen more miserable countries,"" he says. ""Despite the conflict and the lack of freedom of movement, [hungry] people in the CAR can still collect food, plants and caterpillars, from the forest or bush to keep on living. Compare that to Somalia or South Sudan [where populations are suffering from lack of food from drought.]""

Many on Twitter were upset that the Central Africans mentioned in Kristof's story were mainly the poor, helpless victims, not voices of authority. The experts quoted were Westerners from large international aid groups like Mercy Corps and Catholic Relief Services.

I do a bit of journalism in Egypt, so I'm interested in one point covered in the critique. Why don't you mention local NGOs and African activists? What is the journalistic merit of omitting those from the story? Since I think I get journalism, I would like your take. — Wael Eskandar (@weskandar) March 27, 2018

Faced with this criticism, Kristof told NPR, ""The U.S. announced a big cut in U.N. peacekeeping funds this year. Finding people who can comment on that larger problem, on U.S. policy, that's more challenging.""

""It's not satisfying,"" says Knuckey of Kristof's response. ""There are Central Africans who work in the human rights space, who are very aware of what would happen if money to U.N. peacekeepers were cut.""

Others were baffled by some of the facts in Kristof's reporting. Acko, for example, couldn't understand why Kristof chose to highlight the Pygmy population.

The article mentioned that a quarter of the country's population has been forced to flee their homes because of the conflict. But the Pygmy people featured in the story were not displaced by violence, says Acko.

They live in a forest community in the southwest region that is relatively protected from conflict, which has mostly taken place in the north. ""Rebels and armed groups cannot move in the forest to reach the Pygmies,"" says Acko.

""That's true,"" says Kristof. ""But they are representative of people who are suffering from the conflict, which affects lives throughout the country when there's lack of government.""

Others have been supportive of Kristof's coverage.

Sarah as you know we have worked with many local CAR NGOS. I still found @NickKristof piece really useful highlighting the macro needs; namely that we need political, rather than humanitarian, solutions to stop war. For my mind it's the greatest challenge our movement faces. — Andrew Hudson (@andrewhudsonau) March 25, 2018

Kristof is trying to get Americans to care about issues beyond our borders (a worthy goal, IMO). You don't do that by telling happy stories of self-determination. Also NYT won't run these. Where will we read them? The stories of people in his CAR story are real & should be told. — Heather Luca (@heatherannluca) March 27, 2018

In an op-ed on the blog Outside the Beltway, James Joyner, a security studies professor at Marine Corps University, wrote, ""He's not writing for the people of CAR but rather for an American elite he's seeking to influence. He wants his readership to feel for the plight of the world's poor and to implore their government to do something about it.""

Still, Joyner wrote that Kristof owes it to his readers to ""continue to learn"" from experts like Knuckey.

Shortly after Knuckey posted the tweets on Sunday, Kristof fired off a tweet in response. ""Thanks for your critique,"" he tweeted. ""I think it's well-meant, but I don't think you get journalism any more than I get law.""

Knuckey and Kristof met at the Times office in New York City to discuss those critiques.

As for the reaction in the CAR, it depends on whom you talk to.

Abdoulaye says his colleagues — a mix of expats and Central Africans who are activists, lawyers and journalists — were ""shocked"" by Kristof's piece. ""They said he was not professional in the way he gathered his information.""

But Acko doesn't think people in general are up in arms.

""The language spoken here is French,"" he says. ""The New York Times publishes in English. Myself, I was not aware of this article until you sent it to me.

""So yeah — there are really few people who have read this article.""

Your Turn

What's your reaction to Nicholas Kristof's column and its critics? Tweet us @NPRGoatsandSoda with the hashtag #CARDebate",'Times' Column Is Slammed For Its Portrayal Of Central African Republic,https://www.npr.org/sections/goatsandsoda/2018/03/30/598264213/times-column-is-slammed-for-its-portrayal-of-central-african-republic
