,Concerning,Text,Title,URL
15,central+african+republic,"Five Years on, Central African Republic Crisis Deepens Share Tweet

A UN spokesperson has called for a new approach to end the still-deepening crisis in the Central African Republic.

The situation in CAR has been deteriorating for five years now, and in the next six months may grow even worse, according to the head of the UN’s Office for the Coordination of Humanitarian Affairs (OCHA) in CAR, Joseph Inganji.

Speaking to World Watch Monitor last week, Inganji called on “all actors to sit around the table to have a shared analysis and joint planning, in order to cut the vicious cycle of violence, and respond according to each other and everyone’s mandate”.

CAR fell into chaos on 24 March 2013 when a predominantly Muslim coalition of rebels, known as Séléka, ousted President François Bozizé and took power.

Six months later, in September 2013, Séléka’s leader, Michel Djotodia, who had proclaimed himself president, disbanded the group and in January 2014 resigned as president, to be replaced by Catherine Samba-Panza.

Yet during her two-year reign, and that of her successor, Faustin-Archange Touadéra, the conflict continued. More than 14 armed groups are currently active in CAR, together controlling around three quarters of territory.

Recent violence in the eastern village of Séko and its surroundings claimed 46 lives, including that of a priest. Father Joseph Désiré Angbabata, 49, was killed when UPC militants (a Séléka offshoot) stormed his Saint Charles LWANGA parish on Wednesday, 21 March.

Details provided by OCHA revealed that 10 children were among the victims, and as many as 19 villages were burnt down on the 100km stretch of road between Bambari and Ippy. As a result, thousands fled their homes and are now living three newly built camps, including one within the compound of the Catholic Church in Séko, which alone is housing more than 5,000 people.

‘Guerrilla warfare’

Inganji told World Watch Monitor the protection of civilian remains a major concern and that, in the absence of a functioning national army (disbanded in 2013 when Séléka took power), the UN’s Multidimensional Integrated Stabilization Mission in the Central African Republic (MINUSCA) has a key role. However, he said the UN peacekeepers need to change their modus operandi because the conflict has evolved.

“We have seen the fragmentation of armed groups,” he said. “These groups are adopting a guerrilla sort of warfare, while perpetrating gross violations of human rights.”

Injanji said development agencies must address the root causes of the conflict by turning their focus to conflict-resolution, reconciliation, security-sector reform and DDR (disarmament, demobilisation and reinsertion).

He called on aid and development groups and peacekeepers to set “a peace-humanitarian-development nexus”.

The government must also play a key role, he said: “The government has the sovereign responsibility for protection of civilians. That’s why, with the deployment of prefects [administrators] in the remote areas, the FACA [CAR’s armed forces] should be deployed to ensure and reinforce the rule of law.

“Unless we all sit together to have a joint analysis, agreed way forward together with the government, and all actors in the theatre, the situation will continue to deteriorate in the coming days.”

Some 2.5 million people – more than half of CAR’s 4 million inhabitants – are now in need of humanitarian assistance, the highest per capita caseload globally, according to the UN.

Despite the deepening crisis, humanitarian funding is currently at its “worst” and “lowest” level, deplores Inganji. So far, only 2% of the $515.6 million dollars needed has been funded.

“If we’ve got nothing to provide assistance to the needy people, it means that these people will die because we cannot give them our empty hands,” he said. “People require water and sanitation; they require food; they require medicine, etc.”

The head of OCHA called on donors to step up funding for humanitarian and development needs, before warning: “If nothing is done, the international community will be forced in future to use more resources to address the situation. But if there’s funding for humanitarian – alongside development – actions, CAR will remain a model in the world where other countries can replicate the manner in which a crisis needs to be handled.”

‘A whole generation sacrificed’

The violence in CAR is often portrayed as a sectarian conflict, but the country’s top three religious leaders – who head up the CAR’s Interfaith Group – say the conflict relates more to land- and resource-grabbing.

On 20 March, during a briefing at the UN Office in Geneva, Cardinal Dieudonné Nzapalainga, the Archbishop of the capital Bangui, denounced the “business of war” developed by armed groups in order to continue to exploit the resources of the country.

“Since 2013, children are no longer going to school in some regions,” he said. “Which kind of future are we preparing for this country with a whole generation sacrificed?”

Meanwhile, Imam Omar Kobine Layama, the president of the Islamic Conference in CAR, said “all our efforts remain vain because of the lack of security”.

The imam called on the reinforcement of the state, notably the national army, to accompany the UN peacekeepers already deployed in the country.

Finally the representative of CAR’s Evangelical Alliance, François Ndeckere Nzogbia, welcomed the contribution of the international community towards the resolution of the crisis in CAR, but said more needs to be done:

“We need to be supported strongly in order to stop the acts of these warlords and criminals, who continue to kill central Africans on a daily basis. But unfortunately the echo is not raised loud enough to enable the world to know that somewhere in that world, men and women continue to be killed cowardly.”

The Geneva briefing was organised jointly by the World Evangelical Alliance and the Catholic charity Caritas International.

It was also attended by various key stakeholders, including the UN Independent Expert on the situation of human rights in the Central African Republic, Marie-Thérèse Keita Bocoum, who stressed the key role of the religious leaders:

“I want to insist on the importance of interreligious dialogue, which will enable each locality of CAR to move forward to listening, forgiveness and reconciliation.”

The post Five years on, Central African Republic crisis deepens appeared first on World Watch Monitor.

Photo: IPDs waiting for food in CAR’s north-western town of Bozoum. Oct 2017.

Photo courtesy: World Watch Monitor

Publication date: April 4, 2018","Five Years on, Central African Republic Crisis Deepens",https://www.christianheadlines.com/blog/five-years-on-central-african-republic-crisis-deepens.html
16,central+african+republic,"

A general view shows the Central African Republic town of Bria on June 12, 2017. (Saber Jendoubi/AFP/Getty Images)

Recently, The Washington Post’s Jack Losh reported on the precarious governance of Central African Republic, where, “[i]n the absence of an effective government, more than a dozen armed groups and a multitude of local militias have usurped control of about 80 percent of the impoverished former French colony.”

Given this crisis, replete with rising social tensions and political violence, in November 2017 the United Nations Security Council extended the mandate of the Multidimensional Integrated Stabilization Mission in Central African Republic (MINUSCA), widely known as peacekeepers or “blue helmets.” Over the next year, the Security Council expects MINUSCA to protect civilians, facilitate peace and provide “support for the rule of law.”

But such a mission is likely to fail if we don’t understand what these concepts mean to CAR’s citizens. How do they understand justice? And what do they think about their country’s state and traditional justice systems?

Here’s how we did our research

As part of a program to improve access to justice and combat impunity in CAR, the American Bar Association Rule of Law Initiative (ABA ROLI) worked with the Harvard Humanitarian Initiative to conduct and jointly analyze a population-based survey in the capital, Bangui, and the surrounding areas of Bimbo and Bégoua. We surveyed 2,650 respondents in October 2016 in the local Sango language, using multi-staged cluster sampling methods. Responses were weighted based on the United Nations’ 2016 estimates of the adult population in each of the 12 covered neighborhoods.

[ Afghanistan’s road to peace won’t be an easy one ]

Here’s the background

In 2013, an alliance of rebel groups called the Séléka took power from President François Bozizé in a coup d’état. In 2014, following cease-fire negotiations, a newly created National Transitional Council shepherded CAR through a reconciliation process that included a national dialogue, known as the Bangui Forum for National Reconciliation.

In 2015, the Forum convened transitional government officials, representatives of certain armed groups, civil society, religious and traditional leaders, and political parties to discuss the way forward. A “fragile peace” held through the national elections in late 2015 and early 2016. But sporadic violence resumed as leaders of various armed groups became disappointed with their exclusion from coveted state positions and faced weak incentives to relinquish their control over territory and resources.

We wanted to know how to strengthen CAR’s justice system by understanding what people thought about justice and dispute resolution. We focused the survey in the capital of Bangui and the surrounding areas of Bimbo and Bégoua — which are less riven by fighting than other parts of CAR where rival rebel groups contend for control.

[ Yes, Central African Republic is a real country. But it’s a very different kind of country. ]

Retributive justice is more popular than restorative justice

Bangui, Bimbo and Bégoua residents have a rather formalistic and retributive view of justice. When asked to define justice, 82 percent of our respondents talked about “applying the law.” The next most common elements included “establishing the truth,” mentioned by 49 percent of respondents, and “punishing those responsible” for wrongs, mentioned by 47 percent. Only 30 percent of our respondents mentioned holding a trial for those accused of crimes. Even fewer mentioned compensating victims or having perpetrators acknowledge or apologize for their crimes.

CAR residents are optimistic about peace and justice but disagree about amnesty

Fully 90 percent of our sample told us that peace is possible; 77 percent said justice is possible.

But public opinion is divided about amnesty as a way to achieve transitional justice. A third of respondents oppose any form of amnesty; 23 percent favor general amnesty; and 39 percent support amnesty for those who were not leaders or did not commit serious crimes during the recent conflict.

Residents of Bangui, Bimbo and Bégoua distrust others

The recent conflict destroyed many social networks. Not surprisingly, most people we surveyed trust few entities other than their families. While 83 percent of respondents said they trust their families, only 52 percent trust the army, which was the runner-up. Only 47 percent say that they trust religious leaders; 42 percent trust others from their own ethnic group; and only one-third trust their neighbors.

Trust drops even lower for local and national authorities, coming in at 29 and 30 percent, and for domestic and international NGOs, at 26 and 24 percent. Residents expressed the least trust in the United Nations, at 14 percent.

[ Should U.N. peacekeepers launch preemptive strikes? ]

Such distrust helps explain why, of those who said they’d actually suffered crimes and disputes during the conflict between late 2015 and late 2016, only a minority, 32 percent, said they’d approached anyone for assistance.

Residents are most inclined to use courts for sexual and gender-based violent crimes

CAR has a history of porous borders and poor governance, which, among other factors, has undermined the nation’s efforts to establish an effective and legitimate justice system. So which types of crimes and disputes would citizens be willing to take to their nation’s courts?

Sexual assault and murder top the list: 69 percent said people should go to the justice system when there’s a murder, while 61 percent said the same for sexual violence. For these crimes, residents said they would be more inclined to go to the courts than to local police, traditional leaders or their families.

But the opposite was true for land disputes, financial disputes, family disputes, domestic violence and theft. For each of these types of disputes, fewer than 35 percent of respondents said they’d use CAR’s justice system for redress.

Why not use the courts? Those who said that they would not go to the justice system explained that they would be deterred because, first, it would take too much time to reach a resolution and, second, it would make their problems public. Those willing to take crimes and disputes to the justice system, by contrast, most often said they’d do so because the resolution would be enforced.

Residents are worried about basic services and humanitarian issues

Bangui residents are most concerned about meeting their basic needs. Little more than a quarter of residents say they are satisfied with their access to housing, food or water. Fewer than 10 percent are satisfied with access to jobs and employment. Successful rule of law reform will depend upon improving citizen access to these fundamental services.

[ Do women matter to international security? Trump just changed the U.S. government’s answer to that question. ]

Claire Duguid is a program associate at the American Bar Association Rule of Law Initiative (@ABARuleofLaw).



Catherine Lena Kelly (@catherinelkelly) is an adviser at the American Bar Association Rule of Law Initiative and a Penn Kemble Fellow at the National Endowment for Democracy.

Timothy Meyer is a senior program manager at the American Bar Association Rule of Law Initiative.

The survey was funded by a grant from the U.S. Department of State, Bureau of International Narcotics and Law Enforcement. The views presented are those of the authors and not necessarily those of the institutions with which they are affiliated.",How can the U.N. restore the rule of law to the Central African Republic? 5 things you need to know.,https://www.washingtonpost.com/news/monkey-cage/wp/2018/04/03/how-can-the-u-n-restore-the-rule-of-law-to-the-central-african-republic-5-things-you-need-to-know/
17,central+african+republic,"20180327T1454-15880-CNS-CAR-FRAGILE-PEACE.jpg A Franciscan stands near U.N. peacekeeping soldiers in 2017 in the village of Ndim, Central African Republic. The recent death of a Catholic priest in the Central African Republic demonstrates the delicate nature of peace in the country, where a cardinal and an imam have worked to bring the population toward peace and unity. (CNS/Baz Ratner, Reuters)

NAIROBI, Kenya — The recent death of a Catholic priest in the Central African Republic demonstrates the delicate nature of peace in the country, where a cardinal and an imam have worked to bring the population toward peace and unity. Fr. Joseph Desire Angbabata, parish priest at St. Charles Lwanga Church in Seko in the southern Diocese of Bambari, died March 21 after he was shot during an attack at the parish. Rebels shot the 48-year-old priest as he intervened to protect refugees camped at the church compound. Such attacks pose risks to Catholic clergy who step up to protect people forced to flee violence in the troubled country. Two forces — the Christian-dominated Anti-Balaka and the rebel Seleka, led by Arab-speaking Islamists — have clashed in the mineral-rich area for years.



Sign up to receive emails with the latest articles from NCR's The Field Hospital.

The attack on the parish occurred March 20 and lasted about 24 hours, leaving an unknown number of civilians dead. The victims were buried in a mass grave, according to reports. Cardinal Dieudone Nzapalainga of Bangui joined Imam Omar Kobine Layama March 26 in denouncing the priest's killing. ""We strongly condemn these acts. The men of God have task of announcing the path of peace and reconciliation,"" Fides News Agency quoted the two leaders as saying. The two religious leaders have united to steer a fragile peace effort in the country, where Christians make up about 80 percent of the population and Muslims about 15 percent. The country has experienced instability since 2013, when Seleka forces overthrew the government. French and African peacekeepers were deployed in January 2014 and drove the rebels from the capital, Bangui.

Advertisement",Priest's death shows fragility of peace in Central African Republic,https://www.ncronline.org/news/world/priests-death-shows-fragility-peace-central-african-republic
18,central+african+republic,"We offer our condolences to the family of the dead peacekeeper and to the Mauritanian authorities, and wish those who were wounded a speedy recovery.

France reiterates its full support for the actions carried out by MINUSCA, which is evolving in a difficult context and paying a heavy toll for the success of its mission. It reaffirms that attacks on peacekeepers may be a war crime and calls for those responsible to be brought to justice.

France furthermore expresses its strong concern following MINUSCA’s discovery of the bodies of 21 civilians in the same village and demands a thorough investigation of the circumstances of this tragedy.

This violence against peacekeepers and civilians confirms the need to move forward swiftly with the implementation of the joint road map for peace and reconciliation adopted on July 17, 2017, in Libreville, with a view to the effective disarmament of armed groups.",Central African Republic – Attack on MINUSCA (03.04.18),https://www.diplomatie.gouv.fr/en/country-files/central-african-republic/events/article/central-african-republic-attack-on-minusca-03-04-18
19,central+african+republic,"Highlights

• Violent fighting between armed groups around the town of Paoua in the north of the country led to the displacement of more than 60,000 people at the end of January. The humanitarian community is implementing a holistic emergency response and is calling for emergency funds;

• The UNICEF Child Protection response remains underfunded with only 11% of humanitarian funding needs for 2018 met as end of January 2018. This situation jeopardizes UNICEF’s capacity to meet the needs of 100,000 affected children with essential psychosocial support;

• Half of schools of the prefectures of Ouham, Ouham - Pende, Nana Gribizi, Mbomou and Haut Mbomou are destroyed, damaged or occupied by displaced families, denying education for 170,100 children.

Situation Overview & Humanitarian Needs

The humanitarian situation remains worrying. The number of Internally Displaced Persons (IDP) increased by 72% since January 2017 (from 402,240 IDPs in January 2017 to 693,932 in January 2018) according to OCHA. In Kaga-Bandoro and Bria, dry-season fires destroyed shelters of the most vulnerable persons in IDP sites. In addition, persistent conflicts between armed groups, coupled with the increased criminality notably targeting humanitarian workers in the country (e.g. Paoua, Kambakota, Ngaoundaye, Ndim, Bria, Alindao, Bambari), led to an increase in humanitarian need and the worsening of conditions for humanitarian access.

Due to clashes between armed groups in and outside Paoua in December 2017, around 12,506 households (60,000 people) have been forced to flee and find protection in Paoua throughout January. Some of these IDPs are currently hosted by local families, while others have moved and gathered in several locations in Paoua. The humanitarian community is mobilized to provide multi-sectoral assistance to the most vulnerable people in Paoua, including the IDPs and the host population. Due to insecurity on the main axes around Paoua, humanitarian access remains limited.

In Bria, the protection of civilians remains a challenge in the town and along the axes. Ongoing tensions inside the city and fighting on the Bria-Yalinga axis remain high. The lack of access in this area is a serious problem for the protection monitoring.","UNICEF Central African Republic Humanitarian Situation Report, January 2018",https://reliefweb.int/report/central-african-republic/unicef-central-african-republic-humanitarian-situation-report-5
