,Concerning,Text,Title,URL
8,central+african+republic,"UNITED NATIONS — Mostly Christian militia fighters attacked a U.N. peacekeeping base in the Central African Republic early Tuesday, and one peacekeeper from Mauritania was killed and 11 others were injured in a gunbattle that lasted several hours, the United Nations said.

U.N. spokesman Stephane Dujarric said the attack by the anti-Balaka militias took place at a temporary U.N. peacekeeping base in Tagbara, about 60 miles northeast of the central mining town of Bambari. The peacekeeping mission said more than 22 anti-Balaka fighters died in the clash.

Dujarric said the U.N. peacekeeping mission sent reinforcements to the base, and he strongly condemned the attack.

The U.N. Security Council condemned the attack “in the strongest terms” and reiterated that attacks against peacekeepers may constitute war crimes. Its members called on the Central African Republic government to swiftly investigate the attack and bring the perpetrators to justice.

Separately, Dujarric said, the U.N. mission reported that later Tuesday morning peacekeepers discovered the bodies of 21 civilians, including four women and four children, in Tagbara. The mission said the bodies were found near a church, and the victims had been killed with “traditional weapons.”

The Security Council said it supports an investigation by the U.N. peacekeeping mission to see if the civilian casualties are linked to the attack against the Tagbara base.

Secretary-General Antonio Guterres condemned the attack on peacekeepers and is “outraged” at the killing of the 21 civilians and injuries to 14 other civilians, Dujarric said.

“The secretary-general calls on the Central African Republic authorities to investigate these attacks and quickly bring those responsible to justice,” he said.

In another incident, Dujarric said U.N. peacekeepers were informed Monday evening that a rebel group known as the UPC had detained 23 people in Tagbara, including 13 women, seven men and three children. He said they were released peacefully to U.N. peacekeepers and spent the night at the temporary base to ensure their safety.

The U.N. mission condemned the attacks on civilians and said that “nothing can justify these acts that can be considered war crimes.”

It said an investigation will be carried out that “leaves no possibility for impunity.”

Elsewhere, Dujarric said, U.N. peacekeepers and Central African Republic forces launched a joint operation on Saturday and rescued 15 people who had been taken hostage by the Lord’s Resistance Army rebel group led by Joseph Kony, who is wanted by the International Criminal Court for war crimes.

The LRA has wreaked havoc in central Africa over the years in violent rampages that include the abduction of children. It has taken boys who are then forced to become fighters and girls who become sex slaves, one of the reasons the group has gained international attention in recent times.

The Central African Republic has faced deadly interreligious and intercommunal fighting since 2013, when predominantly Muslim Seleka rebels seized power in the capital, Bangui. Mostly Christian anti-Balaka militias fought back, resulting in thousands of people killed and hundreds of thousands displaced.

The impoverished country saw a period of relative peace in late 2015 and 2016 but violence has intensified and spread in the past year.

Copyright 2018 The Associated Press. All rights reserved. This material may not be published, broadcast, rewritten or redistributed.","1 UN peacekeeper killed, 11 hurt in Central African Republic",https://www.washingtonpost.com/world/africa/1-un-peacekeeper-killed-11-hurt-in-central-african-republic/2018/04/03/d9d04ca4-37a7-11e8-af3c-2123715f78df_story.html
9,central+african+republic,"BODA, Central African Republic — Nina Beina, a widowed mother of 11, couldn’t wait to give me a tour of the land she had just bought. She beamed as she showed me the site where her children will build their homes.

Ms. Beina isn’t a real estate mogul, and like most people here she has no access to banks or formal loans. But she was able to buy the property through a program arising from one of the hot ideas in the global fight against poverty — microsavings. With the help of Catholic Relief Services, an international humanitarian organization, Ms. Beina and her neighbors recently started their own savings group.

The idea is that villagers gather regularly and deposit tiny sums — often less than a dollar — into a pool, which is then lent to a member of the group. The loan is paid back over time, and it is often used to help people start small businesses. For Ms. Beina, the new land for her children will give her more space in her already overcrowded home.

For vulnerable populations, especially women, “it empowers them to save,” said Laura Dills, who oversees a range of Catholic Relief Services’ programming, including the organization’s microfinance efforts. “We’re actually building that capacity to go after loans in a very safe setting that’s not going to risk any of their assets.”",Opinion | Finance Isn’t Just for Fat Cats,https://www.nytimes.com/2018/04/09/opinion/finance-isnt-just-for-fat-cats.html
10,central+african+republic,"It’s a legitimate question that I’ve wondered about over the years. But I’ve come to believe that on the contrary, conserving rhinos or gorillas — or speaking up for tortured farm animals at home — is good for humans, too.

At the broadest level, it’s a mistake to pit sympathy for animals against sympathy for humans. Compassion for other species can also nurture compassion for fellow humans. Empathy isn’t a zero-sum game.

Overseas conservation organizations have also gotten much better at giving local people a stake in the survival of animals. The World Wildlife Fund, which helps manage the Dzanga Sangha Protected Area, supports a health clinic and is starting an education initiative. The refuge hires 240 local people, from rangers to trackers who locate the gorillas and get them habituated to people.

“These efforts are good for us,” said Dieudonné Ngombo, one of the trackers. “We work and get a salary, and then our kids live better and we sleep well.”

Martial Yvon Amolet of the Center for Human Rights of Bayanga, which is supported by the Dzanga Sangha Protected Area, says that the BaAka Pygmies appreciate the conservation efforts “because for BaAka, the end of the forest is the end of their culture and identity.”",Opinion | Choosing Animals Over People?,https://www.nytimes.com/2018/04/07/opinion/sunday/wildlife-central-african-republic.html
11,central+african+republic,"The United Nations says challenges to Mr. Kabila’s rule have caused a collapse of political authority, leading to fighting that has displaced 4.5 million people and left 2 million children severely malnourished. It has declared Congo one of the world’s worst humanitarian emergencies on par with Syria and Yemen.

Photo

To respond to the crisis, the United Nations Office for the Coordination of Humanitarian Assistance organized the donor conference in Geneva on April 13 to make its biggest appeal yet for aid to Congo to provide emergency assistance — including food, sanitation, shelter and education — to more than 13 million people affected by the violence.

Mr. Kita said the calls for assistance are “a demonization campaign.” Congolese officials convened a separate meeting in Geneva with other African officials, asking them denounce the aid effort, according to a diplomat with knowledge of the matter. The other nations did not agree to the request.

Still, diplomats and aid workers say they expect the Congolese government’s opposition to have an effect by making it harder for countries at the conference to agree to donate.

Newsletter Sign Up Continue reading the main story Please verify you're not a robot by clicking the box. Invalid email address. Please re-enter. You must select a newsletter to subscribe to. Sign Up You agree to receive occasional updates and special offers for The New York Times's products and services. Thank you for subscribing. An error has occurred. Please try again later. View all New York Times newsletters.

The United Arab Emirates, a co-host of the conference, has already said it would suspend participation if the Congolese government did not support the appeal. Congo also threatened Swedish and Dutch diplomats who helped convene the donor conference, saying they did not consult with their Congolese counterparts and warning of unspecified consequences if the European nations continued with the conference.

Christos Stylianides, the European Commission’s top crisis envoy, said during a visit to Kinshasa late last month that foreign assistance would be ineffective without local government cooperation. Donor nations have already pledged $171 million.

An appeal for aid last year fell far short of needs, as donors provided less than 60 percent of what aid agencies requested.

Jose Barahona, Congo country director for Oxfam International, said he has witnessed firsthand what the funding shortfall means for the ordinary Congolese. His organization had to halve its assistance last year, when promised donor funds did not materialize.

The people left out felt hopeless, he said. He recalled one of them pointing to the ground and saying: “I have two of my younger sons buried here. Do you want me to bury more sons?’”","Despite Millions of Displaced People, Congo Rejects U.N. Aid Effort",https://www.nytimes.com/2018/04/07/world/africa/congo-kabila-aid.html
12,central+african+republic,"Bangui - The United Nations and Central African Republic forces Sunday launched an operation targeting armed groups in a mainly Muslim district of Bangui in which at least two people were killed and dozens wounded, UN and medical sources said.

Eleven peacekeepers, mostly Egyptian, were among the injured in the joint operation mounted by the United Nations peacekeeping force (Minusca) and the Central African security forces, Minusca spokesperson Herve Verhoosel told AFP.

The operation, which had targeted, the ""bases of certain criminal groups"" would continue ""until the goal is achieved"", Verhoosel said.

Eight people belonging to the armed groups Force and 50/50 had been detained by Minusca and ammunition had been seized, he added.

The operation comes after a resurgence in violence in the flashpoint PK5 neighbourhood of Bangui.

The Central African Republic has been struggling to return to stability since the country exploded into bloodshed after the 2013 overthrow of longtime leader Francois Bozize by the mainly Muslim Seleka rebel alliance.

France intervened militarily to push out the Seleka alliance but the country remains plagued with violence pitting groups competing for control of resources and areas of influence.

KEEP UPDATED on the latest news from around the continent by subscribing to our FREE newsletter, Hello Africa.

FOLLOW News24 Africa on Twitter and Facebook.",2 killed in Central African Republic op to rout armed groups,https://www.news24.com/Africa/News/2-killed-in-central-african-republic-op-to-rout-armed-groups-20180409
13,central+african+republic,"06 April 2018 ILLIA DJADI

World Watch Monitor

A UN official has called for a new approach to end the still-deepening crisis in the Central African Republic.

The situation in CAR has been deteriorating for five years now, and in the next six months may grow even worse, according to the head of the UN’s Office for the Coordination of Humanitarian Affairs (OCHA) in CAR, Joseph Inganji.

Speaking to World Watch Monitor last week, Mr Inganji called on “all actors to sit around the table to have a shared analysis and joint planning, in order to cut the vicious cycle of violence, and respond according to each other and everyone’s mandate”.

Internally displaced people waiting for food in CAR’s north-western town of Bozoum in October, 2017. PICTURE: World Watch Monitor

CAR fell into chaos on 24th March, 2013, when a predominantly Muslim coalition of rebels, known as Séléka, ousted President François Bozizé and took power.

Six months later, in September, 2013, Séléka’s leader, Michel Djotodia, who had proclaimed himself president, disbanded the group and in January, 2014, resigned as President, to be replaced by Catherine Samba-Panza.

Yet during her two-year reign, and that of her successor, Faustin-Archange Touadéra, the conflict continued. More than 14 armed groups are currently active in CAR, together controlling around three quarters of territory.

Recent violence in the eastern village of Séko and its surroundings claimed 46 lives, including that of a priest. Father Joseph Désiré Angbabata, 49, was killed when UPC militants (a Séléka offshoot) stormed his Saint Charles LWANGA parish on 21st March.

Details provided by OCHA revealed that 10 children were among the victims, and as many as 19 villages were burnt down on the 100 kilometres stretch of road between Bambari and Ippy. As a result, thousands fled their homes and are now living three newly built camps, including one within the compound of the Catholic Church in Séko, which alone is housing more than 5,000 people.

Mr Inganji told World Watch Monitor the protection of civilian remains a major concern and that, in the absence of a functioning national army (disbanded in 2013 when Séléka took power), the UN’s Multidimensional Integrated Stabilization Mission in the Central African Republic (MINUSCA) has a key role. However, he said the UN peacekeepers need to change their modus operandi because the conflict has evolved.

“We have seen the fragmentation of armed groups,” he said. “These groups are adopting a guerrilla sort of warfare, while perpetrating gross violations of human rights.”

Mr Injanji said development agencies must address the root causes of the conflict by turning their focus to conflict-resolution, reconciliation, security-sector reform and DDR (disarmament, demobilisation and reinsertion).

He called on aid and development groups and peacekeepers to set “a peace-humanitarian-development nexus”.

The government must also play a key role, he said: “The government has the sovereign responsibility for protection of civilians. That’s why, with the deployment of prefects [administrators] in the remote areas, the FACA [CAR’s armed forces] should be deployed to ensure and reinforce the rule of law.

“Unless we all sit together to have a joint analysis, agreed way forward together with the government, and all actors in the theatre, the situation will continue to deteriorate in the coming days.”

Some 2.5 million people – more than half of CAR’s four million inhabitants – are now in need of humanitarian assistance, the highest per capita caseload globally, according to the UN.

Despite the deepening crisis, humanitarian funding is currently at its “worst” and “lowest” level, says Mr Inganji. So far, only two per cent of the $US515.6 million dollars needed has been funded.

“If we’ve got nothing to provide assistance to the needy people, it means that these people will die because we cannot give them our empty hands,” he said. “People require water and sanitation; they require food; they require medicine, etc.”

The head of OCHA called on donors to step up funding for humanitarian and development needs, before warning: “If nothing is done, the international community will be forced in future to use more resources to address the situation. But if there’s funding for humanitarian – alongside development – actions, CAR will remain a model in the world where other countries can replicate the manner in which a crisis needs to be handled.”

The violence in CAR is often portrayed as a sectarian conflict, but the country’s top three religious leaders – who head up the CAR’s Interfaith Group – say the conflict relates more to land and resource grabbing.

Rev François Ndeckere Nzogbia (right) from CAR’s Evangelical Alliance, during a briefing at the UN Office in Geneva, 20th March 2018. PICTURE: WEA

On 20th March, during a briefing at the UN Office in Geneva, Cardinal Dieudonné Nzapalainga, the Archbishop of the capital Bangui, denounced the “business of war” developed by armed groups in order to continue to exploit the resources of the country.

“Since 2013, children are no longer going to school in some regions,” he said. “Which kind of future are we preparing for this country with a whole generation sacrificed?”

Meanwhile, Imam Omar Kobine Layama, the president of the Islamic Conference in CAR, said “all our efforts remain vain because of the lack of security”.

The imam called on the reinforcement of the state, notably the national army, to accompany the UN peacekeepers already deployed in the country.

Finally, the representative of CAR’s Evangelical Alliance, François Ndeckere Nzogbia, welcomed the contribution of the international community towards the resolution of the crisis in CAR, but said more needs to be done: “We need to be supported strongly in order to stop the acts of these warlords and criminals, who continue to kill central Africans on a daily basis. But unfortunately the echo is not raised loud enough to enable the world to know that somewhere in that world, men and women continue to be killed cowardly.”

The Geneva briefing was organised jointly by the World Evangelical Alliance and the Catholic charity Caritas International.

It was also attended by various key stakeholders, including the UN Independent Expert on the situation of human rights in the Central African Republic, Marie-Thérèse Keita Bocoum, who stressed the key role of the religious leaders: “I want to insist on the importance of interreligious dialogue, which will enable each locality of CAR to move forward to listening, forgiveness and reconciliation.”","AFRICA: FIVE YEARS ON, CENTRAL AFRICAN REPUBLIC CRISIS DEEPENS",https://www.sightmagazine.com.au/features/9097-africa-five-years-on-central-african-republic-crisis-deepens
14,central+african+republic,"Sébastien Jagla, MSF project coordinator in the north of Democratic Republic of Congo, describes the challenges to provide humanitarian assistance to Central African refugees, constantly on the move between two places and with no real home.

“Refugees from the Central African Republic (CAR) in the north of the Democratic Republic of Congo (DRC) can be invisible at times. Since mid-2017, tens of thousands have fled a brutal conflict and settled over the last months on the other side of the Ubangi river, in the Congolese districts of Gbadolite and Mobayi-Mbongo. The current number of refugees stands at approximately 42,000, fewer than the approximately 67,000 at the peak of the displacement some months ago.

It is difficult to trace them. Many are still looking after their fields and remaining properties just a few kilometres away and they go back sporadically to look for food and subsistence. They are constantly on the move, living in uncertainty as part time-refugees and part-time returnees, without really benefitting from either status and being subjected to violence and harassment by different parties on both sides of the river.

Mixing with the local communities

Some have managed to blend into the local communities or to live next to them in small settlements in villages and towns across the riverine Congolese border. They have built their own shelters: usually wooden huts. This allows them to fish and farm while remaining close to their country of origin. However, sometimes difficulties arise when accessing the existing resources and basic services.

Central African refugees in these areas are somewhat removed from the camps where humanitarian assistance from the DRC authorities and UNHCR is concentrated. They are also more difficult to access for the few aid organisations present in a remote region where logistics pose big challenges to intervening in a crisis which, on top of this, has not raised much attention.

Risky crossings

Many of the refugees continue to periodically cross over into CAR despite often facing violence by armed groups on the way or upon their temporary return to the country. As one refugee explained to us, some militiamen cut him with a machete because he went back to collect some remaining coffee harvest. The armed men argued that the refugee man was no longer entitled to harvest since he had chosen to live on the other side of the river.

Other refugees have spoken of similar accounts about their return journeys, but also stories of disputes with local Congolese people when accessing water points or dividing the manioc harvests they were allowed to collect for the benefit of both communities.

Carl Theunis/MSF Since May 2017, dozens of thousands of refugees from the Central African Republic have arrived to the towns of Gbadolite and Mobayi-Mbongo and to the rural area along the Ubangi River of the Democratic Republic of Congo after fleeing conflict in their country.

These daily tensions and, more importantly, the risky returns to an obviously unsafe place, would probably be less prevalent if there were proper humanitarian assistance in place, but what we have seen over the past six months of intervention is that these crossings have become common practice, while the crisis has not managed to raise any kind of awareness.

While this may not be an emergency in terms of mortality and child malnutrition levels, our fixed and mobile teams have observed prevalent severe diseases, with malaria, diarrhoea and respiratory tract infections being the most common, a usual pattern in displacement crises. Our teams see very vulnerable people who deserve attention in a context in which the already limited health system and basic services have become clearly overstretched, consequently affecting the host community as well. The lack of visibility and knowledge of this vulnerable population undermines the capacity to address their needs.”

MSF worked between mid-September 2017 and the end of March 2018 supporting two hospitals and nine health centres in the northern Congolese districts of Gbadolite and Mobayi-Mbongo and running mobile clinics for both refugees and the host community.

Teams provided more than 38,600 medical consultations, admitted 3,970 inpatients, treated nearly 2,000 children under five for malnutrition and vaccinated 20,000 children for measles as part of a vaccination campaign against a range of other diseases. Its logistical teams have also helped to improve water and sanitation conditions by constructing 13 boreholes and rehabilitating other water sources.

The intervention has now been handed over to the Ministry of Health after some staff received training, while MSF keeps a surveillance system in Nord-Ubangi province in order to be ready to intervene should an emergency develop.

Since May 2017, MSF has also been providing medical care in the village of Ndu, east of Gbadolite, to more than 12,000 refugees from the Central African city of Bangassou. After an attack on its staff last November, MSF suspended its activities in Bangassou but continues to provide remote support to CAR refugees in Ndu.",CAR/DRC: Lives split over the Congolese border,http://www.msf.org/en/article/cardrc-lives-split-over-congolese-border
