,Concerning,Text,Title,URL
12,central+african+republic,"Funding required: $25.27 B

Funding received: $6.26 B

Funding percentage: 24.8%

People in need: 130.6 M

People to receive aid: 95.3 M

Countries affected: 40

As of April 2018, UN-coordinated Humanitarian Response Plans (HRPs) and the Syria 3RP Regional Refugee and Resilience Plan require US$25.27 billion to meet the humanitarian needs of 95.3 million crisis-affected people in 26 countries.

Three significant humanitarian resource mobilization events took place in April: the High-Level Pledging Event for the Humanitarian Crisis in Yemen, 3 April, Geneva, co-hosted by the UN, Sweden and Switzerland, where US$2.01 billion in contributions for 2018 were announced by 40 entities and a further $20.2 million were announced in multi-year funding; the Humanitarian Conference on the Democratic Republic of the Congo, 13 April, co-hosted in Geneva by the UN, the Netherlands and the EU, where $528.1 million were pledged by 22 donors for 2018 and a further $38.7 million for 2019-2020; and the Supporting the Future of Syria and the Region Brussels II Conference, 24-25 April, co-hosted by the UN and the EU. This drew 36 announcements of humanitarian funding totalling $4.4 billion for 2018 and an additional $3.4 billion for 2019-2020.

The humanitarian funding outlook for the protracted, entrenched humanitarian crisis in DPRK is particularly concerning, with a persistent risk that geo-political tension – even with the recent positive developments – could dampen funding. 10.3 million people in DPRK are estimated to be undernourished. More than one-quarter of children are stunted and 4% wasted, while about 30% of women of reproductive age are anaemic. The lack of safe water and the poor sanitation contribute to high levels of diarrhoea, pneumonia and malnutrition, which are the most common causes of death among young children. The 2018 Needs and Priorities Plan released in April calls for $111 million to provide food assistance, health and nutrition services and improved access to safe water and sanitation for 6 million highly vulnerable people.

On 20 April, the Resident and Humanitarian Coordinator in Ukraine briefed Member States in New York on the dire humanitarian situation faced by 4.4 million conflict-affected people after four years of conflict in eastern Ukraine.

Disrupted access to critical facilities and diminished livelihoods mean that 3.4 million people are without basic supplies and services and need protection and life-saving assistance. Ukraine has the highest proportion of elderly people affected by humanitarian crisis in the world. Some 1.5 million Ukrainians have been displaced across the country, and some 200,000 live in daily fear of shelling. Funding for the HRP is urgently needed.

In 2018, as many as 7 million people in South Sudan need humanitarian assistance to cope with unprecedented levels of food insecurity and grave protection violations including conflict-related sexual violence. This is the world’s third largest refugee crisis: more than 4.2 million people have been displaced, including 1.8 million IDPs and more than 2.4 million refugees.

Severe food insecurity continues to rise as people are unable to plant or harvest and have limited access to humanitarian assistance. With the lean season beginning in May, urgent funding is required to save lives and resources. On 27 April, the DSRSG/RC/HC for South Sudan formally invited the USG to support him in delivering three key messages when he visits the country in mid-May. Namely, calling for a sustainable political solution to the conflict to bring an end to the humanitarian crisis, with IGAD-led peace talks expected to resume in May; urging parties to the conflict, including the numerous splinter groups, to address the insecurity that affects civilians and aid workers; and advocating for resources towards the HRP which is currently funded at 21%.

Humanitarian needs in the Central African Republic have increased from 2.2 million people in need in early 2017 to 2.5 million this year, with a multiplication of hotspots. The spike in tensions and armed violence that erupted in April is also affecting the capital, Bangui. Over the first quarter of 2018, the number of internally displaced people increased by 70% over the first quarter of 2017, and the number of refugees increased by 30%; effectively, 25% of Central Africans are currently displaced either as IDPs or refugees. Underfunding remains one of the biggest impediments to stepping up the humanitarian response. By end April 2018 the HRP had received less than 10 per cent of its $515.6 million requirements.

By 30 April, 21 donors had contributed a combined $278 million (including pledges) to 17 country-based pooled funds (CBPFs), which translated into financial support for 308 humanitarian projects implemented by 229 partners. These included international NGOs which received $55.3 million (42% of total budget allocations) while UN agencies received $42.6 million (32% of allocations). Support to national NGOs included $33.6 million (25% of allocations) and to the Red Cross / Crescent movement $0.6 million (0.5% of total allocations). The largest amounts were channelled to Yemen ($77.9 million), the whole of Syria response ($41.7 million), Sudan ($28.2 million) and the Democratic Republic of the Congo ($26.5 million). New reserve allocations were launched by the Ethiopia Humanitarian Fund (HF) for $16.2 million and by the occupied Palestinian territories HF for $2.2 million, on top of its first standard allocation of the year for $3.9 million, to respond to immediate health and protection needs in the Gaza Strip. The Turkey HF launched a second reserve allocation for $4 million to cover urgent life-saving needs of people displaced inside besieged and hard-to-reach areas in Syria.",2018 Humanitarian Funding Update (as of April 2018),https://reliefweb.int/report/world/2018-humanitarian-funding-update-april-2018
13,central+african+republic,"CENTRAL AFRICAN REPUBLIC

AID CONVOY UNDER ATTACK NEAR KAGA BANDORO

Armed men on 23 April robbed a vehicle in an aid convoy near the northern Kaga Bandoro town, but were later intercepted some 100km away. Insecurity remains prevalent in several regions of CAR and aid convoys are the target of robberies and armed attacks. These incidents are a constant hindrance to relief operations and civilian movement and safety.

MALI

AID WORKERS FACE RECURRENT ATTACKS IN TIMBUKTU REGION

On 22 April, three unidentified armed men robbed aid workers in their accommodation in the town of Gossi, in the northern Timbuktu region. The assailants then looted the premises of the NGO these aid workers belong to, after firing at the guard, who managed to escape. The armed robbers stole motorcycles, phones and computers. This is the fifth incident in Gossi area since the beginning of the year. Earlier, on 19 April assailants attacked four aid workers near Gossi and robbed one of their vehicles. The incident forced an international NGO that recently launched mobile clinic consultations for new IDPs and asylum seekers to suspend the activity.

NIGERIA

MAIDUGURI SHAKEN BY WORST ATTACK IN MONTHS

On 26 April, a Non-State Armed Group launched a multi-pronged attack on Born state capital, Maiduguri, triggering panic among the population and causing residents to flee. Reports indicate that blasts and gunfire could be heard across the city as the raid was carried out, reportedly, by around 100 attackers, including suicide bombers. The military repelled the attack and encouraged residents to return home. The incident is amongst the most significant in recent months, amid a worrying increase in security incidents in Borno state. Maiduguri is at the epicentre of the humanitarian crisis in the north-east of Nigeria and currently hosts over 260,000 internally displaced persons.

NIGER

MENINGITIS CASES MORE THAN DOUBLE IN TWO WEEK

As of 22 April, 930 cases of meningitis, including 70 deaths, were reported with a fatality rate of 7.5 per cent. The number of reported cases has doubled over two weeks. However, they are lower than in the same period in 2017 (2,587 cases and 117 deaths). The health district of Keita in Tahoua region has reached the epidemic threshold, and four other health districts in the Maradi, Tahoua and Tillabéri regions are in alert phase. Epidemiological surveillance, pre-positioning of medical supplies and a vaccination campaign targeting people between 2 and 29 years of age are all ongoing.

HUMANITARIAN AID IMPEDED BY MILITARY OPERATIONS

The ongoing military offensive by the Joint Multinational Task Force (MNJTF) against armed groups presumably affiliated with Boko Haram on the islands of Lake Chad and areas along the Komadougou river is restricting humanitarian operations in the area. Planned missions to Bosso as well as a vaccination campaign and mobile clinics were cancelled.

DR CONGO

NEARLY 12,000 CHILDREN RISK MISSING MAJOR EXAM

Some 12,000 children are at risk of not sitting their end of primary school cycle exams due to the violence in Djugu Territory, in the northeastern Ituri province, which has forced them to miss school since December 2017.

The Education Cluster is in talks with the Ministry of Education for solutions to allow these children to pass the exam. It is estimated that 50 of the 511 schools in Djugu are occupied by internally displaced people, disrupting classes for 16,000 students.",West and Central Africa: Weekly Regional Humanitarian Snapshot (24 - 30 April 2018),https://reliefweb.int/report/central-african-republic/west-and-central-africa-weekly-regional-humanitarian-snapshot-24-1
14,central+african+republic,"“There is no justification for incitement to violence or hate speech,” said the Secretary-General in a statement attributable to his spokesperson.

At least 22 people have been killed and over 100 injured in clashes, which erupted following the arrest of a member of a criminal group by CAR’s security forces.

In the ensuing violence, a church was attacked and a pastor killed. Two members of the UN Multidimensional Integrated Stabilization Mission in the country, known by its French acronym MINUSCA, were also wounded – one seriously – when they were pelted with stones by a crowd.

In the statement, the UN chief also called on the national authorities to investigate the attacks and promptly bring those responsible to justice.

He reaffirmed his support to the country and to MINUSCA’s role to protect civilians and stabilize the country.

The CAR has been plagued by decades of instability and fighting Clashes between the mainly Muslim Séléka rebel coalition and anti-Balaka militia, which are mostly Christian, plunged the country into civil conflict in 2012.

A peace agreement was reached in January 2013, but rebels seized the capital, Bangui, in March of that year, forcing President François Bozizé to flee.

Concerned with the security, humanitarian, human rights and political crisis in the CAR and its regional implications, the Security Council authorized the deployment of MINUSCA in 2014 with the protection of civilians as its utmost priority.

A transitional government has since been established and entrusted with restoring peace. The conflict, however, has taken on increasingly sectarian overtones as the anti-Balaka movement has taken up arms and inter-communal clashes have erupted sporadically in and around Bangui and elsewhere in the country.",UN chief condemns violence in Central African Republic capital Bangui,https://news.un.org/en/story/2018/05/1008812
15,central+african+republic,"This story appears in VICE magazine's Dystopia and Utopia Issue.

As wind whips through an open cockpit, the bush plane banks eastward above the red earth of central Africa. Columns of black smoke tower on the horizon—the calling card of armed cattle herders. The dry season is their time to escape the arid Sahel in search of pasture for their enormous droves—burning forest and poaching wildlife along the way. But they are not the only intruders. A bullet hole in the plane’s wing from a guerrilla’s potshot is a reminder that the Lord’s Resistance Army (LRA) still operates in these badlands, where war is again intensifying. The pilot, Cédric Ganière, peers into the hot, darkening haze. “There is nothing romantic about this,” he says. “They are destroying a country that isn’t theirs. The fox is in the middle of the chickens. It is just kill, kill, kill.”

This is the front line in the battle to save Chinko—one of the largest intact wildernesses in the heart of Africa. The reserve, deep in a remote corner of the war-torn Central African Republic (CAR), lies near borders with Congo and South Sudan. Sitting on an ancient volcanic plateau, the area supports an extraordinary mix of species thanks to a fusion of Congolian rainforest and wooded savannah, nourished by underground wells that feed an expansive network of waterways. This patchwork has created a vital paradise, home to hundreds of bird species and imperiled populations of megafauna—lion and leopard, chimpanzee and antelope, hippo and buffalo, wild dog and golden cat. Devoid of human habitation, it is one of the last holdouts for the country’s endangered elephant population.

But this enchanted Eden is under siege. A protracted civil war is escalating in the region—a brutal and forgotten conflict that has prompted warnings of genocide from the UN. Militarized poacher units have plundered the park to feed the lucrative, insatiable demand for bushmeat, ivory, animal skin, and traditional medicine. Miners illegally dredge riverbeds for diamonds and gold. And the slash-and-burn tactics of nomadic herders, who kill game to supplement their meager rations and salary, threaten a fragile ecosystem.

Within this maelstrom, a group of conservationists is fighting to protect Chinko. Leading this resistance is David Simpson, a charismatic 30-year-old and the park’s manager. His hunger for adventure led him to quit his factory job in the United Kingdom and move to the wilds of central Africa to work for a big-game hunting firm before transforming the area into a unique sanctuary.

Covering an area almost twice the size of Yellowstone, Chinko has since become a mini-state within a failed nation-state. The biggest employer outside the capital of Bangui, Chinko hires hundreds of locals (including reformed poachers) as rangers, builders, farmers, mechanics, and medics. But the park’s survival hangs on the fate of a chronically unstable region. Renewed conflict could wipe out everything Simpson and his cadre are dedicated to protecting.

***

High above the smoldering bush, Ganière calls the control room where NASA-made software plots each blaze on a Google Earth map. This nerve center and two small aircraft are Chinko’s eyes. Units of armed, camouflaged rangers below: its fist.

The tiny plane drops into a gut-wrenching turn toward base. On landing, Ganière spots Simpson, near the dirt airstrip chatting with a group of workers in Sango, the local language. This is a rarity for munju, or white foreigners, who, at best, typically learn a couple of phrases, then opt for French, the tongue of the country’s despised former colonial master.",Eden Under Siege: Saving a Pristine Wilderness from Militarized Poachers and a Humanitarian Crisis,https://pulitzercenter.org/reporting/eden-under-siege-saving-pristine-wilderness-militarized-poachers-and-humanitarian-crisis
