,Concerning,Text,Title,URL
5,central+african+republic,"2017 IN REVIEW

HUMANITARIAN CONTEXT

Humanitarian situation in 2017

The year 2017 was characterized by a series of crises that has led to an unprecedented increase in humanitarian needs since 2014. It also raises the risk of a return to a major humanitarian crisis. While the 2017 Humanitarian Response Plan initially targeted to 2.2 million people in need of humanitarian assistance, the humanitarian community was forced to revise it in June 2017 to meet the needs of 2.4 million people. Of the 402,240 displaced in January, the Central African Republic registered 600,000 as of July 31, 2017, as much as in August 2014. This trend continued and reached the 688,700 at the end of December, representing 71 per cent increase in one year. At the same time, 545,497 Central Africans sought refuge in neighbouring countries, while the trend was to return in early 2017. Today, 1.1 million people or 1 out of 4 Central Africans are internally displaced or refugees.

This increase was the result of the resurgence of violence and the multiplication of hotspots across the country. Some areas previously known as islands of relative stability have shifted into violence and others that tended to return to calm have fallen back into instability. Growing insecurity due to activism of armed groups has increased tensions and heightened the vulnerability of communities already affected by the ongoing humanitarian crisis, forcing thousands of people to leave their homes and seek protection – often around MINUSCA bases and bigger agglomerations – throughout the country.

Impact of violence on humanitarian activities

2017 has also been one of the deadliest years for humanitarians. Security incidents involving aid workers have increased considerably (332 in 2017 against 131 in 2016), placing the Central African Republic among the most dangerous countries in the world. Fourteen humanitarian workers lost their lives in 2017 (6 in 2016). The multiple peaks of violence have also forced humanitarian workers to temporarily suspend their activities on several occasions, and sometimes to relocate their teams. The United Nations Humanitarian Air Service (UNHAS) relocated 297 humanitarian actors from 29 organizations on 23 occasions.

These suspensions, driven by unprecedented levels of insecurity since 2013, have exacerbated the vulnerability of thousands of people whose survival depends heavily on humanitarian assistance. In Bangassou the majority of humanitarian actors had to suspend their activities and withdraw their permanent presence from the city. The same goes for the city of Batangafo (Ouham Prefecture) where humanitarian actors have been trying to return since early December after the majority of them had to withdraw in September. At 60 kilometers from Batangafo, in the city of Kabo, in December 2017, the cessation of humanitarian activities directly or indirectly affected approximately 100,000 people, including displaced persons.

Restriction of humanitarian access

The reduction of humanitarian space was the result of several factors, including the deterioration of the security situation and the deterioration of road infrastructure throughout the country. Access to certain areas required large-scale logistical and operational resources that were partly lacking for a humanitarian community faced with the growing challenge of underfunding. The increased use of air assets for the delivery of humanitarian assistance was necessary to reach remote populations. Despite these significant constraints, humanitarian workers were able to deliver more than 6,700 tons of humanitarian assistance cargo, by road and by air, from January to September 2017. Despite its prohibitive price, several times, the actors had to give priority to the air route to help the populations inaccessible by terrestrial means and more and more isolated.

Underfunded humanitarian crisis

The Central African Republic is one of the few countries in the world where half of the population needs humanitarian assistance. Adequate funding of humanitarian action was therefore a top priority. However, by the end of 2017, only 39 per cent of the $ 497 million Humanitarian Response Plan was funded of which $22.1 million (11.5% of the 2017 HRP funding) channeled through the CAR HF. Despite this deficit, the humanitarian community was able to provide emergency assistance to more than one million vulnerable people. Over the last years, funding levels have steadily declined from 68 per cent in 2014 (right after the December 2013 outbreak), to 39 per cent in 2017. In this context of chronic humanitarian underfunding, recovery funds were also slow to be materialized on the ground. Surveys in the affected areas revealed alarming socio-economic indicators signs at the end of 2017. The number of people in need of humanitarian assistance was estimated at 2.5 million (54%) out of a population of 4.6 million. The overall socio-economic situation of the country is alarming with: 70% of households having no access to potable water, 80 per cent without latrines, 50 per cent in need of food assistance, 20 per cent of schools closed depriving around 70,000 children of education, and an average acute malnutrition rate reaching the emergency threshold of 15 per cent in six health sub-prefectures of the country. The ability of humanitarian actors to respond to critical and urgent needs has been hampered. Regrettably, the needs continued to grow over the years aggravating dangerously the vulnerability of those already affected by the crisis.",Central African Republic Humanitarian Fund - Annual Report 2017,https://reliefweb.int/report/central-african-republic/central-african-republic-humanitarian-fund-annual-report-2017
6,central+african+republic,"CENTRAL AFRICAN REPUBLIC

AID WORKER ATTACKS THREATEN ACCESS

Armed men on 11 April attacked and seized an aid worker near Kouango town in the southern Ouaka prefecture. The aid worker was released, but his belongings were taken. A week earlier, gunmen abducted a driver with an international aid group also near Kouango. The attacks risk affecting humanitarian access in the area. Efforts are underway to sensitise on the neutrality of humanitarian workers.

CHAD

FIRST GROUP OF SUDANESE REFUGEES RETURN HOME

The first group of Sudanese refugees willing to return home left on 14 April. Fifty-three people were repatriated under the terms of a May 2017 agreement between Chad, Sudan and UNHCR on voluntary refugee return. More than 329,000 Sudanese have been living in eastern Chad for over a decade.

Many are unwilling to return due to persistent insecurity back home. Meanwhile, around 4,000 Chadians in Darfur have returned home since December 2017.

MALI

CLASHES FORCE 3,000 TO FLEE TO BURKINA FASO

Since February, intercommunity clashes have forced around 3,000 people – mainly from Koro locality in Mali’s northern Gao region – to flee to Burkina Faso. The clashes between Dogon and Peul communities have also claimed several lives. The new arrivals add to some 24,000 Malian refugees who have found refuge in Burkina Faso since the eruption of conflict in Mali in 2012. The new arrivals living in makeshift shelters are to be relocated to safer areas. The refugees urgently need basic relief items and long-term support, especially the youth. Rising intercommunal tension has also been reported around the Mali - Niger border following the 11 April abduction of a German aid worker in Niger.

NIGER

MENINGITIS AT ALERT LEVEL IN FOUR HEALTH DISTRICTS

On 16 April, health authorities announced that four health districts in Maradi, Tahoua and Zinder regions had reached the meningitis alert threshold, meaning five cases per 100,000 people per week. While no health district has reached the epidemic threshold (10 cases per 100,000), several health centres in Maradi and Tahoua regions have reached the epidemic levels. Health authorities have enough medicines for over 4,000 patients. A vaccination campaign targeting people between two and 29 years old is being organised. In 2017, Niger recorded 3,506 cases of meningitis, causing 232 deaths.

NIGERIA

VIOLENCE FORCES 300,000 CHILDREN FROM SCHOOL

More than 300,000 children have been forced from schools due to persistent farmerherder clashes in Benue state, the state’s top education official said on 17 April. Several primary schools in the four worst-hit localities have either been burned or occupied by armed herders. In some localities schools are now hosting displaced people. With a daily influx of displaced people into camps, there are hardly any spaces to set up learning areas for children. Clashes and killings continue to escalate in the north-central region, particularly in Benue and Nasarawa states with more than 50 people killed recently.",West and Central Africa: Weekly Regional Humanitarian Snapshot (17 - 23 April 2018),https://reliefweb.int/report/central-african-republic/west-and-central-africa-weekly-regional-humanitarian-snapshot-17-1
7,central+african+republic,"Highlights

• On 25 February, six education workers, including a UNICEF education consultant, were killed near Markounda while travelling to conduct a training for com-munity teachers.

• UNICEF RRM partner Solidarités International organized in Nana Gribizi prefecture the mechanism’s first non-food items (NFI) fair, allowing 648 households recently returned in their villages to choose items that met their specific needs.

• Despite growing tensions in Mbomou prefecture, 211 displaced children (89 girls) from the Petit Séminaire IDP site in Bangassou had free access to the Sisters Private Elementary School, supported by UNICEF.

SITUATION IN NUMBERS

1.3 million # of children in need of humanitarian assistance

2.5 million # of people in need (OCHA, February 2018)

693,932 # of Internally displaced persons (OCHA, February 2018)

Outside CAR

546,000 # of registered CAR refugees (OCHA, February 2018)

UNICEF Appeal 2018 US$ 56.5 million

Situation Overview & Humanitarian Needs

Several attacks and robberies against humanitarian partners were committed by armed groups, limiting humanitarian access and assistance to the most vulnerable. On 25 February, six education workers, including a UNICEF consultant, were murdered near Markounda, a remote area near the Chadian border while travelling to start a training for community teachers. Following the attack, UNICEF supported its partners to restart education activities and provided them (NGOs and members of the Ministry of Education) with psychosocial support.

In Paoua, 76,238 people having fled the surrounding rural areas are displaced in town, which has a population of about 40,000. Even though USD 2 million were allocated for the Paoua emergency response through the Humanitarian Fund, this will not be sufficient to cover even the most urgent needs. The burden of the displaced population on the host community is already a source of tensions, and may lead to conflict. The approaching rainy season could exacerbate the already poor sanitation conditions. The lack of access to the fields due to insecurity during the growing season increases the risks of food insecurity in the coming months. Thanks to joint efforts, education authorities, partners and UNICEF supported the continuation of normal school activities in the 11 schools in Paoua. The integration of displaced children into schools is ongoing with 5,123 displaced pupils (1,941 girls) attending school. 15 unaccompanied children (NA) were reunited with their families.

In Bangassou, the security situation remained volatile. For months, armed groups have prohibited neighboring residents to bring regular supply to the Petit Séminaire IDP site. Joint advocacy activities conducted towards armed groups by UNICEF’s partner Enfants Sans Frontières and Sisters from the Catholic Church allowed the population to have access to the IDP site and sell various essential items. 211 displaced children (89 girls and 122 boys) from the Petit Séminaire IDP site now have free access for the rest of the year to the Sisters' private primary school, with UNICEF support. However, no solution has been found yet to reintegrate the 108 high school students living in this site.","UNICEF Central African Republic Humanitarian Situation Report, February 2018",https://reliefweb.int/report/central-african-republic/unicef-central-african-republic-humanitarian-situation-report-9
8,central+african+republic,"BANGUI, Central African Republic — A priest was among at least 16 people killed Tuesday as new sectarian violence targeted a church, mosques and health facilities in Central African Republic’s capital, an aid group, hospital and the United Nations said.

Medecins Sans Frontieres, which reported six dead, called for calm after some Bangui residents threatened the SICA hospital, where some of the more than 50 people shot and wounded were being treated.

Medical workers have a duty to treat people “regardless of their background, religious or political affiliations,” Anne-Marie Boyeldieu, MSF’s head of mission in Central African Republic, said.

Anger has been high among some in the capital since U.N. peacekeeping mission and local security forces launched a joint operation in the largely Muslim neighborhood of PK5 in early April to arrest members of armed criminal groups after their leaders refused to disarm. The dead bodies of 17 civilians were laid in front of the U.N. peacekeeping offices shortly afterward.

Tuesday’s violence erupted in the PK5 and Fatima neighborhoods, MSF said.

Armed groups are suspected of carrying out the attacks, but citizens fed up with violence are making their anger known in other ways. Residents brought the bodies of the priest and some of the other people killed to the presidential Renaissance Palace. Members of the Presidential Guard dispersed the crowd by firing shots in the air.

In the Lakwanga district, a group of young people ransacked a mosque that had just been rehabilitated as part of a social cohesion project.

At least 10 bodies were brought to the community hospital morgue Tuesday, the head of the facility said. He spoke on condition of anonymity because he was not permitted to speak to the press.

The Catholic St. Joseph Movement, an action group, confirmed that there were 10 dead in addition to the six reported by MSF.

The U.N.’s humanitarian coordinator for Central African Republic, Najat Rochdi, said the people killed included Abbot Albert Tougoumale-Baba, a fervent defender of a non-aggression accord that allowed Muslims to hold burial ceremonies in accordance with their religions.

Tougoumale-Baba’s church in Fatima was attacked, Rochdi said, along with other places of worship, including mosques.

“Once again it is the civilian population, especially women and children, who pay the price of violence,” Rochdi said, calling on women to raise their voices against the recruiting of youth as fighters.

David Brownstein, chargé d’affaires at the U.S. Embassy in Bangui, condemned the killings as a “cowardly and violent act.” He called for “calm and the cessation of revenge” attacks, which he said would only perpetuate the cycle of violence.

Bangui Mayor Emile Gros Raymond Nakombo appealed to communities to recognize such violence “is the work of those who do not want peace to return to the country.”

Deeply impoverished Central African Republican has faced deadly interreligious and intercommunal fighting since 2013, when predominantly Muslim Seleka rebels seized power in Bangui. Mostly Christian anti-Balaka militias fought back, resulting in thousands of people killed and hundreds of thousands displaced.

A period of relative peace followed in late 2015 and 2016, but violence has intensified and spread in the past year.

___

Petesch reported from Dakar, Senegal.

___

Follow Africa news at https://twitter.com/AP_Africa

Copyright 2018 The Associated Press. All rights reserved. This material may not be published, broadcast, rewritten or redistributed.",16 dead as fighting strikes Central African Republic capital,https://www.washingtonpost.com/world/africa/6-dead-in-new-fighting-in-central-african-republics-capital/2018/05/01/d6691a38-4d59-11e8-85c1-9326c4511033_story.html
9,central+african+republic,"CENTRAL AFRICAN REPUBLIC

TENSIONS HAMPER HUMANITARIAN MOVEMENTS

Humanitarian movements to and within several towns were disrupted following the 10 April crackdown by UN peacekeepers on armed vigilantes in the capital Bangui. The crackdown prompted sympathetic armed groups to urge retaliation against the UN mission. Armed groups also warned aid workers in some towns against venturing out. At least 145 people and eight peacekeepers were wounded and 31 others, including a peacekeeper, were killed in the skirmishes in Bangui’s PK5 neighbourhood.

DR CONGO

DONORS PLEDGE $528 MILLION FOR RELIEF RESPONSE

Donors pledged US$528 million during the first-ever humanitarian donor conference for the DRC held on 13 April. The conference was organised by the European Union, the Netherlands and OCHA to raise funds to address the deteriorating humanitarian emergency in the country. $1.68 billion are required to assist some 13 million people in country – nearly twice as many as in 2017. The humanitarian situation has drastically worsened over the last year. A surge of violence in 2017 uprooted hundreds of thousands of people and significantly heightened humanitarian needs.

MALI

AID WORKERS HIT BY A SERIES OF ROBBERIES

Armed individuals on 11 April robbed a vehicle rented by an NGO in Tessit area of the northern Gao region. Another NGO vehicle was robbed on the same day in Timbuktu region. Two days earlier, a UN 4x4 vehicle was stolen near the common UN compound in Gao. In a separate incident, robbers made away with two vehicles belonging to an international aid group in Douentza, Mopti region. On 8 April, another vehicle belonging to an international NGO was stolen in Gao. No injuries were reported in the incidents which are now frequent.

NIGER

HUMANITARIAN WORKER KIDNAPPED

Armed men on 11 April kidnapped an aid worker in Ayorou area in the western Tillaberi region near the border with Mali. He was seized by gunmen on motorcycles while on his way back from a field mission with colleagues. The incident prompted a 48-hour suspension of all humanitarian activities in Tillaberi. According to media reports, the aid worker – a German national – has likely been taken across the border to Mali. Niger’s western Tahoua and Tillaberi regions have been hit by several armed attacks that have forced more than 8,000 people to flee their homes. In October 2016, gunmen seized an American aid worker in Tahoua. His whereabouts and condition remain unknown

NIGERIA

OVER 1,000 CHILDREN ABDUCTED SINCE 2013

More than a thousand children have been abducted by armed groups in north-east Nigeria since 2013, UNICEF reported on 13 April, calling for the release of kidnapped children and an end to attacks on schools. On 19 February, over 100 girls were abducted from their school in Dapchi area in Yobe State, but freed weeks later. UNICEF said that 2,295 teachers have been killed and more than 1,400 schools destroyed over the past nine years in north-east Nigeria. Most of the schools have not reopened because of extensive damage or insecurity.",West and Central Africa: Weekly Regional Humanitarian Snapshot (10 - 16 April 2018),https://reliefweb.int/report/central-african-republic/west-and-central-africa-weekly-regional-humanitarian-snapshot-10-1
10,central+african+republic,"Bangui, 1 May 2018 – The Humanitarian Coordinator in the Central African Republic, Najat Rochdi, condemns in the strongest terms possible the new wave of violence that was witnessed in Bangui today.

Acts of utter cowardice led to the deaths of several civilians, including a catholic Father Albert Tougoumalé-Baba following the attack on the Fatima Church in the 6th district of Bangui, while presiding over a mass to mark the St Joseph Day.

“I am shocked by the death of Father Tougoumalé-Baba who was one of the defenders of the Boeing Pact of Non-Aggression,” said Najat Rochdi. This pact enabled the Muslim community in the surrounding neighborhoods to give their dead a befitting burial according to the precepts of Islam. The Humanitarian Coordinator also regrets that today’s violence has taken on a religious dimension ignoring the respect due to places of worship, including churches and mosques.

The Humanitarian Coordinator deplores the threats on health structures and their staff members.

Najat Rochdi reminds that it is contrary to International Humanitarian Law and calls on “the sons and daughters of the Central African Republic to put the future of the country above all other considerations”. She also requests them to respect the humanitarian character of the health structures in accordance with international law.

“Once again, it is the civilian population, especially women and children, who are paying the price for violence,” said Rochdi. The Humanitarian Coordinator calls on “Central African women to raise their voices against the manipulation of young people and to defend peace”.

Najat Rochdi wishes a speedy recovery to the wounded and offers her deepest condolences to the families and people of the Central African Republic for the losses of civilians. The humanitarian community reiterates its full readiness to provide assistance to the affected communities without distinction.",Humanitarian Coordinator condemns latest violence in Bangui,https://reliefweb.int/report/central-african-republic/humanitarian-coordinator-condemns-latest-violence-bangui
11,central+african+republic,"BURKINA FASO

AID ORGANISATION DRIVER REPORTED MISSING

A Burkina Faso Red Cross driver was reported missing on 3 May in the northern Soum province. The driver had been travelling between Djibo and Arbinda towns. His vehicle has also gone missing. Humanitarian access has been significantly hampered in Burkina Faso’s northern region since November 2017 due to armed attacks and military operations. More than 950,000 people, a third of them in the northern Sahel region, require urgent relief assistance across the country.

CENTRAL AFRICAN REPUBLIC

BANGUI UNREST RESTRICTS HUMANITARIAN MOVEMENT

On 4 May, UN and NGO staff restricted staff movement in the capital Bangui during a protest called to desert the city following the killing of 24 people in a violent attack three days earlier. Protesters barricaded main roads and most people stayed away from the city. Aid organisations are still facing difficulties providing emergency assistance such as ferrying injured people to hospitals due to the presence of armed elements. The unrest has also forced some people to flee for safety elsewhere.

DR CONGO

HEAVY RAINS LEAVE OVER 9,000 HOMELESS

Torrential rains over the past two weeks in Uvira in the eastern South Kivu province have left more than 9,000 people homeless and destroyed at least 6,500 houses. Several schools and health centres have been flooded. In total, around 32,000 people have been affected. Basic household items, shelter, water, health, sanitation and hygiene assistance are the urgent needs.

MALI

IED KILLS FOUR CHILDREN IN MOPTI

On 2 May, four children playing with an explosive device they thought was a toy died when the ordnance exploded. The accident happened in Dia town in the central Mopti region. Improvised explosive devices are among the biggest threats in central and northern Mali. Since 2013, 341 tons of obsolete, unsafe and unserviceable ammunition, including 85 obsolete surfaceto-air missiles, and nearly 11,500 fire arms were found and destroyed by UN Mine Action Support (UNMAS). This represents the world’s largest ammunition stockpile disposed of by a national authority with UNMAS assistance.

NIGERIA

CHOLERA OUTBREAK SPREADING IN NORTH-EAST

The cholera outbreak that erupted in February in Nigeria’s northeast is continuing to spread. Cases have now been confirmed in four local government areas (LGA) in Borno state and one LGA in Yobe state.

Suspected cases have also been reported in two other LGAs in Borno and four in Yobe.

The UN and partners are responding to the outbreak, including through surveillance, case management, water and sanitation services and raising awareness in the communities.

TWIN SUICIDE ATTACKS KILL 27 IN ADAMAWA

Twin suicide bombings at a mosque and at a market on 1 May killed at least 27 people and wounded dozens in Mubi town in the north-eastern Adamawa state. The attack was one of the deadliest witnessed in the town. Security has been tightened. Armed groups continue to launch violent attacks against civilians and military targets in northeast Nigeria.",West and Central Africa: Weekly Regional Humanitarian Snapshot (1 - 7 May 2018),https://reliefweb.int/report/nigeria/west-and-central-africa-weekly-regional-humanitarian-snapshot-1-7-may-2018
