,Concerning,Text,Title,URL
0,central+african+republic,"On a late Saturday morning in the Miskine neighborhood of Bangui, the war engulfing the Central African Republic seems far away. There are no militiamen clashing in the streets or eerie, abandoned fields that smell of rot. In Miskine, people are busy living, not dying. Scratchy radios blare music and women call out greetings from doorways. Kids chase each other, sending tiny chicks scuttling after their mother hen.

Sixteen-year-old Fortuné Kibinda seems oblivious to the noise. He’s crouched over an open fire in front of his house, making a full meal of fish, rice and fried yams. He’s sweating — he’s got to finish by 1 p.m., in time for his friend Abigail’s birthday party.

""I’m making something to surprise her,” Fortuné says, grinning.

Related: Fortuné’s big dreams and small spaghetti business

Abigail is a member of the youth singing group that Fortuné started.

Kids in this neighborhood are lucky to be back in school: For years, the fighting that bled across the capital put their education on hold. Still, school here is basic, with no extracurriculars, so these kids organize singing practices themselves, meeting after school and after church on Sundays.

A few hours later, the eight young members of Fortuné’s singing group stand in a circle in Abigail’s living room.

Fortuné's singing group ranges in age from 10 to 16. They organize their own rehearsals, after school and after church. Credit: Brenna Daldorph

The rice and fish that Fortuné made are sitting on a big wooden table. Before the friends dig in, he leads them in prayer.

Fortuné’s voice soars above the harmonies of the other children: “There is no one behind me, no one ahead of me, you are everything, oh, Jesus.”

A breath after the song finishes, Fortuné calls out with the cadence and stature of the preachers he must study in church each Sunday.

“All together, we’ll raise our voices, say thank you to the Lord!” he cries, before dropping his voice to a furious whisper to deliver his own private prayer.

Abigail says the final grace, her voice soft but earnest.

The group’s name is Efficace Divine — which means “Divine Efficiency” in French. Faith is important to these kids, as it is to many just trying to exist in Central African Republic.

“We go to church together,” Fortuné says. “I heard how they sing and that’s why I invited them to be my singers.”

The youngest member is just 10, while Fortuné and Abigail are the oldest — at 16.

A worn notebook contains their entire repertoire of hymns, which Fortuné wrote out by hand.

The name Efficace Divine once belonged to another one of Fortuné’s projects. Just over a year ago, he opened a kiosk where he sold coffee and spaghetti. As his business grew, he dreamed of someday owning a chain of restaurants, of being a successful businessman.

Then, one day, he went to open his kiosk — and found the entire wooden structure gone.

“I asked around and people told me it had been stolen during night,” he says. “My mind was empty. I just started crying. And then I went home.”

For Fortuné, the loss of his stand also represented the loss of the future.

“It was all I had to help me to get ahead,” he says. “That’s why I cried.”

Fortuné lives with his great aunt, a housecleaner, and she didn’t have the money to help him rebuild the kiosk.

So, Fortuné threw himself into something that didn’t require an upfront investment — singing.

“What changed in my life is that I’m getting ahead in music,” he says.

A photo in the family’s living room shows Fortuné in a recording studio, wearing big headphones. The picture was taken when he recorded a song, which now plays on a local Christian radio station. The experience made him even more excited about his group.

""We want to make a CD, release an album and send it to countries across Africa,” he says.

But all that would require money.

“If I had some money again,” he says, “I could restart my kiosk and then invest in my singing group.”

But money is hard to come by in this country, where most people are just scraping by.

So, Fortuné thinks the most likely way he’d get some money would be through divine intervention. He prays a lot. It keeps the uncertainty of the present and the sadness of the past from swallowing him up — things like the loss of his mother, who died while the family was living in a refugee camp.

“I don’t think about her. I only think about God,” he says, voice wavering.

He also says he doesn’t even have time to think about girls.

Not even Abigail?

“No, no, no,” he says, shaking his head. “No. I have a lot to do in my life. There’ll be time for that in the future.”

He smiles, though.

But the truth is the crisis in the Central African Republic is getting worse. Bangui, where Fortuné lives, has some law and order, but much of the rest of the country is controlled by militia groups that regularly target civilians. There’s widespread hunger and hundreds of thousands of people displaced.

His country may be crumbling around him, but Fortuné is so sure that he’ll come out okay, that his faith will carry him through. In fact, there’s this line in the song that he has playing on the radio. In it, he’s speaking directly to God.

“I know that with you, I’ll triumph,” he sings. “I’ll reach the destiny that’s burning in me.”

It’s an amazing destiny, if only he can reach it.

Reporter Brenna Daldorph traveled to the Central African Republic in 2016, when she first met Fortuné, and returned in late 2017. Both times, she was a fellow with the Great Lakes Reporting initiative, run by the International Women’s Media Foundation.",A teenager from the Central African Republic puts his faith in Divine Efficiency,https://www.pri.org/stories/2018-03-27/teenager-central-african-republic-puts-his-faith-divine-efficiency
1,central+african+republic,"New York, New York 19 March 2018

As delivered

Excellences, Ladies and Gentlemen,

Thank you for joining us for this briefing on the Central African Republic and I am delighted to be joined on the podium by H.E. Ms. Ambroisine Kpongo, the Permanent Representative of the Central African Republic to the United Nations.

I am very pleased to be here to discuss the situation in the Central African Republic following my mission to the country last month, and I wish to express my appreciation to the Government and to the people of the Central African Republic for their warm welcome and support throughout my visit.

The situation in the Central African Republic has further deteriorated since the Humanitarian Coordinator for the Central African Republic, Najat Rochdi, briefed you in November last year. Two years after the democratic elections, conflict is escalating. Violence is fast spreading across the country, creating new emergencies while urgent and critical needs that existed before are deepening further.

The number of people displaced within and outside the Central African Republic has reached record high levels. Currently more than 690,000 people have been internally displaced – which is an increase since last year of 72 per cent. Over 546,000 people have sought refuge in neighbouring countries – that is more than 20 per cent more than last year. Insecurity and recurrent displacement led to a 58 per cent decline in crop production, as well as increased food prices and rising malnutrition levels. 1.1 million people are moderately or severely food insecure, and in 2018, an estimated 37,000 children under 5 years will suffer from severe acute malnutrition. Less than half of all children are fully immunized and 1.7 million people are without access to safe water, 800,000 of which are children.

With the upsurge in violence, the recruitment and use of children by armed groups increased by 50 per cent between 2016 and 2017 and, due to insecurity, approximately one in four children is out of school. These figures are even more striking when considering that the total population in the country is less than 5 million, and we estimate that 2.5 million people – more than half of the country’s population – need humanitarian assistance.

During my mission, I met with Government officials, United Nations agencies, the leadership of the Multidimensional Integrated Stabilization Mission in the Central African Republic (MINUSCA), NGO partners, religious leaders and the diplomatic community. I met with internally displaced persons in Paoua, in northwestern Central African Republic, and in the PK5 neighbourhood in the capital, Bangui. I also met with returnees in Bangui’s Bimbo neighbourhood.

Civilians continue to bear the brunt of violence. Women, men, boys and girls are severely affected by the crisis. Too often they are uprooted and forced to flee from their homes because of the presence of armed groups and criminal gangs. Mothers I talked to who have been displaced and are in return sites in Bangui and Paoua were shaken, and I was really shaken listening to the stories that they recounted to me of the violence they experienced while fleeing their homes. They also reminded me how their communities urgently require security, food, water, education and jobs to prevent the youth from joining armed groups.

Armed clashes are affecting towns and villages which were relatively calm and where communities have previously lived peacefully side by side. Countless women, girls, boys and men have been raped. The number of children taken by armed groups has increased in the past year. Cases of torture and inhumane treatment, including enslavement and sexual exploitation of minorities, have not stopped since the conflict erupted.

The latest escalation of violence has come at a time when the Government and the people of the Central African Republic were recovering from years of instability. However, several officials I met in Bangui expressed their optimism about the outlook for the country, and the satisfaction for the work done so far in starting to re-deploy – or in some cases such as Birao, in the North of CAR, deploying for the first time – civil servants such as the prefects. I am firmly convinced that the donor community should increase its investments in those areas of the country that have been successfully stabilized.

At the same time, it is also critical to provide a realistic account on the different realities and challenges faced by the population living outside Bangui. For instance, in Paoua, a relatively small town in the northwestern part of the country, close to the country’s borders with Chad and Cameroon, I witnessed first-hand how once relatively stable areas can rapidly relapse into conflict. This bordering area had been identified as a priority area for initiating recovery and development programmes when, last December, violence erupted, brutally displacing over 65,000 people and generating new dire humanitarian needs.

While the State bears the primary responsibility for the protection of civilians, both humanitarian actors and peacekeepers in the Central African Republic continue to prioritize protection in their respective work. And as mentioned before, with MINUSCA’s support, significant progress has been made in bolstering the State presence in the interior of the country. Measures such as building the capacity of local government administrative officials have helped in improving the situation. Despite these developments, people continue to depend heavily on humanitarian organizations’ support because essential social services remain scarce in many parts of the country. Throughout my conversations with various interlocutors, there was a broad consensus that more needs to be done to protect civilians.

I am also concerned that armed groups increasingly instrumentalize religious or ethnic affiliations to manipulate communities to fight each other and incite them to violence. Civilians are targeted because they are artificially described as belonging to an opposing group. Various spoilers of the peace process have fueled this violence by supporting militias or making inflammatory statements. This must stop immediately.

One such example is Bangassou, where some 1,500 internally displaced people from minority groups continue to be trapped and threatened by armed groups. They have been living in the Catholic Church premises since May 2017 when anti-Balaka elements attacked and destroyed Tokoyo, their neighbourhood of origin. Prevailing insecurity and occupation by their assailants of their area of origin prevents them from returning home, while no solution has been found to relocate them to a safer area. These 1,500 IDPs continue to live in fear in what has become another enclave under MINUSCA’s protection. We should commend MINUSCA’s significant efforts to protect civilians when violence erupts, improve security and promote the conditions for the return of IDPs.

As I could see and hear in Paoua, the presence and violent activities of armed groups continue to be a deterrent forcing civilians to remain displaced for long periods of time. It is concerning that entire areas of the Central African Republic have been emptied of communities who had lived there for generations and now strive to maintain family ties, although the social fabric of their towns and villages has been torn apart.

Insecurity also restricts humanitarian access and undermines the response to the most vulnerable. The Central African Republic is one of the most dangerous countries for humanitarian actors to operate in. In 2017, 14 humanitarian workers lost their lives – a 43 per cent increase from the previous year. In the first two months of 2018 alone, six education workers and four health practitioners were killed. In the past year, violence against aid workers has often led to temporary suspensions of humanitarian activities, leaving vulnerable men, women and children without required life-saving assistance.

I therefore reiterate the call I made in the Central African Republic to all parties, and those who have influence in the region and beyond, to respect and ensure the protection of civilians and humanitarian workers and to facilitate humanitarian access. All parties to the conflict must comply with International Humanitarian Law and International Human Rights Law obligations.

Despite the challenges I have mentioned, there is room for hope. The international community, the authorities and the population of the Central African Republic have a strong commitment for the restoration of stability in the country. The people of the Central African Republic want peace, justice and reconciliation. They want to return safely to their homes and rebuild their lives. They want to contribute to the development of their country.

Humanitarian workers continue to stay and to deliver despite persistent insecurity. I met with international NGOs and local NGOs, and I was really impressed and inspired by their dedication and their courage to put their lives on the line to provide humanitarian assistance and protection day by day.

In 2017, 637,000 people received emergency food assistance, 1.4 million people received clean water assistance, while 447,000 IDPs and affected comminutes received aid in sanitation. 27,000 severely acutely malnourished children under the age of five received nutrition support. Over 5,000 households received shelter, non-food items or cash transfers and 22,000 households in IDP sites received access to basic services. As humanitarians continue to save lives and alleviate suffering, it is critical that development actors step up their efforts to address the root causes of the crisis. This will help put an end to the vicious cycle of violence and support the authorities in providing basic social services.

Yet, serious underfunding continues to hamper the work of aid organizations. This year, the Humanitarian Response Plan (HRP) for the Central African Republic, requires almost US$516 million, but so far only 2 percent has been received. Last year, the HRP – in the whole year – received only 39 per cent of its $497 million requirement.

I want to take this opportunity to thank our esteemed donors for their continued support, which allowed the humanitarian community to meet the needs of 1.3 million people in 2017, despite the security and financial constraints I mentioned. And I call on your continuous support to prevent a further deterioration. We cannot afford to neglect the crisis in the Central African Republic any longer, or the price to pay will be much higher than the investments already made.

Thank you very much, and I would now like to give the floor to Her Excellency the Permanent Representative of the Central African Republic to the United Nations.","Assistant-Secretary-General for Humanitarian Affairs and Deputy Emergency Relief Coordinator, Ursula Mueller, Remarks at Member States Briefing on the Central African Republic",https://reliefweb.int/report/central-african-republic/assistant-secretary-general-humanitarian-affairs-and-deputy-2
2,central+african+republic,"A. Situation analysis

Description of the disaster

Following clashes between armed groups in the North of Paoua in the Central African Republic (CAR) and a steady upsurge of violence in recent months, since 26 December 2017, an influx of CAR refugees entering the Eastern Logone region in the South of Chad has been observed since 26 December 2017. According to UNHCR Emergency Response Plan for Central African Refugees, released on 12 March 2018, about 19,910 Central African refugees have arrived in Chad since the beginning of 2018. The situation is constantly evolving and according to UNHCR-Chad weekly report of 2 March, during the last week of February approximately 2,500 new arrivals were recorded in the Moissala area. Pre-registrations are on-going as new arrivals continue to be identified.

This latest influx is the largest population movement ever observed since the beginning of the crisis in 2013: It exceeds the total number of arrivals to Chad for the whole year 2017, which amounts to 2,000 people. Given the volatile and unpredictable security situation in the North of CAR (Ouham Pende), the presence of refugees will most likely continue for a long time.

In the context of this crisis, the Government and UNHCR, after noting the limited effects of ""camps"" on the socioeconomic integration of refugees, now favours the settlement of refugees from the emergency phase, into host villages such as the Diba experience. Only a part of the new arrivals is being registered in camps, which often constitute ""islets"" that limit the integration of refugees. In recent weeks, authorities and humanitarian partners have been working on redefining the relocation and identification strategy of these refugee resettlement sites / villages.

Chad Red Cross (CRC), in close collaboration with the ICRC and the French RC, has from the onset of this refugee influx, activated its departmental committee and the local volunteer network to monitor the situation. It equally deployed a joint Red Cross Movement assessment mission in January 2018, to assess the needs of the affected populations.

The initial RCRC Movement joint needs assessment in January, as well as the UNHCR Emergency Response Plan, highlight that over 40 host villages are overwhelmed by a precarious food situation, with urgent needs for shelter, food, drinking water, health, education and care for children. There is also a need to strengthen basic services (water, sanitation and health) in these villages. It is for these reasons that Chad RC is requesting a total amount of CHF 271,180, to support in responding to the direst needs of these refugee and host households.

Bearing in mind that during the first weeks of this refugees’ influx, UNHCR was still working on finetuning its strategy, Chad Red Cross, for proper response and action, took the necessary time to observe the evolution of the situation on the ground while coordinating with all actors to plan accordingly for an adequate intervention to fill existing gaps.

As the situation does not seem to be improving, Chad Red Cross within the framework of this DREF, aims to target the priority gaps highlighted by the Government, as well as UNHCR's weekly report of March 2 and Emergency Response Plan for Central African Refugees, particularly about needs in the WASH sector. Indeed, it is essential to respond before the start of the rainy season, in May-June, to the urgent needs in water, hygiene and sanitation and prevent any epidemic outbreaks, while ensuring better access to basic services.",Chad: Population Movement from the Central African Republic (CAR) - Emergency Plan of Action (EPoA) DREF n°MDRTD017 / PTD027,https://reliefweb.int/report/chad/chad-population-movement-central-african-republic-car-emergency-plan-action-epoa-dref-n
3,central+african+republic,"HIGHLIGHTS

The number of IDPs in CAR increases by nearly 70 percent since February 2017

KEY DEVELOPMENTS

Insecurity and violence continue to restrict humanitarian access across Central African Republic (CAR). Attacks targeting civilians and humanitarian staff have continued in recent months, with one incident in Ouham Prefecture resulting in four aid worker deaths.

Clashes between armed groups near Ouaka Prefecture’s capital town of Bambari have caused approximately 11,200 people to flee to internally displaced person (IDP) sites in and around Bambari in recent weeks. In addition, an attack against a UN Multidimensional Integrated Stabilization Mission in CAR (MINUSCA) base in Ouaka resulted in the death of one peacekeeper on April 3.","Central African Republic - Complex Emergency Fact Sheet #3, Fiscal Year (FY) 2018",https://reliefweb.int/report/central-african-republic/central-african-republic-complex-emergency-fact-sheet-3-fiscal-2
4,central+african+republic,"We met Frederick in the western CAR town of Boda, at a hospital run by an aid group called Alima. He’s 5 years old, emaciated, with ribs pressing through his flesh, and weighs just 19.6 pounds. That’s less than half the weight of an average 5-year-old in America.

His mom, Tefole Raissa, explained that they had fled fighting and no longer have land. “I can’t farm now,” she explained. She doesn’t remember the last time she ate meat or eggs; the family gets by on one evening meal a day of cassava, a starchy tuber with negligible nutrition.

This country is lush, with vast areas of untilled land, and nobody should go hungry. But violence changes everything. Collette Lundi, the mother of one desperately malnourished boy fighting for his life in a hospital, said her husband had been killed by a militia and their house destroyed, leaving the family with nothing to eat but small amounts of cassava.

I asked if she ever eats meat.

She nodded and explained, “We try to catch rats.”",Opinion | ‘Conflict Is More Profitable Than Peace’,https://www.nytimes.com/2018/03/23/opinion/sunday/central-african-republic-conflict.html
5,central+african+republic,"A new traveling exhibit that opened Monday April 9 at University Medical Center provides a glimpse of what life is like in refugee camps around the world from the perspective of the people who live there and volunteers with Doctors Without Borders.

Using virtual reality documentaries, photographs, and testimonies from aid workers and patients, the exhibit called Forced from Home, explores the lives of some of the millions of people who have been displaced from their homes either due to armed conflict, political violence, natural or man-made disasters. In 2016 the U. N's refugee agency reported that the number of displaced people reached 65.3 million or one out of 113 people on the planet--the highest number since post-World War II.

The exhibit is self-contained in a mobile trailer and staffed with Doctors Without Borders volunteers from New Orleans, including Dr. Peter Reynaud a local physician and faculty member at the Tulane School of Medicine. Reynaud has completed seven assignments with the humanitarian aid organization over the past 15 years.

He was most recently in the Central African Republic and has also worked with Syrian refugees in northern Iraq as well as earthquake victims in Bangladesh.

""Every place has its own unique challenges but in all we are addressing the basic needs, access to clean water, nutrition, shelter and mental health care,"" Reynaud said pointing to a wall of photographs taken at camps from around the world.

The exhibit includes a virtual reality tour where visitors are able to see aspects of life in four different settlements across the world. In one a young mother from Honduras explains how she had to leave her home country and escape to Mexico after her husband was murdered by local gangs. The organization estimates that 190,000 people are estimated to be displaced in Honduras from violence in 2016, another 504 people were treated by the organization for sexual violence that year.

Another video shows Syrian children singing in their living space in the Domiz Refugee camp in northern Iraq. They are among an estimated 26,500 refugees living in the camp, having fled Syria after civil war broke out in 2011.

Forced from Home is a free exhibit and open to the public from 9 a.m. to 3 p.m. April 9, 10 at the University Medical Center. It will move to Tulane University, McAlister Auditorium on April 11, 12 and be open from 10 a.m. to 4 p.m. It will then move to the Peace Quad at Loyola University on April 13 and open from 12 p.m. to 5 p.m.",See the global refugee crisis through the eyes of medical aid workers and refugees,http://www.nola.com/health/index.ssf/2018/04/see_the_global_refugee_crisis.html
