,Concerning,Text,Title,URL
11,ethiopia,"Country Overview

Background

Ethiopia has a long standing history of hosting refugees.

The country maintains an open door policy for refugee inflows into the country and allows humanitarian access and protection to those seeking asylum on its territory. In 2004, a national Refugee Proclamation was enacted based on the international and regional refugee conventions to which Ethiopia is a party (1951 Convention relating to the Status of Refugees, and its 1967 Protocol and the 1969 OAU Convention). Refugee protection in the country is provided within the framework of these international and national refugee laws as well as the core international human rights treaties that have been ratified by the country.

Continued insecurity within neighbouring states has resulted in sustained refugee movements, either directly as a result of internal conflict and human rights abuses or as a result of conflict related to completion for scare natural resources and drought related food insecurity.

Eritreans, South Sudanese, Sudanese, Yemenis and Somalis originating from South and Central Somalia are recognized as prima facie refugees. Nationals from other countries undergo individual refugee status determination. The refugee flow to Ethiopia continued during 2017, with 109, 851 persons seeking safety and protection within the country’s borders. At the start of 2018, the nation hosted 892,555 thousand refugees who were forced to flee their homes as a result of insecurity, political instability, military conscription, conflict, famine and other problems in their countries of origin. Ethiopia is one of the largest refugee asylum countries world-wide, and the second largest in Africa, reflecting the ongoing fragility and conflict in the region.

Ethiopia provides protection to refugees from some 19 countries. Among the principal factors leading to this situation are predominantly the conflict in South Sudan, ongoing political instability in Eritrea, together with conflict and draught in Somalia.

The majority of refugees in Ethiopia are located in Tigray Regional State and the four Emerging Regions of Ethiopia: Afar Regional State; Benishangul-Gumuz Regional State; Gambella Regional State; and the Somali Regional State. The Emerging Regions are the least developed regions in the country, characterized by harsh weather conditions, poor infrastructure, low administrative capacity, a high level of poverty and poor development indicators. The arid environment in Afar and Somali regions and the small and scattered nomadic populations make it more challenging to provide services. Many parts of the four regions are inaccessible with poor or no roads.

The South Sudanese are the largest refugee population in Ethiopia, totalling 421,867 persons at the close of 2017. Renewed violence in Upper Nile, Jonglei and Unity States; that increasingly impacted border areas, has resulted in 75,447 new arrivals seeking asylum in 2017.

The majority were accommodated through the expansion of Nguenyyiel Camp in the Gambella Region, and in Gure Shembola Camp established in May 2017 in the Beneshangul Gumuz Region. Somalis constitute 28.3 percent of registered refugees, with 6,696 new arrivals during 2017, contributing to a total population of 253,889 individuals. Fleeing generalized instability and a third failed harvest, families were subsequently accommodated across five camps within the Somali region. The Eritrean caseload comprised 164,668 individuals at the end of the year, with 25,265 new arrivals received within the Shire and Afar Regions. Ethiopia also hosts an additional caseload of 52,131 individuals drawn from across the wider region; including from Sudan (44,386), Yemen (1,771), and other countries.

While continuing to respond to three concurrent emergencies, and mindful of the fluid socio-political context within the country, the Government of Ethiopia (GoE) has advocated for stable humanitarian financing, while promoting wider investments in refugees’ selfreliance through an improved and sustainable response that goes beyond mere care and maintenance that combines wider support to host communities, furthering peaceful coexistence and the greater inclusion of refugees as part of broad national development plans. In November 2017, the Government formally launched the Comprehensive Refugee Response Framework (CRRF) in Ethiopia, effectively paving the way for the implementation of the nine pledges it made at the Leaders’ Summit on Refugees in September 2016 in New York.

Through the pledges, which serve as a vehicle for implementing the CRRF in the country, Ethiopia seeks to: expand its out-of-camp policy; provide work permits to refugees; increase enrolment in primary, secondary and tertiary education; provide access to irrigable land for crop cultivation; facilitate local integration in instances of protracted displacement; earmark a percentage of jobs within industrial parks to refugees; and provide access to vital events documentation to facilitate increased access to basic and essential social services. The planned amendment to the 2004 Refugee Proclamation, will enable refugees to become more independent, better protected and have greater access to local solutions.

Through the enabling environment created by the CRRF, the Ethiopia Country Refugee Response Plan (ECRRP) envisages improved coordination mechanisms to ensure timely and effective protection and solutions. The collective engagement of the Government and development actors will help to ensure that the needs of refugees are actively considered in the development agenda, and that complementary services are provided to refugees and their host communities. Fulfilling these considerable and measurable government commitments to further its duty of care to refugees, relative to its existing national resource constraints, will inevitably be based on the scale-up of equitable responsibility-sharing between UN Member States.

With continued refugee arrivals, and in light of ongoing verification taking place as part of Level 3 registration throughout the year, it is anticipated that Ethiopia will host 919,134 refugees by the end of 2018, mainly from South Sudan (485,000), Eritrea (131,343) and Somali (231,348). Within a climate of decreasing humanitarian and development financing; that has led to critical shortfalls in food assistance, limited opportunities for third-country resettlement, together with only modest support to youth and a growing population of unaccompanied and separated children, bold financial commitments - for essential humanitarian services and a sustainable solutions-based response - will be needed to harness the CRRF’s transformational agenda.","Ethiopia Country Refugee Response Plan 2018 : The integrated response plan for refugees from Eritrea, Sudan, South Sudan and Somalia (January - December 2018)",https://reliefweb.int/report/ethiopia/ethiopia-country-refugee-response-plan-2018-integrated-response-plan-refugees
12,ethiopia,"Ethiopia must deal with its home generated security crisis and stop using Eritrea as a smokescreen, this is the view of a former United States Assistant Secretary of State.

Herman Cohen on Monday waded into renewed claims by Ethiopia that neighbouring Eritrea was backing groups aimed at destabilizing the country.

Cohen described the Ethiopian claims as false and averred that the current security crisis in the country was “self-inflicted by a minority kleptocratic regime,” in apparent reference to the Tigray Peoples Liberation Front (TPLF).

#Ethiopia‘s claim that #Eritrea is contributing to violent instability in Ethiopia is false. All instability in Ethiopia is self-inflicted by a minority kleptocratic régime. — Herman J. Cohen (@CohenOnAfrica) March 19, 2018

Ethiopia is currently under a state of emergency imposed on February 16 this year, a day after Prime Minister Hailemariam Desalegn resigned his position to allow for political reforms.

The ruling coalition, the Ethiopian Peoples Revolutionary Democratic Front (EPRDF) is set to meet to elect his successor. The country is currently under a Command Post administering the state of emergency.

The latest accusation against Eritrea was by the federal police chief who whiles giving a briefing on the state of emergency late last week, reportedly cited Eritrean involvement in the crisis. The Eritrean Information minister dismissed the claims in an email exchange with Bloomberg.

“The regime is desperately trying to deflect attention from its intractable domestic crisis — of its own making — and find external scapegoats,” Yemane Ghebre Meskel said describing the claims as false and one that did not merit a serious response.

The ex-ambassador has been a regular commentator on African politics and has previously spoken about the Ethiopian situation.

“In Ethiopia, instead of an all-parties reconciliation conference, I fear a Middle East type military dictatorship takeover and a zero sum game bloody outcome. USG, do not let it happen,” he said hours after a state of emergency was imposed on February 16.

“While in Addis Ababa, Ethiopia, Secretary Tillerson should have talks with Ethiopian government about their internal political crisis, and should encourage the regime in power not to fear an opening to transparent democracy,” he tweeted on March 3, 2018.

“Ethiopia regime should withdraw SOE declaration prior to naming OPDO leader Abiy Ahmed as new Prime Minister, thereby avoiding tense vote in Parliament, and setting stage for political reforms,” he tweeted two days earlier.","Ethiopia security crisis self-inflicted, Eritrea innocent – Ex-US Diplomat",http://www.africanews.com/2018/03/20/ethiopia-security-crisis-self-inflicted-eritrea-innocent-ex-us-diplomat/
13,ethiopia,"The grazing regions of Oromia and Somali in southern and eastern Ethiopia have witnessed an escalation in inter-ethnic violence in recent months. Since last September, more than one million people have fled their villages and been displaced to hundreds of reception areas. HI is working to protect the most vulnerable individuals, primarily women and children. Fabrice Vandeputte, HI’s head of mission in Ethiopia, explains the causes of the crisis and how our team is responding.

How did the crisis begin?

For years, ethnic groups have been fighting over natural resources, especially water and pasture land in the regions of Somali and Oromia in southern and eastern Ethiopia. But the conflict has intensified due to long periods of drought and the famines that have followed them. A disagreement over where the border lies between the two regions also recently turned violent, when hundreds of thousands of people from Oromia living in Somali and even in neighboring Somaliland were forcibly removed to Oromia. The Oromia authorities expelled the Somali population in reprisal.

Where are the displaced people living?

More than one million displaced people, mostly women and children, are currently living in 400 reception areas, such as schools and public buildings, but also with families and the like, on a north-south line from the towns of Jigaga to Moyale, on the border between the Somali and Oromia regions. These population movements are putting a lot of pressure on host communities. For example, one woman we met recently has taken in 50 or so members of her close or extended family. You can imagine the day-to-day problems that causes in terms of sanitary facilities, food, and so on.

What are conditions like for displaced people?

They’re exhausted. Think about it: you’re walking down the street, minding your own business, when you’re suddenly surrounded by police who load you onto a vehicle, and transport you hundreds of miles away from your home region. That’s what’s happened to most displaced people. They’ve lost everything they own. A lot of children even get separated from their parents. Many suffer serious psychological distress.

What are NGOs doing?

Unfortunately, very few humanitarian actors are supported by funding bodies or are able to implement emergency programs. NGOs in the field are finding it hard to launch a response because displaced people are spread across lots of different sites, and you have to find them. Organizing aid for people scattered over a large area is not easy.

What is HI doing?

We’ve set up a program to protect women and children. When people are suddenly displaced in large numbers, and forced together in very poor conditions, it leads to tension and violence, and women and children are usually worst affected. There’s also a heightened risk of rape and child trafficking. In Babile and Kersaa, where we work, we’ve formed mobile teams whose job is to spot risky situations and vulnerable individuals and to refer them to the right services, such as health centers, social services, NGOs, and the like. We’re also opening areas for women and children where they can play or get psychosocial support.

How do you think the crisis will develop over the coming months?

Some observers estimate the number of people who could need humanitarian assistance, displaced people and host communities included, at five to seven million. Very few people are paying attention to this crisis and not enough money has been allocated to it. The basic need for water, food, hygiene and facilities are only just being met. The support provided by funding bodies falls short of what’s needed.

Humanity & Inclusion in Ethiopia

Present in the country since 1986, our team is working to provide support to the displaced as well as improve the quality of and access to physical rehabilitation and orthopedic-fitting services, livelihoods facilities for families of children with disabilities, and assistance for refugees and displaced people, and more.",East Ethiopia - The forgotten crisis,https://reliefweb.int/report/ethiopia/east-ethiopia-forgotten-crisis
14,ethiopia,"A Jewish teenager from Ethiopia who has reached the final stages of the annual International Bible Quiz in Israel will reportedly have to deposit thousands of shekels in order take part in the contest as a guarantee that he will leave the country after it ends.

Sintayehu Shafrao, 18, from Gondar in Ethiopia, who reportedly has siblings in Israel, will be representing Ethiopians who claim Jewish descent, known as Falashmura, in the competition, held as part of Israel’s Independence Day celebrations.

Israeli Ethiopian activists have already taken him to meet with several ministers and Knesset lawmakers, and he was photographed with Justice Minister Ayelet Shaked.

Get The Times of Israel's Daily Edition by email and never miss our top stories Free Sign Up

The Interior Ministry regularly demands such deposits from Ethiopian Falashmura visiting Jewish relatives in Israel, Channel 10 news reported Monday.

לאחר הכתבה המצויינת של @BranuTegene – סינטיהו שיפראו, מסורב עלייה עם אחים בישראל, נציג יהודי אתיופיה בחידון התנ""ך, קיים סדרת פגישות הבוקר בכנסת ישראל יחד עם שרים וח""כים בליווי פעילי מטה המאבק להעלאת יהודי אתיופיה. pic.twitter.com/iC8SDlPv9v — אורי פרדניק (@uripered) April 8, 2018

That is despite a government decision to bring all 9,000 remaining Falashmura from Ethiopia to Israel — a decision that is dependent on state funds being made available.

Last month, the Knesset passed the 2019 state budget with no allocation for Ethiopian immigration. The immigration and its funding are reportedly slated to be discussed at a future inter-ministerial meeting.

Avi Yalou, an Israeli Ethiopian community activist, said Shafrao wanted to immigrate like the rest of the community still in Ethiopia. He described Shafrao’s treatment as “classic racism” and linked it to the government’s determination to deport asylum-seekers and the lack of visible moves to free Averu Mengistu — a mentally ill Israeli of Ethiopian descent — who has been held by the Gaza terror group Hamas since September 2014.

Posting a photograph on his Facebook page of Shafrao meeting with Shaked, Yalou wrote that the young Ethiopian youth was “apparently Jewish enough for the justice minister to be photographed with him but not Jewish enough to be allowed to immigrate with another 9,000 Jews who are waiting in Addis Ababa to come to Israel.”

He added, “Leave the photos and let our brothers and sisters immigrate to Israel.”

The Falashmura claim links to descendants of Jews who converted to Christianity generations ago and now seek to return to Judaism. The Interior Ministry accepts them as immigrants under the Law of Return, which is less restrictive than religious Jewish law.

In August, the government reiterated that it would bring 9,000 Falashmura to Israel by the end of 2020.

The Knesset in November 2015 had unanimously approved a plan to bring them over following a public campaign launched by the nation’s Ethiopian community and volunteer organizations. At the same time, it announced that it would be the last round of Ethiopian immigration. Many of those waiting to immigrate have family already in Israel. Some have been waiting for 20 years to come to Israel. The live in Gondar and in Addis Ababa.

About 135,000 Ethiopian Jews live in Israel today. Some 22,000 Ethiopian Jews were airlifted to Israel during Operation Moses in 1984 and Operation Solomon in 1991.

JTA contributed this report.",Ethiopian Jew forced to put down money to ensure he won’t stay after Bible quiz,https://www.timesofisrael.com/ethiopian-jew-forced-to-put-down-money-to-ensure-he-wont-stay-after-bible-quiz/
15,ethiopia,"ADDIS ABABA, Ethiopia — Ethiopia has closed a prison notorious for decades for holding opposition figures, journalists and activists, a state-affiliated media outlet reported Friday, as the country adjusts to a new prime minister who has said it is time to “make up for all the wrongs done in the past.”

Fana Broadcasting Corporate announced Maekelawi’s closure months after the former prime minister said it would be turned into a museum. Prisoners will be transferred elsewhere.

Ethiopia installed new Prime Minister Abiy Ahmed this week as Africa’s second most populous nation tries to recover from months of the most serious anti-government protests in a quarter-century. The protests demanding more freedoms began in the Oromia and Amhara regions in late 2015 and spread elsewhere, bringing many businesses and transport networks to a standstill and leading to a state of emergency.

Also on Friday, residents across the restive Oromia region told The Associated Press that internet service had returned after several weeks. Observers have said the government shut down service to control the spread of protest images on social media.

The new prime minister is from the Oromo ethnic group, Ethiopia’s largest, and has vowed to solve “lots of problems.”

On Thursday, 11 journalists, politicians and bloggers who were detained last month for allegedly displaying an outlawed flag and gathering in violation of the latest state of emergency were released.

The closure of the prison “could signal the end of an era of bloody repression in Ethiopia,” Amnesty International researcher Fisseha Tekle said when the plan was first announced. “For years, Maekelawi has essentially functioned as a torture chamber, used by the Ethiopian authorities to brutally interrogate anybody who dares to dissent.”

Copyright 2018 The Associated Press. All rights reserved. This material may not be published, broadcast, rewritten or redistributed.",Ethiopia closes notorious prison as internet service returns,https://www.washingtonpost.com/world/africa/ethiopia-closes-notorious-prison-as-internet-service-returns/2018/04/06/76a69e02-39a6-11e8-af3c-2123715f78df_story.html
16,ethiopia,"Highlights

▪ The Government of Ethiopia and UNOCHA launched the Humanitarian and Disaster Resilience Plan (HDRP) for Ethiopia appealing for US$1.66 billion to provide support for 7.9 million people in need.

▪ In January 2018, 26,004 children were treated for severe acute malnutrition, with 94.9 per cent cured.

▪ Following the measles outbreak in Arba Minch University in the Southern Nations, Nationalities, and People’s (SNNP) region, with UNICEF support, 5,550 university students (95 per cent coverage) and 5,867 children 6 to 23 months old (100 per cent coverage) were vaccinated against measles. No further cases were reported.

▪ The Government of Ethiopia reported that the residents of Moyale who fled to Kenya following clashes with Ethiopian security forces on 10 March are returning to their homes.

▪ UNICEF Ethiopia received US$1 million from the Government of Japan and US$6.4 million from the Central Emergency Response Fund to meet the needs of those currently displaced by drought and conflict in the Oromia and Somali regions.

Situation in Numbers

7.9 million* People in need of relief food/cash

50,111* Children in need of treatment for severe acute malnutrition

2.2 million* School-aged children, including adolescents, in need of emergency school feeding and learning material assistance

1.7 million** Internally displaced people in Ethiopia (64 per cent displaced due to conflict) 909,301** Registered refugees and asylum seekers in Ethiopia.

*2018 Humanitarian and Disaster Resilience Plan for Ethiopia, March 2018

** Ethiopia: Conflict displacement situation report, January 2018, NDRMC and OCHA

** Ethiopia, refugee and asylum seekers (UNHCR, February 2018)

Situation Overview and Humanitarian Needs

The Government of Ethiopia is appealing for US$1.66 billion to provide support in agriculture and livestock, education, emergency shelter and non-food items (NFI), food, health, nutrition, protection and water, and sanitation and hygiene for 7.9 million people in need of humanitarian assistance. Just under half of the target population are children. The Humanitarian and Disaster Resilience Plan (HDRP) was released on 13 March 2018. While the document focuses on the immediate response requirements for 2018, it also lays out the basis for a three-pillared model that will allow for further planning and development investments, in line with a disaster risk management approach.

On 10 March 2018, a security incident between the Ethiopian Defence Forces in Moyale led to the death of 10 civilians and the injury of several others. The incident led to the displacement of over 10,000 people across the border to Kenya. In Kenya, the Kenyan Red Cross has reported that 80 per cent of the displaced are women and children and that there are about 600 pregnant women among the 10,557 refugees, who are being provided with basic supplies including food and water. These figures are currently being validated by the Kenyan Refugee Affairs Secretariat and UNHCR. On 21 March, the Secretariat of the State of Emergency Command Post stated that the displaced residents of Moyale who fled to Kenya are returning home. The Government of Ethiopia also announced that the State of Emergency inquiry board will investigate the deaths of civilians. A joint mission to assess the humanitarian situation in Moyale town took place from 23 to 26 March. The team, led by UNOCHA, included WFP, UNICEF, UNHCR and UNDSS. The team was advised that essential services were disrupted immediately after the security incident; however, essential services are now operational. The team recommended to pre-position humanitarian supplies in order to immediately respond to any future needs.

Ethiopia continues to receive refugees and, as of 28 February 2018, 909,301 refugees were reported in Ethiopia. In the first two months of 2018, 15,097 refugees arrived in Ethiopia, including 7,202 in February. They include more than 10,700 from South Sudan and more than 3,700 from Eritrea.",UNICEF Ethiopia Humanitarian Situation Report #3 – Reporting Period March 2018,https://reliefweb.int/report/ethiopia/unicef-ethiopia-humanitarian-situation-report-3-reporting-period-march-2018
