,Concerning,Text,Title,URL
0,ethiopia,"A group of Ethiopian treasures, now on special display at the Victoria and Albert Museum, have rekindled an old debate about whether such artefacts should be returned to their country of origin. Ethiopia would like them back. The V&A’s director, Tristram Hunt, has suggested a long-term loan. The Ethiopian government has welcomed Hunt’s offer. And there, for now, the matter rests.

The treasures, which include an 18th-century gold crown and a royal wedding dress, are part of a fascinating and beautiful collection with a tragic and little-known history. They were seized by the British in 1868 and have been in the V&A ever since. But the circumstances of their seizure, and the consequences, deserve to be much better known.

Looted Ethiopian treasures in UK could be returned on loan Read more

Even most of those who know something of British imperial history are unlikely to know much about the 1868 invasion of Abyssinia which lies at the root of the current debate about the future of these treasures. That’s because the Abyssinia campaign barely features in the dominant historical narratives about British imperial power. The discredited heroic narrative of imperial Britain had prominent places for the conquest of north America, India and even South Africa. The critical big post-colonial narrative that replaced it concentrated on India, the Middle East, the Atlantic slave trade and even Ireland. But the Abyssinia campaign has remained on the margins of both.

The 1868 war gets a passing ironic mention as one of the “justifiable wars” of the 19th century in 1066 and All That. The tragic and poignant fate of the Abyssinian Prince Alemayehu, who was brought to Britain with the treasure in 1868, is possibly marginally better known than the events that gave rise to it. Alemayehu met Queen Victoria and was sent to Rugby school. He died in Headingley, Leeds, at the age of 18 while staying under the care of his former tutor Cyril Ransome, father of the children’s author (and Guardian journalist) Arthur Ransome, and is buried in Windsor Castle. Alemayehu’s exile has recently been the subject of a film and a radio programme. But the wider truth is that this is a forgotten story – except in Ethiopia.

Abyssinia, now Ethiopia, was on the wrong side of Africa to be caught up in the Atlantic slave trade, though always vulnerable to the Arab slave trade. It was too mountainous and isolated to be routinely involved in the struggles between Britain, France and Turkey to control the Red Sea and the route to India. And when the European colonial “rush for Africa” began in earnest in the mid-19th century, it offered too few easy pickings in terms of minerals, cash crops and settlement.

Nineteenth-century Abyssinia, with its ancient culture and its dominant Coptic Christian religion, was both a place apart for the European powers and a place with real, if uneasy, connections to the neighbouring Ottoman Turkish world that dominated north-east Africa and the Middle East. When, in 1855, a remarkable local ruler called Kassa unified Abyssinia’s many provinces and crowned himself the Emperor Tewodros, the outside world began to be aware of one of the great African leaders of the 19th century.

Tewodros was a man of enormous energy and ambition. His aim, never fulfilled, was to create a modern nation state. Though he always struggled to maintain control, he abolished feudal dues, paid salaries to judges and local governors, outlawed bribery, confiscated firearms, forbade the slave trade and abolished polygamy. His growing power attracted foreign governments. A British diplomat visited him in 1855. And in 1862, after receiving a present of two pistols from Britain, Tewodros wrote to Queen Victoria with an audacious proposal. As the great Christian emperor of the south, he proposed an alliance with the great Christian empress of the north. Together, their armies would unite – and drive the Muslim Ottomans from the holy places in Jerusalem.

It was a fateful letter. Lord Palmerston’s government in London had no intention of getting involved. The letter was ignored. Tewodros responded by taking hostage the handful of Europeans in the country, including a British emissary. For years, efforts were made to negotiate the hostages’ release. But Britain’s refusal to send aid workers or to join in the Jerusalem adventure made that impossible. The situation festered and Tewodros’s power began to decline. In 1868, in an operation costing £9m – the equivalent of more than £1bn today – Britain sent an army of 13,000 troops. In April of that year, the British overwhelmed Tewodros’s army at the fortress of Maqdala. In a scene worthy of the climax of a Verdi opera, Tewodros committed suicide with one of the pistols from Queen Victoria.

Tewodros was unquestionably a tragic victim of British imperial might

With Tewodros dead, the British withdrew. The troops went back to India. The freed hostages went home. The railways that had been built to carry military equipment up from the Red Sea coast was pulled up. The Maqdala treasures, along with Tewodros’s son, were taken to Britain. The prime minister, Benjamin Disraeli, told MPs that “We are about to vacate the country in a manner which will prove to the world the purity of our purpose.”

The Abyssinia war is an unusual episode in the British imperial story. It was not a war of plunder, of imperial rivalry or annexation. Politicians at the time thought it was a war about prestige. The British did it because they could. They had the wealth and the weapons; the Ethiopians had neither. Though Tewodros never ruled a stable Abyssinia, his overthrow weakened the fragile state at great human cost. Tewodros was unquestionably a tragic victim of British imperial might.

Abyssinia would be invaded twice more, defeating the Italians in their historic victory at Adowa in 1896, and then being brutally attacked by Mussolini in 1935. Today, Disraeli’s claims of moral purity are not words that anyone would use. And nor should they rule out the return of the Maqdala treasures.

• Martin Kettle is a Guardian columnist",The Ethiopian treasures in the V&A may have to return home | Martin Kettle,https://www.theguardian.com/commentisfree/2018/apr/09/maqdala-treasures-history-ethiopia-v-a-british-war
1,ethiopia,"UN Migration Agency Appeals for USD 88.5 million for Response to Ethiopian Crisis

IOM, the UN Migration Agency, has launched an appeal for USD 88,550,000 to help people in need of humanitarian assistance in Ethiopia. The appeal covers IOM’s activities under the humanitarian community and Government’s Ethiopia Humanitarian and Disaster Resilience Plan (HDRP), IOM’s assistance to Ethiopian migrant returnees from the Kingdom of Saudi Arabia (KSA) and humanitarian support to refugees from neighbouring countries.

IOM’s appeal aims to support some of the 1.7 million Ethiopians displaced throughout the country, identified by IOM’s Displacement Tracking Matrix (DTM). Approximately 1.1 million people are displaced due to conflict, 857,000 of whom were displaced near the borders of the Oromia and Somalia Regions over the past year, and over 500,000 people due to climatic shocks. In addition, 47,600 Ethiopian migrant returnees and 87,000 South Sudanese and Somali refugees are planned to be reached with support detailed in the appeal. Under this appeal, IOM will also support empowerment of young people and the strengthening of institutions in Ethiopia working on counter trafficking in persons and smuggling of migrants.

“We need to rethink the way we work in countries like Ethiopia,” said Mohammed Abdiker, IOM Director of Operations and Emergencies at the Organization’s headquarters in Geneva. “We want this appeal to mark the end of the “Band-Aid approach” and the start of longer term thinking. Millions of people are in dire need of our urgent support in Ethiopia, but we hope that the life-saving sustainable measures we put in place this year will mean that by next year more communities will be resilient to climate stresses like drought,” said Abdiker.

Ethiopia has had a fast-growing non-oil-related economy with double digit growth sustained over a decade. It has experienced massive investment in infrastructure and industry. However, in 2016, the worst El Niño induced drought in 50 years forced more than 10 million people to become depend on relief food assistance, while also eroding household and community resilience and increasing vulnerability nationwide. Last year, rains failed again, and, in south and south-eastern Ethiopia, 8.5 million Ethiopians were left in need of relief food assistance.

The 2018 Humanitarian and Disaster Resilience Plan released by the Government of Ethiopia National Disaster Risk Management Commission and the UN Humanitarian Coordinator shows that this year 16.4 million people will need humanitarian assistance throughout the country.

Hundreds of thousands of Ethiopians leave home to seek employment in the Gulf countries, most often KSA. On 29 March 2017, KSA issued a Note Verbal declaring that all irregular migrants should voluntarily leave the country, among them an estimated 500,000 Ethiopians. To date more than 140,000 Ethiopians have returned. Many returnees come back to little and the push factors that encouraged them to leave in the first place are still present. IOM’s appeal covers reintegration support, which is vital for returnees to sustain their livelihood.

Ethiopia remains the second largest refugee-hosting country in Africa hosting over 909,000 refugees. Of these registered refugees, more than 428,928 are South Sudanese and 254,274 are Somali.

Transportation of newly arrived refugees from border entry points to the refugee camps remains a critical to ensure that they can access aid. Shelter, water, sanitation and hygiene (WASH) and livelihood support in the context of the Comprehensive Refuge Response Framework (CRRF) remains critically under-funded and are included in IOM’s current appeal.

“Ethiopia has bravely endured these difficult situations but to sustain its growing economy, it needs urgent support from the global community,” said Maureen Achieng, IOM Ethiopia Chief of Mission and Representative to the African Union (AU), United Nations Economic Commission for Africa (UNECA) and Intergovernmental Authority on Development (IGAD).

Download the appeal here.

For more information, please contact Alemayehu Seifeselassie at IOM Ethiopia, Tel: +251.11. 5571707 (Ext. 455), Mobile: +251.91.163-9082 Email: salemayehu@iom.int",IOM Ethiopia Crisis Response: January - December 2018,https://reliefweb.int/report/ethiopia/iom-ethiopia-crisis-response-january-december-2018
2,ethiopia,"Democracy, Human Rights and Diaspora Groups Urge Congress to Pass H. Res. 128 on Ethiopia



Ethiopia is at a crossroads. On Monday, April 2, a new Prime Minister, selected from within the ruling coalition, delivered a speech about planned reforms while the country was under another State of Emergency. At such a juncture, amid mounting pressures, the role of the US, Ethiopia’s longstanding international ally to encourage critically-needed reforms and human rights protections, should not be underestimated in urging the country toward a new era of stability.

The undersigned human rights and diaspora groups fully support the passage of House Resolution 128 for the positive contribution it can make toward respecting basic human rights and encouraging inclusive governance in Ethiopia. The resolution has strong bipartisan support and more than 100 co-sponsors. In addition, H. Res. 128 has significant grassroots support among constituents across the US who have ties to Ethiopia. It calls on the government of Ethiopia to open up civic space, ensure accountability for human rights abuses and promote inclusive governance.

For the past three years, Ethiopia has faced largely peaceful and sustained protests in the Oromia and Amhara regions of the country. These protests were led by youth seeking opportunity, political reform and more participatory development strategies. The government responded with excessive force. More than a thousand protesters have been killed by Ethiopian security forces, a greater number injured, tens of thousands imprisoned and many tortured for expressing grievances. Over a million, mostly from Oromia, were uprooted due to government-instigated conflict in the Eastern part of the country.

However, a combination of forces has accumulated in support of the protesters – diaspora groups and international human rights organizations helped publicize the protest movement in Ethiopia and the government’s violent response; the US Congress rallied behind H. Res. 128; international news outlets gave frequent coverage of the protests. At the dawn of this new year, the EPRDF coalition announced reforms and some changes began to occur. Close to 7000 political prisoners were released in January and February of 2018, Prime Minister Hailemariam Desalegn stepped down within days, and Dr. Abiy Ahmed, a man with ties to the region most impacted by the protests, was put forward by the coalition as Ethiopia’s newest prime minister.

In light of these beginnings, now more than ever, it is imperative that the United States Congress take a stand that reiterates the need for Ethiopia to take further steps in a democratic direction by passing H. Res. 128. Ethiopia’s previous transfers of power indicate that leadership change is often followed by unfulfilled promises, a culling of opponents and power consolidation. If Prime Minister Abiy is truly committed to breaking that pattern, this resolution will encourage Ethiopia to lift the State of Emergency, ensuring freedoms of expression and assembly and opening up democratic space, all prerequisites for political and economic reform.

1) H. Res. 128 is a signal of support for the youth in the country who have organized to peacefully demand justice and democracy and have paid a terrible price in terms of loss of life, injury and arbitrary detention. Accountability for the human rights violations that have occurred over the last 3 years will be an essential step towards genuine reconciliation and is a key demand from the protesters.

2) H. Res. 128 contains clauses that could strengthen the hand of the Prime Minister vis-a-vis less responsive segments within the EPRDF party coalition structure, requiring negotiation with the forces that control the country’s security apparatus, intelligence and the economic sectors.

3) H. Res. 128 contains clauses that call on the State Department and USAID to develop a comprehensive strategy to support improved democracy and governance in Ethiopia.

4) H. Res. 128 contains clauses that call on the Secretary of State and Secretary of Treasury to apply appropriate sanctions on individuals and organizations responsible for gross human rights.

We support passage of H. Res. 128 as a means to send a strong, unambiguous signal that the United States Congress requires concrete reforms. Such reforms are needed to create a path toward improved respect and protection of human and civil rights, political stability and sustainable regional security.

We urge members of the House to pass the resolution.

Amhara Association of America

Coalition of Oromos for Human Rights and Democracy

Ethiopian Advocacy Network

Ethiopian Human Rights Project

Human Rights Watch

Oromo Advocacy Alliance",Ethiopia: Joint Letter About US House Resolution 128,https://www.hrw.org/news/2018/04/09/ethiopia-joint-letter-about-us-house-resolution-128
3,ethiopia,"The United States Congress will finally vote on a human rights resolution against the Ethiopian government today as announced by a Congressman deeply involved in the process.

Rep. Mike Coffman who represents Colorado’s Sixth Congressional District tweeted last week that the House Resolution 128 will be on the floor of the House of Representatives on April 10.

He had in March tweeted about how passing the resolution will mean: “The fight for respect of human rights & inclusive governance in Ethiopia continues.”

I’m happy to announce that after months of hard work (by all involved) #HRes128 is scheduled for a vote the week of April 9. The fight for respect of human rights & inclusive governance in #Ethiopia continues… pic.twitter.com/hF1lvOBCZs — Rep. Mike Coffman (@RepMikeCoffman) March 21, 2018

What is the H. Res. 128 about?

H. Res. 128 is a human rights centered move with strong bipartisan support in the U.S. Congress, it has as many as 71 cosponsors.

The resolution passed the House Foreign Affairs Committee unanimously in late July 2017 and was scheduled for a vote by the full House on October 2. That vote was, however, postponed ostensibly after a protest and threat by Addis Ababa to withdraw counter-terrorism cooperation.

One of its authors, Republican Congressman Chris Smith said during the committee mark-up, the resolution is like a mirror held up to the government of Ethiopia, and it is intended to encourage them to recognize how others see them and move forward with reforms.

HRW and advocacy groups back H. Res. 128

Human Rights Watch (HRW) and a network of advocacy groups based in the U.S. have tasked the Congress to vote for the resolution to send a signal to the government that respect for and opening the political space was non-negotiable. Some of the reasons they advanced included:

1) H. Res. 128 is a signal of support for the youth in the country who have organized to peacefully demand justice and democracy and have paid a terrible price in terms of loss of life, injury and arbitrary detention. Accountability for the human rights violations that have occurred over the last 3 years will be an essential step towards genuine reconciliation and is a key demand from the protesters.

2) H. Res. 128 contains clauses that could strengthen the hand of the Prime Minister vis-a-vis less responsive segments within the EPRDF party coalition structure, requiring negotiation with the forces that control the country’s security apparatus, intelligence and the economic sectors.

3) H. Res. 128 contains clauses that call on the State Department and USAID to develop a comprehensive strategy to support improved democracy and governance in Ethiopia.

4) H. Res. 128 contains clauses that call on the Secretary of State and Secretary of Treasury to apply appropriate sanctions on individuals and organizations responsible for gross human rights.

In October 2017, a pro-democracy group, Freedom House, accused Ethiopia of literally blackmailing the U.S. Congress with a threat to withhold counter-terrorism cooperation if the vote went ahead.

Freedom House quoted Congressman Mike Coffman as confirming that Ethiopia’s ambassador in Washington has said the country will “stop counter-terrorism cooperation with the United States if Congress went ahead with a planned vote on a resolution calling for human rights protections and inclusive governance in the country (H. Res. 128).”

But the turn of events, with the vote scheduled to go ahead means that the Congress had ‘thrown out’ the threat from Addis Ababa.

Freedom House’s statement dated October 16, 2017 was titled “U.S. Congress Should Call Ethiopia’s Bluff,” with its Senior Program Officer for Africa, Joseph Badwaza, egging Congress to proceed with its efforts and discard the Ethiopian government’s “bullying tactics.”

“Passing H. Res. 128 would send a powerful message to Addis Ababa to get serious about undertaking reforms, and the Ethiopian government’s bullying tactics should not derail it. Members of Congress should call the bluff, place the resolution back on the House agenda, and approve it.

“Experience shows that Ethiopia would never follow through on the threat to halt security cooperation. The government fully understands who would be the ultimate loser if it did,” Freedom House said.",Ethiopia govt faces hard-hitting U.S. Congress resolution 128 vote,http://www.africanews.com/2018/04/10/ethiopia-govt-faces-hard-hitting-us-congress-resolution-128-vote/
4,ethiopia,"International rights group, Human Rights Watch (HRW) says as a matter of urgency, the Kenyan government must speak on the political and security ongoings in neighbouring Ethiopia.

According to HRW, Kenya especially and the entire East Africa region needed to encourage Ethiopia to undertake needed reforms and to halt its continued descent into chaos.

A March 24, 2018 statement ‘Why is Kenya’s Government Silent on Ethiopia Crackdown’ released by the group’s Senior Researcher for the Horn of Africa, Felix Horne read in part: “… Kenyan leaders should publicly voice their concern over the increased military aggression that causes Ethiopians to flee into Kenya. Kenya, and East Africa more broadly, need a stable and prosperous Ethiopia.

“Adding the voice of a trusted ally like Kenya to the many tens of millions of Ethiopians demanding change will be an important contribution toward stability in the region.”

HRW also stressed that on the humanitarian scale, Kenya stands to suffer if the situation in Ethiopia degenerates any further. With family ties connecting people on both sides of their common border, Ethiopians are likely to continue fleeing into Kenya.

“Over eight million Ethiopians are in need of food aid. Many of them live in southern Ethiopia, close to the Kenyan border. If conflict in Ethiopia increases, many of its most vulnerable citizens will be looking for safety.

“Kinship connections, established trafficking routes, and relatively stable security all make Kenya an attractive destination,” the statement added.

Over the last weeks, thousands of Ethiopians living in the border town of Moyale fled their homes into Kenya’s Marsabit County after a failed military operation by the army led to the deaths of nine people and injuries to others.

Confirming the incident, the Minister of Defense, admitted that the army had acted on failed intelligence as it sought to intercept members of a banned group – the Oromo Liberation Front (OLF) – who were reportedly trying to enter the country.

HRW also reiterated how Ethiopian forces have in the past entered Kenya and perpetuated rights abuses in the name of counter-terrorism operations. They also accused the Kenyan authorities in part of complicity in helping Ethiopia arrest Ethiopians who had fled in Kenya.

“Ethiopia’s intolerance of dissent has also been exported across the border in the past. For years, Ethiopian intelligence officials, sometimes in cooperation with Kenyan police, have harassed, threatened, and on occasion kidnapped Ethiopian asylum seekers in Nairobi and elsewhere in Kenya,” the statement added.

The country is currently under martial law, after a state of emergency was declared in February 16 – a day after the resignation of Prime Minister Hailemariam Desalegn. The ruling coalition is meeting to elect his successor.",Ethiopia crisis: Kenya must abandon indifference and speak up - HRW,http://www.africanews.com/2018/03/24/kenya-must-not-be-indifferent-over-ethiopia-crackdown-hrw-warns/
