,Concerning,Text,Title,URL
0,nigeria,"Since the mid-2000s, an ongoing humanitarian crisis in the three northeastern states of Nigeria has spread to the greater Lake Chad basin. The Boko Haram conflict turned into a major security problem that led to widespread displacement and a major humanitarian catastrophe. UNOCHA estimates that more than 20,0000 people have been killed, 1.6 million are internally displaces, and 200,000 are living as refugees in neighboring countries.

Nigeria uses the Cadre Harmonisé to identify and classify the severity of food security situations. This report examines this system to better understand the technical and political constraints to analyzing famines and extreme emergencies.

This report was jointly written by researchers from the Feinstein International Center and the Centre for Humanitarian Change in Nairobi.

Read the briefing paper here.

1. Brief introduction to Nigeria

Nigeria is Africa’s most populous country, with more than 190 million residents. It is diverse in language, ethnicity, and religion. Though English is the official national language, Hausa and Fulani are spoken widely in the northeast; Yoruba, Igbo, and other languages are spoken elsewhere. The country is almost evenly split between Islam (50 percent) and Christianity (40 percent). The north is predominantly Muslim while the south is predominantly Christian, though this common disaggregation obscures complex ethnic, linguistic, and class unions and divisions throughout the country (Ogunlesi, 2015). The population is young: 42.5 percent of residents are under the age of 15 and 19.61 percent are aged 15–24 years.

Of these youth, approximately 7.7 percent are unemployed; the total unemployment rate is 13.9 percent.

With 5.07 children born per woman, Nigeria has the thirteenth highest fertility rate in the world. The oil and gas sector contributes approximately 35 percent of the country’s GDP, and petroleum accounts for 90 percent of exports (OPEC, 2017). The GDP per capita in 2016 was $5,900, though recent growth rates show a decline of 1.5 percent due to decreased oil prices. Some 70 percent of the population lived below the poverty line in 2010 (OPEC, 2017).

The country is divided into 36 states and the Federal Capital Territory (FCT). States are grouped into six zones and each state is subdivided into three senatorial zones and further into local government areas (LGAs), which are further subdivided into districts, wards, and villages. The zone of northeast Nigeria consists of six states: Bauchi, Gombe, Taraba, Adamawa, Borno, and Yobe (see map in Section 6). The latter three are nestled into the far northeast corner of the country. Yobe (capital: Damaturu) borders Niger to the north. Adamawa (capital: Yola) borders Cameroon to the east. Borno (capital: Maiduguri) borders Niger to the northwest, Chad to the northeast, and Cameroon to the southeast.

The original Borno Empire stretched across several current countries. Borno was a trade hub and the center of Islamic knowledge in Nigeria. Northern Nigeria has long been one of the most neglected, marginalized areas in the country. This was at least partially a result of the colonization process, but issues were not addressed after independence.

Historically, the northeast and the northwest had the lowest social welfare indicators and high levels of inequality—both internally and vis-à-vis the rest of the country. These factors, among others, gave rise to the Boko Haram insurgency",Constraints and Complexities of Information and Analysis in Humanitarian Emergencies: Evidence from Nigeria,https://reliefweb.int/report/nigeria/constraints-and-complexities-information-and-analysis-humanitarian-emergencies
1,nigeria,"Highlights

The reporting period witnessed high levels movement of IDPs, with a total of 16,542 new arrivals, 3,068 departures and 201 transit movements across 33 LGAs in Borno and Adamawa States.

A total of 35 new cases of Acute Watery Diarrhea (AWD) with 3 deaths were reported in Yusufari and Bade LGAs, Yobe State. Laboratory tests confirmed the presence of cholera.

A total of 195,804 medical consultations were supported by UNICEF in 2018, out of which 91,184 consultations were made within the reporting period.

UNICEF and its implementing partners have provided critical child protection services to 200,160 children and caregivers in the crisis-affected states of Borno, Adamawa and Yobe since the start of 2018.

Though critically underfunded at 80% and 90%, WASH and Health reached a total 128,446 and 195,804 conflict-affected people respectively during the reporting period. Increased funding is urgently required in these Sectors for an integrated UNICEF response to crises-affected children in north east Nigeria.

4.5 million

Children in need of humanitarian assistance

(Humanitarian Response Plan, 2018)

7.7 million

People in need of humanitarian assistance in the northeast states of Borno, Adamawa and Yobe for 2017 (Humanitarian Response Plan, 2017)

6.1 million

People targeted in the northeast states of Borno, Adamawa and Yobe

(Humanitarian Response Plan, 2018)

1.5 million

Internally displaced people in Adamawa, Borno and Yobe states

(IOM DTM Round XXI, February 2018)

16,542

Newly displaced people

(IOM DTM Round XXI, February 2018)

Situation Overview & Humanitarian Needs

More than 1.634.000 people remain internally displaced across the three north eastern states of Adamawa, Borno and Yobe, of whom 83.5% are in Borno. The reporting period witnessed a high level of movement, with a total of 16, 542 new arrivals, 3,068 departures and 201 transit movements recorded across 33 LGAs in Borno and Adamawa states. The main reasons for the returns are improved security and voluntary relocation, while new displacement is propelled by poor living conditions, fear of attack, ongoing conflict and military operations.



On 23rd March, the Nigerian Government announced its intention to facilitate the return of IDPs from Maiduguri to Bama LGA. Bama currently has the largest number of displaced people (203,374) still outside of the LGA, and at the same time also hosts the highest number of IDPs (49,139 persons DTM Round XXI) of all Borno LGAs. The first voluntary returns exercise, supported by a government package of 10,000 Naira cash, a 50kg bag of rice, and a bag of maize flour per family, was scheduled for 2nd April. Humanitarian actors have emphasized the importance of ensuring that all returns processes take place in a safe, voluntary, and dignified manner, and take into consideration the capacity of state and other actors to meet the needs of returnees.



As of 31st March, 133 cases of Acute Watery Diarrhea (AWD) with 12 deaths (a case fatality rate of 9%) were reported in Bade and Yusufari LGAs of Yobe State. Laboratory tests confirmed the presence of cholera. WASH and health partners - including UNICEF, WHO, VCM, MSF Spain, State Ministry of Health (SMoH), State Primary Health Care Board (SPHCMB) and LGAs authorities - are responding in the affected areas. Meanwhile, the number of cholera cases in Kukawa LGA continues to decline following responses by UNICEF and partners. A total number of 639 cases and 3 deaths were reported at the end of March (resulting in a case fatality rate of 0.5%).



On 1st March, members of a non-state armed groups attacked the military camp in Rann, killing seven military personnel.



Hostilities also resulted in the deaths of three humanitarian workers (including a doctor working for a UNICEF contractor) and the abduction of three female health workers (including a nurse working for a UNICEF contractor). Humanitarian activities in Rann were suspended as a result of the attack, temporarily leaving the local population and an estimated 40,000 IDPs without life-saving assistance. The attack also resulted in the closure of the only school in Rann, thus halting learning opportunities for 7300 children (46% of whom are girls) and the destruction of 2,700 school bags with essential learning materials prepositioned in preparation for new enrolment. All teachers have moved to Maiduguri following the attack.

","UNICEF Nigeria Humanitarian Situation Report, 01-31 March 2018",https://reliefweb.int/report/nigeria/unicef-nigeria-humanitarian-situation-report-01-31-march-2018
2,nigeria,"Highlights

The Emergency Telecommunications Sector (ETS) deployed vital communications services at the humanitarian hub in Damasak.

The ETS prepositioned Internet and security telecommunications equipment in Banki, where the next humanitarian hub will be established.

The ETS is working with local Mobile Network Operators (MNOs) to evaluate the technical feasibility of a Closed User Group (CUG) to enhance communication among humanitarians.

Situation Overview

In early April, a series of fires broke out in and near the Internally Displaced Person (IDP) camp in Borno’s Rann town, injuring 14 people and burning more than 1,000 shelters in the camp, according to local media. Relief agencies are erecting 500 emergency shelters to decongest affected areas and working to address persistent shelter gaps.

The Yobe State Commissioner for Health declared a cholera outbreak in Nigeria’s Bade Local Government Area (LGA) at the beginning of April. Health actors recorded more than 340 suspected cholera cases in the state, more than 95 percent of which were from Bade, between 28 March and 16 April.

In anticipation of increased access challenges during the upcoming May-to-October rainy season, the Office for the Coordination of Humanitarian Affairs (OCHA) published the 2018 Rainy Season Contingency Planning for North-East Nigeria on 9 April. It highlights that 407,000 people will be potentially affected during the 2018 rainy season in the three states of Borno, Yobe and Adamawa.",Nigeria Crisis - ETS Situation Report #18 (Reporting period 1/04/18 to 30/04/18),https://reliefweb.int/report/nigeria/nigeria-crisis-ets-situation-report-18-reporting-period-10418-300418
3,nigeria,"The Federal Government could ignite a crisis, if its planned resumption of oil exploration in Ogoniland goes ahead without the resolution of key issues.The warning by stakeholders in the Niger Delta is coming on the heels of last weekend’s meeting between the leadership of the Movement for the Survival of the Ogoni People (MOSOP) and the Minister of State for Petroleum Resources, Dr. Ibe Kachikwu. The meeting had sought to find solutions to the crisis in Ogoniland.

Shell Petroleum Development Company (SPDC) was forced to stop exploration and leave Ogoniland in 1993, following an upheaval that caused the death of several Ogoni persons.The President of the Ijaw Youth Council (IYC), Eric Omare, told The Guardian that the meeting proves the Federal Government cares nothing about the tragic experiences the Ogoni people have gone through, including the murder of Ken Saro- Wiwa and other prominent Ogoni activists.

“Government has not learnt anything. What this means is that it values oil more than the Ogoni people and their lives. They are yet to clean the environment and they are talking about the resumption of oil production. I don’t think they will have an environment conducive to oil exploration in Ogoni,” said Omare.

South-South Zonal Director, Civil Liberty Organisation, Steven Obodoekwe, said since government and the oil companies have not shown commitment to cleaning up the devastated Ogoni environment, their desperation to resume oil production therefore amounts to callousness and “fresh corporate terrorism.”

The ideal thing would have been for the government to ensure the environment is completely restored before contemplating renewed exploration in the area, stressed Obodoekwe.A Shell spokesman, who pleaded anonymity, told The Guardian that though the company’s lease for Oil Mining Leases (OML11) has been renewed, it does not cover the over 30 Ogoni oilfields.He explained that contrary to the allegation that Shell wants to return to Ogoni through the backdoor, the company which was forced out of Ogoni in 1993 following an uprising does not intend to resume oil production. Shell’s leases for OML 11 was expected to expire by June 2019.

There has been growing tension in Ogoni since the National Petroleum Investment Management Services (NAPIMS) wrote to Shell last year that it had given preliminary approval to a RoboMichael Limited which had expressed interest in obtaining licensing rights of Ogoni oilfields. It was learnt that Shell had already given its approval to RoboMichael.

The endorsement of RoboMichael Limited by NAPIMS and Supreme Council of Ogoni Traditional Rulers respectively had caused MOSOP and other groups to allege that RoboMichael was Shell’s proxy, an allegation which the oil major has denied.

Amnesty International’s Business and Human Rights Researcher, Mark Dummett, regretted failure by the government and Shell to implement recommendations by the United Nations Environment Programme (UNEP).

“Following its groundbreaking survey of 2011, UNEP clearly laid out the path by which the environment of Ogoniland could be made free of the contamination that has devastated it for so long. The government has created the Hydrocarbon Pollution Remediation Project (HYPREP) to organise the cleanup, but little has so far been achieved, and there is no transparency over its plans,” Amnesty’s Rights researcher Dummett said.

MOSOP had told Kachikwu it was not opposed to discussions on the resumption of oil production, but that the consent of the people must first be obtained.It stated “unequivocally” that the contentious issue involves three main parties – the Federal Government, the oil industry led by Shell, and the Ogoni people. “Any attempt to deal with any aspect of the issue must necessarily involve the three principal actors, as stakeholders in a joint project of finding a lasting solution to the Ogoni crisis,” it said.

MOSOP, therefore, warned it would “resist the present attempt by the Federal Government and Shell Petroleum Development Company of Nigeria to arbitrarily award the Ogoni fields in Oil Mining Lease (OML) 11 without consultation with the Ogoni community.”

The President of the movement, Legborsi Pyagbara, stressed that besides the environmental damage that attended Shell’s operations, Ogoni people are distressed about their lack of participation in the value chain of the oil industry, including employment; the absence of well-defined Community Benefit Sharing Agreements (CBAs); and a sustainable development process that recognises the rights of the people to Free, Prior and Informed Consent (FPIC), in accordance with global best practices.

Pyagbara described attempts in the last few years to use money to “buy support” from the people as “condemnable” and “reprehensible”. Such move, he said, is “against the spirit of transparency and accountability required in the extractive sector.”He cautioned: “Societies the world over have met this challenge through deliberate and clear actions, and the Federal Government should urgently look in this direction. For, if the Nigerian government fails to protect the Ogoni people, it certainly cannot protect itself. History is replete with the ruins of societies that were built on the sort of injustices that have pervaded Ogoniland over the years.”

The MOSOP President urged the government to set up a better framework of engagement under which the parties involved would have a level-playing field for discussions on the future of oil production in Ogoniland.

According to him, Nigeria will be judged, not by its false claims about developments in Ogoniland, but by how it actually protects the weak, the vulnerable and those whose lives have been imperiled by reckless oil exploration of multinationals.Pyagbara disclosed that the Ogoni people, at the behest of MOSOP, have set up a strategic committee representing the various interests in Ogoni, headed by Prof. Ben Naanen, an economic historian and resource governance expert. This will develop a template to harmonise existing positions and guide the people in engagements with the Federal Government and the oil industry. Once the people adopt the template, Ogoniland will be ready for engagement and consultation on oil exploration, he said.

Meanwhile, youths in the Niger Delta have been urged to create an enabling business environment to attract investors to the region.SPDC’s General Manager, External Relations and Social Investment, Mr. Igo Weli, disclosed this while delivering a public lecture organised by the Rivers State University’s Centre of Excellence in Marine Engineering and Offshore Technology.

Speaking on the theme, ‘An enabling Business Environment – Implication for Future Careers in Oil and Gas Industry’, Weli noted that unlike in past years, many companies have left the region due to its unfriendly business atmosphere.He stressed the need for proper conflict management to reverse the situation.","Again, stakeholders warn FG, oil firms on crisis in Ogoni",https://guardian.ng/news/again-stakeholders-warn-fg-oil-firms-on-crisis-in-ogoni/
4,nigeria,"Governorship aspirant on the platform of the All Progressives Congress, Senator Ayo Arise, on Tuesday expressed optimism that the current crisis rocking the party, not withstanding, APC would still be victorious in the July 14 governorship election.

He said the party was determined more than ever to send out the governor Ayodele Fayose-led People’s Democratic Party in the forthcoming governorship election in Ekiti State.

Arise, who represented Ekiti North at the Senate between 2007-2011, however described the May 5 botched governorship primary election as “unfortunate and total embarrassment,” adding that the party is conducting investigation and following up on what led to the disruption and would apportion appropriate sanction on those responsible for the fiasco.

Speaking with newsmen in Ado-Ekiti yesterday, the APC Chieftain said it was not true that hoodlums hijacked the process, but it was brought to a halt by aspirants agents and party members when irregularities and electoral malfeasance was noticed.

According to him, “I don’t think that those who participated can really be described as hoodlums, I think they were agents and party members, so I believe there are some irregularities that they noticed and that led to what we all saw as the effect of the outcome that were noticed and with some evidences that we have seen

“What happened was a shame because those who were supposed to conduct a free and fair election couldn’t do it, some people were allowed to be exchanging cards, money and promissory notes where being given for collection of cash after voting while the election was going on and I believe this is the immediate cause of the reactions that we have all seen that has put us in Ekiti in a very bad light.

“But I want to say that if such anomalies continue, it is very likely that we would still be getting the same result. We have asked for a free and fair election and that is the minimum that we expect from the party and that is the minimum that we would accept as the final outcome.

“We want a free and fair election , we do not want anybody throwing money around while election has started under any disguise, it is a total aberration , it is against the electoral law, anybody that is found culpable should excuse from this process.

On the alleged removal of the party chairman by a section of the party, Arise said, “ I don’t think that there is anybody who will support that, act of gangsterism would not be tolerated and should not be tolerated, there is a procedure to remove the party chairman, I’m not fully aware of what was responsible for that and I believe election of the state executives would be coming up very soon and their names are the name on the delegates list that we recognised. So a lot of complications has already set in there.

“But I don’t think any of the aspirants is in the know of the intention to remove the chairman of the party, Whatever we are going to do in this party must be a collective responsibility of every stakeholder

On whether he still has confidence on the Governor Tanko Almakura electoral Committee, Arise said, “I understand many of us have been shortchanged by the way and manner some members of the committee found their names in the committee and that have been expressed.

“Almakura went as far as changing the secretary, but there is general consensus of the participants of this election that, that committee is compromised because a particular aspirant has been fingered to be the one that nominated most of the members, in such a way that every other contestant is at disadvantage.

Commenting on the statement that the botched process will continue from where it stopped, Arise said that, “our discussion with governor Almakura is that he should come back, fix a date for a fresh election. It is clear to everyone that once a ballot escaped from the box, it becomes invalid, and I’m sure there are legal authorities to be cited to educate whoever is suggesting that we can start or continue with an election that has been botched somehow and when you look at it there are some ballot papers that were thrown around, while people were trying to salvage it, there is no doubt that the integrity of that has been compromised.

“A lot of information about that botched process are flying around that some people are leading, some have no votes, who counted it, where did they got those figures they are banding around, some of these information have been filtering out and it goes without being said that when a ballot is compromised, there is no room for you to substitute and say let me take that one out and start counting the rest, unless the election is finished and if there is any dispute about any ballot , it can be set aside.

“So we don’t know how many were destroyed, because it rained heavily and was in the wet situation that the boxes were scattered. I don’t think we need to beat about the bush about the next line of action, we are not interested in protracted legal tussle”.

Arise lamented that there is no doubt in any body’s mind that things are not going on well with the party, saying “The earlier we able to put our house in order the better the chances of our party in the election, the situation on the ground is very tense and I believe we are going to Abuja to meet our leader and found out the way forward. So that this problem would not drag for too long and things we have been fighting against which is the ground norm for corruption, when a person gets into office under questionable circumstances and we condone that , then we have no business complaining about corruption, if we can not do the very minimum that is expected of us as citizens to ensure that the process is fair to everyone, then you have given room for a lot of doubt, questions, misgivings. For us we want to see real change in our polity, our country and way of behaviours, that is the minimum standard”.

Calling on the leadership of the party not to delay in resolving the crisis, by ensuring that sanction is apportioned appropriately and as quickly as possible, Arise said,“ We have competitions in the incumbent Governor that we want to remove and which I believe by the special grace of God, we would remove him”, he said.







","Ekiti 2018: Forget crisis, APC will win July 14 governorship election",http://dailypost.ng/2018/05/08/ekiti-2018-forget-crisis-apc-will-win-july-14-governorship-election-ayo-arise/
5,nigeria,"SITUATION OVERVIEW

Now in its ninth year, the humanitarian crisis in north-east Nigeria remains massive in scale due to ongoing hostilities: 1.6 million persons remain internally displaced in Borno, Adamawa and Yobe states, human rights violations continue to be reported daily, and the food security situation remains concerning as conflict contin- ues to limit the amount of land under cultivation and some 3.0 million persons are expected to face critical levels of food insecurity during the upcoming lean season (June through September). Insecurity continues to pose major challenges in delivering assistance, especially with the dry season enabling an intensification of hostilities between the Nigerian armed forces and non-state armed groups. Large-scale displacements continue to take place every month with 21,807 new arrivals to various locations in March alone. In addition, close to 930,000 remain in areas hard to reach for international aid organisations, mostly in Borno State.",North-east Nigeria: Humanitarian Dashboard (January - March 2018),https://reliefweb.int/report/nigeria/north-east-nigeria-humanitarian-dashboard-january-march-2018
