,Concerning,Text,Title,URL
6,nigeria,"OPERATIONAL OVERVIEW

Now in its ninth year, the humanitarian crisis in north-east Nigeria remains one of the most severe in the world: 1.6 million persons are internally displaced, human rights violations continue to be reported daily, and the food security and nutrition situation remains extremely concerning as conflict continues to limit the amount of land under cultivation and as the lean season (May through September) is about to kick off. The new Cadre Harmonisé analysis – which provides an updated understanding of the food security and nutrition situation – was issued, revealing that the number of people estimated to be facing critical and crisis food and nutrition insecurity levels (IPC 3 and 4) in Borno, Adamawa, and Yobe stands at 2.3 million for March-May and up to 3 million projected for June-August.

In March, the operational environment deteriorated sharply with the killing of three aid workers in Rann, in Kala/Balge local government area (LGA) in Borno State, during an attack by non-state armed groups (NSAGs) against Nigerian armed forces.

Three female paramedical aid workers were also abducted during the attack and remain unaccounted for. This attack, which took place on 1 March, raised serious concerns regarding the preservation and expansion of the current humanitarian space and the dangers faced by aid workers as they attempt to access vulnerable persons in hard-to-reach areas. Following the attack, all relocatable humanitarian workers were evacuated out of Rann for close to three weeks and little to no assistance was delivered to people in need during that time. Although life-saving activities were able to resume in a progressive manner towards the end of the month, much time was lost in preparing for the rainy season (June through September) in a town that tends to become unreachable by road for months on end due to flooding. The construction of a humanitarian hub, a common storage site and a helipad were delayed pending a new security assessment of the chosen location. As time before the rains start is running out, it is crucial that work on these three projects resume as soon as possible.

Large-scale population movements, caused largely by insecurity, continued with 21,807 new arrivals in March alone. This represents a sharp increase of 75 per cent compared to February and poses major humanitarian challenges as resources are often already overstretched in the locations in which these civilians arrive. With hostilities ongoing, these trends are likely to continue at least until the rainy season starts in May/June. On 24 March, the Government of Nigeria opened the MaiduguriBama-Banki road, in Borno State, to civilian traffic, triggering thousands of population movements along this axis. In addition, the Government has announced its intention to relocate tens of thousands of internally displaced persons (IDPs) from Maiduguri to Bama where rehabilitation of public and private infrastructure is underway. The UN and its partners are calling for close coordination with the federal and state authorities to ensure that any returns and relocations are carried out following internationally recognised standards of dignity, safety and voluntariness. The UN and partners are also calling for the return of civilian authorities to all return areas and the rebuilding of infrastructure and municipal services.

The north-east is also grappling with two new cholera outbreaks: one in Borno State (in Kukawa LGA), which broke out on 13 February and stands at 646 cases with three associated deaths; and one in Yobe State (in Bade, Karasuwa, Yusufari and Bursari LGAs) which started on 28 March, and stands at 44 cases with seven deaths (with a worrisome case fatality rate of 6.4 per cent). A timely and coordinated response by health and water, sanitation and hygiene (WASH) partners has been put in place, including prevention measures, and the outbreaks are expected to be under control in the coming weeks. As the rainy season approaches, preparedness measures are being put in place to limit disease transmission.

Another challenge in March were the heavy winds which have caused repeated fire outbreaks in Borno State, destroying large numbers of shelters, food supplies and other critical items across camps in the state (in Mafa, Jere, Monguno and Kala/Balge LGAs). Although humanitarian organisations were able to respond rapidly with emergency shelter kits and distributions of other life-saving items, fires are creating major gaps in the affected locations. Fire sensitisation campaigns and other mitigation measures, such as fire stations in heavily congested camps, are ongoing or being rolled out.

Overall, the humanitarian response in north-east Nigeria is hampered by the lack of funding for the 2018 Humanitarian Response Plan (HRP). Currently, most activities can only be implemented thanks to carry-over funding from 2017 (US$196 million) which will soon run out. For the response to be sustainable and to avoid interruption in life-saving services, it is crucial that additional funding be urgently received across all the sectors","North-East Nigeria: Humanitarian Situation Update - Progress on key activities from the 2018 Humanitarian Response Plan, March 2018",https://reliefweb.int/report/nigeria/north-east-nigeria-humanitarian-situation-update-progress-key-activities-2018
7,nigeria,"THE NIGERIA HUMANITARIAN FUND

The Nigeria Humanitarian Fund (NHF) was launched by the United Nations (UN) Under-Secretary- General for Humanitarian Affairs and Emergency Relief Coordinator during the Oslo Humanitarian Conference on Nigeria and the Lake Chad Region on 24 February 2017. The NHF is a Country-Based Pooled Fund (CBPF) that is managed4 by a Humanitarian Financing Unit (HFU) of the United Nations Office for the Coordination of Humanitarian Affairs (OCHA) based in Maiduguri, on behalf of the United Nations Resident and Humanitarian Coordinator (HC) for Nigeria. It has a vital role in ensuring an effective, coordinated, prioritized and principled humanitarian response in Nigeria. The overall objectives guiding this and future NHF allocations, include:

• Support principled, prioritized life-saving assistance.

• Strengthen coordination and leadership through the function of the Humanitarian Coordinator and the sector coordination system, promoting synergies and multi-sectoral responses.

• Expand assistance to hard-to-reach areas through frontline responders and enabling activities.

• Leverage the Nigerian private sector in support of humanitarian response.

1st RESERVE ALLOCATION 2018

On 31 January 2018, the UN Resident and Humanitarian Coordinator, supported by the NHF Advisory Board, requested the urgent launch of a NHF Reserve Allocation by following the ‘emergency response window’ modality in order to address prioritized humanitarian needs of highly vulnerable populations in Pulka, the Monguno Axis (totaling US$ 10,000,000.00) and to ensure the continuation of humanitarian air services for frontline responders and critically vital humanitarian projects in north-east Nigeria (totaling US$ 2,000,000.00). This reserve allocation is aiming to address prioritized humanitarian needs in prioritized geographic locations where projects carried out by already present humanitarian organizations would need to be either discontinued, or cannot be scaled up to address significantly increased humanitarian needs due to lack of monetary support. The NHF is allocating a maximum total amount of US$ 12,000,000.00 to be allocated through a noncompetitive

process, subject to technical/financial review of all proposals by the NHF and the respective sector in order to ensure quality and compliance, prior to final endorsement of grant agreements by the UN Resident and Humanitarian Coordinator for Nigeria.

This allocation is supporting the most critical elements of the humanitarian operation envisaged by the 2018 HRP, is closely aligned to 2018 HRP strategic objectives and therefore responds to life-saving humanitarian needs in Nigeria. This allocation will contribute to the achievement of the following HRP objective:

Strategic Objective 1: Provide life-saving emergency assistance to the most vulnerable people in conflict-affected areas ensuring that assistance is timely and appropriate and meets relevant technical standards.

HUMANITARIAN CONTEXT",Nigeria Humanitarian Fund | Allocation Strategy | 1st Reserve Allocation 2018,https://reliefweb.int/report/nigeria/nigeria-humanitarian-fund-allocation-strategy-1st-reserve-allocation-2018
8,nigeria,"BURKINA FASO

AID ORGANISATION DRIVER REPORTED MISSING

A Burkina Faso Red Cross driver was reported missing on 3 May in the northern Soum province. The driver had been travelling between Djibo and Arbinda towns. His vehicle has also gone missing. Humanitarian access has been significantly hampered in Burkina Faso’s northern region since November 2017 due to armed attacks and military operations. More than 950,000 people, a third of them in the northern Sahel region, require urgent relief assistance across the country.

CENTRAL AFRICAN REPUBLIC

BANGUI UNREST RESTRICTS HUMANITARIAN MOVEMENT

On 4 May, UN and NGO staff restricted staff movement in the capital Bangui during a protest called to desert the city following the killing of 24 people in a violent attack three days earlier. Protesters barricaded main roads and most people stayed away from the city. Aid organisations are still facing difficulties providing emergency assistance such as ferrying injured people to hospitals due to the presence of armed elements. The unrest has also forced some people to flee for safety elsewhere.

DR CONGO

HEAVY RAINS LEAVE OVER 9,000 HOMELESS

Torrential rains over the past two weeks in Uvira in the eastern South Kivu province have left more than 9,000 people homeless and destroyed at least 6,500 houses. Several schools and health centres have been flooded. In total, around 32,000 people have been affected. Basic household items, shelter, water, health, sanitation and hygiene assistance are the urgent needs.

MALI

IED KILLS FOUR CHILDREN IN MOPTI

On 2 May, four children playing with an explosive device they thought was a toy died when the ordnance exploded. The accident happened in Dia town in the central Mopti region. Improvised explosive devices are among the biggest threats in central and northern Mali. Since 2013, 341 tons of obsolete, unsafe and unserviceable ammunition, including 85 obsolete surfaceto-air missiles, and nearly 11,500 fire arms were found and destroyed by UN Mine Action Support (UNMAS). This represents the world’s largest ammunition stockpile disposed of by a national authority with UNMAS assistance.

NIGERIA

CHOLERA OUTBREAK SPREADING IN NORTH-EAST

The cholera outbreak that erupted in February in Nigeria’s northeast is continuing to spread. Cases have now been confirmed in four local government areas (LGA) in Borno state and one LGA in Yobe state.

Suspected cases have also been reported in two other LGAs in Borno and four in Yobe.

The UN and partners are responding to the outbreak, including through surveillance, case management, water and sanitation services and raising awareness in the communities.

TWIN SUICIDE ATTACKS KILL 27 IN ADAMAWA

Twin suicide bombings at a mosque and at a market on 1 May killed at least 27 people and wounded dozens in Mubi town in the north-eastern Adamawa state. The attack was one of the deadliest witnessed in the town. Security has been tightened. Armed groups continue to launch violent attacks against civilians and military targets in northeast Nigeria.",West and Central Africa: Weekly Regional Humanitarian Snapshot (1 - 7 May 2018),https://reliefweb.int/report/nigeria/west-and-central-africa-weekly-regional-humanitarian-snapshot-1-7-may-2018
9,nigeria,"2017 IN REVIEW

HUMANITARIAN CONTEXT

The humanitarian crisis in Nigeria’s north-east remains one of the most severe in the world today. In 2017, there were 8.5 million people in need of humanitarian assistance in the worst conflict-affected states of Borno, Adamawa and Yobe. The crisis is considered a protection crisis first and foremost, that is closely linked to food scarcity and insecurity and high levels of need for basic life-saving assistance and services. Civilians continue to bear the brunt of a conflict that has led to widespread forced displacement and violations of international humanitarian and human rights law.

In March 2017, the United Nations Security Council unanimously adopted Resolution 2349, strongly condemning all terrorist attacks, violations of international humanitarian law and human rights abuses by Boko Haram and ISIL, and urged all parties to the conflict to ensure respect for and protection of humanitarian personnel, facilities, and their means of transport and equipment, and to facilitate safe, timely and unhindered access for humanitarian oganisations to deliver life-saving aid to affected people.

Protection concerns

Protection of civilians was a key priority for humanitarians in 2017. Women, men and children faced grave human rights violations and sexual and gender-based violence, including rape. Since the start of the conflict in 2009, over 20,000 people have been killed, thousands of women and girls abducted and, in 2017, over 110 children were used as so-called “suicide” bombers. Toward the latter half of 2017, a surge in attacks by non-state armed groups claimed dozens of lives and injured countless others.

Internal displacement and returns

In 2017, more than 1.6 million people were internally displaced in the three worst crisis-affected states – with 80 per cent of internally displaced persons (IDPs) located in Borno State, the epicentre of the crisis. Over half live outside of IDP camps in local communities. Freedom of movement of all IDPs, including refugee returnees, was limited by continued security threats in areas such as Banki, Pulka, Bama, Gwoza, Ngala and Damasak. Nonetheless, 1.3 million people returned home in 2017, indicating that conditions in some locations had improved. Meanwhile, an estimated 930,000 people remain in hard-to-reach areas and humanitarian actors were not able to assess their situation, or to provide them with aid.

Food insecurity and malnutrition

By the end of the year, the risk of famine had been averted in north-east Nigeria in locations where humanitarians had access. The number of people estimated to be facing food insecurity reduced from 5.2 million during June to August 2017 to 2.6 million during October to December 2017³. This improvement was due to (i) improved security conditions that allowed for farming activities in locations that were previously not safe and an upturn in market and trade activity; (ii) delivery of food and livelihood support to almost 3 million people every month (including 2 million per month with just food assistance) since the start of the year; and (iii) favourable climatic conditions for farming.

An estimated 450,000 children under the age of five suffered from severe acute malnutrition (SAM) across Borno, Adamawa and Yobe in 2017. SAM kits were provided to over 30 stabilisation centres to treat more than 7,000 children suffering from SAM with medical complications, and over 150 health professionals from the Health Ministry and NGOs were trained on in-patient management of SAM. The integration of the provision of safe drinking water, adequate sanitation services and safer food and hygiene practices into nutrition activities were required to improve the health of people in need and help combat malnutrition.

Disease outbreaks, including malaria and cholera

A highly vulnerable population, consisting largely of children (58 per cent), continued to be at high risk of disease outbreaks since routine vaccinations, e.g., polio and measles, had been interrupted for many years, . Two thirds of the health facilities in Borno, Adamawa and Yobe states were damaged by the conflict. The continuous influx of returnees and overcrowding of camps continued to increase the risk of outbreaks. The World Health Organization (WHO) estimated that more than half of recorded deaths in Borno State were due to malaria, more than all other causes of death combined.

Finally, the cholera outbreak that was declared in mid-August 2017 in Borno State, was brought under control following a solid collaboration between health partners and water, sanitation and hygiene partners, and a cholera vaccination campaign in the most at-risk areas of Borno State which reached more than 900,000 people. By the time the epidemic was declared over in December 2017, there had been over 5,300 recorded cases and 61 deaths.

Access and security

The humanitarian access and security situation in the northeast remains challenging for humanitarian partners and has had significant implications on relief operations in 2017.

The north-east of Nigeria, especially Borno State, has experienced a significant increase in military operations in the second half of the year which have resulted in major civilian displacement, access restrictions along main routes and security incidents in previously secure areas.

The Humanitarian Country Team (HCT) estimates that around 85 per cent of the target population (5.2 million people) can be reached with aid while an estimated 930,000 people remain in areas that are hard to reach for UN agencies and international NGOs. In Adamawa, Borno and Yobe states, three local government areas (LGAs) are currently completely inaccessible for UN and international NGO humanitarian services, whereas 26 are partially accessible and 37 are fully accessible.

All of the three inaccessible and the majority of the partially accessible (19) LGAs are located in Borno State. Due to the lack of access of humanitarian partners to these areas, the identification of potential needs as well as independent context and security assessments have largely not been possible.",Nigeria Humanitarian Fund - Annual Report 2017,https://reliefweb.int/report/nigeria/nigeria-humanitarian-fund-annual-report-2017
10,nigeria,"Related News

The lingering crisis affecting the Copyright Society of Nigeria (COSON) has taken a new dimension as the Nigerian Copyright Commission has suspended its operating licence.

Coson’s Head, Corporate Affairs, Chibueze Okereke, confirmed the development in an interview with PREMIUM TIMES on Friday.

According to him, COSON’s lawyers headed by Uche Val Obi (SAN) are challenging NCC’s ruling at the court of appeal.

An entertainment lawyer, Akinyemi Ayinoluwa, had earlier shared the news on his official Instagram page on Friday.

Mr Ayinoluwa posted a copy of the ruling, which was ‘authorised’ by the minister of justice, Abubakar Malami.

According to the new ruling, COSON is no longer authorised under law to collect royalties on behalf of and for musicians and other performing artists in Nigeria.

The Commission is the government agency empowered by law to oversee the affairs of COSON and other agencies under its supervision.

This comes after a petition written by artiste, 2face Idibia to the Commission asking it to wade into the crisis at COSON between its chairman Tony Okoroji and Efe Omorogbe.

Efe Omorogbe continues to insist that he is the recognised chairman of COSON.

Some members of the commission’s board installed Mr Omorogbe as the new chairman, having legally recalled Mr Okoroji from his position as chairman of COSON. This happened in December.

The former was replaced over allegations of impropriety.

It was alleged that Mr Okoroji collects 10 per cent commission on licensing income deemed to have been brought in by him and primarily, because he contracts COSON projects and events to his company, TOPS Limited.

Despite Mr Omorogbe’s election, Mr Okoroji was reinstated as the chairman at an extraordinary general meeting of COSON, held on December 19.

A faction of the board loyal to Mr Okoroji reinstated him and sacked those who voted for Mr Omorogbe.

The crisis got messier in April as police from Zone II Command Headquarters, Onikan, Lagos, arraigned Mr Omorogbe before an Igbosere Magistrates’ Court, Lagos, for alleged impersonation and forgery.

According to the prosecuting officer, Friday Mameh, the defendants (Mr Omorogbe and others) had stormed the meeting of venue of the COSON chairman, with thugs on December 7, 2017 and conducted themselves (in a manner) likely to cause breach of peace.

Mr Mameh alleged that Mr Omorogbe and others forged the COSON letter-headed papers, “with intent to defraud, knowingly use the forged COSON letter headed with intent that it may in anyway be used or acted upon as genuine whether in Nigeria or elsewhere to the prejudice of COSON.”

Mr Omorogbe and others pleaded not guilty.

Their counsel, S. Ehiwelele and Chibuzor Nwankobi had prayed the court to admit them to bail on liberal terms.",COSON Crisis: NCC suspends copyright society’s operating license,https://www.premiumtimesng.com/news/more-news/267313-coson-crisis-ncc-suspends-copyright-societys-operating-license.html
11,nigeria,"The war with Boko Haram in Nigeria has killed tens of thousands of people over the past nine years.

The plight of thousands without food and shelter is being discussed by governors from Chad, Niger and Cameroon at a two-day forum in Nigeria.

As Al Jazeera's Ahmed Idris reports from Maiduguri, millions are suffering in the border region around Lake Chad.",Forum in Nigeria to discuss crisis in Lake Chad,https://www.aljazeera.com/news/2018/05/forum-nigeria-discuss-crisis-lake-chad-180508164708985.html
