,Concerning,Text,Title,URL
17,syria,"1/50 9 May 2018 Iranian MPs burning a US flag in the parliament in Tehran. Iran said it will hold talks with signatories to a nuclear deal after US President Donald Trump's decision to withdraw from the accord, which it branded ""psychological warfare"". President Hassan Rouhani also said Iran could resume uranium enrichment ""without limit"" in response to Trump's announcement. AFP/Islamic Consultative Assembly News Agency

2/50 8 May 2018 Newly elected Prime Minister of Armenia Nikol Pashinian addresses the crowd in Republic Square in Yerevan. The leader of protests that gripped Armenia for weeks was named the country's new prime minister on Tuesday, overcoming the immediate political turmoil but raising uncertainty about the longer term. AP

3/50 7 May 2018 Russian President Vladimir Putin walks before his President inauguration ceremony at the Kremlin in Moscow. Reuters

4/50 6 May 2018 Lava from a robust fissure eruption on Kilauea's east rift zone consumes a home, then threatens another, near Pahoa, Hawaii. The total number of homes lost within the Leilani Estates subdivision thus far is 21, and geologists from the Hawaii Volcanoes Observatory do not expect the eruption to cease any time soon. A local state of emergency has been declared after Mount Kilauea erupted near residential areas, forcing mandatory evacuation of about 1,700 citizens from their nearby homes. The crater's floor collapsed on 01 May and is since then continuing to erode its walls and generating huge explosions of ashes. Several earthquakes have been recorded in the area where the volcanic eruptions continue, including a 6.9 magnitue earthquake which struck the area on 4 May. EPA/PARADISE HELICOPTERS

5/50 5 May 2018 Russian police carrying struggling opposition leader Alexei Navalny at a demonstration against President Vladimir Putin in Moscow. Thousands of demonstrators denouncing Putin's upcoming inauguration into a fourth term gathered in the capital's Pushkin Square. AP

6/50 4 May 2018 Chinese President Xi Jinping speaks at an event to mark Karl Marx’s 200th birthday at the Great Hall of the People in Beijing. AP

7/50 3 May 2018 President Vladimir Putin meets with FIFA president Gianni Infantino in Sochi, ahead of the 2018 World Cup in Russia. AFP/Getty

8/50 2 May 2018 Supporters of opposition lawmaker Nikol Pashinyan protest in Republic Square in Yerevan, Armenia. Pashinyan has urged his supporters to block roads, railway stations and airports after the governing Republican Party voted against his election as prime minister. AP

9/50 1 May 2018 Cubans march during the May Day rally at Revolution Square in Havana. AFP/Getty

10/50 30 April 2018 The sky is the limit: A Saudi man and woman fly over the Arabian Sarawat Mountains in the first ever joint wingsuit flight in traditional dress. A symbolic leap of faith towards women’s empowerment in Saudi Arabia. Alwaleed Philanthropies

11/50 29 April 2018 A general view for the damaged railway station in al-Qadam neighborhood, after it was recaptured from Islamic State militants, in the south of Damascus. According to media reports, the Syrian army continued the military offensive it has launched earlier this month against militant groups entrenching in southern Damascus and captured several neighborhoods, including al-Qadam and al-Assali and targeting the remnants of armed groups in al-Hajar al-Aswad and its surrounding in Damascus southern countryside. EPA

12/50 28 April 2018 Comedian Michelle Wolf attends the Celebration After the White House Correspondents' Dinner. Conservatives walked out after Wolf brutally ridiculed President Donald Trump and his aides during her piece. Getty

13/50 27 April 2018 North Korean leader Kim Jong Un and South Korean President Moon Jae-in raise their hands after signing on a joint statement North Korean leader Kim Jong Un, left, and South Korean President Moon Jae-in raise their hands after signing on a joint statement at the border village of Panmunjom in the Demilitarized Zone, South Korea. The Korean War will be formally declared over after 65 years, the North and South have said. At a historic summit between leaders Kim Jong-Un and Moon Jae-in, the neighbouring countries agreed they would work towards peace on the peninsula with a formal end to the conflict set to be announced later this year. The pair agreed to bring the two countries together and establish a ""peace zone"" on the contested border. Korea Summit Press Pool via AP

14/50 26 April 2018 Women hold portraits of their relatives, who are victims of the Chernobyl nuclear disaster, during a commemoration ceremony in Kiev, Ukraine. Reuters

15/50 25 April 2018 Rohingya refugees gather in the ""no man's land"" behind Myanmar's boder lined with barb wire fences in Maungdaw district, Rakhine state bounded by Bangladesh. Myanmar government said on April 15, it repatriated on April 14 the first family of Rohingya out of some 700,000 refugees who have fled a brutal military campaign, a move slammed by a rights group as a PR stunt ignoring UN warnings that a safe return is not yet possible. AFP/Getty

16/50 24 April 2018 President Donald Trump, French President Emmanuel Macron, first lady Melania Trump and Brigitte Macron hold hands on the White House balcony during a State Arrival Ceremony in Washington. AP

17/50 23 April 2018 A boy walks on a pile of garbage covering a drain in New Delhi. Reuters

18/50 22 April 2018 Newly ordained priests lie on the floor as Pope Francis leads a mass in Saint Peter's Basilica at the Vatican. REUTERS

19/50 21 April 2018 South Koreans cheer during the welcoming event for the inter-Korean summit between South Korea and North Korea in Seoul. The inter-Korean summit is scheduled on April 27, 2018 at the Joint Security Area in Panmunjom, agreed by South Korean President Moon Jae-in and North Korea's leader Kim Jong-un. Getty

20/50 20 April 2018 A Palestinian slings a shot by burning tires on the Israel-Gaza border, following a demonstration calling for the right to return. Palestinian refugees either fled or were expelled from what is now the state of Israel during the 1948 war. AFP/Getty

21/50 19 April 2018 Outgoing Cuban President Raul Castro raising the arm of Cuba's new President Miguel Diaz-Canel after he was formally named by the National Assembly, in Havana. A historic handover ending six decades of rule by the Castro brothers. The 57-year-old Diaz-Canel, who was the only candidate for the presidency, was elected to a five-year term with 603 out of 604 possible votes in the National Assembly. AFP/Getty/www.cubadebate.cu

22/50 18 April 2018 Turkey's President Recep Tayyip Erdogan announces early presidential and parliamentary elections for June 24, 2018, at the Presidential Palace, in Ankara. Erdogan announced the snap elections, originally scheduled for November 2019, in a move that will usher in a new political system increasing the powers of the president. He said the new system needed to be implemented quickly in order to deal with a slew of challenges ahead, including Turkey's fight against Kurdish insurgents in Syria and Iraq. AP

23/50 17 April 2018 European lawmakers raise placards reading ""Stop the War in Syria"" in protest against airstrikes launched by the US, Britain and France in Syria last week criticizing the legitimacy of the operation, as French President Emmanuel Macron delivers his speech at the European Parliament in Strasbourg. Macron is expected to outline his vision for the future of Europe to push for deep reforms of the 19-nation eurozone and will launch a drive to seek European citizens' opinions on the European Union's future. AP

24/50 16 April 2018 People participate in a protest against the rape of an eight-year-old girl in Kathua near Jammu, and a teenager in Unnao, Uttar Pradesh state, in Bangalore, India Reuters

25/50 15 April 2018 Fireworks are set off as the final performance takes place during the Closing Ceremony for the 2018 Commonwealth Games. PA

26/50 14 April 2018 The wreckage of the Scientific Studies and Research Centre compound in the Barzeh district, north of Damascus, after the United States, UK and France launched strikes against Syrian President Bashar al-Assad's regime early on April 14 in response to an alleged chemical weapons attack after mulling military action for nearly a week. Syrian state news agency SANA reported several missiles hit a research centre in Barzeh, north of Damascus, ""destroying a building that included scientific labs and a training centre"" AFP/Getty

27/50 13 April 2018 Indian activists gather to show support for the chairperson of the Delhi Commission for Women Swati Maliwal, who is on a hunger strike against the alleged rapes in Uttar Pradesh, Jammu and Kashmir, in New Delhi, India. According to news reports Maliwal is sitting on hunger strike demanding that authorities take strict actions against the alleged rapists. EPA

28/50 12 April 2018 Shi'ite pilgrims carry a symbolic casket outside Imam Moussa al-Kadhim's shrine to mark the anniversary of his death in Baghdad, Iraq Reuters

29/50 11 April 2018 Seasonal winds washed tons of debris ashore at Matahari Terbit beach, near Sanur, Bali, Indonesia. Reuters

30/50 10 April 2018 Syrian onlookers gather around rescue teams clearing the rubble at the site of an explosion of unknown origin which wrecked a multi-storey building the previous night in the war-battered country's northwestern city of Idlib. The cause of the explosion in the jihadist-held city, which killed more than a ten people and wounded 80, according to the Britain-based Syrian Observatory for Human Rights monitoring group, was not immediately clear. AFP/Getty

31/50 9 April 2018 Protesters try to block French gendarmes during an evacuation operation in the zoned ZAD (Deferred Development Zone) in Notre-Dame-des-Landes, near Nantes, France. Reuters

32/50 8 April 2018 Competitors cross the start line at the annual Pyongyang Marathon. AFP/Getty

33/50 7 April 2018 The body of journalist Yasser Murtaja, 31, is carried during his funeral in Gaza city. He was shot by Israeli troops while reporting on Palestinian protests on the Gaza-Israel border. Reuters

34/50 6 April 2018 Supporters of the former South African president Jacob Zuma rally prior to his appearance in the KwaZulu-Natal High Court on corruption charges in Durban. Zuma, 75, arrived to face corruption charges linked to a multi-billion dollar 1990s arms deal. The graft case against him was postponed until June 8 after a brief 15-minute hearing. AFP/Getty

35/50 5 April 2018 Palestinian protesters run during clashes with Israeli troops at Israel-Gaza border. Reuters

36/50 4 April 2018 Presidents Hassan Rouhani of Iran, Tayyip Erdogan of Turkey and Vladimir Putin of Russia pose before their meeting in Ankara. Reuters

37/50 3 April 2018 South African school children pause next to a portrait of the late South African anti-apartheid campaigner Winnie Madikizela-Mandela, wife of African National Congress leader Nelson Mandela, at her house in Soweto. South African President Cyril Ramaphosa paid tribute to Winnie, who died on April 2, saying that Nelson Mandela's former wife was a ""voice of defiance"" against white-minority rule. AFP/Getty

38/50 2 April 2018 Jewish priests and civilians take part in the Cohanim prayer during the Passover holiday at the Western Wall in the Old City of Jerusalem. AFP/Getty

39/50 1 April 2018 Pope Francis greets the crowd at St Peter's square after the Easter Sunday Mass in the Vatican. Christians around the world are marking the Holy Week, commemorating the crucifixion of Jesus Christ, leading up to his resurrection on Easter. AFP/Getty

40/50 31 March 2018 Mourners hold back a relative of Palestinian Hamdan Abu Amshah, who was killed along the Israel border with Gaza, during his funeral in Beit Hanoun town. Reuters

41/50 30 March 2018 Israeli soldiers shot tear gas grenades towards the Palestinian tent city protest commemorating Land Day. The day marks the killing of six Arab Israelis during 1976 demonstrations against Israeli confiscations of Arab land. AFP/Getty

42/50 29 March 2018 An emotional Steve Smith is comforted by his father Peter as he fronts the media at Sydney International Airport. Steve Smith, David Warner and Cameron Bancroft were flown back to Australia following investigations into alleged ball tampering in South Africa. Getty

43/50 28 March 2018 French gendarmes escort the coffin of the late Lieutenant Colonel Arnaud Beltrame transported by car during a funeral procession leaving the Pantheon as part of a national tribute in Paris. The French President will lead a national commemoration to hostage-swap policeman Arnaud Beltrame killed in jihadist attack. AFP/Getty

44/50 27 March 2018 Russian President Vladimir Putin visits a memorial made for the victims of a fire in a multi-story shopping center in the Siberian city of Kemerovo. Officials say that the fire escapes were blocked and a PA system was turned off during the fire that killed over 50 people. Kremlin Pool Photo via AP

45/50 26 March 2018 At least 64 shoppers have been killed in fire at a shopping centre in Russia. A further 16 people were still missing after flames broke out at the four-storey Winter Cherry mall in the city of Kemerovo in Siberia, according to Russian Emergencies Minister Vladimir Puchkov. The fire was extinguished in the morning after burning through the night. Parts of the building were still smouldering and the floors of the cinema hall had caved in in places, another emergency official said. Russian Emergencies Ministry via Reuters

46/50 25 March 2018 Syrian civilians gathering for their evacuation from the town of Arbin in the Eastern Ghouta region on the outskirts of the capital Damascus, following a deal with the regime. The deal is expected to see some 7,000 people bussed from Arbin and Zamalka towns and the district of Jobar to a rebel-dominated part of northern Syria. AFP/Getty

47/50 24 March 2018 Students attend the ‘March For Our Lives’ in Washington. In the wake of the Florida attack, there has been a widespread effort to ban assault rifle. Getty

48/50 23 March 2018 Police at the scene of a hostage situation in a supermarket in Trebes. An armed man took hostages in a supermarket in southern France, killing three and injuring about a dozen others, police said. A French minister confirmed the gunman had been shot dead by police. Reuters

49/50 22 March 2018 A boy rows his boat in the polluted waters of the Brahmaputra river on World Water Day in Guwahati, India. Reuters",Syria crisis: Putin warns France against 'ill-considered and dangerous actions',https://www.independent.co.uk/news/syria-crisis-latest-russia-putin-france-dangerous-actions-a8302996.html
