,Concerning,Text,Title,URL
5,syria,"Syria crisis: UNICEF’s response for children

© UNICEF/UN0187723/Sanadiki A UNICEF child protection specialist holds 6-months-old baby Yusuf as his mother queues for services in eastern Ghouta, Syria, March 2018.



DAMASCUS, Syria, 23 April 2018 - Seven years of brutal conflict in Syria and there is no end in sight. Millions of children have never known peace.

Access to basic and lifesaving services has been severely restricted and in some areas completely cut off. More than 13.1 million people, including 5.3 million children, need urgent life-saving assistance in 2018.

>> UNICEF’s response to the Syria Crisis 2018

>> Nearly 5 million Syrian children accessing education despite over seven years of war on children

In 2017, UNICEF also continued to support the efforts of governments and partners to deliver essential services in refugee camps and host communities in Egypt, Iraq, Jordan, Lebanon and Turkey, benefiting an estimated 2.5 million people, including 1.7 million children.

>> UNICEF’s response to the Syria Crisis 2018



© UNICEF/UN0142215/Tom/OCHA A child is checked by a health professional for severe acute malnutrition in East Ghouta, October 2017. UNICEF and partners treated more than 7,000 children in Syria for severe acute malnutrition in 2017.

The situation facing Syrian children

As the Syrian crisis enters its eighth year, it continues to have a devastating impact on children inside Syria and in neighbouring countries. UNICEF is appealing for funding to meet both the immediate and longer term needs of children and their families, wherever they are.

Over two million school-age children are out-of-school in Syria.

1 in 3 schools in Syria cannot be used because it is either damaged, destroyed or sheltering displaced families or used for military purposes.

Half of all healthcare facilities in Syria are either partially functioning or not functioning at all.

The proportion of people living in extreme poverty in Syria (less than US$1.90 per day) doubled from 34% pre-crisis to nearly 70% today.

6.5 million people are facing acute food insecurity in Syria.

More than 5.6 million people, including 2.7 million children, have been living as registered refugees in Egypt, Iraq, Jordan, Lebanon and Turkey since the onset of the conflict.

>> UNICEF’s response to the Syria Crisis 2018

>> UNICEF’s 2018 Syria appeal

Read next:

Cash assistance helps Syrian children with disabilities to pursue their dreams

Child-friendly spaces offer respite for Raqqa’s displaced children

In east Aleppo, clinics on wheels keep children healthy

",Syria crisis: UNICEF’s response for children,https://www.unicef.org/infobycountry/syria_102805.html
6,syria,,Israel strikes Iranian targets in Syria,http://www.globes.co.il/en/article-israel-strikes-iranian-targets-in-syria-reports-1001235172
7,syria,"A recent rally in oil prices to multi-year highs is about much more than the deepening crisis in Syria, analysts told CNBC Thursday.

Crude futures soared to highs not seen since December 2014 on Wednesday, underpinned by greater geopolitical uncertainty in the Middle East and heightened concerns over the prospect of imminent military action from Western powers. Ample crude supplies had pared some of the gains on Thursday, though crude futures remained in touching distance of levels not seen in more than three years.

""I think certainly some of what we are seeing is a little bit of geopolitical premium (but) I don't think it is just about Syria,"" Richard Mallinson, geopolitical analyst at Energy Aspects, told CNBC's ""Street Signs"" Thursday.

Instead, Mallinson argued crude futures had soared to multi-year highs on the back of two main price drivers — concern over the ""wider ramifications"" of heightened geopolitical tension in the Middle East and the looming prospect of the U.S. withdrawing from the Iran nuclear deal.

Oil prices slipped away from 2018 highs on Thursday, with global benchmark Brent trading at $71.15 in early afternoon deals, down 0.8 percent, and WTI trading at $66.38, around 0.6 percent lower.","Oil price rally is about much more than just Syria crisis, analysts say",https://www.cnbc.com/2018/04/12/oil-price-rally-is-about-much-more-than-just-syria-crisis-analysts-say.html
8,syria,"Jan Egeland, Special Adviser to the UN Special Envoy for Syria, was speaking to journalists after a scheduled humanitarian task force meeting in Geneva.

“It’s not over, and that’s what I fear, people think it’s over,” he said, amid reports that “tens of thousands of people” from Rural Damascus were preparing to evacuate to Idlib in the north-west of the country.

“We’ve still only 23 per cent of humanitarian programmes funded and we’re now in May,” Mr Egeland said, warning that there was “no cash …available to humanitarian actors” as “desperate, exhausted people arrive now every day in Idlib. There is no money for the operations.”

He called on countries not to slow down their support “before this marathon of suffering is over.”

Mr. Egeland’s comments come amid ongoing aid-access challenges, in many areas of Syria, linked to mass displacement and acute needs caused by more than seven years of war.

“It’s not over, and that’s what I fear, people think it’s over” - Jan Egeland, Special Adviser to the UN Special Envoy for Syria

One year ago, well over four million people lived in so-called hard-to-reach locations where aid access was extremely unreliable, and hundreds of thousands more were trapped by surrounding forces.

Today, two million people remain in hard-to-reach areas in Syria and 11,000 still live in besieged locations; but the apparent progress in terms of numbers, is deceptive, the UN Special Advisor explained:

“It is a good thing that people are not any longer living massively in besieged areas, and that much fewer people live in hard-to-reach areas. But when this comes at the cost of horrific battles in heavily populated areas, and when it comes because of agreements made by a small group of military people and politicians, too often humanitarian concerns and the protection concerns for the civilian population is lost.”

According to the UN Office for the Coordination of Humanitarian Affairs (OCHA), displacement in some parts of Syria is as high as it was at the beginning of the crisis.

OCHA’s records indicate that for every person who returns home voluntarily, another three people are newly displaced.

Areas of particular concern include Afrin in the north, the former ISIL stronghold of Raqqa, as well as Eastern Ghouta outside Damascus and Yarmouk in the south of the capital - where the UN has highly-restricted access.

But Mr. Egeland said his “worry number one” was Idlib, which is already home to more than two million people.

“They are living out in the open, they are living in congested displacement camps…crammed in collective centres,” he said.

“They arrive at 2am, you know, sort of every night now, just to find that they can hardly get a bed anywhere offered by completely overwhelmed humanitarian actors. So we cannot have a war in Idlib,” he implored.

Amid reports that armed groups are continuing to strike what Mr Egeland called “bad humanitarian agreements” to allow civilians to leave several conflict zones including the besieged Shia towns of Foah and Kafraya in the north-west and Yarmouk south of Damascus, he said it was important that people went to a place of their choosing.

Mr. Egeland also expressed concern for the 40,000 people living in displacement camps near eastern Ghouta – previously home to 390,000 people - amid a reported lack of freedom of movement for civilians, particularly men.

The veteran aid chief also defended the value of the UN-coordinated “deconfliction system” which offers protection to humanitarian locations whose location is communicated to warring parties.

More than 660 sites had now asked the UN to transmit their coordinates to Member States whose militaries are operating within Syria, Mr. Egeland said, and more than 500 of those requests had come this year alone.

“I’m surprised really by those who say they really want to help protect medical facilities, that they are questioning the whole value of trying to get a deconfliction system up in the Syria war, like we have it in Yemen, we have it in Afghanistan, we have it in Mali and many other conflicts,” he added.","‘Marathon of suffering’ in Syria conflict, far from over: UN humanitarian adviser",https://news.un.org/en/story/2018/05/1008832
9,syria,"The State Department has reportedly frozen funding for a humanitarian group working in Syria, threatening the group’s effectiveness.

CBS News reported Thursday that the State Department has put funding for the White Helmets group under ""active review"" as it determines which foreign aid programs to continue funding.

The White Helmets have essentially served as emergency responders in the war-torn country. In the past, the U.S. had provided roughly one-third of the group’s total funding, CBS reported.

""This is a very worrisome development,"" an official with White Helmets told CBS about the funding freeze. ""Ultimately, this will negatively impact the humanitarian workers' ability to save lives.""

ADVERTISEMENT

U.S. officials are reportedly working to see if there are alternative funding sources to cover some of the groups in need.

The move comes as President Trump Donald John TrumpMcConnell trolls Blankenship on Twitter: 'Thanks for playing, Don' Pittenger loses GOP primary fight Blankenship concedes GOP Senate primary in W. Va. MORE more broadly weighs the future of U.S. involvement in Syria.

Trump in March ordered the State Department to freeze $200 million in recovery funds for Syria. Trump has also indicated he’d like to wind down U.S. military involvement in the region.

The U.S. carried out targeted missile strikes in coordination with France and the United Kingdom last month in response to a chemical weapons attack on civilians in the Syrian town of Douma.

However, Trump has repeatedly said in recent weeks that he’d like to bring U.S. troops home from the country “very soon.”

He has also suggested that Middle Eastern nations should have to contribute financially and put troops on the ground in Syria in order to help maintain stability in the region.",State Dept. freezes funding for famed Syrian humanitarian group: report,http://thehill.com/homenews/administration/386169-state-dept-freezes-funding-for-famed-syrian-humanitarian-group
10,syria,"

President Trump announces the U.S. withdrawal from the Iran nuclear deal. (Photo by Jabin Botsford/The Washington Post)

Pulling out of the Iran nuclear deal was the easy part. Now, Donald Trump must implement the strategy he just announced — to confront Iranian aggression and expansionism in all its forms. The key battleground is Syria, but U.S. policy there is still a muddled mess. If Trump is serious about Iran, he needs to get serious about Syria.

Trump barely mentioned Syria in his speech Tuesday announcing U.S. withdrawal from the Iran nuclear deal, other than to include Iranian support for the Bashar al-Assad regime in his list of “sinister activities.” Trump promised to work with allies to block Iran’s “menacing activity across the Middle East” and rightly pointed out that the Iran deal enabled the Iranian regime’s bloody regional expansion.

Treasury Secretary Steven Mnuchin promised in his Tuesday statement that new sanctions on the Iranian Revolutionary Guard Corps would cut off its malign regional activity, including “its support for the brutal Assad regime in Syria.” Sanctioning Iran for its crimes in Syria is good, but far from sufficient. Absent a new comprehensive approach in Syria, the worsening situation there could soon spin out of control.

The Israeli government isn’t waiting for the United States to get serious about doing something in Syria. As Trump was speaking to the American people, the Israeli military was reportedly conducting its latest strikes on Iranian military targets inside Syria. The battle is already raging to prevent Tehran from turning Syria into a major base of Iranian military operations, but the United States seems paralyzed.

Even worse, Trump has already declared that he intends to cut and run from Syria. There’s no sign he’s changed his view on that even after striking the Assad regime for the second time last month in response to the Syrian president’s use of chemical weapons on civilians. Despite what Trump tweeted, the mission is not accomplished.

Trump’s freezing of $200 million of U.S. humanitarian and civil support aid to Syrians living outside the control of Assad and Iranian forces is hugely counterproductive. That shortsighted move is affecting the work of the White Helmets, who are literally saving lives. But it has also taken money away from investigations into the war crimes Trump professes to care about.

We know how national security adviser John Bolton feels about Syria. Just weeks before he joined the White House, he told a group of graduate students that both the Obama and Trump administrations have failed to come up with a strategy for stopping Iranian expansion there.

“The collapse of the ISIS territorial caliphate unfortunately has given Iran the prospect of having an arc of control” from Iran to Lebanon, he said.

The Trump administration is still placing too much emphasis on the Kurds and the Iraqi government, which Bolton calls a “satellite” of the Iranian regime. Iran, Russia and Assad aren’t done spreading misery in Syria, and the risks of inaction are severe.

“Iran was thinking of the next possible conflict and we were not,” Bolton said. “It does require a more comprehensive approach than we’ve got right now, given that there’s not much time before conditions worsen, I certainly hope it’s something they come up with.”

In all the briefings this week to explain Trump’s decision to pull out of the Iran deal, no Trump administration could articulate how Syria fits in.

A senior State Department official delegated to explain Trump’s Iran deal decision to reporters answered a question about Syria strategy as follows: “Well, the President’s focus in Syria is on ISIS,” the official said.

So what would a real U.S. strategy for Syria look like? Well, there’s no shortage of ideas. Retired Gen. Jack Keane and the American Enterprise Institute’s Danielle Pletka laid out one set of policies last month.

They argue that the United States should consolidate and strengthen its position in Eastern Syria, work to support Arab Sunnis there who can govern and stabilize liberated areas, arm and support the remaining rebels in Western Syria who are fighting the regime, and solicit physical and financial support from Arab allies, as Bolton reportedly is trying to do. Then the United States and its allies should protect Syrian civilians by taking out the Assad regime’s capability to slaughter them from the air.

The authors correctly note that only severe pressure on Assad will make a negotiated political solution possible. But their call for thousands more U.S. troops is likely a non-starter for Trump. Syrian activists say that, at the very least, Trump must turn back on the spigot of humanitarian aid to show Syrians the United States is not abandoning them.

“Regardless if the Iran deal was good or bad, the Syrian civilians paid the heaviest price for it,” and Iran is set to commit more atrocities against innocents, said Mouaz Moustafa, executive director of the Syrian Emergency Task Force. “The $200 million of humanitarian support that was withheld by the Trump administration is a fraction of what Syrian civilians desperately need.”

Trump can have both a real Iran strategy and a real Syria strategy, but he can’t have one without the other. The Iran deal is over, but its demise provides a chance — perhaps the last one — for the United States to get Syria right.",Trump’s new Iran strategy succeeds or fails in Syria,https://www.washingtonpost.com/news/josh-rogin/wp/2018/05/09/trumps-new-iran-strategy-succeeds-or-fails-in-syria/
11,syria,"Highlights

Following the end of displacement from East Ghouta and East Qalamoun in Rural Damascus to the northwest of Syria, new agreements were reached in southern Rural Damascus, Yarmouk camp and northern rural Homs, which are likely to result in additional displacements to north-western Syria.

The UN and humanitarian organizations have a funding requirement of an estimated $100 million to provide life- saving assistance and services to people, who were displaced to northern Syria. This is in addition to the $95 million required to assist those who displaced to areas in rural Damascus, or who remained in areas of East Ghouta that recently shifted control including Duma city.

The security situation in the north-west, particularly in Idleb governorate, deteriorated significantly on 26 April following the onset of a series of targeted killings and an increase in what seems to be criminal activity. The poor security environment has a negative impact on civilians and impairs unfettered humanitarians access.

To respond to the acute needs of these new arrivals to northwestern Syria, the Deputy Regional Humanitarian Coordinator launched the Turkey Humanitarian Fund’s second reserve allocation of $4 million. This is to respond to the urgent and specific needs. The allocation is prioritizing Camp Coordination and Camp Management, Shelter and NFIs and Food Security and Livelihoods response.

Situation Overview

As of mid-April, the displacement of internally-displaced persons (IDPs) from the communities that were previously held by non-state armed groups (NSAGs) in Eastern Ghouta came to an end. It is estimated that a total of 66,365 individuals arrived in north-western Syria, of whom 47,188 individuals arrived in Idleb governorate and adjacent NSAG-held areas, and 19,177 individuals arrived in the Euphrates Shield areas in northern rural Aleppo. Negotiations between the parties to the conflict in the Eastern Qalamoun region of Rural Damascus concluded in the movement of 6,235 individuals to northern Syria in mid-April. Of the total, 5,031 individuals ended up in the Euphrates Shield areas in northern rural Aleppo, while the rest moved to Idleb governorate.

Against the backdrop of the ongoing hostilities in southern Damascus city, in late April an agreement was reached between Hayyat Tahrir Al-Sham (HTS), which controls a small area in the Yarmouk camp, and the Government of Syria (GoS) forces. As per the agreement, 141 individuals, including 17 women and 16 children, moved from the Yarmouk camp area to Idleb governorate on 1 May. In exchange, five medical patients, along with 18 family members, as well as 42 prisoners, who were imprisoned in Idleb governorate were allowed to leave to GoS-held areas in Aleppo governorate. The agreement included the evacuation of large numbers of people from the besieged communities of Foah and Kafraya in Idleb governorate; however, disagreements among the parties to the conflict led to the suspension of this movement. At present, it is unclear whether this movement will take place.

In the communities of Yalda, Babella and Beit Sahm, all in southern Rural Damascus, a similar agreement between the parties to the conflict was reached in late April. The first movement of IDPs from these communities took place on 3 May when 1,643 left for the Euphrates Shield areas in northern rural Aleppo. On 4 May, a convoy carrying 618 IDPs, the majority of whom are reportedly Palestinian refugees, arrived in the Euphrates Shield areas, and were later transported to an IDP camp near Deir Balut village in Afrin district. On 5 May, a convoy carrying 2,705 IDPs arrived in the Euphrates Shield areas; while on 7 May, a convoy carrying 1,612 IDPs from southern Rural Damascus arrived in Idleb governorate.

In the northern countryside of Homs, an agreement was reached following several rounds of negotiations between the parties to the conflict. As per the agreement, the registration of those who want to leave to northern Syria reportedly began on 2 May, and the movement was planned for 5 May, but has not yet started. Several local councils, including the Talbiseh and Ar-Rastan councils, in northern rural Homs issued statements to the humanitarian organizations operating in northern Syria to make the necessary preparations for the arrival of IDPs from the northern Homs enclave.

In north-western Syria, and especially in Idleb governorate, the poor security environment is of concern to newly- arrived IDPs and local populations. In addition to the threats of aerial bombardment and inter-factional fighting between the different armed groups, an increase in targeted killings and criminal activity further exacerbates the security environment. While targeted killings against armed group members have routinely been reported in the north-west, it is concerning that some of these targeted killings and criminal incidents were reportedly directed at non-affiliated individuals. Of note was the incident that took place on 3 May, in which a vehicle-borne improvised explosive device exploded near one of the program facilities of an international NGO (INGO) in Dana town. The explosion resulted in the death of four people, including an INGO watchman, and the wounding of 10 people. Due to insecurity, an INGO suspended its operations on 3 and 4 May; while another humanitarian organization was forced to limit the movement of its ambulances, especially during the early morning and late evening hours. On 28 April, the Education Directorate and Idleb University suspended their activities for two days. Aleppo University suspended activities for three days.

Aside from the security challenges, tensions were reported between some host communities and the new arrivals. A local council in southern rural Idleb reportedly asked a humanitarian organization providing assistance to prioritize the local population over the IDPs in their distribution plans. It is perceived that the additional numbers of IDPs are likely to decrease the quality of life and availability of existing services hitherto enjoyed by host communities, thus increasing tensions and negative perceptions towards newly arrived IDPs.

In addition to the security challenges mentioned above and the lack of shelter capacity, which was mentioned in previous reports, several Turkey-based humanitarian organizations were ordered by the Turkish authorities to refrain from the use of Hawala networks (unofficial money transfer services) to transfer funds from Turkey to Syria for their programming. In Turkey, the use of Hawala is not sanctioned by law and organizations that use it might be subjected to hefty fines. Humanitarian organizations are currently exploring solutions and alternative options to transfer funds to Syria.

With regards to the ongoing response, given the additional explosive hazards contamination caused by the continuous aerial bombardments, Mine Action Sub-Cluster partners scaled up the number of mobile teams to provide direct risk education sessions, and are conducting contamination impact surveys and victim data collection. In addition, the Mine-Action Sub-Cluster continues to integrate risk education materials through other clusters such as the Education and CCCM Clusters. The Shelter and NFI Cluster partners continue to distribute assistance to the affected population. As of 1 April, Cluster partners provided NFIs to a total of 53,397 East Ghouta IDPs. Furthermore, a total of 8,114 East Ghouta IDPs received shelter assistance. To respond to the acute needs of these new arrivals to northwestern Syria, the Deputy Regional Humanitarian Coordinator launched the Turkey Humanitarian Fund’s second reserve allocation of $4 million. This is to respond to the urgent and specific needs. The allocation is prioritizing Camp Coordination and Camp Management, Shelter and NFIs and Food Security and Livelihoods response.

For further information, please contact:

Trond Jensen, UNOCHA Turkey Head of Office, jensen8@un.org

Mobile Turkey: (+90) 530 041 9152

Annette Hearns, UNOCHA Turkey Deputy Head of Office, hearns@un.org Mobile Turkey: +90-535-021-9574",Turkey | Syria: Situation in North-western Syria - Situation Report No.4 (as of 8 May 2018),https://reliefweb.int/report/syrian-arab-republic/turkey-syria-situation-north-western-syria-situation-report-no4-8-may
