,Concerning,Text,Title,URL
12,syria,"PARIS (Reuters) - French President Emmanuel Macron said on Monday France will contribute 50 million euros ($61.9 million) toward urgent humanitarian aid for Syria following a meeting with a group of non-governmental organizations (NGO) in Paris.

FILE PHOTO: Internally displaced Syrians from eastern Ghouta queue for food in Herjelleh shelter in Damascus countryside, Syria, April 15, 2018. REUTERS/Ali Hashisho

“This evening I brought together NGOs working on the ground in Syria. Faced with the humanitarian situation, France is setting up an emergency program of 50 million euros,” Macron said on his official Twitter account.

The funds will be allocated to NGOs and U.N. agencies working on the ground in Syria, including the U.N. office for humanitarian affairs, the French president’s office said.

Some two dozens NGOs participated in the meeting with Macron at the Elysee presidential palace, including Action Aid, Handicap International, the Red Cross, and Care.

According to United Nations estimates, some 13 million people including six million children are in need of humanitarian aid in Syria, ravaged by a seven-year war that has displaced millions.

The United Nations said on Thursday that it was hopeful of getting aid to at least 100,000 Syrians who are desperate for help after months of battle ended years of siege around the rebel-held enclave of eastern Ghouta.",France announces 50 million euro humanitarian aid for Syria,https://www.reuters.com/article/us-mideast-crisis-syria-aid/france-announces-50-million-euro-humanitarian-aid-for-syria-idUSKBN1HN2Z5
13,syria,"JERUSALEM (Reuters) - Russia is unlikely to try to limit Israel’s military actions in Syria, Israeli Prime Minister Benjamin Netanyahu said on Wednesday after meeting Russian President Vladimir Putin.

Russian President Vladimir Putin and Israeli Prime Minister Benjamin Netanyahu attend a meeting at the Kremlin in Moscow, Russia May 9, 2018. Sergei Ilnitsky/Pool via REUTERS

Since intervening in the Syrian civil war on behalf of President Bashar al-Assad in 2015, Russia has generally turned a blind eye to Israeli attacks on suspected arms transfers and deployments by Assad’s Iranian and Lebanese Hezbollah allies.

But Moscow’s condemnation of an April 9 strike that killed seven Iranian personnel set off speculation in Israel that Russian patience might be wearing thin.

Netanyahu flew to Moscow on Wednesday to meet Putin, hours after U.S. President Donald Trump quit the Iranian nuclear deal and after Syria accused Israel of carrying out a fresh missile strike on an army base near Damascus.

“Given what is happening in Syria at this very moment, there is a need to ensure the continuation of military coordination between the Russian military and the Israel Defence Forces,” Netanyahu told reporters before departing, referring to a hotline designed to prevent the countries clashing accidentally.

After the talks with Putin, Netanyahu sounded upbeat.

“In previous meetings, given statements that were putatively attributed to - or were made by - the Russian side, it was meant to have limited our freedom of action or harm other interests and that didn’t happen, and I have no basis to think that this time will be different,” he told reporters in a phone briefing.

There was no immediate comment from the Kremlin.

The Syrian Observatory for Human Rights said on Wednesday that the overnight air strike near Damascus killed at least 15 people, including eight Iranians. Israel has neither confirmed nor denied responsibility.

But the Israelis have said they are on high alert for a possible attack by Iranian forces in Syria, after Tehran vowed to avenge the April 9 strike. Israel has pledged to prevent Iran and Hezbollah from forming a Lebanese-Syria front against it.

Netanyahu’s relationship with Putin has been buoyed by a long-running Israeli courting of Russian sensitivities.

During his 10-hour Moscow visit, the Israeli leader attended, alongside Putin, annual Red Square celebrations of the anniversary of the end of World War Two. Israel recognizes the Russian date, May 9. Most Western powers mark it on May 8.

“When the president of Russia invites the prime minister of the state of the Jews to stand alongside him at the parade symbolizing the Red Army’s victory over the Nazis, its liberation, also, of the (concentration) camps, of Jews and others – for Russia, that is very significant,” Israeli Intelligence Minister Israel Katz told the Ynet news site.

Last week, Israeli Defence Minister Avigdor Lieberman used a Russian newspaper interview to remind Moscow that Israel had not joined Western sanctions against it over the Crimea crisis and the poisoning of a Russian ex-spy in Britain.",Russia unlikely to limit Israeli actions in Syria: Netanyahu,https://www.reuters.com/article/us-mideast-crisis-syria-israel-russia/russia-unlikely-to-limit-israeli-actions-in-syria-netanyahu-idUSKBN1IA2UA
14,syria,"A family displaced from Eastern Ghouta by fighting lives in a small shelter they put up themselves in Herjalleh, Syria. © UNHCR/Ola Kabalan

With violence in several areas of Syria UNHCR, the UN Refugee Agency today expresses its alarm at the civilian deaths this is causing as well as spiralling new displacement. This is on top of a humanitarian situation that is already desperate; Syrian civilians have more than suffered enough.

Of particular concern is the situation in Douma in Eastern Ghouta where tens of thousands of civilians remain trapped. We estimate that more than 133,000 people have fled Eastern Ghouta over the past four weeks. This is almost three times the number we reported on 20 March and includes some 45,000 people who are currently being accommodated in eight collective shelters in Rural Damascus. An estimated 44,000, mainly women, children and elderly have so far been allowed to leave the collective shelters after completion of their security screening. UNHCR teams are working with UN and NGO partners to help improve the conditions at these collective shelters, which remain congested. We continue to appeal to all parties to the conflict for proper protection of civilians, including freedom of movement and free choice over where to stay. Family unity must also be respected.

Since the outset of this emergency, as part of the wider UN response, UNHCR has been working to address the needs of the displaced. Our staff are paying daily visits to all the collective shelters where displaced people from Eastern Ghouta are accommodated, to assess needs and help address them. Overcrowded shelters and insufficient sanitation facilities are posing serious health risks. Common concerns we are hearing are a lack of civil documentation, restrictions on freedom of movement, family separation and SGBV risks.

UNHCR’s response to the Eastern Ghouta emergency encompasses the delivery of core relief items, shelter support and protection services. Nearly a quarter or a million urgently need aid, and more than 60,000 people have been reached so far. UNHCR is purchasing clothes locally as many people fled with nothing more than what they were wearing. In addition to a massive shelter effort, UNHCR protection partners have provided legal counseling to 22,000 people.

Meanwhile, we are facing similar challenges and concerns in responding to the humanitarian needs of more than 137,000 Syrians displaced from the Afrin region. Most are scattered across Tal Rifaat, Nubol, Zahraa and surrounding villages in northwest Aleppo, living in makeshift shelters, damaged or unfinished buildings, mosques, warehouses and open-spaces. Some 3,500 people are being accommodated in a tented camp in Fafin to the north of Aleppo. In addition we have distributed more than 1,400 kits for shelter rehabilitation and redeployed 1,000 UNHCR family-sized tents, for use as needed.

Displacement from Afrin has subsided and some returns to the city are taking place. The challenging journey back home for the displaced may take up to four days in some cases. Movements of displaced people towards Aleppo and other government-controlled areas continues to be constrained.

For more information on this topic, please contact:",UNHCR alarm at escalating Syria humanitarian needs,http://www.unhcr.org/news/briefing/2018/4/5acc75974/unhcr-alarm-escalating-syria-humanitarian-needs.html
15,syria,,"US hampering humanitarian aid deliveries to Syria's Rukban, al-Tanf and Raqqa",http://tass.com/world/1002923
16,syria,"Hours after Syria strikes, the US, UK and France circulate draft resolution calling for aid access and Assad engage in peace talks

The United States, Britain and France have launched a new bid at the United Nations to investigate chemical weapons attacks in Syria in the wake of US-led missile strikes against Bashar al-Assad’s regime.

Despite Trump's bluster, it's unclear what Syria strikes accomplished Read more

Hours after the strikes against chemical weapons facilities in Damascus and Homs, the three allies circulated a joint draft resolution at the security council that also called for unimpeded delivery of humanitarian aid, enforcement of a ceasefire and a demand that Syria engage in UN-led peace talks.

The move signalled the west’s resolve to return to diplomacy after pre-dawn attacks that Donald Trump praised as “perfectly executed” and “mission accomplished”.

The new diplomatic push came after a stormy security council meeting called by Russia, which branded the military action an “aggression” against Syria and sought condemnation. That bid however failed, with only China and Bolivia voting alongside Russia to condemn the missile strikes. Eight countries opposed condemnation while four abstained.

The draft resolution by the US, UK and France would establish an independent investigation of allegations of toxic gas attacks in Syria with the aim of identifying the perpetrators. Russia in November used its veto three times to bury a previous UN-led inquiry which found that Syrian forces had dropped sarin on the town of Khan Sheikhun in April last year.

Theresa May faces anger over Syria raids as Trump declares ‘mission accomplished’ Read more

The measure would instruct the Organisation for the Prohibition of Chemical Weapons (OPCW) to report within 30 days on whether Syria has fully disclosed its chemical weapons stockpile. Teams from the chemical weapons watchdog had been due to visit Douma when Trump ordered Saturday’s strikes.

Play Video 2:05 What you need to know about the Syria strikes – video report

The west has accused Syria of failing to live up to its commitment to scrap its chemical weapons program, under a 2013 deal reached between the US and Russia.

On the humanitarian side, the measure demands medical evacuations and safe passage for aid convoys to be allowed to all areas.

The text calls for a ceasefire resolution adopted in February – but which never materialised – to finally take hold and demands that Assad’s government engage in peace talks “in good faith, constructively and without preconditions”.

Several rounds of peace talks held under UN auspices in Geneva have failed to yield progress, deadlocked over demands that Assad make way for a political transition.

Negotiations on the draft resolution are set to begin on Monday, but diplomats said it remained unclear when the council would vote on the proposal.

Western diplomats said they were ready to allow time for negotiations to make every effort to bring Russia aboard. Moscow has used its veto 12 times at the security council to block action targeting its Syrian ally.

Addressing the security council on Saturday, US ambassador Nikki Haley said the US was confident the military strikes had crippled Syria’s chemical weapons program.

Haley warned that the US was “locked and loaded” and ready to strike again if any new chemical attack was carried out in Syria.

Russian ambassador Vassily Nebenzia accused the west of “hooliganism” and demanded it “immediately end its actions against Syria and refrain from them in the future”.

“You are not only placing yourselves above international law, but you are trying to rewrite international law,” Nebenzia said.

The US, Britain and France launched air strikes in response to a suspected chemical attack in the rebel-held town of Douma a week ago that killed at least 40 people.

The council has met five times this week on Syria amid repeated pleas from UN secretary general, Antonio Guterres, to end divisions over Syria.",Syria crisis: trio of allies launch new bid for UN chemical weapons inquiry,https://www.theguardian.com/world/2018/apr/15/syria-crisis-allies-un-chemical-weapons-inquiry-douma
