,Concerning,Text,Title,URL
11,ukraine,"

A Ukrainian fighter stands in a building damaged by shelling in Avdiivka, Ukraine, on Feb. 4, 2017. (Evgeniy Maloletka/AP)

The fighting in eastern Ukraine’s Donbas region is entering its fifth year. More than 10,000 people have been killed in this persistent conflict; 2,800 were civilians. Nearly two million people have been internally displaced or put at risk if they remain in their homes.

Today, the Donbas war is among the worst humanitarian crises in the world, with frequent attacks occurring from both sides across the oblasts (provinces) of Donetsk and Luhansk. Before the war, this compact, heavily urbanized and industrialized region held nearly 15 percent of Ukraine’s population (6.6 million) and generated 16 percent of its gross domestic product.

Now it’s a war zone. And our research has documented that, as its hospitals and medical facilities are destroyed — perhaps even targeted — its citizens are being deprived of basic health-care services, echoing Syria’s similar if larger crisis.

So what happened in Ukraine?

Let’s review quickly how that happened.

In 2014, Ukraine was divided between those who wanted to affiliate with Russia and those who leaned toward Europe and NATO. In Kiev, in what was called the Maidan Revolution, the pro-Europe faction overthrew the kleptocratic and Russian-leaning Ukrainian President Viktor Yanukovych.

[ When does Russian propaganda work — and when does it backfire? Here’s what we found. ]

Reactions in the Donbas, a region bordering Russia and composed of ethnic Russians and Ukrainians, varied. Separatist forces, abetted by Russia, began fighting the Ukrainian military, soon fortified by backup from Russian army units. That fighting has damaged the Donbas’s basic infrastructure, particularly hospitals and clinics — making it hard for the government to deliver core services such as health care.

How we did our research

Combatants often attack hospitals. In Syria, human rights organizations and the U.N. Security Council have denounced these attacks as violations of international law. Fewer observers have noticed the attacks on Ukraine’s hospitals, even though the World Health Organization (WHO) documented 33 such attacks from 2014 through 2016.

As part of a larger study, we compiled an inventory of the 247 registered hospitals and clinics in the Donbas. We then examined U.N. reports, investigations by nongovernmental organizations, central news reports in Ukraine and Russia, and Donetsk and Luhansk newspapers for evidence of health-care infrastructure damage from 2014 through 2017. We geo-located all specific reports of damage, eliminating duplicates.

We found that one-third of all Donbas medical facilities had been damaged

Our resulting geospatial database reveals patterns of “bricks and mortar” damage to the health-care system, as you can see below.

Adjusting for multiple hits, we found that 82 medical facilities — one-third of all those in the Donbas — had reported damage. That’s far more than those reported by WHO.

However, the bricks-and-mortar damage doesn’t show casualties among medical personnel or the loss of vehicles. Nor does it show how local civilians suffered severe damage to their housing and access to heat, electricity and clean water. Many of the residents who’ve stayed must now risk a great deal to reach even basic health care.

[ Could U.N. peacekeepers help end the war in Ukraine? ]

Is this a surprise? Are health-care facilities deliberately attacked?

There are no safe places in a major war

The Donbas conflict is often described as “hybrid warfare,” something akin to Russia’s seizure of Crimea with “little green men.” This is a serious mischaracterization.

Yes, at first it was a skirmish between Ukrainian security forces and local separatist militias, bolstered by Russian mercenaries. But by late 2014, the fighting involved large numbers of troops including Russian army regulars, outfitted with armor and artillery.

Most of the health-care damage happened during the heaviest fighting, before February 2015. Since then, damage has been limited to breaks in the cease-fire agreements. Health infrastructure is damaged when it’s located near the heaviest fighting. Away from the front, we found little harm to medical facilities.

Mapping our data illustrates that attacks on health-care facilities are concentrated in the city of Donetsk and its environs; along the cease-fire line, where the front stabilized after February 2015; and around the city of Sloviansk, which was occupied by separatist forces but later retaken by Ukrainian troops. Along the coast of the Sea of Azov, advances by Russian troops and separatists resulted in a cluster of attacks near Mariupol. Northern Luhansk Oblast and western Donetsk Oblast saw little heavy fighting, and therefore little damage.

Were hospitals targets?

Many health-care facilities in the Donbas were destroyed. Was this deliberate — or was it collateral damage? We looked at what types of weapons were used, for some clues.

In the Syrian civil war, heavy aerial bombardment destroyed a vast amount of infrastructure. By contrast, the Donbas fighting has used conventional artillery, heavy mortars and rockets such as the notorious Grad (“Hail”) system. Such indirect-fire weapons are not accurate enough to target specific buildings. Those using them often can’t see the target — so to destroy a particular target building, such weapons would succeed only when used in sufficient numbers, and would leave behind a great deal of collateral damage.

Some medical locations might have been attacked by shorter-range, direct-fire weapons such as tanks, antitank missiles or rocket-propelled grenades. Examining both witness accounts and the blast patterns in photos of derelict health-care facilities, we find that the damage appears to be what we would expect from artillery rounds or rockets.

It looks more like hospitals and clinics have been collateral damage than targets

When military targets are attacked and are fighting back, it’s hard to conclude which side damaged the surrounding civilian infrastructure. Reliable reports document that both sides have quartered troops in or fired from hospitals, blurring the line between combatant and noncombatant.

In other conflicts, forensic examination of fragments or unexploded ordnance helps identify the type of munitions used to attack hospitals — making it easier to conclude which side attacked which target. But in the Donbas war, both sides mostly use the same weaponry, making it difficult to deduce which side attacked the health-care facilities.

Were attacks on health-care facilities deliberate? Our preliminary examination suggests that they haven’t been targeted. They appear to have suffered collateral damage, and have been hit by both sides. To draw conclusions about responsibility, one would need to employ the sophisticated open-source data and methods used to analyze the Syrian war damage.

No matter who is responsible, the fighting has damaged not just health-care services, but other civilian infrastructure such as housing, schools and election facilities — while killing, terrifying and displacing civilians. If Ukraine can’t deliver essential services, the war has undermined the legitimacy of the state and made it harder to reach a reconciliation if and when the conflict ends.

Cynthia Buckley is professor of sociology at the University of Illinois at Urbana-Champaign.

Ralph Clem is emeritus professor of geography at Florida International University.

Jarod Fox is a research assistant at the University of Illinois at Urbana-Champaign.

Erik Herron is professor of political science at West Virginia University.",The war in Ukraine is more devastating than you know,https://www.washingtonpost.com/news/monkey-cage/wp/2018/04/09/the-war-in-ukraine-is-more-devastating-than-you-know/
12,ukraine,"Top adviser to Vladimir Putin Vladislav Surkov said Monday that Russia has abandoned its centuries-long aspirations of integrating into the West and is bracing for a new era of ""geopolitical loneliness."" Surkov wrote this in an article for Russia in Global Affairs magazine released April 9, 2018.

Surkov wrote in the piece for Russia in Global Affairs that ""Russia's epic journey toward the West"" is over, marking an end to its ""repeated vain attempts to become part of Western civilization"" over four centuries.

Russia-West ties have sunk to post-Cold War lows over the Ukrainian crisis, the war in Syria and other issues, most recently the poisoning of an ex-spy in Britain that triggered mass expulsions of diplomats.

Surkov, a longtime Putin aide who served as his top strategist for many years and currently works as the presidential adviser on Ukraine, wrote: ""Loneliness doesn't mean complete isolation,"" but added that Russia's openness would be limited.

Russia's 2014 annexation of Ukraine's Crimean peninsula and Moscow's support for separatists in eastern Ukraine triggered U.S. and European Union sanctions that together with a slump in global oil prices sent the Russian economy into a two-year recession.

A 2015 peace deal brokered by France and Germany helped reduce the scale of the hostilities in eastern Ukraine, but regular clashes have continued.

Surkov, who held several rounds of fruitless talks on the Ukrainian crisis with U.S. counterpart Kurt Volker, said 2014 marked a watershed that in his view launched ""a century (or perhaps two or three centuries) of geopolitical loneliness.""

""Russia, without doubt, will engage in trade, attract investments, exchange know-how and fight wars ... compete and cooperate, cause fear, hatred, curiosity, sympathy and admiration,"" Surkov wrote. ""But without false goals and self-denial,"" Surkov wrote.

As it was reported earlier, Vladislav Surkov coordinates militants in Donbas occupied territories, determines internal and personnel issues in the so-called ""LNR"" and ""DNR.""

Surkov was banned entry to the United States and EU countries since March 2017 over his possible involvement in the planning of the annexation of Crimea.","Putin’s aide predicts Russia an era of ""geopolitical loneliness""",https://112.international/politics/putins-aide-predicts-russia-an-era-of-geopolitical-loneliness-27425.html
13,ukraine,"The humanitarian situation in eastern Ukraine remains critical. The hostilities picked up again on both sides of the ‘contact line’ after a relative lull in January, while harsh weather conditions, with temperatures plummeting to below -20 Celsius over the last week of February further deepened people’s suffering. Disruption of critical water and power supply infrastructure due to heavy snow or indiscriminate shelling meant that at least 70 settlements on both sides of the ‘contact line’ remained without heat or water, sometimes for days. Interruption of operations of the 1st Lift Pumping Station of the South Donbas Water Pipeline due to harsh weather alone left 100,000 people without water or heat for more than 24 hours. Of alarming concern is the incidents targeting staff and infrastructure at the Donetsk Filter Station (DFS) which supplies water to 345,000 men, women and children in eastern Ukraine. Between 6 to 14 March, the DFS staff was shot at on four occasions. While a temporary window of silence has been obtained, sustained safety and protection of civilian workers is necessary to avoid interruption of water and inter-dependent heating system. Protection and wellbeing of civilians remain a major concern, due to daily shelling and heightened risk of mines, Explosive Remnants of War (ERW) and Unexploded Ordnances (UXOs) explosion. OHCHR recorded 5 civilians killed and 20 injured in the first two months of 2018. While humanitarian needs of the most vulnerable conflict-affected people continue to rise, the human cost of the protracted crisis is largely forgotten. In order to break the impasse, on 28 February, the European Union for Humanitarian Aid and Civil Protection (ECHO) and the United Nations organized a high-level conference with an aim to bring the international attention to the plight of 4.4 million people affected. Over 100 participants from various European Union (EU) Member States, International Organizations and the UN agencies attended the conference, where the EU announced EUR 24 million to the humanitarian response in Ukraine in 2018.",Ukraine: Humanitarian Snapshot (as of 16 March 2018),https://reliefweb.int/report/ukraine/ukraine-humanitarian-snapshot-16-march-2018
14,ukraine,"Military Drones Prove Vulnerable to GPS Jamming

Russian R-330Zh Zhitel GPS / satcom / cellular jammer deployed in an exercise, 2017 (topwar.ru)

By MarEx 2018-04-10 20:50:00

Maritime security experts have warned for years about the hazards that simple GPS jamming methods could pose to merchant shipping. According to American defense officials, the Russian military is deploying a weaponized form of GPS jamming that is effectively blocking some U.S. drone aircraft operations over Syria - and is even affecting drones equipped with anti-jamming technology. As more and more operators contemplate the deployment of autonomous vessels and aircraft in the maritime space, the vulnerability of high-specification military hardware to GPS jamming may pose a cautionary tale.

So far, the attacks have only affected small surveillance drones, four officials told NBC News, not the U.S. Air Force's armed Predator and Reaper models. They declined to discuss whether any of the small aircraft had gone down as a result of jamming. High-end drones like the Global Hawk, Predator and Reaper are equipped with inertial navigation systems, which do not depend upon external signals for positioning, in addition to their GPS receivers.

According to the U.S. Army's Asymmetric Warfare Group, the Russian military has invested heavily in electronic warfare gear in recent years, and its units ""layer these systems to shut down FM, SATCOM, cellular, GPS, and other signals.” Russian forces have used these jamming capabilities before. During the Ukraine crisis in 2014, Russian forces grounded a U.N. surveillance drone fleet during operations in Eastern Ukraine using GPS jamming, and Ukrainian forces reported widespread comms degradation. Last year, the U.S. Maritime Administration reported a GPS spoofing attack off the Russian Black Sea port of Novorossiysk, which caused the GPS displays on multiple merchant ships to show incorrect positions. The incident was not definitively linked to Russian forces, but reports indicate that it affected at least 20 ships.

Jamming coincides with suspected poison gas attack

The jamming incidents over Syria have been happening for several weeks, according to NBC News. The time period and the location of the jamming overlap with the latest series of suspected chemical weapons attacks on civilians in rebel-held eastern Ghouta, a suburb of Damascus, and U.S. officials told NBC that they believed that Russian forces used the jamming to impede aerial surveillance after the incidents. The U.S. is currently considering retaliatory measures for the use of chemical weapons on a civilian population; Russia, which backs the Syrian government regime of Bashar al-Assad, has denied that the attacks occurred.

Five years ago, Ghouta was the scene of another massive chemical weapons attack: on August 21, Syrian forces used rockets filled with sarin gas to kill between 280 and 1,700 people in the region, including civilians. To prevent a Western military intervention, Syria's government reached a diplomatic agreement with the U.S. to dispose of all of its chemical weapons, with Russia as the guarantor of the program. The U.S. alleges that Russia has not fulfilled this role. “For Russia to claim that the Assad regime has eliminated its chemical stockpiles is just absurd. Its continued denial of the Assad’s regime culpability in the use of chemical weapons is simply incredible,” U.S. disarmament ambassador Robert Wood said in February.

The opinions expressed herein are the author's and not necessarily those of The Maritime Executive.",Military Drones Prove Vulnerable to GPS Jamming,https://www.maritime-executive.com/editorials/military-hardware-proves-vulnerable-to-gps-jamming
15,ukraine,"Turchynov says Vilkha is better than the Russian analog Smerch by all odds.

Secretary of the National Security and Defense Council of Ukraine Oleksandr Turchynov has said Ukraine tested the Vilkha missile system in Odesa region on April 10.

According to Turchynov, the current tests are ""the final stage of a large-scale project of Ukrainian scientists, designers and manufacturers,"" the NSDC's press service reports.

Read alsoModernized anti-aircraft missile system Pechora tested in Ukraine (video)

""Thanks to the efforts of all those who worked on this project, we have received a powerful missile weapon, which is better than the Russian analog Smerch by all odds,"" he said.

Turchynov said the tests would go through several stages, during which the customer will check all the tactical and technical characteristics of missiles for compliance with the parameters set. He explained that the missiles would be launched in full combat equipment at predefined targets. ""Taking into account the ability to guide missiles, a separate target will be set for each of them,"" he added.

Turchynov stressed that after the completion of these large-scale tests, the Vilkha missile system would be accepted for the army's use, and the Ukrainian defense-industrial complex will launch their mass production.

""I want to emphasize that the first stage of the tests, during which the missiles hit particular targets at the maximum shooting range, was successful and the testing program was fully implemented,"" he said.",Turchynov: Ukraine tests Vilkha missile system (Photo),https://www.unian.info/war/10075205-turchynov-ukraine-tests-vilkha-missile-system-photo.html
16,ukraine,"On April 4, Volodymyr Yelchenko, the Ukrainian ambassador to the United Nations, spoke at the University about the now four-year-long crisis of Russia’s annexation of Crimea and the brutal “hybrid war” being waged in the provinces of Donetsk and Luhansk.

Yelchenko began by summarizing the events of the past four years.

According to Yelchenko, the crisis began on Feb. 26, 2014, with “little green men” — unmarked Russian soldiers without insignias, armed with modern weapons, and moving in armored vehicles.

Yelchenko explained that these soldiers seized key infrastructure sites and that overnight, the Crimean parliament was seized and a pro-Russian government took power. This government promptly held a referendum on whether to stay in Ukraine or join Russia.

But no one in the international community regarded Crimea’s referendum as official, according to Yelchenko. Then, on March 18, Crimea was annexed by the Russian Federation.

Tensions quickly expanded beyond Crimea. As Ukrainians ousted their pro-Russian president Viktor Yanukovych, separatist groups in the eastern Ukrainian provinces of Luhansk and Donetsk began an active armed conflict with the Ukrainian government, supported by Russian hardware and personnel support, Yelchenko explained.

This quasi-war has since flared up occasionally. Yelchenko and the Ukrainian government estimate the total death count to be approximately 10,000, while hundreds of thousands have been displaced.

Ukraine has since improved relations with the West, distancing itself from the expansionist Russia, Yelchenko explained, citing that Ukrainian citizens can travel to European Union states without visas, bringing Ukraine closer to Western Europe.

The United States has placed heavy trade sanctions on the Russian Federation, which, according to Yelchenko, have reduced the Russian gross domestic product by about 35 percent.

Meanwhile, without seven percent of its land and while fighting an active civil war, Ukrainian GDP has risen up to two percent per quarter, mostly due to closer ties with the European Union.

However, while the issue has largely disappeared from the public’s eye, casualties occur in Ukraine almost daily, according to Yelchenko.

“All human life is precious. One death is a tragedy,” Yelchenko said.

Russia’s goals remain in line with the goals of the Russian Empire and the Soviet Union, primarily territorial expansion, and Russian tactics and technology have evolved greatly since the collapse of the USSR, Yelchenko said.

For the West, there are several critical conclusions to draw on, according to the ambassador. Fake news, cyber attacks on critical infrastructure such as power plants, and the use of internet trolls have all been implemented to create a doctrine of hybrid war, according to Yelchenko.

Yelchenko explained that no one is entirely sure what hybrid warfare is. This hybrid war strategy has been implemented alongside traditional military tactics and equipment to take territory without drawing international attention or responses.

It is suspected that these same tactics have been used to influence foreign elections and governments far beyond the nations bordering Russia.

Yelchenko’s talk was sponsored by the Center for International Security Studies; the Princeton Institute for International and Regional Studies; the Program in Russian, East European and Eurasian Studies; and the Liechtenstein Institute on Self-Determination. The lecture took place at 4:30 p.m. in McCosh 50.",Ukrainian ambassador to the U.N. talks Crimean crisis,http://www.dailyprincetonian.com/article/2018/04/ukrainian-ambassador-to-the-un-talks-crimean-crisis
17,ukraine,"FILE - In this Feb. 13, 2012 file photo, , Russian Prime Minister Vladimir Putin, right, speaks to Vladislav Surkov, deputy prime minister in charge of economic modernization, during a visit in Kurgan, Russia. Surkov wrote in an article for Russia in Global Affairs magazine released Monday, April 9, 2018 that Russia has abandoned its centuries-long aspirations of integrating into the West and is bracing up for a new era of ""geopolitical loneliness."" (Alexei Nikolsky/RIA Novosti Kremlin via AP) The Associated Press

By VLADIMIR ISACHENKOV, Associated Press

MOSCOW (AP) — Russia has abandoned its centuries-long aspirations of integrating into the West and is bracing for a new era of ""geopolitical loneliness,"" a top adviser to President Vladimir Putin warned in a magazine article released Monday.

Vladislav Surkov wrote in the piece for Russia in Global Affairs that ""Russia's epic journey toward the West"" is over, marking an end to its ""repeated vain attempts to become part of Western civilization"" over four centuries.

Surkov's article echoes statements from Putin. The Russian leader sought to forge close ties with the West after his first election in 2000, but later grew increasingly critical of the United States and its NATO allies. He accuses them of shunning Moscow's offers of cooperation and trying to sideline and weaken his country.

Russia-West ties have sunk to post-Cold War lows over the Ukrainian crisis, the war in Syria and other issues, most recently the poisoning of an ex-spy in Britain that triggered mass expulsions of diplomats.

Surkov, a longtime Putin aide who served as his top strategist for many years and currently works as the presidential adviser on Ukraine, wrote: ""Loneliness doesn't mean complete isolation,"" but added that Russia's openness would be limited.

Russia's 2014 annexation of Ukraine's Crimean Peninsula and Moscow's support for separatists in eastern Ukraine triggered U.S. and European Union sanctions that together with a slump in global oil prices sent the Russian economy into a two-year recession.

A 2015 peace deal brokered by France and Germany helped reduce the scale of the hostilities in eastern Ukraine, but regular clashes have continued.

Surkov, who held several rounds of fruitless talks on the Ukrainian crisis with U.S. counterpart Kurt Volker, said 2014 marked a watershed that in his view launched ""a century (or perhaps two or three centuries) of geopolitical loneliness.""

He lamented futile attempts at Westernization by past Russian rulers, noting that Russia has attempted to imitate the Netherlands, France and the United States and ""edge into the West"" during its history.

""Our elite perceived the ideas and trepidations coming from it with a huge and probably excessive enthusiasm,"" Surkov said.

Not any more, he warned.

""Russia without doubt will engage in trade, attract investments, exchange know-how and fight wars ... compete and cooperate, cause fear, hatred, curiosity, sympathy and admiration,"" Surkov wrote. ""But without false goals and self-denial.""

The 53-year-old Surkov, a colorful character who admires American rapper Tupac Shakur and has written novels, ended his piece on a somewhat enigmatic note.

""It's going to be tough,"" he said, adding that Russia will face a long journey ""through the thorns to the stars.""

""It'll be fun,"" Surkov wrote. ""And we will see the stars.""",Kremlin Aide: Russia's Centuries-Long Romance With West Over,https://www.usnews.com/news/world/articles/2018-04-09/kremlin-aide-russias-centuries-long-romance-with-west-over
