,Concerning,Text,Title,URL
5,ukraine,"Kyiv hotel prices go sky-high for Champions League Final day

Kyiv hotel prices go sky-high for Champions League Final day 136

Adidas accused of historical insensitivity for its Russia ‘tank dress’

Adidas accused of historical insensitivity for its Russia ‘tank dress’ 595

With the conflict in eastern Ukraine entering its fifth year, 1.5 million people are registered as IDPs.

Read more here.",UNIAN: IOM reports ‘shocking’ 97 percent shortfall in humanitarian funding for Ukraine’s conflict-affected,https://www.kyivpost.com/ukraine-politics/unian-iom-reports-shocking-97-percent-shortfall-humanitarian-funding-ukraines-conflict-affected.html
6,ukraine,"Funding required: $25.27 B

Funding received: $6.26 B

Funding percentage: 24.8%

People in need: 130.6 M

People to receive aid: 95.3 M

Countries affected: 40

As of April 2018, UN-coordinated Humanitarian Response Plans (HRPs) and the Syria 3RP Regional Refugee and Resilience Plan require US$25.27 billion to meet the humanitarian needs of 95.3 million crisis-affected people in 26 countries.

Three significant humanitarian resource mobilization events took place in April: the High-Level Pledging Event for the Humanitarian Crisis in Yemen, 3 April, Geneva, co-hosted by the UN, Sweden and Switzerland, where US$2.01 billion in contributions for 2018 were announced by 40 entities and a further $20.2 million were announced in multi-year funding; the Humanitarian Conference on the Democratic Republic of the Congo, 13 April, co-hosted in Geneva by the UN, the Netherlands and the EU, where $528.1 million were pledged by 22 donors for 2018 and a further $38.7 million for 2019-2020; and the Supporting the Future of Syria and the Region Brussels II Conference, 24-25 April, co-hosted by the UN and the EU. This drew 36 announcements of humanitarian funding totalling $4.4 billion for 2018 and an additional $3.4 billion for 2019-2020.

The humanitarian funding outlook for the protracted, entrenched humanitarian crisis in DPRK is particularly concerning, with a persistent risk that geo-political tension – even with the recent positive developments – could dampen funding. 10.3 million people in DPRK are estimated to be undernourished. More than one-quarter of children are stunted and 4% wasted, while about 30% of women of reproductive age are anaemic. The lack of safe water and the poor sanitation contribute to high levels of diarrhoea, pneumonia and malnutrition, which are the most common causes of death among young children. The 2018 Needs and Priorities Plan released in April calls for $111 million to provide food assistance, health and nutrition services and improved access to safe water and sanitation for 6 million highly vulnerable people.

On 20 April, the Resident and Humanitarian Coordinator in Ukraine briefed Member States in New York on the dire humanitarian situation faced by 4.4 million conflict-affected people after four years of conflict in eastern Ukraine.

Disrupted access to critical facilities and diminished livelihoods mean that 3.4 million people are without basic supplies and services and need protection and life-saving assistance. Ukraine has the highest proportion of elderly people affected by humanitarian crisis in the world. Some 1.5 million Ukrainians have been displaced across the country, and some 200,000 live in daily fear of shelling. Funding for the HRP is urgently needed.

In 2018, as many as 7 million people in South Sudan need humanitarian assistance to cope with unprecedented levels of food insecurity and grave protection violations including conflict-related sexual violence. This is the world’s third largest refugee crisis: more than 4.2 million people have been displaced, including 1.8 million IDPs and more than 2.4 million refugees.

Severe food insecurity continues to rise as people are unable to plant or harvest and have limited access to humanitarian assistance. With the lean season beginning in May, urgent funding is required to save lives and resources. On 27 April, the DSRSG/RC/HC for South Sudan formally invited the USG to support him in delivering three key messages when he visits the country in mid-May. Namely, calling for a sustainable political solution to the conflict to bring an end to the humanitarian crisis, with IGAD-led peace talks expected to resume in May; urging parties to the conflict, including the numerous splinter groups, to address the insecurity that affects civilians and aid workers; and advocating for resources towards the HRP which is currently funded at 21%.

Humanitarian needs in the Central African Republic have increased from 2.2 million people in need in early 2017 to 2.5 million this year, with a multiplication of hotspots. The spike in tensions and armed violence that erupted in April is also affecting the capital, Bangui. Over the first quarter of 2018, the number of internally displaced people increased by 70% over the first quarter of 2017, and the number of refugees increased by 30%; effectively, 25% of Central Africans are currently displaced either as IDPs or refugees. Underfunding remains one of the biggest impediments to stepping up the humanitarian response. By end April 2018 the HRP had received less than 10 per cent of its $515.6 million requirements.

By 30 April, 21 donors had contributed a combined $278 million (including pledges) to 17 country-based pooled funds (CBPFs), which translated into financial support for 308 humanitarian projects implemented by 229 partners. These included international NGOs which received $55.3 million (42% of total budget allocations) while UN agencies received $42.6 million (32% of allocations). Support to national NGOs included $33.6 million (25% of allocations) and to the Red Cross / Crescent movement $0.6 million (0.5% of total allocations). The largest amounts were channelled to Yemen ($77.9 million), the whole of Syria response ($41.7 million), Sudan ($28.2 million) and the Democratic Republic of the Congo ($26.5 million). New reserve allocations were launched by the Ethiopia Humanitarian Fund (HF) for $16.2 million and by the occupied Palestinian territories HF for $2.2 million, on top of its first standard allocation of the year for $3.9 million, to respond to immediate health and protection needs in the Gaza Strip. The Turkey HF launched a second reserve allocation for $4 million to cover urgent life-saving needs of people displaced inside besieged and hard-to-reach areas in Syria.",2018 Humanitarian Funding Update (as of April 2018),https://reliefweb.int/report/world/2018-humanitarian-funding-update-april-2018
7,ukraine,"Despite the ‘Spring’ and ‘Easter’ ceasefires which began on 5 and 30 March respectively, clashes continued along both sides of the ‘contact line’ with severe impact on civilians. In March, shelling, mines and Explosive Remnants of War (ERW) killed 5 civilians and injured 13. Key infrastructure, such as water and electricity facilities continued to be regularly affected by shelling and harsh weather conditions. On several occasions, over 400 000 people were left without water, electricity and heat for over 24 hours, due to the harsh weather conditions. With the arrival of spring, protection of civilians is a growing concern. Millions of civilians, including farmers and children are being exposed to heightened dangers due to mine contamination. Prolonged hostilities continue to stretch coping capacities of millions of people affected with increased food insecurity. According to the new Trend Analysis on Food Security and Socio-Economic Situation, after four years of armed conflict, one in five households (Government controlled area, GCA) experiences worsened food insecurity. The analysis further suggests that some 80 per cent of households reported applying negative coping strategies, including exhausting their meagre savings or spending their health expenditures, to afford food[1]. Against this background, the 2018 HRP remains severely underfunded. As of 19 April, only 3 per cent of the 2018 HRP was funded (US$ 6 million received out of US$ 187 million requested).",Ukraine: Humanitarian Snapshot (as of 19 April 2018),https://reliefweb.int/report/ukraine/ukraine-humanitarian-snapshot-19-april-2018
8,ukraine,"(New York, 20 April) – The Resident and Humanitarian Coordinator in Ukraine, Mr. Neal Walker, today briefed Member States and International Organizations on the dire humanitarian situation faced by 4.4 million conflict-affected people in eastern Ukraine. After four years of conflict, 3.4 million people in Ukraine are struggling to cope with the impact of the humanitarian crisis and urgently require humanitarian assistance and protection.

Every day, the armed conflict in eastern Ukraine forces millions of civilians to make impossible choices whether they eat, have medicine, or their children go to school. Critical civilian infrastructure is severely impacted, as ceasefire agreements are consistently disregarded. There were on average 40,000 violations per month last year alone. During his briefing, Mr. Walker said that, “only this week, five water treatment workers were shot while trying to maintain critical water infrastructure along the “contact line”. Today, water supplies to over 345,000 civilians hang in the balance. Last year alone, over 130 incidents affected critical water infrastructure”.

Over 600,000 people, including 100,000 children, bear the brunt of the continued armed clashes along the 457-km ‘contact line’. Every month, over 1 million people are forced to cross the “noman’s land” through checkpoints, many to simply access basic humanitarian and social services.

More than 2,500 civilian men, women and children have been killed, and over 9,000 injured, since hostilities began four years ago.

Explosive hazard contamination in eastern Ukraine is impacting 1.9 million people, including around 200,000 children. The use of landmines across urban areas, farmland and the checkpoints is a constant concern. “Last week, landmines killed a family of four in eastern Ukraine. In 2017, over 235 civilians were killed or injured by landmines and other explosive remnants of war,” said Mr.

Walker.

The humanitarian community is committed to meeting the humanitarian needs of all conflictaffected people in Ukraine. In December 2017, humanitarian agencies launched a highly prioritized US$187 million appeal to reach over 2.3 million of the most vulnerable people in Ukraine with assistance and protection services. So far, this appeal remains largely unfunded. In his concluding remarks, Mr. Walker said: “Today, I call on Member States to stand in solidarity with conflict affected people in Ukraine and to help urgently address this 97 per cent funding gap. I continue to call on the parties to the conflict to take all measures necessary to ensure international humanitarian law is respected – civilians and civilian infrastructure must be protected. The only solution to the crisis in eastern Ukraine is peace. We do not want to mark any further anniversaries of continued conflict.”

For further information, please contact:

Damian Rance, OCHA New York, rance@un.org, Tel: +1 917 367 4930, Cell: +1 917 328 6574

Jens Laerke, OCHA Geneva, laerke@un.org , Tel.: +41 22 917 11 42, Cell: +41 79 472 9750

Valijon Ranoev, OCHA Kyiv: ranoev@un.org, tel. +38 050 422-3943

OCHA press releases are available at www.unocha.org or www.reliefweb.int",Four years of conflict in Ukraine leave 4.4 million people in a dire humanitarian situation [EN/UK],https://reliefweb.int/report/ukraine/four-years-conflict-ukraine-leave-44-million-people-dire-humanitarian-situation-0
9,ukraine,"It is always risky to make definitive pronouncements about the future prospects of Russian politicians. Now that Vladimir Putin has started his fourth term as Russia’s president, we again start discussions of who his potential successor might be, since, unless the Russian Constitution is changed, he will run up against the prohibition of holding more than two consecutive terms in office. Moreover, there is the simple reality of biology: at some point, Putin will no longer be capable of wielding supreme executive power—and he will either want to be able to enjoy his retirement or to have preparations made to secure his legacy once he has departed from this mortal vale.

But recall that after Boris Yeltsin’s re-election in 1996, and for the subsequent two years that followed, the name “Vladimir Putin” never appeared on any of the lists compiled by Russian and foreign experts of likely presidential successors. There is a high probability that the next person who occupies the presidential chair in the Kremlin is someone who is not on the radar of anyone in the analytical community right now—someone who at this moment may be laboring in near-obscurity in a provincial center or in the mid-level echelons of the government. Moreover, Dmitry Medvedev, who was nominated to serve once again as prime minister, submitted to the Duma the outlines of a new cabinet that displaces some of the people, like former deputy prime minister Dmitry Rogozin, who consistently have appeared on the lists of Russian presidential papabilie.

In some ways, focusing on names and playing the games of “who’s in” and “who’s out” distracts us from the more important analytical questions: to identify the features of people Putin is likely to need and want in positions of power in the coming months and years.

If we think of Putin’s tenure in office as a play, then the first act was to arrest the alarming decline and collapse of the Russian state. The second was to reverse those negative effects and to commence the rebuilding of Russian capabilities, a mandate that continued through the period of the tandem when Putin served as prime minister in Dmitry Medvedev’s administration. The third act is, from Putin’s point of view, one of tragedy. Rereading his election manifesto of 2012, the return to the presidency was supposed to be marked by Russia’s return as one of the world’s great powers—something that the Sochi Winter Olympics were to display. The Ukraine crisis, however, derailed Putin’s plans; it has led to a growing estrangement of the West and the prospect of Russian disintegration and isolation from the global economy.

The curtain rises on Putin’s fourth act, therefore, in the midst of a new crisis, and the first scenes will be the search for the exit from that crisis. Whether this comes about because of a new strategic partnership with China, or the restoration of pre-existing ties with Europe (following along the lines of French president Emmanuel Macron’s call for a new ‘historic dialogue’ between Europe and Russia), Putin must reconceptualize the basis of Russian economic and strategic power. To the extent that Dmitry Medvedev may not be up for that job, the stage has been set for Putin to bring back into the halls of power his economic “emergency man,” Aleksei Kudrin. At the same time, Putin must generate a new social contract with the so-called “Generation P”—younger Russians whose formative experiences were not Soviet collapse and Russian degradation of the 1980s and 1990s, but who came to political maturity amidst the prosperity and opportunity of the 2000s.

The play must then continue to the denouement of the fourth act: consolidation. The system Putin created must be able to outlive its creator and show its prowess at perpetuation, in order to secure his legacy.

For the first part of the fourth act, we should expect a certain degree of continuity in Russian governing affairs, which is why the proposed Medvedev cabinet retains key figures like finance minister Anton Siluanov, who would also be promoted to become a deputy prime minister. Getting through the existing problems—the economy, Ukraine, Syria and instability in the Eurasian space (Armenia may be a harbinger for developments in Belarus and Kazakhstan)—is the immediate priority. But then it will be time to begin the handoff to a new political generation.

Sergei Kiriyenko, the former prime minister and the first deputy head of the presidential administration, has been spearheading the recruitment and testing of new cadres. The provincial governorships are one of the new training and proving grounds for the next generation of Russian executives to demonstrate their chops. Kiriyenko has made it a priority to develop lists of new candidates “under 50” who can be promoted into higher positions—reflecting that Putin’s team has absorbed one key lesson of the Leonid Brezhnev era of stagnation: relying on the same cohort of people to age in office and to provide no light at the end of the political tunnel for younger figures to seek advancement will create the same conditions which destabilized the Soviet political order.

At the same time, this next generation must be willing to extend the set of guarantees that Putin and his associates will demand for protection of their property and the assets and influence wielded by their families. Russia may not qualify under Robert Dah’s definition of what constitutes a mature democracy, but the ability of Mikhail Gorbachev and Boris Yeltsin to peacefully retire and not face arrest, detention or exile contrasts favorably with the experience of other post-Soviet states, notably Georgia, where no post-Soviet president has enjoyed that level of security.

Pages",Who Will Lead Russia after Putin?,http://nationalinterest.org/feature/who-will-lead-russia-after-putin-25760
10,ukraine,"Overview

Crossing the ‘contact line’ in eastern Ukraine continues to force millions of Ukrainians to endure dire conditions, long waiting hours and constant insecurity from shelling and mine contamination. Of particular concern is the lack of adequate facilities, such as heating/resting points, transportation, medical units and latrines in the “no man’s land” - a 2-km stretch between the EECPs of Government controlled areas (GCA) and Non-Government controlled areas (NGCA).

Over a million individual crossings were recorded in March, a 6 per cent increase compared with the same period in 2017. In mid-March, thousands of civilians, particularly the elderly, children and pregnant women, faced further hardship, while making this journey as they had to walk up to 5 kilometers to the EECPs. This was due to the interruption of ‘irregular’ public transportation to/ from EECPs’, for about 2 weeks. As part of shifting to “spring” season, the operational hours of all EECPs were extended by 2.5 hours, from 07:00 to 18:30",Ukraine: Humanitarian Snapshot (as of 13 April 2018),https://reliefweb.int/report/ukraine/ukraine-humanitarian-snapshot-13-april-2018
11,ukraine,"HIGHLIGHTS

Heavy snowfall and hostilities stop operations of critical infrastructure

Landmines, UXOs and ERW – second biggest cause of casualties in 2017

Europe focuses on the plight of 4.4 million people affected in eastern Ukraine

2017 HRP: 1.1 million vulnerable men, women and children reached with vital assistance and protection

Funding for the 2018 HRP is urgently required to sustain life-saving operations for 2.3 million Ukrainians

Ukraine’s harsh winter: thousands of civilians bear the brunt of the armed conflict

With temperatures plummeting to -19 Celsius in February, suffering of thousands of Ukrainians living in more than 90 settlements on both sides of the ‘contact line’ intensified due to the extreme cold. Many saw their electricity and water supplies disrupted, and heating systems deactivated.

The situation was extreme during the last two weeks of February, particularly due to heavy snowfall. Some 100,000 people on both sides of the ‘contact line’ saw water supply interrupted for more than 24 hours, as on 1 March, the 1st Lift Pumping Station of the South Donbas Water Pipeline was de-energized. Vulnerable men, women and children also struggled to access markets, services and critical facilities, as big piles of snow blocked many roads. People living along the ‘contact line’ also struggled to collect wood for heating, as it was too dangerous for them to enter the forests contaminated by landmines.

Harsh weather conditions also meant that civilians having to cross the ‘contact line’ often waited for long periods in the freezing cold. On several occasions in February, more than 500 people were unable to cross the ‘contact line’ and forced to stay overnight in highly insecure areas near the checkpoints. In addition, thousands of civilians, including children, elderly and people with disabilities, had to walk up to five kilometres of icy dangerous roads after private buses were unable to provide the required documentation to local authorities to be able to arrive near the Maiorske (Donetska oblast) and Stanytsia Luhanska (Luhanska oblast) checkpoints.

Lowest civilian casualties recorded since the start of the conflict

Ordinary men, women and children are paying the highest price for the armed conflict in eastern Ukraine. During the first two months of 2018, five civilians were killed and 20 injured according to the Office of the High Commissioner for Human Rights (OHCHR).

The number of civilian casualties recorded in February, however, was the lowest since the beginning of the conflict.",Humanitarian Bulletin: Ukraine | Issue 24 | 1 January – 28 February 2018,https://reliefweb.int/report/ukraine/humanitarian-bulletin-ukraine-issue-24-1-january-28-february-2018
12,ukraine,"Adidas accused of historical insensitivity for its Russia ‘tank dress’

Adidas accused of historical insensitivity for its Russia ‘tank dress’ 595

Russia sent its 76th so-called ‘humanitarian convoy’ to the occupied by the militants Donbas. This was reported by the press service of the Emergency Ministry of the Russian Federation.

Read more here.",112.ua: Russia sends its 76th ‘humanitarian convoy to Donbas,https://www.kyivpost.com/ukraine-politics/112-ua-russia-sends-76th-humanitarian-convoy-donbas.html
