,Concerning,Text,Title,URL
6,ukraine,"The payment from Mr. Pinchuk “is curious because it comes during a campaign and is from a foreigner and looks like an effort to buy influence,” said Marcus S. Owens, a former head of the Internal Revenue Service division that oversees tax-exempt organizations. He called the donation “an unusual amount of money for such a short speech.”

Mr. Cohen did not respond to a request for comment. Jay Sekulow, a lawyer for the president, did not return several messages seeking comment, nor did a lawyer for the Trump Organization. When The New York Times revealed the existence of the subpoena in March, Mr. Trump’s associates played it down as a routine court order to ensure the Trump Organization had handed over all the documents Mr. Mueller had demanded.

Mr. Trump assailed the special counsel investigation on Monday as a “witch hunt,” reaching for a favored insult in response to the seizure of Mr. Cohen’s records. He complained that he had cooperated with the inquiry and viewed the warrant for the raid, obtained by federal prosecutors in Manhattan after a referral from Mr. Mueller, as an extreme step.

“It’s a disgraceful situation,” he told reporters at the White House. “It’s a total witch hunt. I’ve been saying it for a long time. I’ve wanted to keep it down. I’ve given over a million pages in documents to the special counsel.”

Newsletter Sign Up Continue reading the main story Get the Morning Briefing by Email What you need to know to start your day, delivered to your inbox Monday through Friday. Please verify you're not a robot by clicking the box. Invalid email address. Please re-enter. You must select a newsletter to subscribe to. Sign Up You agree to receive occasional updates and special offers for The New York Times's products and services. Thank you for subscribing. An error has occurred. Please try again later. View all New York Times newsletters.

Mr. Mueller has also examined a deal Mr. Cohen was putting together with Mr. Trump to build a Trump Tower in Moscow. Mr. Trump said last summer that Mr. Mueller should not look at his or his family’s finances beyond issues related directly to Russia.

But the special counsel’s investigators have questioned witnesses about whether money from the Persian Gulf had been used to finance Mr. Trump’s political efforts and asked for information on Mr. Pinchuk.

The inquiry into the Trump Organization’s payments from foreign nationals underscores how diffuse Mr. Trump’s sources of income have been over many years. And the destination of Mr. Pinchuk’s donation — the Trump Foundation instead of the president’s personal coffers — raised fresh questions about how the president handled the entity he set up to deal with charitable giving.

Advertisement Continue reading the main story

Mr. Trump’s foundation attracted scrutiny during the 2016 campaign over revelations about his lack of financial support for it and his use of it to pay legal settlements rather than fulfill pledges he made to give to charity. In 2007, Mr. Trump used $20,000 from the foundation to buy a six-foot-tall portrait of himself.

Two weeks after he was elected president, the foundation acknowledged in a tax form that it might have broken federal rules designed to prohibit self-dealing, when charities use their money to benefit principals in their organization.

In the same filing, the foundation disclosed the donation from Mr. Pinchuk for Mr. Trump’s video appearance.

Mr. Pinchuk is the son-in-law of a former president of Ukraine, Leonid Kuchma, who from 1994 to 2005 led a government criticized for corruption, nepotism and the murder of dissident journalists. Mr. Pinchuk, who has been accused by steel makers in the United States of illegally dumping steel on the American market at artificially low prices, drew more scrutiny during the campaign for his ties to Hillary Clinton and her family foundation. He has donated more than $13 million to that organization since 2006.

Mr. Trump’s appearance was broadcast at the Yalta European Strategy conference, which promotes pro-European Union policies for Ukraine. Through his own foundation, Mr. Pinchuk sponsors the affair, which typically attracts well-known former Western leaders like former Prime Minister Tony Blair of Britain and former President Bill Clinton. It was moved to Kiev after Russia’s annexation of Crimea in 2014.

In a statement, the Victor Pinchuk Foundation said it reached out to Mr. Trump and other world leaders to help “promote strengthened and enduring ties between Ukraine and the West.”

Photo

The foundation said the donation was “a specific request of Mr. Trump Foundation in September of 2015 when there were multiple candidates for the Republican nomination for president and it was by no means assured that Mr. Trump would be the Republican nominee in 2016.”

At the time, Mr. Trump occupied an unusual position in the presidential race. Though he was the Republican front-runner, the primary field was crowded and he was being vetted or seriously considered by few, if any, in the news media or the Republican establishment.

Advertisement Continue reading the main story

The event, his first foray into global politics during the campaign, was set up by Doug Schoen, a veteran political consultant and pollster who works with Mr. Pinchuk, according to a person familiar with how the speech was arranged. Mr. Schoen, a frequent Fox News guest, has known Mr. Trump for years and contacted him personally to set it up at the end of August 2015, according to the person.

Mr. Trump did not raise the prospect of any payment. But the next day, Mr. Cohen called Mr. Schoen to solicit the $150,000 as an honorarium, the person briefed on the matter said. Mr. Schoen, who had gotten to know Mr. Cohen by running into him in the green room at Fox News, dealt with him and not Mr. Trump directly, according to another person briefed on the exchange.

The Kiev talk received little attention, with the scant coverage focused on the awkward nature of Mr. Trump’s delivery. He repeatedly stopped speaking, apparently believing he had to pause to give translators time to relay what he was saying.

“You need not wait for any translation,” Mr. Schoen finally told him.

Mr. Trump continued to pause and said he was having trouble hearing. “The sound system is terrible because there is a huge delay and feedback,” he said.

Mr. Trump used the appearance to criticize President Barack Obama amid deteriorating relations between the United States and Russia over its incursions into Ukraine, which had begun a year earlier. “Our president is not strong and he is not doing what he should be doing for the Ukraine,” Mr. Trump said, using the article before Ukraine, which is seen as insulting by some Ukrainians.

“Putin does not respect our president whatsoever,” he said of President Vladimir V. Putin of Russia.

Ukraine, once a part of the Soviet Union, has been at the center of another part of Mr. Mueller’s inquiry. He is investigating the consulting work done in Kiev by Mr. Trump’s former campaign chairman, Paul Manafort, for the country’s pro-Russian former president, Viktor F. Yanukovych. Mr. Manafort has pleaded not guilty to charges of tax fraud and other financial crimes.

He resigned from Mr. Trump’s campaign in August 2016 after handwritten ledgers were made public showing that he received $12.7 million in undisclosed cash payments from Mr. Yanukovych’s pro-Russian political party from 2007 to 2012.","Mueller Investigating Ukrainian’s $150,000 Payment for a Trump Appearance",https://www.nytimes.com/2018/04/09/us/politics/trump-mueller-ukraine-victor-pinchuk.html
7,ukraine,"KIEV (Reuters) - Ukraine will impose sanctions on Russian oligarchs including Oleg Deripaska, following the lead of penalties ordered by the United States, President Petro Poroshenko said on Tuesday.

Ukrainian President Petro Poroshenko attends a joint a news conference with German Chancellor Angela Merkel at the Chancellery in Berlin, Germany, April 10, 2018. REUTERS/Hannibal Hanschke

A new round of U.S. sanctions, announced on Friday, target officials and business people around Russian President Vladimir Putin, in response to alleged Russian meddling in the 2016 U.S. election.",Ukraine to impose sanctions on Russian oligarchs: president,https://www.reuters.com/article/us-usa-russia-sanctions-ukraine/ukraine-to-impose-sanctions-on-russian-oligarchs-president-idUSKBN1HH1JT
8,ukraine,"The Head of State underlined the importance of immediate withdrawal of Russian troops from the occupied Ukrainian territory and implementation of Minsk agreements, including support for the peacekeeping operation in Donbas.

Ukrainian President Petro Poroshenko during his Germany visit emphasized that Russia is involved in the chemical attack in Syria and continues its aggression against Ukraine in Donbas, at the same time constantly rejecting its wrongdoings.

“This has been lasting for four years already. And it is called 'they are not there',” Petro Poroshenko said during a briefing following the meeting with German Chancellor Angela Merkel.

“From the very first minute of the Russian aggression, Russia has strongly rejected the fact that the Russian armed forces are engaged in the aggression against the state of Ukraine, engaged in the chemical attack in Syria, took part or were somehow related to the poisoning in Salisbury,” Petro Poroshenko said.

“Slogan “they are not there” is no longer accepted in the world,” Petro Poroshenko noted.

Read alsoPoroshenko states ""certain progress"" on Donbas peacekeepersHe reported that 23 Russian officers had been imprisoned in Ukraine. “This is the evidence of Russian presence. Of course, we expect a more civilized response from Russia: recognition of accusations, coordination and cooperation to prevent such things in the future,” the president said.

The Head of State underlined the importance of immediate withdrawal of Russian troops from the occupied Ukrainian territory and implementation of Minsk agreements, including support for the peacekeeping operation in Donbas.

In turn, the Chancellor of Germany commented on the developments in Syria and the use of chemical weapons against civilians: “I think chemical weapons were definitely used there.”

Read alsoUkraine diplomat: West signals it has had enough of Russian aggression“Yesterday we emphasized that we strongly condemn their use. It is unacceptable that after many international discussions chemical weapons are used there again and again,” she said.","Poroshenko on Russian aggression in Ukraine, Syria: World no longer accepts “we are not there” claim",https://www.unian.info/politics/10075763-poroshenko-on-russian-aggression-in-ukraine-syria-world-no-longer-accepts-we-are-not-there-claim.html
9,ukraine,"Special counsel Robert Mueller is investigating a payment made to President Trump's foundation by a Ukranian billionaire for a speech Mr. Trump made in 2015 during his presidential campaign, according to the New York Times.

After federal investigators subpoenaed the Trump Organization, documents were handed over detailing a $150,000 payment made by Ukrainian billionaire Victor Pinchuk to the Donald J. Trump Foundation, the Times reported. Mr. Trump in September 2015 gave a 20-minute speech to a conference in Kiev, Ukraine, via video video link, commenting on everything from Syria, to having a ""weak"" president in Barack Obama, to his poll numbers. In the video, Mr. Trump frequently referred to Ukraine as ""the Ukraine,"" generally an offensive reference to Ukrainians. The speech was a slightly awkward one, with Mr. Trump apparently experiencing a delay and audio problems, prompting some laughs from the audience.

Pinchuk is a Ukranian businessman and oligarch, who built his wealth particularly from steel.

During the campaign, Mr. Trump and Republicans criticized former Secretary of States Hillary Clinton and former President Bill Clinton for accepting payments for speeches from foreign governments via the Clinton Family Foundation. Pinchuk also donated $13 million to the Clinton Family Foundation over several years, since 2006, according to the Times.

Mueller is investigating Russian election meddling and any ties to the Trump campaign. Mueller's probe doesn't appear to be slowing anytime soon. News that Mueller's investigation prompted the raid of Mr. Trump's personal attorney's office has frustrated Mr. Trump. The raid was carried out by the FBI's public corruption unit, CBS News' Andres Triay has reported.

Mr. Trump blasted the Cohen raid on Monday night, in thinly veiled comments to reporters, calling it a ""disgraceful situation.""

""So I just heard they broke into the office of one of my personal attorneys,"" the president said Monday night. ""...It's a disgraceful situation. It's a total witch hunt. I've been saying it for a long time. I've wanted to keep it down. I've given over a million pages in documents to the special counsel. They continue to just go forward and here we are talking about Syria, we're talking about a lot of serious things...and I have this witch hunt constantly going on for over 12 months now. Actually it's much more than that. You could say right after I won the nomination it started.""

Mr. Trump declined to rule out firing Mueller.

""I think it's a disgrace what's going on,"" the president also said Monday. ""We'll see what happens. ... Many people have said you should fire him. Again, they found nothing and in finding nothing that's a big statement because you know the person who is in charge of the investigation -- you know all about that -- Deputy Rod Rosenstein he wrote the letter very critical of (fired FBI director James) Comey.""",Mueller looking into payment for Trump Ukraine speech: Report,https://www.cbsnews.com/news/mueller-looking-into-payment-for-trump-ukraine-speech-report/
10,ukraine,"FUNDING:

US$ 204 million requested

US$ 71 million received

BENEFICIARIES:

2.4 million targeted

1.1 million reached

SITUATION OVERVIEW

2017 witnessed worsening human toll of the armed conflict in eastern Ukraine, which continues unabated. With a lack of complete adherence to renewed ceasefire agreements, nearly 14,000 security incidents-- an average of 38 incidents a day-- were recorded in Donetska and Luhanska oblasts, majority of which were concentrated in the area along the 457-kilometre ‘contact line’. Daily hostilities claimed almost 600 civilian lives and caused damage to houses and critical civilian infrastructures repeatedly. Civilians were caught between parties to the conflict facing abuses, risks from mines, unexploded ordnance and clashes, while less able to access assistance. The ‘contact line’, which is rapidly becoming one of the most mine contaminated lands in the world, long became a de facto border that not only severed socioeconomic connection and inter-dependence between the Government controlled areas (GCA) and NGCA, but also hampered access to essential basic services and goods. Today, one in four Ukrainians suffers from detrimental consequences of the protracted conflict in eastern Ukraine. As resources are shrinking, millions of people, including 1.6 million internally displaced persons (IDPs), half of whom are the elderly, are being forced to make impossible choices between food, medicine, shelter, heating or their children’s education and rely on humanitarian assistance to survive.

Meanwhile, reported humanitarian funding to Ukraine was halved from US$246 million in 2016 to $127 million in 2017. The 2017 HRP faced a severe underfunding, with only US$71 million received (or 35 per cent of the $204 requirement) – a 32 per cent decrease from $105 million the 2016 HRP received. Humanitarians were forced to terminate several critical operations, while some were even forced to close down. Their decision to end their activities means bigger gaps to fill for those remaining, and ultimately, reduced assistance to the most vulnerable people in need.

Despite funding challenges, humanitarian community mounted a collective response and reached an estimated 1.1 million people with some form of humanitarian assistance at least once. This represents a 47 per cent achievement of 2.4 million people targeted. While the figure may appear somewhat positive, particularly against a very low funding, it has to be interpreted carefully. Overall, it shows a significant decline in the reach of the response by approximately 20 per cent, compared to that of 2016. This seems to directly correlate with the decrease in funding in 2017. In addition, the figure also counts people, who received any type of assistance at least once in a year. In other words, it is not a reflection of the depth and sustained continuation of assistance. Finally, the figure is a result of a carry-over effect of financial resources from 2016 to 2017 given the multiple donors’ different fiscal year cycles and multi-year funding mechanism that are not particularly in line with that of the HRP single year cycle.

A clear set of cash-specific indicators embedded in the 2017 HRP allows for a measurable achievement of cash-based assistance in 2017. Approximately 181,000 people received humanitarian assistance disbursed as cash or voucher. However, coverage of cash-based assistance was limited mainly in the GCA only provided that markets were found to continue functioning and where banking and postal services offered a safe and efficient delivery mechanisms.

Furthermore, a closer look at the geographical breakdown also reveals an uneven distribution of the number of people reached in the GCA and NGCA vis a vis the targets. Persistent insecurity along the ‘contact line’ and continuous hindrances for humanitarian actors to access people living in NGCA compelled humanitarian organizations to adopt a ‘pragmatic’ approach in programming, re-allocating resources to other beneficiaries in accessible areas that met similar vulnerability criteria. As such, some 850,000 of 1.1 million people reached were those in the GCA, including IDPs and those crossing from the NGCA to GCA to access assistance, while only around one-quarter of the targeted population in NGCA, where needs were identified, were reached.

The three Strategic Objectives (SOs) of the HRP 2017 were met at varying degrees individually, but at a lower rate of achievement collectively compared with 2016. Specifically, the target of SO1 - focusing on responding to protection needs of conflict-affected people- was achieved by 42 per cent, with an estimated 1 million receiving some type of protection-related assistance. However, the limited humanitarian access to the NGCA throughout 2017 meant that, out of 1.3 million people in the NGCA initially targeted, protection-related assistance reached only 15 per cent.

The SO2 focusing on delivering life-saving emergency assistance was achieved by only 28 per cent, primarily due to the regular hostilities, increasing emergency needs and constant demands for response vis a vis limited resources. Meanwhile, the SO3 focusing on improving the resilience and early recovery of conflict-affected people achieved only 4 per cent of the target. The low level of achievement against the SO3 called for enhanced commitments and actions for humanitarian and development actors to strengthen humanitarian-development nexus through a range of well-aligned short, medium and longer-term approaches in reducing risks and addressing pre-existing systemic weaknesses.

While the HRP did not reflect the full spectrum of humanitarian actions due to its strict prioritization, it served as a strategic tool that identified shared humanitarian priorities based on common analysis of the situation of needs. As such, the 2017 End-of-Year report captures and recognizes the valuable contribution of non-HRP partners who provided information and coordinated their activities, contributing to achieving common goals in alleviating the suffering of conflict-affected people.","Ukraine - 2017 Humanitarian Response Plan (HRP) End-of-Year Report, January-December 2017 - Feb 2018",https://reliefweb.int/report/ukraine/ukraine-2017-humanitarian-response-plan-hrp-end-year-report-january-december-2017-feb
