,Concerning,Text,Title,URL
13,ukraine,"We cannot yet know what chaos Donald Trump’s decision on the nuclear deal with Iran will unleash in the Middle East and in global affairs at large – but we do know that truth is the first casualty of war. Years ago, the person who made me most aware of the meaning of that expression was a Finn, Olli Heinonen, who was at the time the head of the international inspectors surveying Iran’s nuclear programme. A calm, sturdy man under intense pressure, Heinonen would sit down with me in the cafeteria of the International Atomic Energy Agency in Vienna. We’d sip glasses of wine while he explained some of the conclusions of his team’s reports, which I was writing articles about.

Fake news has a long history. Beware the state being keeper of ‘the truth’ | Kenan Malik Read more

Heinonen saw his task as establishing facts – in the belief that only documented, rational discourse had a chance of preventing passions from overtaking everything. His father had fought in the Soviet-Finnish Winter war of 1939-40, and always repeated that sentence to him in his youth, as a lesson never to be forgotten: truth is the first casualty of war.

These discussions with Heinonen hark back to an era before social media, before what is now commonly called fake news, and before democracies in Europe and the US started being shaken to the core by multiple crises. I can only shudder at the thought that another war might break out in the Middle East. If it happens, it will be accompanied by a renewed frenzy of lies, manipulation and propaganda that would leave many people dizzy and confused. For the “mainstream media” – outlets that seek to describe complex realities as honestly as possible, not least by checking their facts – the challenges will be huge.

Not all of this is new, of course. What war reporters have known for a long time, arguably ever since the Crimean war of the 1850s and its coverage by the intrepid Irishman William Howard Russell, is that you can believe the statements of generals only once you have yourself witnessed the retaking of a hill or a fort, the level of destruction and the plight of soldiers and civilians. Propaganda was certainly taken to new heights by 20th-century totalitarian systems, when radio first appeared as a mass medium. Some of those same methods are again at play today, in a digital era where messaging can be infinitely amplified by clicks and data exploitation.

We the 'mainstream media' are not perfect, but we do correct our factual errors

One way of looking at the world is to say that we have a clash between democracies and autocracies, with some of the latter finding “useful idiots” among the former – people who prefer to lash out at “the system” or the “elite” in countries where they have the freedom to do so unhindered and without incurring any risk.

Syria, with its estimated 500,000 dead, is the terrain on which our western politics and media have foundered, and on which the possibility of a conflict involving Israel, Iran and other powers is increasingly contemplated. It is not that brave, knowledgeable and dedicated reporters have not covered the bloodbath there – they have, and admirably so. Rather, it is that somehow the horror has only occasionally seeped into western consciences rendered confused or fatalistic by the very magnitude of the crisis and by conflicting versions of it.

A few weeks ago I took part in a conference in Caen, Normandy, at the city’s memorial museum to the 1944 Allied landings. The topic discussed was Vladimir Putin and his policies in Ukraine and the Middle East – with the showing of a documentary film by Antoine Vitkine, a French director. After the microphone was handed to the audience for questions, a dozen or so hands shot up, and Vitkine and I found ourselves accused of being “CIA agents” or “anti-Russian” because of our criticism of Putin’s militaristic revisionism.

These people were angry, and they distrusted us because we came from the “mainstream”. They were a minority, but their energy seemed to intimidate other people in the room. After a while, I asked one of the men who had lashed out at us how he got his information. He listed French public television, Le Monde, a far-right conspiracy-heavy website and Russia Today. He added: “I know these media say different things, but I believe there is interesting information in all of them, and that the truth is somewhere in the middle.”

Serious, reliable media organisations take pride in their work, and rightly so. But we have barely started addressing the question of how and why that work may be met with such antagonism. Dialogue was not what those angry men in the auditorium wanted: they wanted to pour out resentment. Would acknowledging mistakes help? We the “mainstream media” are not perfect, but we do correct our factual errors – which propaganda outfits, of course, never do. We can hold political sympathies, but that is not the same thing – nor should it be – as a systematic bias based on selective coverage of the news, or its distortion.

The good news is that the US and Europe are now awash with initiatives aimed at countering “fake news”. The bad is that those two words fail to distinguish between inaccuracies stemming from genuine human error, deliberate fabrications and distortions for financial gain, political spin, and the results of propaganda offensives launched by regimes or groups whose strategy is to erode democratic institution and to attack the very notion that truth exists.

Truth does exist; it is not somewhere in the middle. The “mainstream” media’s only mission is to honestly and independently seek it. But as another Trump-inspired crisis approaches, convincing the public of that will be a test for us too.

• Natalie Nougayrède is a Guardian columnist","As the Iran crisis looms, prepare for a battle over facts and truth | Natalie Nougayrède",https://www.theguardian.com/commentisfree/2018/may/08/crisis-iran-challenge-truth-trump-syria
14,ukraine,"Over 40 trucks are on route to the militant-controlled territories in eastern Ukraine.

Another convoy of trucks that the Kremlin says contains humanitarian aid to the war-torn region has left Russia for the occupied Donbas, marking a 76th such deployment.

According to the Russian civil defense and emergency ministry, one part of the convoy is heading toward Donetsk, while another one – to Luhansk.

It is alleged that the convoy consists of over 40 trucks that are allegedly supposed to deliver ""more than 400 tonnes of humanitarian goods, including children's food kits, educational literature and medical equipment"" to residents of Donbas.

Read alsoRussian-led forces mount 80 attacks on Ukraine troops in Donbas in past day – JFO centerAs UNIAN reported earlier, Russia has been sending the so-called ""humanitarian convoys"" to the zone of hostilities in Donbas since August 2014. Ukrainian customs and border guards are not allowed to inspect the said trucks.

The Ukrainian side claimed there was evidence that the convoys were used as a decoy to supply militants with weapons, ammunition and anti-tank grenades.

The Ministry of Foreign Affairs of Ukraine has repeatedly demanded that the Russian Federation stop violating Ukraine's sovereignty under the pretext of delivering the so-called ""humanitarian aid.""","Russia sends another ""humanitarian"" convoy to occupied Donbas",https://www.unian.info/war/10108478-russia-sends-another-humanitarian-convoy-to-occupied-donbas.html
15,ukraine,"Ready to join the resistance? Sign up for Take Action Now and we’ll send you three actions every Tuesday. Sign up for Take Action Now and we’ll send you three actions every Tuesday.

Thank you for signing up. For more from The Nation, check out our latest issue

Subscribe now for as little as $2 a month!

Support Progressive Journalism The Nation is reader supported: Chip in $10 or more to help us continue to write about the issues that matter. The Nation is reader supported: Chip in $10 or more to help us continue to write about the issues that matter.

Fight Back! Sign up for Take Action Now and we’ll send you three meaningful actions you can take each week. Sign up for Take Action Now and we’ll send you three meaningful actions you can take each week.

Travel With The Nation Be the first to hear about Nation Travels destinations, and explore the world with kindred spirits. Be the first to hear about Nation Travels destinations, and explore the world with kindred spirits.

Sign up for our Wine Club today. Did you know you can support The Nation by drinking wine?

Last week, controversy erupted in Britain when a Conservative member of Parliament, Bob Seely, claimed that he had seen intelligence that indicated billionaire investor and founder of the Legatum Group, Christopher Chandler, had links to Russian intelligence. Ad Policy

Steely told the House of Commons, “According to the French intelligence services, as recorded by their colleagues in Monaco … Mr Chandler is described as having been ‘an object of interest’ to the DST [Directorate of Territorial Surveillance] since 2002 on suspicion of working for Russian intelligence services.”

According to a summary of his remarks in the Financial Times, Seely said that “the relevant files had been verified by French, US and UK sources, and seen by four other MPs.”

Was Chandler a Russian asset? No intelligence has been publicly released to support such a claim. Current Issue View our current issue

But the fact that such a reputation-shattering accusation can be made by a British MP speaks to the new Cold War atmosphere in which we are now living.

And it is an atmosphere that owes its creation, in part, to Chandler’s own Legatum Institute, which has been at the forefront of fostering a political climate in which accusations of unpatriotic disloyalty can be leveled without the slightest bit of evidence or compunction.

Much of this ugliness dates back to late 2014, when former Legatum senior fellow Peter Pomerantsev teamed up with The Interpreter’s editor in chief Michael Weiss and published a report titled “The Menace of Unreality: How the Kremlin Weaponizes Information, Culture and Money.” Funded by a think tank led by the son of exiled Russian oligarch Mikhail Khodorkovsky, and launched at an event hosted by the Legatum Institute, the report’s fixation with Russian “disinformation” presaged the current obsession over Russia’s alleged information war on the West.

The report was credulously promoted by, among others, the National Endowment for Democracy, Columbia University’s Harriman Institute, Radio Free Europe/Radio Liberty, The New York Review of Books, and The Washington Post (in separate articles authored by former Legatum forum director Anne Applebaum). The Economist’s Ed Lucas praised the report as “a sizzling new report on Kremlin disinformation.”

Yet, in a critical review of the report for The Nation three years ago, I warned:

The “Menace of Unreality” report is dangerous not only because it lends an intellectual sheen to what amounts to a censorship campaign, but because it further pollutes the already toxic atmosphere that has enveloped the debate over the crisis in Ukraine. Indeed, as one leading political scientist told me: “The atmosphere here in the US created by the Ukraine crisis is poisonous—and I say this having been in academe for 37 years.”

Needless to say, since the 2016 election, the atmosphere has only gotten worse.

In the years following the report’s publication, a cottage industry of disinformation warriors has emerged, including projects by the Center for American Progress (The Moscow Project); the German Marshall Fund (Hamilton 68); the Atlantic Council (Digital Forensic Research Lab); Coda Story (Disinformation Crisis); the Center for European Policy Analysis (StratCom Project); and the London School of Economics (the Arena project).

Some of the names associated with these newer projects will be familiar: Legatum alumni Pomerantsev and Applebaum are now with LSE’s Arena project; Lucas is with the CEPA’s StratCom Project; Weiss and The Interpreter are now with Coda Story, where Pomerantsev also serves as editor at large.

Clearly, disinformation warfare has become big business.

Perhaps the lesson of the Chandler episode is that it may be only a matter of time before the disinformation warriors themselves end up on the receiving end of a Russia-frenzy they did so much to unleash.",Accusations of Russian Disinformation Are Snowballing,https://www.thenation.com/article/accusations-of-russian-disinformation-are-snowballing/
16,ukraine,"1,492,125

INTERNALLY DISPLACED PEOPLE REGISTERED

(MINISTRY OF SOCIAL POLICY, 18 DECEMBER 2017)

3.4 million

PEOPLE IN NEED OF HUMANITARIAN ASSISTANCE

SITUATION OVERVIEW

Nearly four years of ongoing conflict in Eastern Ukraine has had a significant impact on all aspects of life for the communities residing in the Donbas region. The protracted nature of the crisis has paralyzed economic activity and severely reduced household coping capacities on both sides of the 457 km contact line. At the household level, few employment opportunities have also led to a lack of income and the inability to meet basic needs.

According to Ukraine’s Ministry of Social Policy (MoSP), nearly 1.5 million persons are registered as displaced, with the vast majority residing in Donetsk and Luhansk oblasts. Internally displaced persons (IDPs), returnees and other conflict-affected populations continue to cross the contact line regularly, between the non-government controlled area (NGCA) and government controlled area (GCA) at five checkpoints. Throughout 2017, figures of individuals crossing the contact line reached an all-time high in August, when a recorded 1.2 million people crossed the contact line during the month. The large numbers of people crossing between the GCA and NGCA and limited capacity of the checkpoints to process the increase in crossings has led to long queues, lack of adequate sanitation facilities and exposure to bad weather conditions, or other health and protection concerns, such as those related to psychosocial needs, trafficking in persons and exploitation.

The overall humanitarian situation in Eastern Ukraine remains dire. Assistance continues to be provided in the NGCA despite various challenges, including limitation on transport of humanitarian cargo and limited access to the affected populations. The deterioration of the situation in the NGCA is evidenced by the increase in poor food consumption, application of negative cop ing mechanisms and reduction of food expenditure. Moreover, the damage to or destruction of gas and water pipelines as well as homes and social institutions further increases the vulnerability of entire social segments of conflict-affected communities by limiting their access to adequate heating, hygiene facilities and clean drinking water. The peak in unemployment rates and the scarce public services increase overall dependency on humanitarian aid and public support.

In the GCA, the economic depression and limited resources of the displaced population have placed further strain on already overstretched social services. According to IOM’s National Monitoring System Round 8 report, 33% of surveyed IDP households in the GCA have ‘only enough funds to cover food’ and 11% have to ‘limit expenses even for food’. Despite the continuously increasing percentage of employed IDPs (from 35% in March 2016 to 50% in December 2017), the average IDP household monthly income per person (UAH 2,446 in December 2017) remains below the actual subsistence level established by the Ministry of Social Policy (UAH 3,091 in December 2017).

Due to the protracted nature of the conflict in Eastern Ukraine, slow economic growth and increased social tensions, 2018 will be a critical year for the transition from humanitarian assistance to longer-term recovery efforts. Bridging the gap between humanitarian and development interventions is critical to simultaneously address the urgent and longer-term needs of conflictaffected communities in the Donbas. The situation of protracted displacement requires concerted efforts from the Government of Ukraine, humanitarian and development actors as well as conflict affected communities to jointly identify actions in support of durable solutions to end displacement.","IOM Ukraine Crisis Response Plan, 1 January – 31 December 2018",https://reliefweb.int/report/ukraine/iom-ukraine-crisis-response-plan-1-january-31-december-2018
17,ukraine,"As UNIAN reported earlier, the TCG's humanitarian subgroup, which deals with prisoner swaps, also met in Minsk on May 4.

The next session of the Trilateral Contact Group on the Donbas settlement will be held in Minsk on May 16, according to Darka Olifer, a press secretary for Ukraine's representative to the TCG, Leonid Kuchma.

""The next meeting of the Trilateral Contact Group in Minsk is scheduled for May 16,"" Olifer told UNIAN.

On May 4, OSCE's envoy to the group, Martin Sajdik, said that the previous week, he had presented results of the TCG's efforts before the OSCE Permanent Council in Vienna, according to BelTA.

""I would like to use this opportunity to once again thank the OSCE member states for assistance, in particular, for supporting and financing the OSCE Special Monitoring Mission to Ukraine,"" he said.

As UNIAN reported earlier, the TCG's humanitarian subgroup, which deals with prisoner swaps, also met in Minsk on May 4.

""We haven't heard a feedback from Russian representatives to the offer to hand over to them 23 Russians convicted of crimes against the Ukrainian state so that Ukrainians who are political prisoners of the Kremlin could be freed,"" Ukraine's humanitarian envoy to the TCG reported.

She added that Russian proxies in Donbas demanded that Ukraine release 80 militants in exchange for 15 Ukrainian hostages held in the temporarily-occupied territory in eastern Ukraine.",Contact group on Ukraine to reconvene in Minsk on May 16,https://www.unian.info/politics/10105772-contact-group-on-ukraine-to-reconvene-in-minsk-on-may-16.html
