,Concerning,Text,Title,URL
0,yemen,"The World Health Organization (WHO), in cooperation with Yemeni local health authorities, has launched a wide-scale anti-cholera vaccination campaign in south Yemen, WHO said in a statement Sunday, Xinhua reported.

It said the campaign will last until May 10, and targeted, in its first phase, four districts in Aden city.

The government-run Saba news website quoted deputy health minister Ahmed al-Waledi as saying that the campaign will include Tawahee, Mualla, Khormaksar and Sirah districts.

He said the oral vaccine would target nearly 350,000 children at the age of five.

Though the number of cholera infection cases has declined rapidly in the Yemen, fears grow about a possible new cholera outbreak in this rainy season, according to United Nations humanitarian agencies.

The rainy season began in April and will last until August.

In November 2017, the United Nations reported more than 925,000 suspected cholera cases with over 2,200 associated deaths in the war-torn country since the epidemic started in April of the same year.

The infection rate has since been declining, by around 0.2 percent to 0.3 percent, according to WHO.

Yemen has been locked in a civil war for more than three years between Iranian-allied Houthi rebel group and the internationally-recognized government backed by a Saudi-led coalition forces.

The war has killed more than 10,000 Yemenis, half of them civilians, and triggered the largest humanitarian crisis in the world.

Follow Trend on Telegram. Only most interesting and important news",Anti-cholera campaign kicks off in Yemen amid fears of new outbreak,https://en.trend.az/world/arab/2899112.html
1,yemen,"KEY ISSUES:

• Humanitarian partners are concerned at the safety of more than 4,000 civilians near the frontlines in Al Hudaydah Governorate.

• Updated casualty figures compiled by WHO from health facilities indicate that nearly 9,500 people were killed and 55,000 more were injured over the last three years.

• The purchasing power of the Yemeni currency is now below half of what it used it to be.

CONCERNS AT THE SAFETY OF CIVILIANS LIVING NEAR FRONTLINES IN AL HUDAYDAH GOVERNORATE

Humanitarian partners are concerned about the safety of more than 4,000 civilians living near active frontlines in Al Hudaydah Governorate. Local partners report that families are currently sheltering around Hays, At Tuhayat and Al Garrahi Districts where sporadic armed clashes have continued. During the reporting period, fighting was also reported in Al Khawkhah District.

Fighting in Al Hudaydah and Taizz Governorates has resulted in scores of people killed and injured and has displaced more than 130,000 people since December 2017.

Humanitarian partners are assisting some of the displaced in the areas covered by Al Hudaydah hub, but as shown in the map, a significant number of districts have high access constraints. Southern districts of Al Hudaydah Governorate and northern districts of Hajjah Governorate, where the conflict is most active, are among the hardest to reach.

UPDATES FROM THE HUMANITARIAN HUBS

Al Hudaydah Hub: On 24 April, airstrikes reportedly hit a fuel station located in Abs District, killing 20 people and injuring 30 others. The INGO Action Contre La Faim reported supporting 663 newly displaced families from Hays district hosted in Al Garrahi District with nonfood item (NFI) packages. UNHCR supported 1,200 vulnerable displaced families living in Al Qanawes District with NFI packages. A total of 714 households of these received emergency shelter kits. UNHCR also provided 240 vulnerable displaced families in Al Hudaydah City with rental subsidies covering three months.

Aden Hub: The total number of families reportedly displaced to Aden Hub since December 2017 has reached 9,536 households as of 22 April. According to a displacement tracking report, the number of IDPs increased by 102 households over the last week, 75 of which were reported in Tuban and Tur Al Bahah Districts in Lahj Governorate and 27 in Zingibar District in Abyan Governorate. Displacement figures remain unchanged in Al Mukha and Dhubab Districts in Taizz Governorate, that is 618 and 55 households respectively.

Aden Governorate reportedly suffered from sewage overflow, especially Mualla, Sheihk Othamn, Mansorah and Dar Saad Districts. Government efforts yielded in the provision of new four suction tankers with a total cost of US$1 million. In Al Buraiqeh District, CARE has started rehabilitating a water network to help cover the water shortage in IDP settlements in Aden Governorate.

Ibb Hub: In Taizz Governorate, heavy clashes between government forces and Ansar Allah reportedly continued in Maqbanah, Mawza and Dimnat Khadir districts. Following the killing of an ICRC staff last week, clashes erupted between government forces and armed groups, including ISIS, in Taizz city. In the latter, shortages of drinking water continued as fuel could not be delivered to the water department due to the ongoing clashes.

UNICEF reported the delivery of nutrition supplies to Government Health Offices both in Ibb and Taizz governorates. The supplies are to be distributed to 82 health facilities in Ibb and to 86 health facilities in Taizz.

UNHCR completed the distribution of non-food items to 37 families (293 individuals) in Dhi AsSufal District of Ibb Governorate.

Sa’ada Hub: Escalated airstrikes and ground fighting continued across the districts bordering the Kingdom of Saudi Arabia in Sa’ada Governorate and the frontlines in Al Jawf Governorate. Civilian casualties were reported.

According to local authorities, about 1,270 households have been displaced in the last few months in Kitaf Wa Al Boqe’e, Shada’a, Qatabir, and Ghamr districts in Sa’ada Governorate. UNHCR reported the distribution of 1,000 non-food item packages and 500 emergency shelter kits in Bquim and Razih Districts.

Sana’a Hub: The Protection Cluster reported that the number of civilian impact incidents in the Sana’a hub fell during the period from 19 to 25 April, although airstrikes hit an electricity power station in the south of Sana’a City. Five civilians were injured in the airstrike, and the damages caused to the facility will potentially affect 320 people.

During the reporting period, the Dhamar Customs Office held three trucks carrying nutrition assistance items from Aden to Sana’a. The items were to be warehoused in Sana’a before being dispatched to Al Hudaydah Governorate. The Nutrition Cluster and OCHA are following up with the local authorities.

Meanwhile, Al Joumhoury Hospital in Sana’a City has warned that it may have to close its dialysis centre due to lack of supplies.",Yemen Humanitarian Update Covering 24 – 30 April 2018 | Issue 13,https://reliefweb.int/report/yemen/yemen-humanitarian-update-covering-24-30-april-2018-issue-13
2,yemen,"UPDATES FROM THE HUMANITARIAN HUBS

Al Hudaydah: Health sources reported that at least 20 civilians were killed and 47 were injured by airstrikes on a wedding ceremony in Bani Qais District in Hajjah Governorate on 22 April. Other sources have up to 40 people killed. The UN Secretary-General has strongly condemned the attack calling for an investigation. In Abs District, an airstrike on an IDP house reportedly killed five civilians including one woman and injured one man from the same family. WFP distributed 2,700 food baskets through an implementing partner in Al Khawkhah District. Following the identification of seven positive cholera cases in Al Hudaydah city, ICRC conducted a verification test to all suspected water sources used by patients and found one borehole contaminated by the cholera vibrio. The borehole was immediately closed and the Rapid Response Team was activated to ensure chlorination of all water sources across the Governorate.

Aden: Partners continued to assist the current IDP caseload. Although the humanitarian response has improved through stronger coordination with subnational clusters, some gaps remain in Shabwah,

Hadramaut and Al Maharah Governorates. OCHA is working with sub-national clusters to address those gaps. Additionally, in order to effectively respond to increased displacement in areas along Yemen’s western coast, humanitarian partners have started to pre-position different type of stocks including energy biscuits, hygiene kits, drinking water, transitional shelter and non-food items to be dispatched to selected service points in Hays and Al Khawkhah within 24 hours. During the reporting period, a rapid need assessment was conducted in Khanfir, Zingibar, Lawdar Districts in Abyan Governorate and Al Had District in Lahj Governorate. Findings indicate that there is an urgent need for humanitarian assistance in the sectors of water, sanitation and hygiene, food and shelter. However, there is no need for rapid health response as it is being covered by existing health facilities services and mobile clinics. A multi-sector assessment conducted in Al Khawkhah District in Al-Hudaydah Governorate concluded the need for sustained interventions in the areas of water, sanitation and hygiene, shelter and nonfood items, protection, food and health. A multi-sector assessment in Bayhan District, Shabwah Governorate reported that there are 700 displaced families. More than 90 per cent of the IDPs lack access to water, sanitation and hygiene, shelter and non-food items ad face specific protection concerns.

Sana’a: Ground fighting in Al Bayda Governorate escalated during the reporting period, resulting in the displacement of approximately 50 families. OCHA is working with shelter cluster to ensure that the needs are addressed. The latest report of the Civilian Impact Monitoring Project (CIMP) covering Amanat Al Asimah (Sana’a City), Sana’a and Marib Governorates indicates that the number of civilian impact incidents fell again for the third consecutive week, from four to two. One of the incidents was in Al Haymah Ad Dakhiliyah District in western Sana’a, and the other was in Bani Al Harith in the north of the capital city. Both incidents were caused by airstrikes. Although there were no civilian fatalities, three civilians were reportedly injured and civilian infrastructure was damaged. Authorities in Sana’a have formally informed the World Health Organization that the implementation of the cholera vaccination campaign in the areas under their control is rejected.

Sa’ada: The protection cluster reports that in the period from 12 to 18 April, the number of civilian impact incidents in Sa’ada increased from 23 to 30. Although the number of incidents increased, the number of civilian casualties decreased, dropping from 41 to 12. Contrary to previous weeks, casualties were the result of shelling (67%) or small arms fire (23%). Airstrikes also hit water infrastructure and a school in Razih District, potentially leaving 3,000 households with restricted access to basic services.

UNICEF issued a statement on the recent incident that targeted a water project in Sa’ada Governorate on 13 April. The Al-Hamazat water system in the Sehar District in Sa’ada Governorate was completely destroyed in an attack that left 7,500 people, including IDP families, without water. During the attack, the nearby solar energy system which provides power to the water system was also severely damaged. The water system had already been destroyed in 2015 and was later rebuilt in 2017. UNICEF stressed that damage to water infrastructure jeopardizes efforts to prevent another cholera outbreak in Yemen.

Ibb: Western frontlines in Taizz Governorate witnessed a military escalation during the reporting period. On 20 April, 20 people were reportedly killed when their vehicles were hit by airstrikes in Mawza District.The UN Secretary-General has strongly condemned the attack calling for an investigation. A multicluster rapid assessment in Mawza District of Taizz Governorate found that humanitarian situation of some 655 IDP families displaced within the district since May 2017 is dire with 98 per cent of the IDPs scattered in open areas, living in shelters made from straw without any basic water sanitation and hygiene services. The report indicates also that women and children (less than 12 years old) are the majority of the IDPs. WFP reported completing the in-kind food distribution cycle of March, targeting approximately 527,000 people in Taizz Governorate and 344,880 people in Ibb Governorate. A distribution of non-food items by UNHCR to 71 households in Dhu-Sufar District in Ibb Governorate was postponed to next week due to access constraints. The two main hospitals (AlJamhoury and Al- Thawrah) in Taizz city have closed their dialysis departments due to lack of supplies.

The head of ICRC’s detention program in Yemen, was deadly shot in an attack on his vehicle by unknown armed men on 21 April in Taizz Governorate. The humanitarian community has widely condemned the killing; in his statement of 22 April the UN SecretaryGeneral reminded all parties of their obligations under international humanitarian law concerning the protection of civilians and civilian infrastructure during armed conflicts and called for a prompt, effective and transparent investigation. The Government of Yemen has condemned the incident that happened in an area under its control and committed to exposing the perpetrators.",Yemen Humanitarian Update Covering 17 – 23 April 2018 | Issue 12,https://reliefweb.int/report/yemen/yemen-humanitarian-update-covering-17-23-april-2018-issue-12
3,yemen,"2017 IN REVIEW

HUMANITARIAN CONTEXT

A deepening humanitarian crisis

The year 2017 was marked by a steady deterioration of the humanitarian crisis in Yemen. The unabating conflict, the steady economic decline and the resulting collapse of basic social services further aggravated the vulnerability of millions of people whose coping mechanisms had been under pressure for two years. Displacement, food insecurity, disease and malnutrition continued to be the primary drivers of needs. As the year unfolded, a cholera outbreak, the worst recorded in history, spread across the entire country affecting more than one million people. By the end of the year the number of people in need had increased by 2 million, resulting in 20.8 million people requiring some form of humanitarian assistance and protection, 11.3 million of whom were in acute need.

Violations of IHL threaten the protection of civilians

The conduct of hostilities continued to be brutal, air strikes and fighting continued to inflict heavy casualties, damage public and private infrastructure, and impede delivery of humanitarian assistance. Serious concerns regarding the conduct of the conflict, in which all parties appeared to have committed violations of international humanitarian law and international human rights law continued to be raised. of 31 December 2017, health facilities had reported nearly reported 9,245 conflict related deaths and over 52,807 injuries. These figures significantly undercount the true extent of casualties given diminished reporting capacity of health facilities and people’s difficulties accessing healthcare. The conflict and violence engulfed the country in a vast protection crisis in which millions of people faced tremendous threats to their safety and wellbeing, and the most vulnerable struggled to survive.

Forced displacement and returns

Conflict continued to be the main driver of displacement. Since the escalation of the conflict in March 2015, more than 3 million people were displaced within Yemen, including 2 million who remained displaced by the end of 2017. While over 1 million former IDPs had provisionally returned to their areas of origin, the sustainability of these returns remained highly precarious due to lack of livelihoods opportunity, exhausted coping mechanism and crumbling access to social services in areas of return. Substantial numbers of returnees were found to be living in damaged houses, unable to afford repairs and facing serious protection risks. Nearly 70 per cent of returnees were in Aden, Sana’a or Taiz while half of the IDPs were sheltering in Hajjah, Taizz and Sana’a, living with host families or in rented accommodation.

Collapse of basic services and institutions

Essential basic services and the institutions that provide them continued to collapse under the weight of conflict, displacement and economic decline. As the public budget deficit grew by more than 50 per cent salaries for health facility staff, teachers and other public sector workers were paid erratically, often leaving 1.25 million state employees and their 6.9 million dependents – nearly 30 per cent of the population – without a regular income at a time of shortages and rising prices. The ability of public institutions to provide services contracted at a time while needs were surging. The inability of the health services to contain localized cases of cholera will result in the unfolding of an unprecedented outbreak.

Economic decline and access to markets

Economic decline and import restrictions continued to impact the availability and price of basic goods in markets.

Due to the intensification of the conflict, and restrictions of movement in active conflict areas, the formal market systems were disconnected and commodity movements were disrupted resulting in to scarcity and escalation of prices of essential food and non-food commodities. The closure of Yemen’s ports (sea, land and airports) on 6 November 2017 by the Saudi-led Coalition, resulted in the sharp rise within a 24 hours period in the prices for food, fuel and water had soared, putting them out of reach of vulnerable populations.",Yemen Humanitarian Fund - Annual Report 2017,https://reliefweb.int/report/yemen/yemen-humanitarian-fund-annual-report-2017
