,Concerning,Text,Title,URL
8,yemen,"Food hangs in sacks on the wall of the home of a displaced family, in Lahj, southern Yemen, in this Feb. 11, 2018 photo. Many markets in Yemen have food but increasing numbers of people are unable to afford it in the economic collapse caused by the war. That is one reason aid agencies warn that parts of the country will soon fall into outright famine. (AP Photo/Nariman El-Mofty) Nariman El-Mofty

Hagar Yahia pulls the veil off of her malnourished 5-year-old daughter, Awsaf, to feed her, in their hut in Abyan, Yemen, in this Feb. 15, 2018 photo. Towns and villages all around southern Yemen are full of scrawny and stunted children. With the war dragging on and people falling deeper into desperation, aid agencies warn that many parts of Yemen will be struck by outright famine with widespread death. (AP Photo/Nariman El-Mofty) Nariman El-Mofty

This Feb. 15, 2018 photo shows the hut made of tree limbs and rags where Hagar Yahia and her family live in Abyan, Yemen. Her family is among 18,000 people who escaped war zones further west and streamed into Abyan province, a stretch of territory where Yemen's barren mountains meet the Arabian Sea. There, they join a resident population that is also struggling to feed itself. (AP Photo/Nariman El-Mofty) Nariman El-Mofty

Awsaf, a 5-year-old Yemeni girl, eats bread and drinks tea while crouching next to her mother in their hut in Abyan, Yemen. On many days, the meal is the only food she will have. AP photos

Hagar Yahia, a Yemeni mother of eight, cries in her hut in Abyan, Yemen in this Feb. 9, 2018 photo. Displaced from their home and scrounging for work, she and her husband can barely afford to buy enough food for their family. “I go hungry for my children. I prefer that I don’t eat so they can,” she said. (AP Photo/Nariman El-Mofty) Nariman El-Mofty

A doctor shows on her mobile phone a photo of Fadl, an 8-month-old Yemeni boy taken in his last days before he starved to death, in this Feb. 10, 2018 photo at a hospital in Mocha, Yemen. Fadl’s mother gave birth to him under a tree as she fled fighting, and ever since she struggled to get him enough food. Eight months later, at the time of his death, the baby boy weighed 2.9 kilograms (6 pounds), a third of the normal weight for his age. (AP Photo/Nariman El-Mofty) Nariman El-Mofty

Staff measure the middle upper arm of Salima Ahmed Koryat, a 6-month-old Yemeni girl, to test how malnourished she is at the main hospital in Mocha, Yemen.

Mothers and children crowd into a center for treating malnutrition at the main hospital in the town of al-Khoukha, Yemen, in this Feb. 12, 2018 photo. They left empty-handed: The center has virtually run out of supplies, even as doctors estimate 40 percent of the children in the town suffer from malnutrition. Shifting front lines in the war have cut off aid routes and fighting has driven thousands of people to take refuge in the town. (AP Photo/Nariman El-Mofty) Nariman El-Mofty

Umm Mizrah, a 25-year-old Yemeni woman, holds her son Mizrah on a scale in Al-Sadaqa Hospital in Aden in February. The woman, who is nearly into the second trimester of her pregnancy, weighed 84 pounds, severely underweight. Mizrah, who was 17 months old at the time, weighed 12.8 pounds, about half the normal weight for his age.

This Feb. 13, 2018 photo shows photographs of severely malnourished infants hung on wall in the administrative office at the Aden Hospital, in Yemen. (AP Photo/Nariman El-Mofty) Nariman El-Mofty

Umm Mizrah, a 25-year-old Yemeni mother, reveals her collarbones and emaciated ribs to be photographed, in this Feb. 13, 2018 photo at Al-Sadaqa Hospital in Aden, Yemen. Umm Mizrah, who is nearly into the second trimester of pregnancy, weighs 38 kilograms (84 pounds) and is severely undernourished. She has been eating one meal a day trying to feed her youngest son, who is badly malnourished. (AP Photo/Nariman El-Mofty) Nariman El-Mofty

Hagar Yahia, a Yemeni woman, shows the amount of flour she uses to make a loaf of bread, in this Feb. 15, 2018 photo taken in Abyan, Yemen. On the few good days when she or her husband find work, they may have some vegetables. But most often they eat a heavy bread called “tawa” that fills the stomach longer, Yahia said. (AP Photo/Nariman El-Mofty) Nariman El-Mofty

Hagar Yahia pours tea for her 5-year-old daughter Awsaf in their hut in Abyan, Yemen in this Feb. 15, 2018 photo. Many families across southern Yemen described how they live largely on bread and sweetened tea, sometimes just once a day. (AP Photo/Nariman El-Mofty) Nariman El-Mofty

Hagar Yahia holds her 5-year-old daughter Awsaf, who is suffering from malnourishment from living mainly off of bread and tea, in this Feb. 9, 2018 photo in Abyan, Yemen. Yahia, her husband and eight children fled from their hometown on Yemen’s western Red Sea coast to escape the war, eventually ending up more than 200 miles away in the village of Red Star in the south. Ever since, they've struggled to find enough food. (AP Photo/Nariman El-Mofty) Nariman El-Mofty

Associated Press

The young mother stepped onto the scale for the doctor. Even with all her black robes on, she weighed only 84 pounds. Umm Mizrah is pregnant, but starving herself to feed her children.

And her sacrifice may not be enough to save them.

The doctor’s office is covered with dozens of pictures of emaciated babies who have come through Al-Sadaqa Hospital in Aden, casualties of a three-year war in Yemen that has left millions of people on the edge of famine.

Mothers like Umm Mizrah are often the only defense against the hunger that has killed thousands. They skip meals, they sleep to escape the gnawing in their stomachs. They hide bony faces and emaciated bodies in voluminous black abaya robes and veils.

The doctor asked the mother to get back on the scale holding her son, Mizrah. At 17 months, he was 12.8 pounds – around half the normal weight for his age.

He showed all the signs of “severe acute malnutrition,” the most dire stage of hunger. His legs and feet were swollen, he wasn’t getting enough protein. When the doctor pressed a finger into the skin of his feet, the indentation lingered.

Around 2.9 million women and children are acutely malnourished; another 400,000 children are fighting for their lives, in the same condition as Mizrah.

Nearly a third of Yemen’s population – 8.4 million of its 29 million people – rely completely on food aid or else they would starve. That number grew by a quarter over the past year.

Aid agencies warn that parts of Yemen could soon start to see widespread death from famine. More and more people are reliant on aid that is already failing to reach people. The war, now three years old, drags on interminably between Yemen’s Shiite Houthi rebels who hold the country’s north, and the Saudi-led coalition, armed and backed by the United States, which has sought to bomb the rebels into submission with a relentless air campaign in support of the Yemeni government.

It is unknown how many have died, since authorities are not able to track cases. Save the Children late last year estimated that 50,000 children may have died in 2017 of extreme hunger or disease, given that up to 30 percent of children with untreated cases of severe acute malnutrition die.

“Unfortunately, now Yemen is considered to be the world’s largest humanitarian emergency,” said Stephen Anderson, the Yemen director of the World Food Program. Some 18 million people do not know where their next meal is coming from.

Even before the war, the Arab world’s poorest nation struggled to feed itself. It is a country of deserts and mountains with dwindling water resources where only 2 to 4 percent of the land is cultivated, so almost all of its food and supplies must be imported.

The war has shattered everything that kept Yemen just above starvation. Coalition warplanes blasted hospitals, schools, farms, factories, bridges and roads.

The coalition has also clamped a land-sea-and-air embargo on Houthi-controlled areas, including the Red Sea port of Hodeida, once the entry point of 70 percent of Yemen’s imports. Now far less gets in as coalition ships off shore allow through only UN-inspected and approved commercial ships and aid, often with delays.

The United States gives significant backing to the coalition campaign, providing intelligence and billions of dollars-worth of munitions as well logistical help like air-to-air refueling of coalition warplanes. The U.S. State Department says Washington has provided nearly $854 million to address the humanitarian situation in Yemen.

In many places there is food in the markets, but people simply can’t afford it, since salaries are going unpaid, work is harder to find and the currency has collapsed in value.

Umm Mizrah and her husband, who have three young daughters in addition to Mizrah, usually eat one meal a day, often just bread and tea. The Associated Press is identifying her by the nickname she often goes by – meaning “mother of Mizrah” – to protect her privacy.

When the doctor in Aden told her malnutrition can be fatal, she trembled. The parents felt helpless. Cigarette burns were visible on the baby’s belly. Desperate, the father had turned to a Yemeni folk cure called “maysam,” or “branding” – using burns to expel evil spirits.

“I don’t know what is right,” she said quietly. “He was playful and doing fine then he started to get sick and stopped breastfeeding and playing.”

The AP traveled across southern Yemen, territory held by the coalition-backed government, and visited several districts among the 107 areas nationwide that the U.N. warns are most likely to fall into outright famine.

It is a landscape of desperation.

Death by starvation

A video filmed by a doctor shows 8-month-old Fadl in his last days of life.

The baby twitches his legs in pain. He’s crying but he is so dehydrated his eyes can’t produce tears. His belly is inflated as taut as a balloon. You can easily count the 12 rows of protruding ribs on his rapidly palpitating chest. His desperate parents plastered his head with black henna, a dye that is used as a folk cure.

Fadl was born in the wilderness. His mother, Fatma Halabi, was eight months pregnant when she and thousands of others fled the area around her district of Mowza as government forces descended on the Houthis.

Separated from her husband, Halabi led her four children and two goats across the Great Valley, the arid plain spilling down from the mountains toward the city of Mocha on the Red Sea.

These desolate stretches are historically a site of death. More than 400 years ago, a Muslim ruler forcibly sent almost the entire Jewish population of Yemen here for refusing to convert. Chroniclers say two thirds of them died in the heat and deprivation.

Halabi and the children hid in thorn bushes to avoid artillery and airstrikes along the shifting front line. One day in April last year, she went into labor and, alone, gave birth to Fadl under a tree. And then fainted.

Eventually, she and her husband reunited and settled in an abandoned hut in the valley.

Speaking from inside her makeshift home in February, Halabi sat with a rope cinched around her emaciated waist, her blue robe sliding off her bony shoulder.

She spoke in short, exhausted sentences. When asked what she had eaten that day, she said, “Bor,” the local Arabic word for flour. “We stay patient,” she said. “We have to feed the children.” When she gets hungry, she lies down and tries to sleep.

Often she and her husband eat one meal in the morning, and nothing again until the next day.

Unable to breastfeed Fadl, she gave him goat or camel milk, which lack the nutrients of breast milk or formula. The newborn kept getting fever and diarrhea, so she repeatedly borrowed money to take him to the hospital in Mocha.

The hospital has seen 600 malnutrition cases over the past 10 months, but is so short on supplies it doesn’t even have pain relievers for headaches, said one doctor, Abdel-Rehim Ahmed. It has no therapeutic feeding center. None of its doctors have been trained in treating malnutrition.

And Mocha is swelling with 40,000 displaced people.

Left untreated, prolonged malnutrition causes the body to lose its stock of carbohydrates, fats, and proteins. The body starts to eat itself. The brain struggles to find energy, the heart shrinks, and the skin cracks, exposing the body to infections. The kidney and the liver stop functioning properly, so toxins build up inside the body, leading to a vicious cycle of disease.

Fadl’s last visit to the hospital was Nov. 29. At eight months old, he weighed 6 pounds, a third of the normal weight. The circumference of his upper arm, a common measure for malnutrition, was less than 3 inches. That indicated severe acute malnutrition.

Unable to pay for a hospital stay, Fadl’s parents took him home.

He gave his last breath not long after in the arms of his grandmother. His exhausted parents were asleep on the floor. The grandmother woke them and told them their boy was dead.

The only image of Fadl from his short life of hunger and pain is the video, taken by the head of the nutrition center. His parents don’t have mobile phones or a camera.

“Sometimes I wake up in the morning and I remember he’s no longer there and I start to cry,” Halabi said. “Who wouldn’t cry for their children?”

‘Liberated’ and still starving

Even in parts of Yemen that are wrested from Houthi rule, starvation persists – or gets worse.

In late February, mothers carrying babies mobbed the nutrition center at the main hospital in al-Khoukha, a little town on the Red Sea, expecting to receive monthly allotments of baby formula and nutrient supplies.

They left empty-handed.

The center ran out of supplies weeks ago. Some of the women, cloaked in black abayas, pushed and shoved feebly. But most were too weak to complain and silently shuffled away.

Al-Khoukha was taken back from the Houthis in December by coalition-backed forces marching up the coast. In rebel hands, the town had been directly connected to the Hodeida port farther north, the biggest entryway for international aid into Yemen.

Now cut off from the port, no supplies have come from the south.

“We have no vaccinations. There are shortages in medicines. The aid stopped,” said Abdullah Doubala, head of al-Khoukha health department. The burden is increasing as families fleeing fighting elsewhere stream into al-Khoukha, bringing more thin and hungry children.

Doctors estimate that 40 percent of the children in the town suffer from malnutrition. Barefoot kids fill the center’s corridors, many visibly emaciated, some with malaria or cholera. Some can barely stand.

Nine-month old Galila, her ribs sharply outlined, her eyes bulging in shrunken sockets, sat in the lap of her mother, Aisha.

The baby girl caught malaria and began to lose weight. Now she is all of 10 pounds, compared to the average of 13-17 pounds for a 9-month-old girl.

Her mother is tiny as well, ravaged by giving up food for a family that is constantly growing.

Aisha has been giving birth each year; Galila is her 14th child. Her husband, a woodcutter, can hardly find any work. Even coming to the hospital is too expensive; if she wants to come, she has to wait for her brother, who has a motorcycle, to take her.

“I eat whatever is available or wait till next day,” Aisha said. “A meal once a day.”

The mothers’ hunger is repeated over and over throughout the war-ravaged country.

A mother’s hunger

It isn’t just those driven from their homes who suffer.

Isolated in a mountain valley, the 450 residents of the village of Qibli are wasting away. Boys and girls running around barefoot in the dirt paths are stunted.

Most of the men here are soldiers, who haven’t been paid for months, or farm laborers, who can no longer find work.

Any money they have goes in search of food. The nearest market is 8 miles away, which means paying high gas prices on top of the cost for the food itself, which have doubled over the past year.

Sitting on the floor of her home, Sherine fed her two children scraps of bread dipped in “besbas,” a sauce of tomato and garlic. She took no bites herself.

Her 1-year-old daughter Amal, has been diagnosed with acute malnutrition and can no longer stand up.

The family lives largely on bread and tea. Her husband is among the ranks of unpaid soldiers. His father, a retired soldier, still gets a meager pension, but uses that to help all his children and grandchildren, a family of 16 in total.

Aid hasn’t come to Qibli since 2016, according to relief volunteer Rashid al-Khoushbi. Only four families in the area were on the World Food Program lists for food aid. Most households here are considered to have a male breadwinner, making them a lower priority.

In the area’s main town, al-Mallah, doctors were nowhere to be seen at the hospital. No one pays them so many staffers often don’t show up.

Sitting in bed, Umm Molham was so weak she could barely lift her 13-month-old son. When the AP met her, she had been at the hospital for three days waiting for someone to examine him.

The toddler had been vomiting, coughing and suffered from diarrhea. The family can only afford to give him formula once a day. His body is emaciated, his eyes sunken.

His mother sat helplessly, the baby in her lap.

“She is not breastfeeding,” said her husband, Anwar Said. “She doesn’t eat well and has no milk.”

Umm Molham didn’t say a word, even when asked questions, lost in her internal world of frailty and hunger.",Yemen on the edge of famine,http://www.concordmonitor.com/One-meal-a-day-Yemeni-mothers-try-to-feed-their-families-17298935
9,yemen,"TEHRAN - Hossein Jaberi Ansari, the Iranian foreign minister’s special assistant in political affairs, said on Thursday that Iran is making efforts to help end the crisis in Yemen.

“One of the objectives behind the Islamic Republic of Iran’s regional policies is making efforts to end this [Yemeni] crisis,” Jaberi Ansari told IRNA after a consultation meeting in Rome between Iran and EU/E4 on regional issues.

“Developments in Yemen was the main theme of the meeting,” he noted.

Jaberi Ansari added, “We had good discussions with the European representatives about various humanitarian, political and military dimensions of the Yemeni crisis.”

According to a press release issued by the EU website, the meeting was chaired by EEAS Secretary General Helga Schmid and attended by E4 countries (France, Germany, Italy and United Kingdom) at the level of political directors. The Iranian delegation was led by Jaberi Ansari.

“This is the second edition of talks in this format after the meeting in the margins of the Munich Security Conference in February 2018. The discussions, focused on the political and humanitarian situation in Yemen, were productive. The participants agreed to meet again in this format in Brussels in the near future,” the statement said.

NA/PA",Iran making efforts to end Yemen crisis,http://www.tehrantimes.com/news/423224/Iran-making-efforts-to-end-Yemen-crisis
10,yemen,"KEY ISSUES:

• Continued fighting in Yemen’s western governorates of Al Hudaydah and Taizz has displaced more than 19,000 households.

• The losses caused by the fire in the WFP warehouse in Al Hudaydah on 31 March amount to USD 5 million. A fire reportedly broke out in a WFP mobile storage unit for non-food items in Al Hudaydah city on 16 April. Initial reports indicate that the fire has caused minimal damage.

• A WHO-chartered cargo plane delivered 19 tons of medical supplies to Sana’a Airport.

PROTRACTED VIOLENCE CONTINUES TO PUSH YEMENIS INTO DISPLACEMENT

The Shelter/NFI/CCCM cluster reports that as of 12 April protracted violence in the Al Hudaydah and Taizz governorates has displaced 19,145 households of whom 9,838 have been assisted. This new wave of displacement further adds up to the three million Yemenis who have already faced the shock of having to flee their homes, two million of whom remain displaced across the country. 89 percent of IDPs in Yemen have been displaced for more than one year.

According to the Protection Cluster, displaced people increasingly face protection risks, including those living in public buildings, collective centres or spontaneous settlements. Deteriorating shelter conditions, such as overcrowding and unsanitary IDP settlements, have led to increased spread and susceptibility to communicable diseases. Many IDPs are in need of shelter, food, water, sanitation and access to health services. They are vulnerable to exploitation, indebtedness, and negative coping mechanism, such as begging, child labour, recruitment by armed groups and early marriage.

As conditions deteriorate in Yemen, humanitarian partners have prioritised assistance for some of the most vulnerable communities, including IDPs, returnees and host communities. In 2018, a total of 266,000 IDP households are targeted to receive assistance as part of the Yemen Humanitarian Response Plan, including rental subsidies, core relief items, emergency shelter and legal aid. USD 198.7 million and unimpeded access are required.

Multi-cluster humanitarian response to new displacement driven by the conflict in Al Hudaydah and Taizz governorates is still ongoing. However, a lack of implementing partners on the ground and the authorities’ delay in releasing the necessary approvals have negatively affected the response.

In between January and March 2018, the Shelter/NFI/ CCCM cluster reached approx. 227,000 people as per the breakdown below.

UPDATES FROM THE HUMANITARIAN HUBS

Al Hudaydah: WFP reported that the estimated value of the assistance destroyed in the fire that occurred in its warehouse in Al Hudaydah city on 31 March amounts to US$5 million. The lost supplies were meant to contribute to the rations of at least 1.8 million beneficiaries for a month’s period. WFP is using reserves to partially cover the gap and prevent any disruption to the monthly distribution process. A new fire broke out on 16 April in a WFP mobile storage unit for non-food items in Al Hudaydah city, no significant damage was reported. At least two humanitarian organisations reached and responded in Al Khawkhah district during the reporting period. However, access to the eastern part of Hays district remains challenging due to continued shelling. In Al Hudaydah city, humanitarian partners have provided NFI, cash and hygiene assistance to some 1,500 families, including IDPs. In Hajjah governorate, 158 families among the most vulnerable in Abs district received cash assistance.

Aden: Queues have been witnessed at private fuel stations in the governorate, while government-run fuel stations are not functioning. Fuel is available in the unofficial market at a higher price. In nearby governorates, however, fuel is available with no change in price. Cut-off hours of electricity have increased during the reporting period to 6-8 hours a day, compared to two hours a day in the previous weeks. According to a displacement tracking exercise, 305 new IDP households were reported in Aden in the past week. Reportedly, 244 other new IDP families have been displaced in the districts of Khanfir, Lawdar and Zingibar in Abyan governorate and 61 in Tuban and Al Had districts in Lahj governorate. 299 suspected diphtheria cases were reported in the hub as of 8 April, including 141 cases in Al Dhale’e, 67 in Aden, 12 in Lahj, seven in Abyan and one case in Shabwah.

Sana’a: On 11 April, a WHO-chartered cargo plane delivered 19 tons of medical and therapeutic items to Sana’a International Airport. The items will be distributed across Yemen. The road from Sana’a to Sayun in Hadramaut governorate, mainly used by civilians planning to travel abroad through Sayun Airport, has been temporarily cut off due to ground clashes in Al Bayda governorate.

Humanitarian partners have also reported access constraints in Hamdan and Bani Matar districts (Sana’a governorate) and in Harib district (Marib governorate) by local authorities restricting their movement and ability to implement programmes.

Sa’ada: Airstrikes and ground fighting continued across the districts bordering the Kingdom of Saudi Arabia and along frontlines in Al Jawf governorate, resulting in several civilian casualties, including children. ACTED and DRC reported that airstrikes on 9 April hit targets within a short distance from their premises in Sa’ada city while 56 staff were working. Both premises are deconflicted.

Four water projects were completed in the districts of Bart Al Anan and Rajuzahin Al Jawf governorate. The intervention, which involved rehabilitating and protecting water sources and installing solar systems for generating power will serve 10,000 beneficiaries. Three additional water projects in the districts of As Safra and Sahar will benefit some 17,000 beneficiaries.

Ibb: Clashes continued along the frontlines in Taizz governorate, including in Salah, Dimnat Khadir and Hayfan districts. On 10 April, at least 15 people, including children, were reportedly killed when an airstrike hit their house in Dimnat Khadir district. Around 50 families have been displaced from As Silw district in Taizz governorate to Dimnat Khadir district in the same governorate and Dhi As Sufal district in Ibb governorate.

Following the closure of the dialysis department of the AlThawrah Hospital in Taizz city, Al-Jamhoury hospital may also be forced to close its dialysis department due to lack of supplies.",Yemen Humanitarian Update Covering 10 – 16 April 2018 | Issue 11,https://reliefweb.int/report/yemen/yemen-humanitarian-update-covering-10-16-april-2018-issue-11
