,Concerning,Text,Title,URL
11,yemen,"King Salman Humanitarian Aid and Relief Center continues to supply aid to Yemenis in distress

JEDDAH: The King Salman Humanitarian Aid and Relief Center (KSRelief) on Sunday distributed 6,000 cartons of meat to 108,000 beneficiaries in a number of districts in Yemen’s Al-Jouf Governorate.

The aid comes within the framework of food assistance provided by KSRelief to the Yemeni people.

KSReleif has also stepped up its medical relief efforts in Yemen, with three new medical teams to provide treatment without discrimination.

During his visit to Saudi Arabia, the director general of the World Health Organization (WHO), Tedros Adhanom Ghebreyesus, also commended the Kingdom’s leading and effective role in the region and around the world — and in particular the KSRelief.

He pointed out that the main objective of his visit to Saudi Arabia was to promote the bilateral partnership with KSRelief.

There are some 2 million Yemenis working in the Kingdom and they send more than $10 million to their families in Yemen. The Kingdom has opened certain points to enable organizations to transport relief goods to reach people in need.

To boost the economy of Yemen, Saudi Arabia has funded its Central Bank with $2 billion and another $1.5 billion has been given to UN organizations to help distressed Yemenis.",King Salman Humanitarian Aid and Relief Center continues to supply aid to Yemenis in distress,http://www.arabnews.com/node/1297806/saudi-arabia
12,yemen,"Highlights

The 26 March 2018 saw the third anniversary of the Yemen conflict, which continues to heavily impact the lives of children. As fighting continued this month, 16 children were reportedly killed and 39 were injured.

UNICEF launched a report highlighting the negative effects of conflict on children's education. It also appealed to warring parties to put an end to the war and all grave violations against children.

An Integrated Response, Preparedness and Prevention Plan for Acute Watery Diarreah/Cholera is now in place, and thanks to UNICEF support, a total of 736 WASH Rapid Response Teams, with nationwide coverage, are now on stand-by to respond to a potential outbreak in the coming months.

This month, UNICEF supported a six-day diphtheria campaign in 39 high- risk districts where it. It reached over 1.9 million children, covering 75 per cent of the target.

UNICEF provided psychosocial support to at least 12,011 people in March, including 6,123 children, through community based and mobile child friendly spaces in 9 governorates.

Situation Overview & Humanitarian Needs

Despite attempts by the new UN envoy, Martin Griffiths, to renew stagnated peace talks, fighting continued throughout March. Marking the third anniversary of the start of the Saudi-led coalition’s military intervention in Yemen, the Houthis fired a set of ballistic missiles towards cities in Saudi Arabia, where at least one person was reportedly killed by shrapnel in Riyadh. In Sana'a, the most affected governorate by active fighting, airstrikes intensified in the city and ground clashes continued along the Nihm frontline northeast of the capital. Meanwhile in the Southern governorates and the city of Aden, violent crime and assassinations are on the increase, with several attacks carried-out by Al Qaeda in the Arabian Peninsula (AQAP) and Islamic State of Iraq and the Levant (ISIL) killing and injuring security forces and civilians.

Children continue to bear the heaviest toll of the conflict. 16 children were killed and 38 injured during March, bringing the cumulative totals for 2018 up to a 110 and 192 respectively.1 The conflict also continues to heavily impact children's right to an education. Many teachers' salaries remain unpaid (61 per cent) and over three years of conflict is now compromising the education of over 4.5 million children. Whilst no data available concerning the attendance of teachers, it is reported than in some school's teachers work only a few hours a day, and in others, parents are grouping together to collect fees for teachers.

The consequences of this has a varying impact across the country. The cumulative total of suspected cholera cases reported since April 2017 to 31 March 2018 is 1,085,305 with 2,270 associated deaths across the country.2 Children under 5 years old represent 28.8 per cent of total suspected cases, but the number of weekly new cases continues to decline for the 29th consecutive week. As of the end of the reporting month, the total number of reported probable diphtheria cases has now reached 1,522 (a 25 per cent increase from the previous month) with 85 deaths (a 10 per cent increase) and a case fatality rate of 5.5 per cent.",UNICEF Yemen Humanitarian Situation Report (March 2018) [EN/AR],https://reliefweb.int/report/yemen/unicef-yemen-humanitarian-situation-report-march-2018-enar
13,yemen,"Premium

To continue reading this article log in to your account, or join us now and get a free trial which includes access to this specific story.

You will not be charged for your trial and there is no obligation to purchase.

Create an account or sign in",Iran Striving to Help End Yemen Crisis,https://financialtribune.com/articles/national/85776/iran-striving-to-help-end-yemen-crisis
14,yemen,"Conflict Background

Yemen has a weak, highly decentralized central government that has struggled to rule the northern Yemen Arab Republic (YAR) and the southern People’s Democratic Republic of Yemen (PDRY). Since the unification of these entities in 1990, Yemen has experienced three civil conflicts. As the poorest country in the Arab world, Yemen faces serious food and water shortages for a population dispersed over mountainous terrain. The country’s weaknesses have been exploited by Saudi Arabia which shares a porous border with Yemen. Further, the instability of Yemen’s central government has created a power vacuum filled by foreign states and terrorist groups. The central government has never had effective control of all Yemeni territory.

Ali Abdullah Saleh, who was president of Yemen for 34 years, secured his power through playing factions within the population off one another. The Yemeni conflict is not solely a result of a Sunni-Shia conflict, although sectarianism plays a role. The 2011 Arab Spring re-energized the Houthi movement, a Zaydi Shia movement, which led to the overthrow of the Saleh government. Abd-Rabbu Mansour Hadi took office as interim president in a transition led by a coalition of Arab Gulf states and backed by the United States. Hadi has struggled to deal with a variety of problems, including insurgency, the continuing loyalty of many military officers to former president Saleh, as well as corruption, unemployment and food insecurity.",A Conflict Overlooked: Yemen in Crisis,https://reliefweb.int/report/yemen/conflict-overlooked-yemen-crisis
15,yemen,"Saudi FM discusses Yemen’s humanitarian aid needs with new UN envoy

RIYADH: Saudi Foreign Minister Adel Al-Jubeir on Wednesday met with the new UN Envoy to Yemen, Martin Griffiths, in Riyadh.

During the meeting, they discussed the political and humanitarian situation in Yemen and Saudi Arabia’s support for the UN's efforts to alleviate the sufferings of the Yemeni people.

Saudi Arabia is at the forefront of international efforts to provide relief to the Yemenis. On March 28, Saudi Arabia and the UAE donated $930 million to the UN for humanitarian aid in Yemen.

War-ravaged Yemen is the world’s worst humanitarian crisis, according to the UN, with 75 percent of the population — 22 million people — in need of aid. A severe cholera outbreak has also killed more than 2,000 people and infected 1 million.

On Wednesday, the King Salman Humanitarian Aid and Relief Center (KSRelief) distributed 9,000 packs of meat to 27,000 needy families in 11 camps set up for displaced people in Yemen’s Marib province. In addition, a specialized medical team of 25 doctors arrived in Marib to provide health services to all Yemenis.

There are some 2 million Yemenis working in the Kingdom who send more than $10 million remittances to their families in Yemen.

To boost the economy of Yemen, Saudi Arabia has also funded its central bank with $2 billion. According to a recent statement by Saudi Ambassador to Yemen Mohammed Al-Jabir, the Kingdom’s assistance to Yemen totaled about $10.96 billion.

The Kingdom’s total aid to developing countries since 1973 had reached $152 billion, he said.

Earlier, the UN envoy also expressed his aspiration to work with the Yemeni government and engage with all stakeholders without exception to achieve lasting peace in Yemen.",Saudi FM discusses Yemen’s humanitarian aid needs with new UN envoy,http://www.arabnews.com/node/1295596/saudi-arabia
16,yemen,"As the ‘forgotten war’ in Yemen enters its fourth year, the cost of human suffering is turning more and more enormous. Saudi Arabia and UAE's genocidal war against Yemen, assisted by the US and the UK, has taken a devastating toll, particularly on the most vulnerable members of society – the children. Most have been reduced to skin and bones, under conditions of life-threatening malnutrition.

Geert Cappealaere, the UNICEF Regional Director for the Middle East and North Africa, recently returned from a field visit to Yemen. Her report has some very hard-hitting observations.

“I wanted to share with you the impact that three years of brutal war and decades of chronic underdevelopment are having on 11 million Yemeni boys and girls,” she observes in her report.

The ongoing crisis is one of the worst humanitarian crisis the world is currently seeing. According to her report, in 2017 alone, a minimum of five children were being killed or seriously injured every single day. The same year also saw outbreaks of deadly diseases such as cholera and diphtheria, killing hundreds of children in its wake.

In 2015, because of Yemen’s underdevelopment, 200,000 children suffered from severe acute malnutrition – life-threatening malnutrition. With three years of war, this has doubled, making Yemen among the three countries with the highest number of acutely malnourished children in the world.

Geert writes that in the past two weeks, the international community, along with the local heroes, the health and humanitarian workers in Yemen, have managed to stem the cholera outbreak after many months. But in a few weeks, the rainy season will start and cholera will hit the children of Yemen once more.

“Three years of war, decades of underdevelopment have done more to children than the confrontation with death, life-threatening preventable diseases,” mentions the report.

Along with the health crisis, the children of Yemen are constantly under an educational crisis. Compared to three years ago, half a million more children are not able to go to school anymore. Close to two million Yemeni boys and girls are not attending school or never had a chance to. The reason being that 2,500 schools in the country have either been destroyed by the war, or are being used for military purposes, or for hosting displaced families.

There is also the other fact that 80 per cent of the population is suffering from severe poverty. And this is just a rough estimate. Thus a large number of parents are sending their children to beg on the streets instead of sending them to schools. They are marrying them off at an early age so that they have ‘one less mouth to feed in the family’.

“Sending your child to beg, sending your child to work, marry your girl at an early age, are not choices that any Yemeni father or mother want to make. It is not a choice, it is forced on them because of this brutal war,” Geert observes in the report.

During her trip, Geert visited a group of 12-13-year-old girls outside San’a, all of whom were livid with anger and frustration at the state of education in their country.

She says that one of the girls, showed her a textbook that was at least 30-40 years old and said, “We need to learn from this? How can we ever become the doctors, the teachers, the engineers that Yemen so badly needs if we need to learn from this?”

Is there a solution to all of this? Yes. And the first one is putting an end to this brutal war in Yemen. It’s a senseless war from a children’s perspective and no single boy or girl understands what this is all about. Second, there can be no negotiations with any party regarding access to safe drinking water or cholera vaccination.

“We are losing time, energy and money on conversations that should never happen. Access to humanitarian supplies, supplies that are needed to be delivered against the acute needs of the population cannot and shall not be negotiated,” notes Geert.

Investment in education is a must if the world does not want to deprive two million children of education. It needs to be prioritised and now.

Yemen was once called “Arabia Felix” – the happy Arabia - but not much of the happiness remains there today. It will only come back to Yemen, if the world agrees to invest in children, stop the brutal war and invest in education.",Saudi and UAE War on the Children of Yemen: A UNICEF Report,https://newsclick.in/saudi-and-uae-war-children-yemen-unicef-report
17,yemen,"Pentagon statement confirms visibility of Yemeni leadership that aggression is American [06/May/2018]







SANAA, May 6 (Saba) - ""The Pentagon's announcement of the presence of US forces directly involved in the coalition aggression against the Yemeni people confirms the clear vision of the Yemeni leadership from the first moment, which considered that the aggression against Yemen is an American aggression in the first place,"" said the spokesman of the armed forces, Brigadier General Sharaf Ghaleb Luqman on Saturday.



Every day, more details are revealed about the nature of the criminal roles of US-backed Saudi-led coalition aggression against Yemen on the level of direct targeting of the Yemeni people in the shelling, siege and on the level of intelligence, logistics and armament of the tools of aggression on Yemen from the labor systems, especially the Saudi regime and the UAE regime, said Brigadier Luqman in a statement combined by Saba.



The presence of US forces represents an additional motivation for the Yemeni people to redouble efforts to confront the forces of invasion and aggression, said Luqman.



The army and committees have full legal and constitutional right to use various means available to defend land, he also said.



The humiliating defeat of America's tools is what forced USA to intervene directly to lift the morale of its customers and those who failed to achieve any of the objectives of the aggression on Yemen.



USA continues to violate these laws and international conventions by interfering in the affairs of a sovereign state and the United Nations must stop and condemn any American escalation.



Eman







SABA",Yemen news agency,https://www.sabanews.net/en/news495266.htm
18,yemen,"The Emergency Crisis Response Project (ECRP) works on building the resilience of vulnerable people and communities in Yemen to cope with the current crisis through restoring key public service, creating employment opportunities, and supporting small businesses.",Yemen emergency crisis response project as of March 2018,https://reliefweb.int/report/yemen/yemen-emergency-crisis-response-project-march-2018
19,yemen,"International Non-Government Organisations working in Yemen condemn in the strongest terms the abhorrent attack on an ICRC vehicle that resulted in the killing of an employee of the International Committee of the Red Cross earlier today, 21 April 2018. We are deeply shocked by the death of Hanna Lahoud, a member of the humanitarian community who gave his life delivering assistance to people in dire need of aid. Our deepest condolences go to Hanna’s family, friends and colleagues at the International Committee of the Red Cross.

“As a very close knit international community, we are all saddened by the death of our colleague, Hanna,“ said Shane Stevenson, Country Director of Oxfam in Yemen. “Our most sincere sympathies go to Hanna’s family and colleagues at ICRC. We are appalled by this brutal attack on a fellow humanitarian who gave his life working to help others in need. Aid workers need security and protection to deliver life-saving aid, and we remain committed to the cause for which Hanna gave his life.”

Humanitarian organisations in Yemen work in accordance with humanitarian principles of humanity, independence, neutrality and impartiality to deliver aid to populations affected by violent conflict. More than three quarters of Yemen’s population is in need of humanitarian assistance or protection that alleviates suffering and promotes dignity in the context of a war that is depriving many of the things they need to stay alive. An attack on humanitarian workers; UN, ICRC or non-government organisation – it is not only an attack on a humanitarian worker but also on the rights of people affected by conflict to receive assistance and protection.

INGOs in Yemen call on all parties to the conflict, authorities in Yemen and the international community to take concrete steps that guarantee the protection of humanitarian personnel and materials, as is provided for under International Humanitarian Law. We will not allow violence of this kind to deter our efforts to support highly vulnerable people in Yemen but need absolute assurance we can do so with safety.

Endorsed by the following INGOs in Yemen:

ACF

ACTED

ADRA

CARE

Danish Refugee Council

Global Communities

International Medical Corps

Norwegian Refugee Council

INTERSOS

Islamic Relief

Oxfam

Save the Children

Search for Common Ground

Solidarités International

ZOA International",Humanitarian Organisations in Yemen Condemn Attacks and Call for Immediate Protection of Aid Workers,https://reliefweb.int/report/yemen/humanitarian-organisations-yemen-condemn-attacks-and-call-immediate-protection-aid
